[
  {
    "HicriTarihKisa": "25.4.1447",
    "HicriTarihKisaIso8601": null,
    "HicriTarihUzun": "25 Rebiulahir 1447",
    "HicriTarihUzunIso8601": null,
    "AyinSekliURL": "https://namazvakti.diyanet.gov.tr/images/sd4.gif",
    "MiladiTarihKisa": "17.10.2025",
    "MiladiTarihKisaIso8601": "17.10.2025",
    "MiladiTarihUzun": "17 Ekim 2025 Cuma",
    "MiladiTarihUzunIso8601": "2025-10-17T00:00:00.0000000+02:00",
    "GreenwichOrtalamaZamani": 3.0,
    "Aksam": "18:25",
    "Gunes": "07:50",
    "GunesBatis": "18:18",
    "GunesDogus": "07:57",
    "Ikindi": "15:44",
    "Imsak": "05:53",
    "KibleSaati": "10:10",
    "Ogle": "13:12",
    "Yatsi": "20:07"
  },
  {
    "HicriTarihKisa": "26.4.1447",
    "HicriTarihKisaIso8601": null,
    "HicriTarihUzun": "26 Rebiulahir 1447",
    "HicriTarihUzunIso8601": null,
    "AyinSekliURL": "https://namazvakti.diyanet.gov.tr/images/sd5.gif",
    "MiladiTarihKisa": "18.10.2025",
    "MiladiTarihKisaIso8601": "18.10.2025",
    "MiladiTarihUzun": "18 Ekim 2025 Cumartesi",
    "MiladiTarihUzunIso8601": "2025-10-18T00:00:00.0000000+02:00",
    "GreenwichOrtalamaZamani": 3.0,
    "Aksam": "18:23",
    "Gunes": "07:52",
    "GunesBatis": "18:16",
    "GunesDogus": "07:59",
    "Ikindi": "15:43",
    "Imsak": "05:55",
    "KibleSaati": "10:09",
    "Ogle": "13:12",
    "Yatsi": "20:04"
  },
  {
    "HicriTarihKisa": "27.4.1447",
    "HicriTarihKisaIso8601": null,
    "HicriTarihUzun": "27 Rebiulahir 1447",
    "HicriTarihUzunIso8601": null,
    "AyinSekliURL": "https://namazvakti.diyanet.gov.tr/images/sd6.gif",
    "MiladiTarihKisa": "19.10.2025",
    "MiladiTarihKisaIso8601": "19.10.2025",
    "MiladiTarihUzun": "19 Ekim 2025 Pazar",
    "MiladiTarihUzunIso8601": "2025-10-19T00:00:00.0000000+02:00",
    "GreenwichOrtalamaZamani": 3.0,
    "Aksam": "18:20",
    "Gunes": "07:54",
    "GunesBatis": "18:13",
    "GunesDogus": "08:01",
    "Ikindi": "15:41",
    "Imsak": "05:57",
    "KibleSaati": "10:08",
    "Ogle": "13:12",
    "Yatsi": "20:02"
  },
  {
    "HicriTarihKisa": "28.4.1447",
    "HicriTarihKisaIso8601": null,
    "HicriTarihUzun": "28 Rebiulahir 1447",
    "HicriTarihUzunIso8601": null,
    "AyinSekliURL": "https://namazvakti.diyanet.gov.tr/images/sd7.gif",
    "MiladiTarihKisa": "20.10.2025",
    "MiladiTarihKisaIso8601": "20.10.2025",
    "MiladiTarihUzun": "20 Ekim 2025 Pazartesi",
    "MiladiTarihUzunIso8601": "2025-10-20T00:00:00.0000000+02:00",
    "GreenwichOrtalamaZamani": 3.0,
    "Aksam": "18:18",
    "Gunes": "07:56",
    "GunesBatis": "18:11",
    "GunesDogus": "08:03",
    "Ikindi": "15:39",
    "Imsak": "05:59",
    "KibleSaati": "10:07",
    "Ogle": "13:12",
    "Yatsi": "20:00"
  },
  {
    "HicriTarihKisa": "29.4.1447",
    "HicriTarihKisaIso8601": null,
    "HicriTarihUzun": "29 Rebiulahir 1447",
    "HicriTarihUzunIso8601": null,
    "AyinSekliURL": "https://namazvakti.diyanet.gov.tr/images/ictima.gif",
    "MiladiTarihKisa": "21.10.2025",
    "MiladiTarihKisaIso8601": "21.10.2025",
    "MiladiTarihUzun": "21 Ekim 2025 Salı",
    "MiladiTarihUzunIso8601": "2025-10-21T00:00:00.0000000+02:00",
    "GreenwichOrtalamaZamani": 3.0,
    "Aksam": "18:15",
    "Gunes": "07:58",
    "GunesBatis": "18:08",
    "GunesDogus": "08:05",
    "Ikindi": "15:37",
    "Imsak": "06:01",
    "KibleSaati": "10:06",
    "Ogle": "13:12",
    "Yatsi": "19:58"
  },
  {
    "HicriTarihKisa": "30.4.1447",
    "HicriTarihKisaIso8601": null,
    "HicriTarihUzun": "30 Rebiulahir 1447",
    "HicriTarihUzunIso8601": null,
    "AyinSekliURL": "https://namazvakti.diyanet.gov.tr/images/ruyet.gif",
    "MiladiTarihKisa": "22.10.2025",
    "MiladiTarihKisaIso8601": "22.10.2025",
    "MiladiTarihUzun": "22 Ekim 2025 Çarşamba",
    "MiladiTarihUzunIso8601": "2025-10-22T00:00:00.0000000+02:00",
    "GreenwichOrtalamaZamani": 3.0,
    "Aksam": "18:13",
    "Gunes": "08:00",
    "GunesBatis": "18:06",
    "GunesDogus": "08:07",
    "Ikindi": "15:35",
    "Imsak": "06:03",
    "KibleSaati": "10:06",
    "Ogle": "13:11",
    "Yatsi": "19:55"
  },
  {
    "HicriTarihKisa": "1.5.1447",
    "HicriTarihKisaIso8601": null,
    "HicriTarihUzun": "1 Cemaziyelevvel 1447",
    "HicriTarihUzunIso8601": null,
    "AyinSekliURL": "https://namazvakti.diyanet.gov.tr/images/r1.gif",
    "MiladiTarihKisa": "23.10.2025",
    "MiladiTarihKisaIso8601": "23.10.2025",
    "MiladiTarihUzun": "23 Ekim 2025 Perşembe",
    "MiladiTarihUzunIso8601": "2025-10-23T00:00:00.0000000+02:00",
    "GreenwichOrtalamaZamani": 3.0,
    "Aksam": "18:11",
    "Gunes": "08:02",
    "GunesBatis": "18:04",
    "GunesDogus": "08:09",
    "Ikindi": "15:33",
    "Imsak": "06:05",
    "KibleSaati": "10:05",
    "Ogle": "13:11",
    "Yatsi": "19:53"
  },
  {
    "HicriTarihKisa": "2.5.1447",
    "HicriTarihKisaIso8601": null,
    "HicriTarihUzun": "2 Cemaziyelevvel 1447",
    "HicriTarihUzunIso8601": null,
    "AyinSekliURL": "https://namazvakti.diyanet.gov.tr/images/r2.gif",
    "MiladiTarihKisa": "24.10.2025",
    "MiladiTarihKisaIso8601": "24.10.2025",
    "MiladiTarihUzun": "24 Ekim 2025 Cuma",
    "MiladiTarihUzunIso8601": "2025-10-24T00:00:00.0000000+02:00",
    "GreenwichOrtalamaZamani": 3.0,
    "Aksam": "18:08",
    "Gunes": "08:04",
    "GunesBatis": "18:01",
    "GunesDogus": "08:11",
    "Ikindi": "15:32",
    "Imsak": "06:07",
    "KibleSaati": "10:04",
    "Ogle": "13:11",
    "Yatsi": "19:51"
  },
  {
    "HicriTarihKisa": "3.5.1447",
    "HicriTarihKisaIso8601": null,
    "HicriTarihUzun": "3 Cemaziyelevvel 1447",
    "HicriTarihUzunIso8601": null,
    "AyinSekliURL": "https://namazvakti.diyanet.gov.tr/images/r3.gif",
    "MiladiTarihKisa": "25.10.2025",
    "MiladiTarihKisaIso8601": "25.10.2025",
    "MiladiTarihUzun": "25 Ekim 2025 Cumartesi",
    "MiladiTarihUzunIso8601": "2025-10-25T00:00:00.0000000+02:00",
    "GreenwichOrtalamaZamani": 3.0,
    "Aksam": "18:06",
    "Gunes": "08:06",
    "GunesBatis": "17:59",
    "GunesDogus": "08:13",
    "Ikindi": "15:30",
    "Imsak": "06:09",
    "KibleSaati": "10:03",
    "Ogle": "13:11",
    "Yatsi": "19:49"
  },
  {
    "HicriTarihKisa": "4.5.1447",
    "HicriTarihKisaIso8601": null,
    "HicriTarihUzun": "4 Cemaziyelevvel 1447",
    "HicriTarihUzunIso8601": null,
    "AyinSekliURL": "https://namazvakti.diyanet.gov.tr/images/r4.gif",
    "MiladiTarihKisa": "26.10.2025",
    "MiladiTarihKisaIso8601": "26.10.2025",
    "MiladiTarihUzun": "26 Ekim 2025 Pazar",
    "MiladiTarihUzunIso8601": "2025-10-26T00:00:00.0000000+02:00",
    "GreenwichOrtalamaZamani": 3.0,
    "Aksam": "17:04",
    "Gunes": "07:08",
    "GunesBatis": "16:57",
    "GunesDogus": "07:15",
    "Ikindi": "14:28",
    "Imsak": "05:11",
    "KibleSaati": "09:03",
    "Ogle": "12:11",
    "Yatsi": "18:47"
  },
  {
    "HicriTarihKisa": "5.5.1447",
    "HicriTarihKisaIso8601": null,
    "HicriTarihUzun": "5 Cemaziyelevvel 1447",
    "HicriTarihUzunIso8601": null,
    "AyinSekliURL": "https://namazvakti.diyanet.gov.tr/images/r5.gif",
    "MiladiTarihKisa": "27.10.2025",
    "MiladiTarihKisaIso8601": "27.10.2025",
    "MiladiTarihUzun": "27 Ekim 2025 Pazartesi",
    "MiladiTarihUzunIso8601": "2025-10-27T00:00:00.0000000+02:00",
    "GreenwichOrtalamaZamani": 3.0,
    "Aksam": "17:01",
    "Gunes": "07:10",
    "GunesBatis": "16:54",
    "GunesDogus": "07:17",
    "Ikindi": "14:26",
    "Imsak": "05:13",
    "KibleSaati": "09:02",
    "Ogle": "12:11",
    "Yatsi": "18:45"
  },
  {
    "HicriTarihKisa": "6.5.1447",
    "HicriTarihKisaIso8601": null,
    "HicriTarihUzun": "6 Cemaziyelevvel 1447",
    "HicriTarihUzunIso8601": null,
    "AyinSekliURL": "https://namazvakti.diyanet.gov.tr/images/r6.gif",
    "MiladiTarihKisa": "28.10.2025",
    "MiladiTarihKisaIso8601": "28.10.2025",
    "MiladiTarihUzun": "28 Ekim 2025 Salı",
    "MiladiTarihUzunIso8601": "2025-10-28T00:00:00.0000000+02:00",
    "GreenwichOrtalamaZamani": 3.0,
    "Aksam": "16:59",
    "Gunes": "07:12",
    "GunesBatis": "16:52",
    "GunesDogus": "07:19",
    "Ikindi": "14:24",
    "Imsak": "05:15",
    "KibleSaati": "09:01",
    "Ogle": "12:11",
    "Yatsi": "18:43"
  },
  {
    "HicriTarihKisa": "7.5.1447",
    "HicriTarihKisaIso8601": null,
    "HicriTarihUzun": "7 Cemaziyelevvel 1447",
    "HicriTarihUzunIso8601": null,
    "AyinSekliURL": "https://namazvakti.diyanet.gov.tr/images/ilkdordun.gif",
    "MiladiTarihKisa": "29.10.2025",
    "MiladiTarihKisaIso8601": "29.10.2025",
    "MiladiTarihUzun": "29 Ekim 2025 Çarşamba",
    "MiladiTarihUzunIso8601": "2025-10-29T00:00:00.0000000+02:00",
    "GreenwichOrtalamaZamani": 3.0,
    "Aksam": "16:57",
    "Gunes": "07:14",
    "GunesBatis": "16:50",
    "GunesDogus": "07:21",
    "Ikindi": "14:23",
    "Imsak": "05:16",
    "KibleSaati": "09:00",
    "Ogle": "12:11",
    "Yatsi": "18:41"
  },
  {
    "HicriTarihKisa": "8.5.1447",
    "HicriTarihKisaIso8601": null,
    "HicriTarihUzun": "8 Cemaziyelevvel 1447",
    "HicriTarihUzunIso8601": null,
    "AyinSekliURL": "https://namazvakti.diyanet.gov.tr/images/i1.gif",
    "MiladiTarihKisa": "30.10.2025",
    "MiladiTarihKisaIso8601": "30.10.2025",
    "MiladiTarihUzun": "30 Ekim 2025 Perşembe",
    "MiladiTarihUzunIso8601": "2025-10-30T00:00:00.0000000+02:00",
    "GreenwichOrtalamaZamani": 3.0,
    "Aksam": "16:55",
    "Gunes": "07:16",
    "GunesBatis": "16:48",
    "GunesDogus": "07:23",
    "Ikindi": "14:21",
    "Imsak": "05:18",
    "KibleSaati": "09:00",
    "Ogle": "12:11",
    "Yatsi": "18:39"
  },
  {
    "HicriTarihKisa": "9.5.1447",
    "HicriTarihKisaIso8601": null,
    "HicriTarihUzun": "9 Cemaziyelevvel 1447",
    "HicriTarihUzunIso8601": null,
    "AyinSekliURL": "https://namazvakti.diyanet.gov.tr/images/i2.gif",
    "MiladiTarihKisa": "31.10.2025",
    "MiladiTarihKisaIso8601": "31.10.2025",
    "MiladiTarihUzun": "31 Ekim 2025 Cuma",
    "MiladiTarihUzunIso8601": "2025-10-31T00:00:00.0000000+02:00",
    "GreenwichOrtalamaZamani": 3.0,
    "Aksam": "16:52",
    "Gunes": "07:19",
    "GunesBatis": "16:45",
    "GunesDogus": "07:26",
    "Ikindi": "14:19",
    "Imsak": "05:20",
    "KibleSaati": "08:59",
    "Ogle": "12:11",
    "Yatsi": "18:37"
  },
  {
    "HicriTarihKisa": "10.5.1447",
    "HicriTarihKisaIso8601": null,
    "HicriTarihUzun": "10 Cemaziyelevvel 1447",
    "HicriTarihUzunIso8601": null,
    "AyinSekliURL": "https://namazvakti.diyanet.gov.tr/images/i3.gif",
    "MiladiTarihKisa": "01.11.2025",
    "MiladiTarihKisaIso8601": "01.11.2025",
    "MiladiTarihUzun": "01 Kasım 2025 Cumartesi",
    "MiladiTarihUzunIso8601": "2025-11-01T00:00:00.0000000+02:00",
    "GreenwichOrtalamaZamani": 3.0,
    "Aksam": "16:50",
    "Gunes": "07:21",
    "GunesBatis": "16:43",
    "GunesDogus": "07:28",
    "Ikindi": "14:18",
    "Imsak": "05:22",
    "KibleSaati": "08:58",
    "Ogle": "12:10",
    "Yatsi": "18:35"
  },
  {
    "HicriTarihKisa": "11.5.1447",
    "HicriTarihKisaIso8601": null,
    "HicriTarihUzun": "11 Cemaziyelevvel 1447",
    "HicriTarihUzunIso8601": null,
    "AyinSekliURL": "https://namazvakti.diyanet.gov.tr/images/i4.gif",
    "MiladiTarihKisa": "02.11.2025",
    "MiladiTarihKisaIso8601": "02.11.2025",
    "MiladiTarihUzun": "02 Kasım 2025 Pazar",
    "MiladiTarihUzunIso8601": "2025-11-02T00:00:00.0000000+02:00",
    "GreenwichOrtalamaZamani": 3.0,
    "Aksam": "16:48",
    "Gunes": "07:23",
    "GunesBatis": "16:41",
    "GunesDogus": "07:30",
    "Ikindi": "14:16",
    "Imsak": "05:24",
    "KibleSaati": "08:58",
    "Ogle": "12:10",
    "Yatsi": "18:33"
  },
  {
    "HicriTarihKisa": "12.5.1447",
    "HicriTarihKisaIso8601": null,
    "HicriTarihUzun": "12 Cemaziyelevvel 1447",
    "HicriTarihUzunIso8601": null,
    "AyinSekliURL": "https://namazvakti.diyanet.gov.tr/images/i5.gif",
    "MiladiTarihKisa": "03.11.2025",
    "MiladiTarihKisaIso8601": "03.11.2025",
    "MiladiTarihUzun": "03 Kasım 2025 Pazartesi",
    "MiladiTarihUzunIso8601": "2025-11-03T00:00:00.0000000+02:00",
    "GreenwichOrtalamaZamani": 3.0,
    "Aksam": "16:46",
    "Gunes": "07:25",
    "GunesBatis": "16:39",
    "GunesDogus": "07:32",
    "Ikindi": "14:14",
    "Imsak": "05:26",
    "KibleSaati": "08:57",
    "Ogle": "12:10",
    "Yatsi": "18:31"
  },
  {
    "HicriTarihKisa": "13.5.1447",
    "HicriTarihKisaIso8601": null,
    "HicriTarihUzun": "13 Cemaziyelevvel 1447",
    "HicriTarihUzunIso8601": null,
    "AyinSekliURL": "https://namazvakti.diyanet.gov.tr/images/i6.gif",
    "MiladiTarihKisa": "04.11.2025",
    "MiladiTarihKisaIso8601": "04.11.2025",
    "MiladiTarihUzun": "04 Kasım 2025 Salı",
    "MiladiTarihUzunIso8601": "2025-11-04T00:00:00.0000000+02:00",
    "GreenwichOrtalamaZamani": 3.0,
    "Aksam": "16:44",
    "Gunes": "07:27",
    "GunesBatis": "16:37",
    "GunesDogus": "07:34",
    "Ikindi": "14:13",
    "Imsak": "05:27",
    "KibleSaati": "08:57",
    "Ogle": "12:10",
    "Yatsi": "18:29"
  },
  {
    "HicriTarihKisa": "14.5.1447",
    "HicriTarihKisaIso8601": null,
    "HicriTarihUzun": "14 Cemaziyelevvel 1447",
    "HicriTarihUzunIso8601": null,
    "AyinSekliURL": "https://namazvakti.diyanet.gov.tr/images/dolunay.gif",
    "MiladiTarihKisa": "05.11.2025",
    "MiladiTarihKisaIso8601": "05.11.2025",
    "MiladiTarihUzun": "05 Kasım 2025 Çarşamba",
    "MiladiTarihUzunIso8601": "2025-11-05T00:00:00.0000000+02:00",
    "GreenwichOrtalamaZamani": 3.0,
    "Aksam": "16:42",
    "Gunes": "07:29",
    "GunesBatis": "16:35",
    "GunesDogus": "07:36",
    "Ikindi": "14:11",
    "Imsak": "05:29",
    "KibleSaati": "08:56",
    "Ogle": "12:10",
    "Yatsi": "18:28"
  },
  {
    "HicriTarihKisa": "15.5.1447",
    "HicriTarihKisaIso8601": null,
    "HicriTarihUzun": "15 Cemaziyelevvel 1447",
    "HicriTarihUzunIso8601": null,
    "AyinSekliURL": "https://namazvakti.diyanet.gov.tr/images/d1.gif",
    "MiladiTarihKisa": "06.11.2025",
    "MiladiTarihKisaIso8601": "06.11.2025",
    "MiladiTarihUzun": "06 Kasım 2025 Perşembe",
    "MiladiTarihUzunIso8601": "2025-11-06T00:00:00.0000000+02:00",
    "GreenwichOrtalamaZamani": 3.0,
    "Aksam": "16:40",
    "Gunes": "07:31",
    "GunesBatis": "16:33",
    "GunesDogus": "07:38",
    "Ikindi": "14:10",
    "Imsak": "05:31",
    "KibleSaati": "08:56",
    "Ogle": "12:10",
    "Yatsi": "18:26"
  },
  {
    "HicriTarihKisa": "16.5.1447",
    "HicriTarihKisaIso8601": null,
    "HicriTarihUzun": "16 Cemaziyelevvel 1447",
    "HicriTarihUzunIso8601": null,
    "AyinSekliURL": "https://namazvakti.diyanet.gov.tr/images/d2.gif",
    "MiladiTarihKisa": "07.11.2025",
    "MiladiTarihKisaIso8601": "07.11.2025",
    "MiladiTarihUzun": "07 Kasım 2025 Cuma",
    "MiladiTarihUzunIso8601": "2025-11-07T00:00:00.0000000+02:00",
    "GreenwichOrtalamaZamani": 3.0,
    "Aksam": "16:38",
    "Gunes": "07:33",
    "GunesBatis": "16:31",
    "GunesDogus": "07:40",
    "Ikindi": "14:08",
    "Imsak": "05:33",
    "KibleSaati": "08:55",
    "Ogle": "12:11",
    "Yatsi": "18:24"
  },
  {
    "HicriTarihKisa": "17.5.1447",
    "HicriTarihKisaIso8601": null,
    "HicriTarihUzun": "17 Cemaziyelevvel 1447",
    "HicriTarihUzunIso8601": null,
    "AyinSekliURL": "https://namazvakti.diyanet.gov.tr/images/d3.gif",
    "MiladiTarihKisa": "08.11.2025",
    "MiladiTarihKisaIso8601": "08.11.2025",
    "MiladiTarihUzun": "08 Kasım 2025 Cumartesi",
    "MiladiTarihUzunIso8601": "2025-11-08T00:00:00.0000000+02:00",
    "GreenwichOrtalamaZamani": 3.0,
    "Aksam": "16:36",
    "Gunes": "07:35",
    "GunesBatis": "16:29",
    "GunesDogus": "07:42",
    "Ikindi": "14:07",
    "Imsak": "05:34",
    "KibleSaati": "08:55",
    "Ogle": "12:11",
    "Yatsi": "18:23"
  },
  {
    "HicriTarihKisa": "18.5.1447",
    "HicriTarihKisaIso8601": null,
    "HicriTarihUzun": "18 Cemaziyelevvel 1447",
    "HicriTarihUzunIso8601": null,
    "AyinSekliURL": "https://namazvakti.diyanet.gov.tr/images/d4.gif",
    "MiladiTarihKisa": "09.11.2025",
    "MiladiTarihKisaIso8601": "09.11.2025",
    "MiladiTarihUzun": "09 Kasım 2025 Pazar",
    "MiladiTarihUzunIso8601": "2025-11-09T00:00:00.0000000+02:00",
    "GreenwichOrtalamaZamani": 3.0,
    "Aksam": "16:34",
    "Gunes": "07:37",
    "GunesBatis": "16:27",
    "GunesDogus": "07:44",
    "Ikindi": "14:05",
    "Imsak": "05:36",
    "KibleSaati": "08:54",
    "Ogle": "12:11",
    "Yatsi": "18:21"
  },
  {
    "HicriTarihKisa": "19.5.1447",
    "HicriTarihKisaIso8601": null,
    "HicriTarihUzun": "19 Cemaziyelevvel 1447",
    "HicriTarihUzunIso8601": null,
    "AyinSekliURL": "https://namazvakti.diyanet.gov.tr/images/d5.gif",
    "MiladiTarihKisa": "10.11.2025",
    "MiladiTarihKisaIso8601": "10.11.2025",
    "MiladiTarihUzun": "10 Kasım 2025 Pazartesi",
    "MiladiTarihUzunIso8601": "2025-11-10T00:00:00.0000000+02:00",
    "GreenwichOrtalamaZamani": 3.0,
    "Aksam": "16:32",
    "Gunes": "07:40",
    "GunesBatis": "16:25",
    "GunesDogus": "07:47",
    "Ikindi": "14:04",
    "Imsak": "05:38",
    "KibleSaati": "08:54",
    "Ogle": "12:11",
    "Yatsi": "18:19"
  },
  {
    "HicriTarihKisa": "20.5.1447",
    "HicriTarihKisaIso8601": null,
    "HicriTarihUzun": "20 Cemaziyelevvel 1447",
    "HicriTarihUzunIso8601": null,
    "AyinSekliURL": "https://namazvakti.diyanet.gov.tr/images/d6.gif",
    "MiladiTarihKisa": "11.11.2025",
    "MiladiTarihKisaIso8601": "11.11.2025",
    "MiladiTarihUzun": "11 Kasım 2025 Salı",
    "MiladiTarihUzunIso8601": "2025-11-11T00:00:00.0000000+02:00",
    "GreenwichOrtalamaZamani": 3.0,
    "Aksam": "16:30",
    "Gunes": "07:42",
    "GunesBatis": "16:23",
    "GunesDogus": "07:49",
    "Ikindi": "14:02",
    "Imsak": "05:40",
    "KibleSaati": "08:53",
    "Ogle": "12:11",
    "Yatsi": "18:18"
  },
  {
    "HicriTarihKisa": "21.5.1447",
    "HicriTarihKisaIso8601": null,
    "HicriTarihUzun": "21 Cemaziyelevvel 1447",
    "HicriTarihUzunIso8601": null,
    "AyinSekliURL": "https://namazvakti.diyanet.gov.tr/images/sondordun.gif",
    "MiladiTarihKisa": "12.11.2025",
    "MiladiTarihKisaIso8601": "12.11.2025",
    "MiladiTarihUzun": "12 Kasım 2025 Çarşamba",
    "MiladiTarihUzunIso8601": "2025-11-12T00:00:00.0000000+02:00",
    "GreenwichOrtalamaZamani": 3.0,
    "Aksam": "16:28",
    "Gunes": "07:44",
    "GunesBatis": "16:21",
    "GunesDogus": "07:51",
    "Ikindi": "14:01",
    "Imsak": "05:41",
    "KibleSaati": "08:53",
    "Ogle": "12:11",
    "Yatsi": "18:16"
  },
  {
    "HicriTarihKisa": "22.5.1447",
    "HicriTarihKisaIso8601": null,
    "HicriTarihUzun": "22 Cemaziyelevvel 1447",
    "HicriTarihUzunIso8601": null,
    "AyinSekliURL": "https://namazvakti.diyanet.gov.tr/images/sd1.gif",
    "MiladiTarihKisa": "13.11.2025",
    "MiladiTarihKisaIso8601": "13.11.2025",
    "MiladiTarihUzun": "13 Kasım 2025 Perşembe",
    "MiladiTarihUzunIso8601": "2025-11-13T00:00:00.0000000+02:00",
    "GreenwichOrtalamaZamani": 3.0,
    "Aksam": "16:26",
    "Gunes": "07:46",
    "GunesBatis": "16:19",
    "GunesDogus": "07:53",
    "Ikindi": "14:00",
    "Imsak": "05:43",
    "KibleSaati": "08:52",
    "Ogle": "12:11",
    "Yatsi": "18:15"
  },
  {
    "HicriTarihKisa": "23.5.1447",
    "HicriTarihKisaIso8601": null,
    "HicriTarihUzun": "23 Cemaziyelevvel 1447",
    "HicriTarihUzunIso8601": null,
    "AyinSekliURL": "https://namazvakti.diyanet.gov.tr/images/sd2.gif",
    "MiladiTarihKisa": "14.11.2025",
    "MiladiTarihKisaIso8601": "14.11.2025",
    "MiladiTarihUzun": "14 Kasım 2025 Cuma",
    "MiladiTarihUzunIso8601": "2025-11-14T00:00:00.0000000+02:00",
    "GreenwichOrtalamaZamani": 3.0,
    "Aksam": "16:25",
    "Gunes": "07:48",
    "GunesBatis": "16:18",
    "GunesDogus": "07:55",
    "Ikindi": "13:58",
    "Imsak": "05:45",
    "KibleSaati": "08:52",
    "Ogle": "12:11",
    "Yatsi": "18:14"
  },
  {
    "HicriTarihKisa": "24.5.1447",
    "HicriTarihKisaIso8601": null,
    "HicriTarihUzun": "24 Cemaziyelevvel 1447",
    "HicriTarihUzunIso8601": null,
    "AyinSekliURL": "https://namazvakti.diyanet.gov.tr/images/sd3.gif",
    "MiladiTarihKisa": "15.11.2025",
    "MiladiTarihKisaIso8601": "15.11.2025",
    "MiladiTarihUzun": "15 Kasım 2025 Cumartesi",
    "MiladiTarihUzunIso8601": "2025-11-15T00:00:00.0000000+02:00",
    "GreenwichOrtalamaZamani": 3.0,
    "Aksam": "16:23",
    "Gunes": "07:50",
    "GunesBatis": "16:16",
    "GunesDogus": "07:57",
    "Ikindi": "13:57",
    "Imsak": "05:46",
    "KibleSaati": "08:52",
    "Ogle": "12:11",
    "Yatsi": "18:12"
  },
  {
    "HicriTarihKisa": "25.5.1447",
    "HicriTarihKisaIso8601": null,
    "HicriTarihUzun": "25 Cemaziyelevvel 1447",
    "HicriTarihUzunIso8601": null,
    "AyinSekliURL": "https://namazvakti.diyanet.gov.tr/images/sd4.gif",
    "MiladiTarihKisa": "16.11.2025",
    "MiladiTarihKisaIso8601": "16.11.2025",
    "MiladiTarihUzun": "16 Kasım 2025 Pazar",
    "MiladiTarihUzunIso8601": "2025-11-16T00:00:00.0000000+02:00",
    "GreenwichOrtalamaZamani": 3.0,
    "Aksam": "16:21",
    "Gunes": "07:52",
    "GunesBatis": "16:14",
    "GunesDogus": "07:59",
    "Ikindi": "13:56",
    "Imsak": "05:48",
    "KibleSaati": "08:51",
    "Ogle": "12:12",
    "Yatsi": "18:11"
  },
  {
    "HicriTarihKisa": "26.5.1447",
    "HicriTarihKisaIso8601": null,
    "HicriTarihUzun": "26 Cemaziyelevvel 1447",
    "HicriTarihUzunIso8601": null,
    "AyinSekliURL": "https://namazvakti.diyanet.gov.tr/images/sd5.gif",
    "MiladiTarihKisa": "17.11.2025",
    "MiladiTarihKisaIso8601": "17.11.2025",
    "MiladiTarihUzun": "17 Kasım 2025 Pazartesi",
    "MiladiTarihUzunIso8601": "2025-11-17T00:00:00.0000000+02:00",
    "GreenwichOrtalamaZamani": 3.0,
    "Aksam": "16:20",
    "Gunes": "07:54",
    "GunesBatis": "16:13",
    "GunesDogus": "08:01",
    "Ikindi": "13:55",
    "Imsak": "05:49",
    "KibleSaati": "08:51",
    "Ogle": "12:12",
    "Yatsi": "18:10"
  }
]