[
  {
    "HicriTarihKisa": "7.6.1447",
    "HicriTarihKisaIso8601": null,
    "HicriTarihUzun": "7 Cemaziyelahir 1447",
    "HicriTarihUzunIso8601": null,
    "AyinSekliURL": "https://namazvakti.diyanet.gov.tr/images/ilkdordun.gif",
    "MiladiTarihKisa": "27.11.2025",
    "MiladiTarihKisaIso8601": "27.11.2025",
    "MiladiTarihUzun": "27 Kasım 2025 Perşembe",
    "MiladiTarihUzunIso8601": "2025-11-27T00:00:00.0000000+03:00",
    "GreenwichOrtalamaZamani": 3.0,
    "Aksam": "18:07",
    "Gunes": "05:47",
    "GunesBatis": "18:00",
    "GunesDogus": "05:54",
    "Ikindi": "15:26",
    "Imsak": "04:41",
    "KibleSaati": "11:46",
    "Ogle": "12:02",
    "Yatsi": "19:10"
  },
  {
    "HicriTarihKisa": "8.6.1447",
    "HicriTarihKisaIso8601": null,
    "HicriTarihUzun": "8 Cemaziyelahir 1447",
    "HicriTarihUzunIso8601": null,
    "AyinSekliURL": "https://namazvakti.diyanet.gov.tr/images/i1.gif",
    "MiladiTarihKisa": "28.11.2025",
    "MiladiTarihKisaIso8601": "28.11.2025",
    "MiladiTarihUzun": "28 Kasım 2025 Cuma",
    "MiladiTarihUzunIso8601": "2025-11-28T00:00:00.0000000+03:00",
    "GreenwichOrtalamaZamani": 3.0,
    "Aksam": "18:08",
    "Gunes": "05:48",
    "GunesBatis": "18:01",
    "GunesDogus": "05:55",
    "Ikindi": "15:26",
    "Imsak": "04:41",
    "KibleSaati": "11:47",
    "Ogle": "12:03",
    "Yatsi": "19:10"
  },
  {
    "HicriTarihKisa": "9.6.1447",
    "HicriTarihKisaIso8601": null,
    "HicriTarihUzun": "9 Cemaziyelahir 1447",
    "HicriTarihUzunIso8601": null,
    "AyinSekliURL": "https://namazvakti.diyanet.gov.tr/images/i2.gif",
    "MiladiTarihKisa": "29.11.2025",
    "MiladiTarihKisaIso8601": "29.11.2025",
    "MiladiTarihUzun": "29 Kasım 2025 Cumartesi",
    "MiladiTarihUzunIso8601": "2025-11-29T00:00:00.0000000+03:00",
    "GreenwichOrtalamaZamani": 3.0,
    "Aksam": "18:08",
    "Gunes": "05:48",
    "GunesBatis": "18:01",
    "GunesDogus": "05:55",
    "Ikindi": "15:27",
    "Imsak": "04:41",
    "KibleSaati": "11:47",
    "Ogle": "12:03",
    "Yatsi": "19:11"
  },
  {
    "HicriTarihKisa": "10.6.1447",
    "HicriTarihKisaIso8601": null,
    "HicriTarihUzun": "10 Cemaziyelahir 1447",
    "HicriTarihUzunIso8601": null,
    "AyinSekliURL": "https://namazvakti.diyanet.gov.tr/images/i3.gif",
    "MiladiTarihKisa": "30.11.2025",
    "MiladiTarihKisaIso8601": "30.11.2025",
    "MiladiTarihUzun": "30 Kasım 2025 Pazar",
    "MiladiTarihUzunIso8601": "2025-11-30T00:00:00.0000000+03:00",
    "GreenwichOrtalamaZamani": 3.0,
    "Aksam": "18:08",
    "Gunes": "05:48",
    "GunesBatis": "18:01",
    "GunesDogus": "05:55",
    "Ikindi": "15:27",
    "Imsak": "04:41",
    "KibleSaati": "11:47",
    "Ogle": "12:03",
    "Yatsi": "19:11"
  },
  {
    "HicriTarihKisa": "11.6.1447",
    "HicriTarihKisaIso8601": null,
    "HicriTarihUzun": "11 Cemaziyelahir 1447",
    "HicriTarihUzunIso8601": null,
    "AyinSekliURL": "https://namazvakti.diyanet.gov.tr/images/i4.gif",
    "MiladiTarihKisa": "01.12.2025",
    "MiladiTarihKisaIso8601": "01.12.2025",
    "MiladiTarihUzun": "01 Aralık 2025 Pazartesi",
    "MiladiTarihUzunIso8601": "2025-12-01T00:00:00.0000000+03:00",
    "GreenwichOrtalamaZamani": 3.0,
    "Aksam": "18:09",
    "Gunes": "05:49",
    "GunesBatis": "18:02",
    "GunesDogus": "05:56",
    "Ikindi": "15:28",
    "Imsak": "04:42",
    "KibleSaati": "11:47",
    "Ogle": "12:04",
    "Yatsi": "19:12"
  },
  {
    "HicriTarihKisa": "12.6.1447",
    "HicriTarihKisaIso8601": null,
    "HicriTarihUzun": "12 Cemaziyelahir 1447",
    "HicriTarihUzunIso8601": null,
    "AyinSekliURL": "https://namazvakti.diyanet.gov.tr/images/i5.gif",
    "MiladiTarihKisa": "02.12.2025",
    "MiladiTarihKisaIso8601": "02.12.2025",
    "MiladiTarihUzun": "02 Aralık 2025 Salı",
    "MiladiTarihUzunIso8601": "2025-12-02T00:00:00.0000000+03:00",
    "GreenwichOrtalamaZamani": 3.0,
    "Aksam": "18:09",
    "Gunes": "05:49",
    "GunesBatis": "18:02",
    "GunesDogus": "05:56",
    "Ikindi": "15:28",
    "Imsak": "04:42",
    "KibleSaati": "11:48",
    "Ogle": "12:04",
    "Yatsi": "19:12"
  },
  {
    "HicriTarihKisa": "13.6.1447",
    "HicriTarihKisaIso8601": null,
    "HicriTarihUzun": "13 Cemaziyelahir 1447",
    "HicriTarihUzunIso8601": null,
    "AyinSekliURL": "https://namazvakti.diyanet.gov.tr/images/i6.gif",
    "MiladiTarihKisa": "03.12.2025",
    "MiladiTarihKisaIso8601": "03.12.2025",
    "MiladiTarihUzun": "03 Aralık 2025 Çarşamba",
    "MiladiTarihUzunIso8601": "2025-12-03T00:00:00.0000000+03:00",
    "GreenwichOrtalamaZamani": 3.0,
    "Aksam": "18:10",
    "Gunes": "05:50",
    "GunesBatis": "18:03",
    "GunesDogus": "05:57",
    "Ikindi": "15:29",
    "Imsak": "04:42",
    "KibleSaati": "11:48",
    "Ogle": "12:05",
    "Yatsi": "19:13"
  },
  {
    "HicriTarihKisa": "14.6.1447",
    "HicriTarihKisaIso8601": null,
    "HicriTarihUzun": "14 Cemaziyelahir 1447",
    "HicriTarihUzunIso8601": null,
    "AyinSekliURL": "https://namazvakti.diyanet.gov.tr/images/dolunay.gif",
    "MiladiTarihKisa": "04.12.2025",
    "MiladiTarihKisaIso8601": "04.12.2025",
    "MiladiTarihUzun": "04 Aralık 2025 Perşembe",
    "MiladiTarihUzunIso8601": "2025-12-04T00:00:00.0000000+03:00",
    "GreenwichOrtalamaZamani": 3.0,
    "Aksam": "18:10",
    "Gunes": "05:50",
    "GunesBatis": "18:03",
    "GunesDogus": "05:57",
    "Ikindi": "15:29",
    "Imsak": "04:43",
    "KibleSaati": "11:48",
    "Ogle": "12:05",
    "Yatsi": "19:13"
  },
  {
    "HicriTarihKisa": "15.6.1447",
    "HicriTarihKisaIso8601": null,
    "HicriTarihUzun": "15 Cemaziyelahir 1447",
    "HicriTarihUzunIso8601": null,
    "AyinSekliURL": "https://namazvakti.diyanet.gov.tr/images/d1.gif",
    "MiladiTarihKisa": "05.12.2025",
    "MiladiTarihKisaIso8601": "05.12.2025",
    "MiladiTarihUzun": "05 Aralık 2025 Cuma",
    "MiladiTarihUzunIso8601": "2025-12-05T00:00:00.0000000+03:00",
    "GreenwichOrtalamaZamani": 3.0,
    "Aksam": "18:10",
    "Gunes": "05:50",
    "GunesBatis": "18:03",
    "GunesDogus": "05:57",
    "Ikindi": "15:29",
    "Imsak": "04:43",
    "KibleSaati": "11:49",
    "Ogle": "12:05",
    "Yatsi": "19:13"
  },
  {
    "HicriTarihKisa": "16.6.1447",
    "HicriTarihKisaIso8601": null,
    "HicriTarihUzun": "16 Cemaziyelahir 1447",
    "HicriTarihUzunIso8601": null,
    "AyinSekliURL": "https://namazvakti.diyanet.gov.tr/images/d2.gif",
    "MiladiTarihKisa": "06.12.2025",
    "MiladiTarihKisaIso8601": "06.12.2025",
    "MiladiTarihUzun": "06 Aralık 2025 Cumartesi",
    "MiladiTarihUzunIso8601": "2025-12-06T00:00:00.0000000+03:00",
    "GreenwichOrtalamaZamani": 3.0,
    "Aksam": "18:11",
    "Gunes": "05:51",
    "GunesBatis": "18:04",
    "GunesDogus": "05:58",
    "Ikindi": "15:30",
    "Imsak": "04:43",
    "KibleSaati": "11:49",
    "Ogle": "12:06",
    "Yatsi": "19:14"
  },
  {
    "HicriTarihKisa": "17.6.1447",
    "HicriTarihKisaIso8601": null,
    "HicriTarihUzun": "17 Cemaziyelahir 1447",
    "HicriTarihUzunIso8601": null,
    "AyinSekliURL": "https://namazvakti.diyanet.gov.tr/images/d3.gif",
    "MiladiTarihKisa": "07.12.2025",
    "MiladiTarihKisaIso8601": "07.12.2025",
    "MiladiTarihUzun": "07 Aralık 2025 Pazar",
    "MiladiTarihUzunIso8601": "2025-12-07T00:00:00.0000000+03:00",
    "GreenwichOrtalamaZamani": 3.0,
    "Aksam": "18:11",
    "Gunes": "05:51",
    "GunesBatis": "18:04",
    "GunesDogus": "05:58",
    "Ikindi": "15:30",
    "Imsak": "04:44",
    "KibleSaati": "11:49",
    "Ogle": "12:06",
    "Yatsi": "19:14"
  },
  {
    "HicriTarihKisa": "18.6.1447",
    "HicriTarihKisaIso8601": null,
    "HicriTarihUzun": "18 Cemaziyelahir 1447",
    "HicriTarihUzunIso8601": null,
    "AyinSekliURL": "https://namazvakti.diyanet.gov.tr/images/d4.gif",
    "MiladiTarihKisa": "08.12.2025",
    "MiladiTarihKisaIso8601": "08.12.2025",
    "MiladiTarihUzun": "08 Aralık 2025 Pazartesi",
    "MiladiTarihUzunIso8601": "2025-12-08T00:00:00.0000000+03:00",
    "GreenwichOrtalamaZamani": 3.0,
    "Aksam": "18:12",
    "Gunes": "05:52",
    "GunesBatis": "18:05",
    "GunesDogus": "05:59",
    "Ikindi": "15:31",
    "Imsak": "04:44",
    "KibleSaati": "11:50",
    "Ogle": "12:07",
    "Yatsi": "19:15"
  },
  {
    "HicriTarihKisa": "19.6.1447",
    "HicriTarihKisaIso8601": null,
    "HicriTarihUzun": "19 Cemaziyelahir 1447",
    "HicriTarihUzunIso8601": null,
    "AyinSekliURL": "https://namazvakti.diyanet.gov.tr/images/d5.gif",
    "MiladiTarihKisa": "09.12.2025",
    "MiladiTarihKisaIso8601": "09.12.2025",
    "MiladiTarihUzun": "09 Aralık 2025 Salı",
    "MiladiTarihUzunIso8601": "2025-12-09T00:00:00.0000000+03:00",
    "GreenwichOrtalamaZamani": 3.0,
    "Aksam": "18:12",
    "Gunes": "05:52",
    "GunesBatis": "18:05",
    "GunesDogus": "05:59",
    "Ikindi": "15:31",
    "Imsak": "04:44",
    "KibleSaati": "11:50",
    "Ogle": "12:07",
    "Yatsi": "19:15"
  },
  {
    "HicriTarihKisa": "20.6.1447",
    "HicriTarihKisaIso8601": null,
    "HicriTarihUzun": "20 Cemaziyelahir 1447",
    "HicriTarihUzunIso8601": null,
    "AyinSekliURL": "https://namazvakti.diyanet.gov.tr/images/d6.gif",
    "MiladiTarihKisa": "10.12.2025",
    "MiladiTarihKisaIso8601": "10.12.2025",
    "MiladiTarihUzun": "10 Aralık 2025 Çarşamba",
    "MiladiTarihUzunIso8601": "2025-12-10T00:00:00.0000000+03:00",
    "GreenwichOrtalamaZamani": 3.0,
    "Aksam": "18:13",
    "Gunes": "05:52",
    "GunesBatis": "18:06",
    "GunesDogus": "05:59",
    "Ikindi": "15:32",
    "Imsak": "04:45",
    "KibleSaati": "11:50",
    "Ogle": "12:08",
    "Yatsi": "19:16"
  },
  {
    "HicriTarihKisa": "21.6.1447",
    "HicriTarihKisaIso8601": null,
    "HicriTarihUzun": "21 Cemaziyelahir 1447",
    "HicriTarihUzunIso8601": null,
    "AyinSekliURL": "https://namazvakti.diyanet.gov.tr/images/d7.gif",
    "MiladiTarihKisa": "11.12.2025",
    "MiladiTarihKisaIso8601": "11.12.2025",
    "MiladiTarihUzun": "11 Aralık 2025 Perşembe",
    "MiladiTarihUzunIso8601": "2025-12-11T00:00:00.0000000+03:00",
    "GreenwichOrtalamaZamani": 3.0,
    "Aksam": "18:13",
    "Gunes": "05:53",
    "GunesBatis": "18:06",
    "GunesDogus": "06:00",
    "Ikindi": "15:32",
    "Imsak": "04:45",
    "KibleSaati": "11:51",
    "Ogle": "12:08",
    "Yatsi": "19:16"
  },
  {
    "HicriTarihKisa": "22.6.1447",
    "HicriTarihKisaIso8601": null,
    "HicriTarihUzun": "22 Cemaziyelahir 1447",
    "HicriTarihUzunIso8601": null,
    "AyinSekliURL": "https://namazvakti.diyanet.gov.tr/images/sondordun.gif",
    "MiladiTarihKisa": "12.12.2025",
    "MiladiTarihKisaIso8601": "12.12.2025",
    "MiladiTarihUzun": "12 Aralık 2025 Cuma",
    "MiladiTarihUzunIso8601": "2025-12-12T00:00:00.0000000+03:00",
    "GreenwichOrtalamaZamani": 3.0,
    "Aksam": "18:13",
    "Gunes": "05:53",
    "GunesBatis": "18:06",
    "GunesDogus": "06:00",
    "Ikindi": "15:33",
    "Imsak": "04:46",
    "KibleSaati": "11:51",
    "Ogle": "12:08",
    "Yatsi": "19:17"
  },
  {
    "HicriTarihKisa": "23.6.1447",
    "HicriTarihKisaIso8601": null,
    "HicriTarihUzun": "23 Cemaziyelahir 1447",
    "HicriTarihUzunIso8601": null,
    "AyinSekliURL": "https://namazvakti.diyanet.gov.tr/images/sd1.gif",
    "MiladiTarihKisa": "13.12.2025",
    "MiladiTarihKisaIso8601": "13.12.2025",
    "MiladiTarihUzun": "13 Aralık 2025 Cumartesi",
    "MiladiTarihUzunIso8601": "2025-12-13T00:00:00.0000000+03:00",
    "GreenwichOrtalamaZamani": 3.0,
    "Aksam": "18:14",
    "Gunes": "05:54",
    "GunesBatis": "18:07",
    "GunesDogus": "06:01",
    "Ikindi": "15:33",
    "Imsak": "04:46",
    "KibleSaati": "11:52",
    "Ogle": "12:09",
    "Yatsi": "19:17"
  },
  {
    "HicriTarihKisa": "24.6.1447",
    "HicriTarihKisaIso8601": null,
    "HicriTarihUzun": "24 Cemaziyelahir 1447",
    "HicriTarihUzunIso8601": null,
    "AyinSekliURL": "https://namazvakti.diyanet.gov.tr/images/sd2.gif",
    "MiladiTarihKisa": "14.12.2025",
    "MiladiTarihKisaIso8601": "14.12.2025",
    "MiladiTarihUzun": "14 Aralık 2025 Pazar",
    "MiladiTarihUzunIso8601": "2025-12-14T00:00:00.0000000+03:00",
    "GreenwichOrtalamaZamani": 3.0,
    "Aksam": "18:14",
    "Gunes": "05:54",
    "GunesBatis": "18:07",
    "GunesDogus": "06:01",
    "Ikindi": "15:34",
    "Imsak": "04:46",
    "KibleSaati": "11:52",
    "Ogle": "12:09",
    "Yatsi": "19:18"
  },
  {
    "HicriTarihKisa": "25.6.1447",
    "HicriTarihKisaIso8601": null,
    "HicriTarihUzun": "25 Cemaziyelahir 1447",
    "HicriTarihUzunIso8601": null,
    "AyinSekliURL": "https://namazvakti.diyanet.gov.tr/images/sd3.gif",
    "MiladiTarihKisa": "15.12.2025",
    "MiladiTarihKisaIso8601": "15.12.2025",
    "MiladiTarihUzun": "15 Aralık 2025 Pazartesi",
    "MiladiTarihUzunIso8601": "2025-12-15T00:00:00.0000000+03:00",
    "GreenwichOrtalamaZamani": 3.0,
    "Aksam": "18:15",
    "Gunes": "05:55",
    "GunesBatis": "18:08",
    "GunesDogus": "06:02",
    "Ikindi": "15:34",
    "Imsak": "04:47",
    "KibleSaati": "11:53",
    "Ogle": "12:10",
    "Yatsi": "19:18"
  },
  {
    "HicriTarihKisa": "26.6.1447",
    "HicriTarihKisaIso8601": null,
    "HicriTarihUzun": "26 Cemaziyelahir 1447",
    "HicriTarihUzunIso8601": null,
    "AyinSekliURL": "https://namazvakti.diyanet.gov.tr/images/sd4.gif",
    "MiladiTarihKisa": "16.12.2025",
    "MiladiTarihKisaIso8601": "16.12.2025",
    "MiladiTarihUzun": "16 Aralık 2025 Salı",
    "MiladiTarihUzunIso8601": "2025-12-16T00:00:00.0000000+03:00",
    "GreenwichOrtalamaZamani": 3.0,
    "Aksam": "18:15",
    "Gunes": "05:55",
    "GunesBatis": "18:08",
    "GunesDogus": "06:02",
    "Ikindi": "15:35",
    "Imsak": "04:47",
    "KibleSaati": "11:53",
    "Ogle": "12:10",
    "Yatsi": "19:19"
  },
  {
    "HicriTarihKisa": "27.6.1447",
    "HicriTarihKisaIso8601": null,
    "HicriTarihUzun": "27 Cemaziyelahir 1447",
    "HicriTarihUzunIso8601": null,
    "AyinSekliURL": "https://namazvakti.diyanet.gov.tr/images/sd5.gif",
    "MiladiTarihKisa": "17.12.2025",
    "MiladiTarihKisaIso8601": "17.12.2025",
    "MiladiTarihUzun": "17 Aralık 2025 Çarşamba",
    "MiladiTarihUzunIso8601": "2025-12-17T00:00:00.0000000+03:00",
    "GreenwichOrtalamaZamani": 3.0,
    "Aksam": "18:16",
    "Gunes": "05:56",
    "GunesBatis": "18:09",
    "GunesDogus": "06:03",
    "Ikindi": "15:35",
    "Imsak": "04:48",
    "KibleSaati": "11:54",
    "Ogle": "12:11",
    "Yatsi": "19:19"
  },
  {
    "HicriTarihKisa": "28.6.1447",
    "HicriTarihKisaIso8601": null,
    "HicriTarihUzun": "28 Cemaziyelahir 1447",
    "HicriTarihUzunIso8601": null,
    "AyinSekliURL": "https://namazvakti.diyanet.gov.tr/images/sd6.gif",
    "MiladiTarihKisa": "18.12.2025",
    "MiladiTarihKisaIso8601": "18.12.2025",
    "MiladiTarihUzun": "18 Aralık 2025 Perşembe",
    "MiladiTarihUzunIso8601": "2025-12-18T00:00:00.0000000+03:00",
    "GreenwichOrtalamaZamani": 3.0,
    "Aksam": "18:16",
    "Gunes": "05:56",
    "GunesBatis": "18:09",
    "GunesDogus": "06:03",
    "Ikindi": "15:36",
    "Imsak": "04:48",
    "KibleSaati": "11:54",
    "Ogle": "12:11",
    "Yatsi": "19:20"
  },
  {
    "HicriTarihKisa": "29.6.1447",
    "HicriTarihKisaIso8601": null,
    "HicriTarihUzun": "29 Cemaziyelahir 1447",
    "HicriTarihUzunIso8601": null,
    "AyinSekliURL": "https://namazvakti.diyanet.gov.tr/images/sd7.gif",
    "MiladiTarihKisa": "19.12.2025",
    "MiladiTarihKisaIso8601": "19.12.2025",
    "MiladiTarihUzun": "19 Aralık 2025 Cuma",
    "MiladiTarihUzunIso8601": "2025-12-19T00:00:00.0000000+03:00",
    "GreenwichOrtalamaZamani": 3.0,
    "Aksam": "18:17",
    "Gunes": "05:57",
    "GunesBatis": "18:10",
    "GunesDogus": "06:04",
    "Ikindi": "15:36",
    "Imsak": "04:49",
    "KibleSaati": "11:54",
    "Ogle": "12:12",
    "Yatsi": "19:21"
  },
  {
    "HicriTarihKisa": "30.6.1447",
    "HicriTarihKisaIso8601": null,
    "HicriTarihUzun": "30 Cemaziyelahir 1447",
    "HicriTarihUzunIso8601": null,
    "AyinSekliURL": "https://namazvakti.diyanet.gov.tr/images/ruyet.gif",
    "MiladiTarihKisa": "20.12.2025",
    "MiladiTarihKisaIso8601": "20.12.2025",
    "MiladiTarihUzun": "20 Aralık 2025 Cumartesi",
    "MiladiTarihUzunIso8601": "2025-12-20T00:00:00.0000000+03:00",
    "GreenwichOrtalamaZamani": 3.0,
    "Aksam": "18:17",
    "Gunes": "05:57",
    "GunesBatis": "18:10",
    "GunesDogus": "06:04",
    "Ikindi": "15:37",
    "Imsak": "04:49",
    "KibleSaati": "11:55",
    "Ogle": "12:12",
    "Yatsi": "19:21"
  },
  {
    "HicriTarihKisa": "1.7.1447",
    "HicriTarihKisaIso8601": null,
    "HicriTarihUzun": "1 Recep 1447",
    "HicriTarihUzunIso8601": null,
    "AyinSekliURL": "https://namazvakti.diyanet.gov.tr/images/r1.gif",
    "MiladiTarihKisa": "21.12.2025",
    "MiladiTarihKisaIso8601": "21.12.2025",
    "MiladiTarihUzun": "21 Aralık 2025 Pazar",
    "MiladiTarihUzunIso8601": "2025-12-21T00:00:00.0000000+03:00",
    "GreenwichOrtalamaZamani": 3.0,
    "Aksam": "18:18",
    "Gunes": "05:58",
    "GunesBatis": "18:11",
    "GunesDogus": "06:05",
    "Ikindi": "15:37",
    "Imsak": "04:50",
    "KibleSaati": "11:55",
    "Ogle": "12:13",
    "Yatsi": "19:22"
  },
  {
    "HicriTarihKisa": "2.7.1447",
    "HicriTarihKisaIso8601": null,
    "HicriTarihUzun": "2 Recep 1447",
    "HicriTarihUzunIso8601": null,
    "AyinSekliURL": "https://namazvakti.diyanet.gov.tr/images/r2.gif",
    "MiladiTarihKisa": "22.12.2025",
    "MiladiTarihKisaIso8601": "22.12.2025",
    "MiladiTarihUzun": "22 Aralık 2025 Pazartesi",
    "MiladiTarihUzunIso8601": "2025-12-22T00:00:00.0000000+03:00",
    "GreenwichOrtalamaZamani": 3.0,
    "Aksam": "18:18",
    "Gunes": "05:58",
    "GunesBatis": "18:11",
    "GunesDogus": "06:05",
    "Ikindi": "15:38",
    "Imsak": "04:50",
    "KibleSaati": "11:56",
    "Ogle": "12:13",
    "Yatsi": "19:22"
  },
  {
    "HicriTarihKisa": "3.7.1447",
    "HicriTarihKisaIso8601": null,
    "HicriTarihUzun": "3 Recep 1447",
    "HicriTarihUzunIso8601": null,
    "AyinSekliURL": "https://namazvakti.diyanet.gov.tr/images/r3.gif",
    "MiladiTarihKisa": "23.12.2025",
    "MiladiTarihKisaIso8601": "23.12.2025",
    "MiladiTarihUzun": "23 Aralık 2025 Salı",
    "MiladiTarihUzunIso8601": "2025-12-23T00:00:00.0000000+03:00",
    "GreenwichOrtalamaZamani": 3.0,
    "Aksam": "18:19",
    "Gunes": "05:59",
    "GunesBatis": "18:12",
    "GunesDogus": "06:06",
    "Ikindi": "15:38",
    "Imsak": "04:51",
    "KibleSaati": "11:56",
    "Ogle": "12:14",
    "Yatsi": "19:23"
  },
  {
    "HicriTarihKisa": "4.7.1447",
    "HicriTarihKisaIso8601": null,
    "HicriTarihUzun": "4 Recep 1447",
    "HicriTarihUzunIso8601": null,
    "AyinSekliURL": "https://namazvakti.diyanet.gov.tr/images/r4.gif",
    "MiladiTarihKisa": "24.12.2025",
    "MiladiTarihKisaIso8601": "24.12.2025",
    "MiladiTarihUzun": "24 Aralık 2025 Çarşamba",
    "MiladiTarihUzunIso8601": "2025-12-24T00:00:00.0000000+03:00",
    "GreenwichOrtalamaZamani": 3.0,
    "Aksam": "18:19",
    "Gunes": "05:59",
    "GunesBatis": "18:12",
    "GunesDogus": "06:06",
    "Ikindi": "15:39",
    "Imsak": "04:51",
    "KibleSaati": "11:57",
    "Ogle": "12:14",
    "Yatsi": "19:23"
  },
  {
    "HicriTarihKisa": "5.7.1447",
    "HicriTarihKisaIso8601": null,
    "HicriTarihUzun": "5 Recep 1447",
    "HicriTarihUzunIso8601": null,
    "AyinSekliURL": "https://namazvakti.diyanet.gov.tr/images/r5.gif",
    "MiladiTarihKisa": "25.12.2025",
    "MiladiTarihKisaIso8601": "25.12.2025",
    "MiladiTarihUzun": "25 Aralık 2025 Perşembe",
    "MiladiTarihUzunIso8601": "2025-12-25T00:00:00.0000000+03:00",
    "GreenwichOrtalamaZamani": 3.0,
    "Aksam": "18:20",
    "Gunes": "06:00",
    "GunesBatis": "18:13",
    "GunesDogus": "06:07",
    "Ikindi": "15:39",
    "Imsak": "04:52",
    "KibleSaati": "11:57",
    "Ogle": "12:15",
    "Yatsi": "19:23"
  },
  {
    "HicriTarihKisa": "6.7.1447",
    "HicriTarihKisaIso8601": null,
    "HicriTarihUzun": "6 Recep 1447",
    "HicriTarihUzunIso8601": null,
    "AyinSekliURL": "https://namazvakti.diyanet.gov.tr/images/r6.gif",
    "MiladiTarihKisa": "26.12.2025",
    "MiladiTarihKisaIso8601": "26.12.2025",
    "MiladiTarihUzun": "26 Aralık 2025 Cuma",
    "MiladiTarihUzunIso8601": "2025-12-26T00:00:00.0000000+03:00",
    "GreenwichOrtalamaZamani": 3.0,
    "Aksam": "18:20",
    "Gunes": "06:00",
    "GunesBatis": "18:13",
    "GunesDogus": "06:07",
    "Ikindi": "15:40",
    "Imsak": "04:52",
    "KibleSaati": "11:58",
    "Ogle": "12:15",
    "Yatsi": "19:24"
  },
  {
    "HicriTarihKisa": "7.7.1447",
    "HicriTarihKisaIso8601": null,
    "HicriTarihUzun": "7 Recep 1447",
    "HicriTarihUzunIso8601": null,
    "AyinSekliURL": "https://namazvakti.diyanet.gov.tr/images/ilkdordun.gif",
    "MiladiTarihKisa": "27.12.2025",
    "MiladiTarihKisaIso8601": "27.12.2025",
    "MiladiTarihUzun": "27 Aralık 2025 Cumartesi",
    "MiladiTarihUzunIso8601": "2025-12-27T00:00:00.0000000+03:00",
    "GreenwichOrtalamaZamani": 3.0,
    "Aksam": "18:21",
    "Gunes": "06:01",
    "GunesBatis": "18:14",
    "GunesDogus": "06:08",
    "Ikindi": "15:40",
    "Imsak": "04:53",
    "KibleSaati": "11:59",
    "Ogle": "12:16",
    "Yatsi": "19:24"
  },
  {
    "HicriTarihKisa": "8.7.1447",
    "HicriTarihKisaIso8601": null,
    "HicriTarihUzun": "8 Recep 1447",
    "HicriTarihUzunIso8601": null,
    "AyinSekliURL": "https://namazvakti.diyanet.gov.tr/images/i1.gif",
    "MiladiTarihKisa": "28.12.2025",
    "MiladiTarihKisaIso8601": "28.12.2025",
    "MiladiTarihUzun": "28 Aralık 2025 Pazar",
    "MiladiTarihUzunIso8601": "2025-12-28T00:00:00.0000000+03:00",
    "GreenwichOrtalamaZamani": 3.0,
    "Aksam": "18:21",
    "Gunes": "06:01",
    "GunesBatis": "18:14",
    "GunesDogus": "06:08",
    "Ikindi": "15:41",
    "Imsak": "04:53",
    "KibleSaati": "11:59",
    "Ogle": "12:16",
    "Yatsi": "19:25"
  }
]