[
  {
    "HicriTarihKisa": "27.4.1447",
    "HicriTarihKisaIso8601": null,
    "HicriTarihUzun": "27 Rebiulahir 1447",
    "HicriTarihUzunIso8601": null,
    "AyinSekliURL": "https://namazvakti.diyanet.gov.tr/images/sd6.gif",
    "MiladiTarihKisa": "19.10.2025",
    "MiladiTarihKisaIso8601": "19.10.2025",
    "MiladiTarihUzun": "19 Ekim 2025 Pazar",
    "MiladiTarihUzunIso8601": "2025-10-19T00:00:00.0000000-03:00",
    "GreenwichOrtalamaZamani": 3.0,
    "Aksam": "19:34",
    "Gunes": "06:30",
    "GunesBatis": "19:27",
    "GunesDogus": "06:37",
    "Ikindi": "16:39",
    "Imsak": "05:16",
    "KibleSaati": "07:42",
    "Ogle": "13:07",
    "Yatsi": "20:44"
  },
  {
    "HicriTarihKisa": "28.4.1447",
    "HicriTarihKisaIso8601": null,
    "HicriTarihUzun": "28 Rebiulahir 1447",
    "HicriTarihUzunIso8601": null,
    "AyinSekliURL": "https://namazvakti.diyanet.gov.tr/images/sd7.gif",
    "MiladiTarihKisa": "20.10.2025",
    "MiladiTarihKisaIso8601": "20.10.2025",
    "MiladiTarihUzun": "20 Ekim 2025 Pazartesi",
    "MiladiTarihUzunIso8601": "2025-10-20T00:00:00.0000000-03:00",
    "GreenwichOrtalamaZamani": 3.0,
    "Aksam": "19:35",
    "Gunes": "06:29",
    "GunesBatis": "19:28",
    "GunesDogus": "06:36",
    "Ikindi": "16:39",
    "Imsak": "05:15",
    "KibleSaati": "07:39",
    "Ogle": "13:07",
    "Yatsi": "20:44"
  },
  {
    "HicriTarihKisa": "29.4.1447",
    "HicriTarihKisaIso8601": null,
    "HicriTarihUzun": "29 Rebiulahir 1447",
    "HicriTarihUzunIso8601": null,
    "AyinSekliURL": "https://namazvakti.diyanet.gov.tr/images/ictima.gif",
    "MiladiTarihKisa": "21.10.2025",
    "MiladiTarihKisaIso8601": "21.10.2025",
    "MiladiTarihUzun": "21 Ekim 2025 Salı",
    "MiladiTarihUzunIso8601": "2025-10-21T00:00:00.0000000-03:00",
    "GreenwichOrtalamaZamani": 3.0,
    "Aksam": "19:36",
    "Gunes": "06:28",
    "GunesBatis": "19:29",
    "GunesDogus": "06:35",
    "Ikindi": "16:38",
    "Imsak": "05:13",
    "KibleSaati": "07:37",
    "Ogle": "13:07",
    "Yatsi": "20:45"
  },
  {
    "HicriTarihKisa": "30.4.1447",
    "HicriTarihKisaIso8601": null,
    "HicriTarihUzun": "30 Rebiulahir 1447",
    "HicriTarihUzunIso8601": null,
    "AyinSekliURL": "https://namazvakti.diyanet.gov.tr/images/ruyet.gif",
    "MiladiTarihKisa": "22.10.2025",
    "MiladiTarihKisaIso8601": "22.10.2025",
    "MiladiTarihUzun": "22 Ekim 2025 Çarşamba",
    "MiladiTarihUzunIso8601": "2025-10-22T00:00:00.0000000-03:00",
    "GreenwichOrtalamaZamani": 3.0,
    "Aksam": "19:36",
    "Gunes": "06:27",
    "GunesBatis": "19:29",
    "GunesDogus": "06:34",
    "Ikindi": "16:38",
    "Imsak": "05:12",
    "KibleSaati": "07:34",
    "Ogle": "13:07",
    "Yatsi": "20:46"
  },
  {
    "HicriTarihKisa": "1.5.1447",
    "HicriTarihKisaIso8601": null,
    "HicriTarihUzun": "1 Cemaziyelevvel 1447",
    "HicriTarihUzunIso8601": null,
    "AyinSekliURL": "https://namazvakti.diyanet.gov.tr/images/r1.gif",
    "MiladiTarihKisa": "23.10.2025",
    "MiladiTarihKisaIso8601": "23.10.2025",
    "MiladiTarihUzun": "23 Ekim 2025 Perşembe",
    "MiladiTarihUzunIso8601": "2025-10-23T00:00:00.0000000-03:00",
    "GreenwichOrtalamaZamani": 3.0,
    "Aksam": "19:37",
    "Gunes": "06:26",
    "GunesBatis": "19:30",
    "GunesDogus": "06:33",
    "Ikindi": "16:38",
    "Imsak": "05:11",
    "KibleSaati": "07:31",
    "Ogle": "13:06",
    "Yatsi": "20:47"
  },
  {
    "HicriTarihKisa": "2.5.1447",
    "HicriTarihKisaIso8601": null,
    "HicriTarihUzun": "2 Cemaziyelevvel 1447",
    "HicriTarihUzunIso8601": null,
    "AyinSekliURL": "https://namazvakti.diyanet.gov.tr/images/r2.gif",
    "MiladiTarihKisa": "24.10.2025",
    "MiladiTarihKisaIso8601": "24.10.2025",
    "MiladiTarihUzun": "24 Ekim 2025 Cuma",
    "MiladiTarihUzunIso8601": "2025-10-24T00:00:00.0000000-03:00",
    "GreenwichOrtalamaZamani": 3.0,
    "Aksam": "19:37",
    "Gunes": "06:25",
    "GunesBatis": "19:30",
    "GunesDogus": "06:32",
    "Ikindi": "16:38",
    "Imsak": "05:10",
    "KibleSaati": "07:28",
    "Ogle": "13:06",
    "Yatsi": "20:48"
  },
  {
    "HicriTarihKisa": "3.5.1447",
    "HicriTarihKisaIso8601": null,
    "HicriTarihUzun": "3 Cemaziyelevvel 1447",
    "HicriTarihUzunIso8601": null,
    "AyinSekliURL": "https://namazvakti.diyanet.gov.tr/images/r3.gif",
    "MiladiTarihKisa": "25.10.2025",
    "MiladiTarihKisaIso8601": "25.10.2025",
    "MiladiTarihUzun": "25 Ekim 2025 Cumartesi",
    "MiladiTarihUzunIso8601": "2025-10-25T00:00:00.0000000-03:00",
    "GreenwichOrtalamaZamani": 3.0,
    "Aksam": "19:38",
    "Gunes": "06:24",
    "GunesBatis": "19:31",
    "GunesDogus": "06:31",
    "Ikindi": "16:38",
    "Imsak": "05:09",
    "KibleSaati": "07:26",
    "Ogle": "13:06",
    "Yatsi": "20:48"
  },
  {
    "HicriTarihKisa": "4.5.1447",
    "HicriTarihKisaIso8601": null,
    "HicriTarihUzun": "4 Cemaziyelevvel 1447",
    "HicriTarihUzunIso8601": null,
    "AyinSekliURL": "https://namazvakti.diyanet.gov.tr/images/r4.gif",
    "MiladiTarihKisa": "26.10.2025",
    "MiladiTarihKisaIso8601": "26.10.2025",
    "MiladiTarihUzun": "26 Ekim 2025 Pazar",
    "MiladiTarihUzunIso8601": "2025-10-26T00:00:00.0000000-03:00",
    "GreenwichOrtalamaZamani": 3.0,
    "Aksam": "19:39",
    "Gunes": "06:23",
    "GunesBatis": "19:32",
    "GunesDogus": "06:30",
    "Ikindi": "16:38",
    "Imsak": "05:08",
    "KibleSaati": "07:23",
    "Ogle": "13:06",
    "Yatsi": "20:49"
  },
  {
    "HicriTarihKisa": "5.5.1447",
    "HicriTarihKisaIso8601": null,
    "HicriTarihUzun": "5 Cemaziyelevvel 1447",
    "HicriTarihUzunIso8601": null,
    "AyinSekliURL": "https://namazvakti.diyanet.gov.tr/images/r5.gif",
    "MiladiTarihKisa": "27.10.2025",
    "MiladiTarihKisaIso8601": "27.10.2025",
    "MiladiTarihUzun": "27 Ekim 2025 Pazartesi",
    "MiladiTarihUzunIso8601": "2025-10-27T00:00:00.0000000-03:00",
    "GreenwichOrtalamaZamani": 3.0,
    "Aksam": "19:39",
    "Gunes": "06:23",
    "GunesBatis": "19:32",
    "GunesDogus": "06:30",
    "Ikindi": "16:38",
    "Imsak": "05:07",
    "KibleSaati": "07:20",
    "Ogle": "13:06",
    "Yatsi": "20:50"
  },
  {
    "HicriTarihKisa": "6.5.1447",
    "HicriTarihKisaIso8601": null,
    "HicriTarihUzun": "6 Cemaziyelevvel 1447",
    "HicriTarihUzunIso8601": null,
    "AyinSekliURL": "https://namazvakti.diyanet.gov.tr/images/r6.gif",
    "MiladiTarihKisa": "28.10.2025",
    "MiladiTarihKisaIso8601": "28.10.2025",
    "MiladiTarihUzun": "28 Ekim 2025 Salı",
    "MiladiTarihUzunIso8601": "2025-10-28T00:00:00.0000000-03:00",
    "GreenwichOrtalamaZamani": 3.0,
    "Aksam": "19:40",
    "Gunes": "06:22",
    "GunesBatis": "19:33",
    "GunesDogus": "06:29",
    "Ikindi": "16:38",
    "Imsak": "05:06",
    "KibleSaati": "07:18",
    "Ogle": "13:06",
    "Yatsi": "20:51"
  },
  {
    "HicriTarihKisa": "7.5.1447",
    "HicriTarihKisaIso8601": null,
    "HicriTarihUzun": "7 Cemaziyelevvel 1447",
    "HicriTarihUzunIso8601": null,
    "AyinSekliURL": "https://namazvakti.diyanet.gov.tr/images/ilkdordun.gif",
    "MiladiTarihKisa": "29.10.2025",
    "MiladiTarihKisaIso8601": "29.10.2025",
    "MiladiTarihUzun": "29 Ekim 2025 Çarşamba",
    "MiladiTarihUzunIso8601": "2025-10-29T00:00:00.0000000-03:00",
    "GreenwichOrtalamaZamani": 3.0,
    "Aksam": "19:41",
    "Gunes": "06:21",
    "GunesBatis": "19:34",
    "GunesDogus": "06:28",
    "Ikindi": "16:38",
    "Imsak": "05:05",
    "KibleSaati": "07:15",
    "Ogle": "13:06",
    "Yatsi": "20:52"
  },
  {
    "HicriTarihKisa": "8.5.1447",
    "HicriTarihKisaIso8601": null,
    "HicriTarihUzun": "8 Cemaziyelevvel 1447",
    "HicriTarihUzunIso8601": null,
    "AyinSekliURL": "https://namazvakti.diyanet.gov.tr/images/i1.gif",
    "MiladiTarihKisa": "30.10.2025",
    "MiladiTarihKisaIso8601": "30.10.2025",
    "MiladiTarihUzun": "30 Ekim 2025 Perşembe",
    "MiladiTarihUzunIso8601": "2025-10-30T00:00:00.0000000-03:00",
    "GreenwichOrtalamaZamani": 3.0,
    "Aksam": "19:41",
    "Gunes": "06:20",
    "GunesBatis": "19:34",
    "GunesDogus": "06:27",
    "Ikindi": "16:38",
    "Imsak": "05:04",
    "KibleSaati": "07:12",
    "Ogle": "13:06",
    "Yatsi": "20:53"
  },
  {
    "HicriTarihKisa": "9.5.1447",
    "HicriTarihKisaIso8601": null,
    "HicriTarihUzun": "9 Cemaziyelevvel 1447",
    "HicriTarihUzunIso8601": null,
    "AyinSekliURL": "https://namazvakti.diyanet.gov.tr/images/i2.gif",
    "MiladiTarihKisa": "31.10.2025",
    "MiladiTarihKisaIso8601": "31.10.2025",
    "MiladiTarihUzun": "31 Ekim 2025 Cuma",
    "MiladiTarihUzunIso8601": "2025-10-31T00:00:00.0000000-03:00",
    "GreenwichOrtalamaZamani": 3.0,
    "Aksam": "19:42",
    "Gunes": "06:19",
    "GunesBatis": "19:35",
    "GunesDogus": "06:26",
    "Ikindi": "16:38",
    "Imsak": "05:03",
    "KibleSaati": "07:10",
    "Ogle": "13:06",
    "Yatsi": "20:54"
  },
  {
    "HicriTarihKisa": "10.5.1447",
    "HicriTarihKisaIso8601": null,
    "HicriTarihUzun": "10 Cemaziyelevvel 1447",
    "HicriTarihUzunIso8601": null,
    "AyinSekliURL": "https://namazvakti.diyanet.gov.tr/images/i3.gif",
    "MiladiTarihKisa": "01.11.2025",
    "MiladiTarihKisaIso8601": "01.11.2025",
    "MiladiTarihUzun": "01 Kasım 2025 Cumartesi",
    "MiladiTarihUzunIso8601": "2025-11-01T00:00:00.0000000-03:00",
    "GreenwichOrtalamaZamani": 3.0,
    "Aksam": "19:43",
    "Gunes": "06:19",
    "GunesBatis": "19:36",
    "GunesDogus": "06:26",
    "Ikindi": "16:38",
    "Imsak": "05:02",
    "KibleSaati": "07:07",
    "Ogle": "13:06",
    "Yatsi": "20:55"
  },
  {
    "HicriTarihKisa": "11.5.1447",
    "HicriTarihKisaIso8601": null,
    "HicriTarihUzun": "11 Cemaziyelevvel 1447",
    "HicriTarihUzunIso8601": null,
    "AyinSekliURL": "https://namazvakti.diyanet.gov.tr/images/i4.gif",
    "MiladiTarihKisa": "02.11.2025",
    "MiladiTarihKisaIso8601": "02.11.2025",
    "MiladiTarihUzun": "02 Kasım 2025 Pazar",
    "MiladiTarihUzunIso8601": "2025-11-02T00:00:00.0000000-03:00",
    "GreenwichOrtalamaZamani": 3.0,
    "Aksam": "19:44",
    "Gunes": "06:18",
    "GunesBatis": "19:37",
    "GunesDogus": "06:25",
    "Ikindi": "16:38",
    "Imsak": "05:01",
    "KibleSaati": "07:04",
    "Ogle": "13:06",
    "Yatsi": "20:56"
  },
  {
    "HicriTarihKisa": "12.5.1447",
    "HicriTarihKisaIso8601": null,
    "HicriTarihUzun": "12 Cemaziyelevvel 1447",
    "HicriTarihUzunIso8601": null,
    "AyinSekliURL": "https://namazvakti.diyanet.gov.tr/images/i5.gif",
    "MiladiTarihKisa": "03.11.2025",
    "MiladiTarihKisaIso8601": "03.11.2025",
    "MiladiTarihUzun": "03 Kasım 2025 Pazartesi",
    "MiladiTarihUzunIso8601": "2025-11-03T00:00:00.0000000-03:00",
    "GreenwichOrtalamaZamani": 3.0,
    "Aksam": "19:44",
    "Gunes": "06:17",
    "GunesBatis": "19:37",
    "GunesDogus": "06:24",
    "Ikindi": "16:38",
    "Imsak": "05:00",
    "KibleSaati": "07:02",
    "Ogle": "13:06",
    "Yatsi": "20:56"
  },
  {
    "HicriTarihKisa": "13.5.1447",
    "HicriTarihKisaIso8601": null,
    "HicriTarihUzun": "13 Cemaziyelevvel 1447",
    "HicriTarihUzunIso8601": null,
    "AyinSekliURL": "https://namazvakti.diyanet.gov.tr/images/i6.gif",
    "MiladiTarihKisa": "04.11.2025",
    "MiladiTarihKisaIso8601": "04.11.2025",
    "MiladiTarihUzun": "04 Kasım 2025 Salı",
    "MiladiTarihUzunIso8601": "2025-11-04T00:00:00.0000000-03:00",
    "GreenwichOrtalamaZamani": 3.0,
    "Aksam": "19:45",
    "Gunes": "06:16",
    "GunesBatis": "19:38",
    "GunesDogus": "06:23",
    "Ikindi": "16:38",
    "Imsak": "04:59",
    "KibleSaati": "06:59",
    "Ogle": "13:06",
    "Yatsi": "20:57"
  },
  {
    "HicriTarihKisa": "14.5.1447",
    "HicriTarihKisaIso8601": null,
    "HicriTarihUzun": "14 Cemaziyelevvel 1447",
    "HicriTarihUzunIso8601": null,
    "AyinSekliURL": "https://namazvakti.diyanet.gov.tr/images/dolunay.gif",
    "MiladiTarihKisa": "05.11.2025",
    "MiladiTarihKisaIso8601": "05.11.2025",
    "MiladiTarihUzun": "05 Kasım 2025 Çarşamba",
    "MiladiTarihUzunIso8601": "2025-11-05T00:00:00.0000000-03:00",
    "GreenwichOrtalamaZamani": 3.0,
    "Aksam": "19:46",
    "Gunes": "06:16",
    "GunesBatis": "19:39",
    "GunesDogus": "06:23",
    "Ikindi": "16:38",
    "Imsak": "04:58",
    "KibleSaati": "06:57",
    "Ogle": "13:06",
    "Yatsi": "20:58"
  },
  {
    "HicriTarihKisa": "15.5.1447",
    "HicriTarihKisaIso8601": null,
    "HicriTarihUzun": "15 Cemaziyelevvel 1447",
    "HicriTarihUzunIso8601": null,
    "AyinSekliURL": "https://namazvakti.diyanet.gov.tr/images/d1.gif",
    "MiladiTarihKisa": "06.11.2025",
    "MiladiTarihKisaIso8601": "06.11.2025",
    "MiladiTarihUzun": "06 Kasım 2025 Perşembe",
    "MiladiTarihUzunIso8601": "2025-11-06T00:00:00.0000000-03:00",
    "GreenwichOrtalamaZamani": 3.0,
    "Aksam": "19:46",
    "Gunes": "06:15",
    "GunesBatis": "19:39",
    "GunesDogus": "06:22",
    "Ikindi": "16:38",
    "Imsak": "04:57",
    "KibleSaati": "06:54",
    "Ogle": "13:06",
    "Yatsi": "20:59"
  },
  {
    "HicriTarihKisa": "16.5.1447",
    "HicriTarihKisaIso8601": null,
    "HicriTarihUzun": "16 Cemaziyelevvel 1447",
    "HicriTarihUzunIso8601": null,
    "AyinSekliURL": "https://namazvakti.diyanet.gov.tr/images/d2.gif",
    "MiladiTarihKisa": "07.11.2025",
    "MiladiTarihKisaIso8601": "07.11.2025",
    "MiladiTarihUzun": "07 Kasım 2025 Cuma",
    "MiladiTarihUzunIso8601": "2025-11-07T00:00:00.0000000-03:00",
    "GreenwichOrtalamaZamani": 3.0,
    "Aksam": "19:47",
    "Gunes": "06:14",
    "GunesBatis": "19:40",
    "GunesDogus": "06:21",
    "Ikindi": "16:38",
    "Imsak": "04:56",
    "KibleSaati": "06:52",
    "Ogle": "13:06",
    "Yatsi": "21:00"
  },
  {
    "HicriTarihKisa": "17.5.1447",
    "HicriTarihKisaIso8601": null,
    "HicriTarihUzun": "17 Cemaziyelevvel 1447",
    "HicriTarihUzunIso8601": null,
    "AyinSekliURL": "https://namazvakti.diyanet.gov.tr/images/d3.gif",
    "MiladiTarihKisa": "08.11.2025",
    "MiladiTarihKisaIso8601": "08.11.2025",
    "MiladiTarihUzun": "08 Kasım 2025 Cumartesi",
    "MiladiTarihUzunIso8601": "2025-11-08T00:00:00.0000000-03:00",
    "GreenwichOrtalamaZamani": 3.0,
    "Aksam": "19:48",
    "Gunes": "06:14",
    "GunesBatis": "19:41",
    "GunesDogus": "06:21",
    "Ikindi": "16:38",
    "Imsak": "04:55",
    "KibleSaati": "06:50",
    "Ogle": "13:06",
    "Yatsi": "21:01"
  },
  {
    "HicriTarihKisa": "18.5.1447",
    "HicriTarihKisaIso8601": null,
    "HicriTarihUzun": "18 Cemaziyelevvel 1447",
    "HicriTarihUzunIso8601": null,
    "AyinSekliURL": "https://namazvakti.diyanet.gov.tr/images/d4.gif",
    "MiladiTarihKisa": "09.11.2025",
    "MiladiTarihKisaIso8601": "09.11.2025",
    "MiladiTarihUzun": "09 Kasım 2025 Pazar",
    "MiladiTarihUzunIso8601": "2025-11-09T00:00:00.0000000-03:00",
    "GreenwichOrtalamaZamani": 3.0,
    "Aksam": "19:49",
    "Gunes": "06:13",
    "GunesBatis": "19:42",
    "GunesDogus": "06:20",
    "Ikindi": "16:38",
    "Imsak": "04:54",
    "KibleSaati": "06:47",
    "Ogle": "13:06",
    "Yatsi": "21:02"
  },
  {
    "HicriTarihKisa": "19.5.1447",
    "HicriTarihKisaIso8601": null,
    "HicriTarihUzun": "19 Cemaziyelevvel 1447",
    "HicriTarihUzunIso8601": null,
    "AyinSekliURL": "https://namazvakti.diyanet.gov.tr/images/d5.gif",
    "MiladiTarihKisa": "10.11.2025",
    "MiladiTarihKisaIso8601": "10.11.2025",
    "MiladiTarihUzun": "10 Kasım 2025 Pazartesi",
    "MiladiTarihUzunIso8601": "2025-11-10T00:00:00.0000000-03:00",
    "GreenwichOrtalamaZamani": 3.0,
    "Aksam": "19:49",
    "Gunes": "06:13",
    "GunesBatis": "19:42",
    "GunesDogus": "06:20",
    "Ikindi": "16:38",
    "Imsak": "04:53",
    "KibleSaati": "06:45",
    "Ogle": "13:06",
    "Yatsi": "21:03"
  },
  {
    "HicriTarihKisa": "20.5.1447",
    "HicriTarihKisaIso8601": null,
    "HicriTarihUzun": "20 Cemaziyelevvel 1447",
    "HicriTarihUzunIso8601": null,
    "AyinSekliURL": "https://namazvakti.diyanet.gov.tr/images/d6.gif",
    "MiladiTarihKisa": "11.11.2025",
    "MiladiTarihKisaIso8601": "11.11.2025",
    "MiladiTarihUzun": "11 Kasım 2025 Salı",
    "MiladiTarihUzunIso8601": "2025-11-11T00:00:00.0000000-03:00",
    "GreenwichOrtalamaZamani": 3.0,
    "Aksam": "19:50",
    "Gunes": "06:12",
    "GunesBatis": "19:43",
    "GunesDogus": "06:19",
    "Ikindi": "16:38",
    "Imsak": "04:53",
    "KibleSaati": "06:43",
    "Ogle": "13:06",
    "Yatsi": "21:04"
  },
  {
    "HicriTarihKisa": "21.5.1447",
    "HicriTarihKisaIso8601": null,
    "HicriTarihUzun": "21 Cemaziyelevvel 1447",
    "HicriTarihUzunIso8601": null,
    "AyinSekliURL": "https://namazvakti.diyanet.gov.tr/images/sondordun.gif",
    "MiladiTarihKisa": "12.11.2025",
    "MiladiTarihKisaIso8601": "12.11.2025",
    "MiladiTarihUzun": "12 Kasım 2025 Çarşamba",
    "MiladiTarihUzunIso8601": "2025-11-12T00:00:00.0000000-03:00",
    "GreenwichOrtalamaZamani": 3.0,
    "Aksam": "19:51",
    "Gunes": "06:11",
    "GunesBatis": "19:44",
    "GunesDogus": "06:18",
    "Ikindi": "16:38",
    "Imsak": "04:52",
    "KibleSaati": "06:40",
    "Ogle": "13:06",
    "Yatsi": "21:05"
  },
  {
    "HicriTarihKisa": "22.5.1447",
    "HicriTarihKisaIso8601": null,
    "HicriTarihUzun": "22 Cemaziyelevvel 1447",
    "HicriTarihUzunIso8601": null,
    "AyinSekliURL": "https://namazvakti.diyanet.gov.tr/images/sd1.gif",
    "MiladiTarihKisa": "13.11.2025",
    "MiladiTarihKisaIso8601": "13.11.2025",
    "MiladiTarihUzun": "13 Kasım 2025 Perşembe",
    "MiladiTarihUzunIso8601": "2025-11-13T00:00:00.0000000-03:00",
    "GreenwichOrtalamaZamani": 3.0,
    "Aksam": "19:52",
    "Gunes": "06:11",
    "GunesBatis": "19:45",
    "GunesDogus": "06:18",
    "Ikindi": "16:38",
    "Imsak": "04:51",
    "KibleSaati": "06:38",
    "Ogle": "13:06",
    "Yatsi": "21:06"
  },
  {
    "HicriTarihKisa": "23.5.1447",
    "HicriTarihKisaIso8601": null,
    "HicriTarihUzun": "23 Cemaziyelevvel 1447",
    "HicriTarihUzunIso8601": null,
    "AyinSekliURL": "https://namazvakti.diyanet.gov.tr/images/sd2.gif",
    "MiladiTarihKisa": "14.11.2025",
    "MiladiTarihKisaIso8601": "14.11.2025",
    "MiladiTarihUzun": "14 Kasım 2025 Cuma",
    "MiladiTarihUzunIso8601": "2025-11-14T00:00:00.0000000-03:00",
    "GreenwichOrtalamaZamani": 3.0,
    "Aksam": "19:53",
    "Gunes": "06:10",
    "GunesBatis": "19:46",
    "GunesDogus": "06:17",
    "Ikindi": "16:38",
    "Imsak": "04:50",
    "KibleSaati": "06:36",
    "Ogle": "13:06",
    "Yatsi": "21:07"
  },
  {
    "HicriTarihKisa": "24.5.1447",
    "HicriTarihKisaIso8601": null,
    "HicriTarihUzun": "24 Cemaziyelevvel 1447",
    "HicriTarihUzunIso8601": null,
    "AyinSekliURL": "https://namazvakti.diyanet.gov.tr/images/sd3.gif",
    "MiladiTarihKisa": "15.11.2025",
    "MiladiTarihKisaIso8601": "15.11.2025",
    "MiladiTarihUzun": "15 Kasım 2025 Cumartesi",
    "MiladiTarihUzunIso8601": "2025-11-15T00:00:00.0000000-03:00",
    "GreenwichOrtalamaZamani": 3.0,
    "Aksam": "19:53",
    "Gunes": "06:10",
    "GunesBatis": "19:46",
    "GunesDogus": "06:17",
    "Ikindi": "16:38",
    "Imsak": "04:50",
    "KibleSaati": "06:34",
    "Ogle": "13:07",
    "Yatsi": "21:08"
  },
  {
    "HicriTarihKisa": "25.5.1447",
    "HicriTarihKisaIso8601": null,
    "HicriTarihUzun": "25 Cemaziyelevvel 1447",
    "HicriTarihUzunIso8601": null,
    "AyinSekliURL": "https://namazvakti.diyanet.gov.tr/images/sd4.gif",
    "MiladiTarihKisa": "16.11.2025",
    "MiladiTarihKisaIso8601": "16.11.2025",
    "MiladiTarihUzun": "16 Kasım 2025 Pazar",
    "MiladiTarihUzunIso8601": "2025-11-16T00:00:00.0000000-03:00",
    "GreenwichOrtalamaZamani": 3.0,
    "Aksam": "19:54",
    "Gunes": "06:10",
    "GunesBatis": "19:47",
    "GunesDogus": "06:17",
    "Ikindi": "16:38",
    "Imsak": "04:49",
    "KibleSaati": "06:32",
    "Ogle": "13:07",
    "Yatsi": "21:09"
  },
  {
    "HicriTarihKisa": "26.5.1447",
    "HicriTarihKisaIso8601": null,
    "HicriTarihUzun": "26 Cemaziyelevvel 1447",
    "HicriTarihUzunIso8601": null,
    "AyinSekliURL": "https://namazvakti.diyanet.gov.tr/images/sd5.gif",
    "MiladiTarihKisa": "17.11.2025",
    "MiladiTarihKisaIso8601": "17.11.2025",
    "MiladiTarihUzun": "17 Kasım 2025 Pazartesi",
    "MiladiTarihUzunIso8601": "2025-11-17T00:00:00.0000000-03:00",
    "GreenwichOrtalamaZamani": 3.0,
    "Aksam": "19:55",
    "Gunes": "06:09",
    "GunesBatis": "19:48",
    "GunesDogus": "06:16",
    "Ikindi": "16:38",
    "Imsak": "04:48",
    "KibleSaati": "06:29",
    "Ogle": "13:07",
    "Yatsi": "21:10"
  },
  {
    "HicriTarihKisa": "27.5.1447",
    "HicriTarihKisaIso8601": null,
    "HicriTarihUzun": "27 Cemaziyelevvel 1447",
    "HicriTarihUzunIso8601": null,
    "AyinSekliURL": "https://namazvakti.diyanet.gov.tr/images/sd6.gif",
    "MiladiTarihKisa": "18.11.2025",
    "MiladiTarihKisaIso8601": "18.11.2025",
    "MiladiTarihUzun": "18 Kasım 2025 Salı",
    "MiladiTarihUzunIso8601": "2025-11-18T00:00:00.0000000-03:00",
    "GreenwichOrtalamaZamani": 3.0,
    "Aksam": "19:56",
    "Gunes": "06:09",
    "GunesBatis": "19:49",
    "GunesDogus": "06:16",
    "Ikindi": "16:38",
    "Imsak": "04:48",
    "KibleSaati": "06:27",
    "Ogle": "13:07",
    "Yatsi": "21:11"
  },
  {
    "HicriTarihKisa": "28.5.1447",
    "HicriTarihKisaIso8601": null,
    "HicriTarihUzun": "28 Cemaziyelevvel 1447",
    "HicriTarihUzunIso8601": null,
    "AyinSekliURL": "https://namazvakti.diyanet.gov.tr/images/sd7.gif",
    "MiladiTarihKisa": "19.11.2025",
    "MiladiTarihKisaIso8601": "19.11.2025",
    "MiladiTarihUzun": "19 Kasım 2025 Çarşamba",
    "MiladiTarihUzunIso8601": "2025-11-19T00:00:00.0000000-03:00",
    "GreenwichOrtalamaZamani": 3.0,
    "Aksam": "19:56",
    "Gunes": "06:08",
    "GunesBatis": "19:49",
    "GunesDogus": "06:15",
    "Ikindi": "16:38",
    "Imsak": "04:47",
    "KibleSaati": "06:25",
    "Ogle": "13:07",
    "Yatsi": "21:12"
  }
]