[
  {
    "HicriTarihKisa": "3.6.1447",
    "HicriTarihKisaIso8601": null,
    "HicriTarihUzun": "3 Cemaziyelahir 1447",
    "HicriTarihUzunIso8601": null,
    "AyinSekliURL": "https://namazvakti.diyanet.gov.tr/images/r3.gif",
    "MiladiTarihKisa": "23.11.2025",
    "MiladiTarihKisaIso8601": "23.11.2025",
    "MiladiTarihUzun": "23 Kasım 2025 Pazar",
    "MiladiTarihUzunIso8601": "2025-11-23T00:00:00.0000000+03:00",
    "GreenwichOrtalamaZamani": 3.0,
    "Aksam": "18:00",
    "Gunes": "07:46",
    "GunesBatis": "17:53",
    "GunesDogus": "07:53",
    "Ikindi": "15:38",
    "Imsak": "06:22",
    "KibleSaati": "10:33",
    "Ogle": "12:58",
    "Yatsi": "19:19"
  },
  {
    "HicriTarihKisa": "4.6.1447",
    "HicriTarihKisaIso8601": null,
    "HicriTarihUzun": "4 Cemaziyelahir 1447",
    "HicriTarihUzunIso8601": null,
    "AyinSekliURL": "https://namazvakti.diyanet.gov.tr/images/r4.gif",
    "MiladiTarihKisa": "24.11.2025",
    "MiladiTarihKisaIso8601": "24.11.2025",
    "MiladiTarihUzun": "24 Kasım 2025 Pazartesi",
    "MiladiTarihUzunIso8601": "2025-11-24T00:00:00.0000000+03:00",
    "GreenwichOrtalamaZamani": 3.0,
    "Aksam": "18:00",
    "Gunes": "07:47",
    "GunesBatis": "17:53",
    "GunesDogus": "07:54",
    "Ikindi": "15:38",
    "Imsak": "06:23",
    "KibleSaati": "10:32",
    "Ogle": "12:59",
    "Yatsi": "19:19"
  },
  {
    "HicriTarihKisa": "5.6.1447",
    "HicriTarihKisaIso8601": null,
    "HicriTarihUzun": "5 Cemaziyelahir 1447",
    "HicriTarihUzunIso8601": null,
    "AyinSekliURL": "https://namazvakti.diyanet.gov.tr/images/r5.gif",
    "MiladiTarihKisa": "25.11.2025",
    "MiladiTarihKisaIso8601": "25.11.2025",
    "MiladiTarihUzun": "25 Kasım 2025 Salı",
    "MiladiTarihUzunIso8601": "2025-11-25T00:00:00.0000000+03:00",
    "GreenwichOrtalamaZamani": 3.0,
    "Aksam": "17:59",
    "Gunes": "07:48",
    "GunesBatis": "17:52",
    "GunesDogus": "07:55",
    "Ikindi": "15:37",
    "Imsak": "06:24",
    "KibleSaati": "10:32",
    "Ogle": "12:59",
    "Yatsi": "19:18"
  },
  {
    "HicriTarihKisa": "6.6.1447",
    "HicriTarihKisaIso8601": null,
    "HicriTarihUzun": "6 Cemaziyelahir 1447",
    "HicriTarihUzunIso8601": null,
    "AyinSekliURL": "https://namazvakti.diyanet.gov.tr/images/r6.gif",
    "MiladiTarihKisa": "26.11.2025",
    "MiladiTarihKisaIso8601": "26.11.2025",
    "MiladiTarihUzun": "26 Kasım 2025 Çarşamba",
    "MiladiTarihUzunIso8601": "2025-11-26T00:00:00.0000000+03:00",
    "GreenwichOrtalamaZamani": 3.0,
    "Aksam": "17:59",
    "Gunes": "07:49",
    "GunesBatis": "17:52",
    "GunesDogus": "07:56",
    "Ikindi": "15:37",
    "Imsak": "06:25",
    "KibleSaati": "10:32",
    "Ogle": "12:59",
    "Yatsi": "19:18"
  },
  {
    "HicriTarihKisa": "7.6.1447",
    "HicriTarihKisaIso8601": null,
    "HicriTarihUzun": "7 Cemaziyelahir 1447",
    "HicriTarihUzunIso8601": null,
    "AyinSekliURL": "https://namazvakti.diyanet.gov.tr/images/ilkdordun.gif",
    "MiladiTarihKisa": "27.11.2025",
    "MiladiTarihKisaIso8601": "27.11.2025",
    "MiladiTarihUzun": "27 Kasım 2025 Perşembe",
    "MiladiTarihUzunIso8601": "2025-11-27T00:00:00.0000000+03:00",
    "GreenwichOrtalamaZamani": 3.0,
    "Aksam": "17:59",
    "Gunes": "07:50",
    "GunesBatis": "17:52",
    "GunesDogus": "07:57",
    "Ikindi": "15:37",
    "Imsak": "06:26",
    "KibleSaati": "10:32",
    "Ogle": "12:59",
    "Yatsi": "19:18"
  },
  {
    "HicriTarihKisa": "8.6.1447",
    "HicriTarihKisaIso8601": null,
    "HicriTarihUzun": "8 Cemaziyelahir 1447",
    "HicriTarihUzunIso8601": null,
    "AyinSekliURL": "https://namazvakti.diyanet.gov.tr/images/i1.gif",
    "MiladiTarihKisa": "28.11.2025",
    "MiladiTarihKisaIso8601": "28.11.2025",
    "MiladiTarihUzun": "28 Kasım 2025 Cuma",
    "MiladiTarihUzunIso8601": "2025-11-28T00:00:00.0000000+03:00",
    "GreenwichOrtalamaZamani": 3.0,
    "Aksam": "17:58",
    "Gunes": "07:51",
    "GunesBatis": "17:51",
    "GunesDogus": "07:58",
    "Ikindi": "15:37",
    "Imsak": "06:27",
    "KibleSaati": "10:32",
    "Ogle": "13:00",
    "Yatsi": "19:18"
  },
  {
    "HicriTarihKisa": "9.6.1447",
    "HicriTarihKisaIso8601": null,
    "HicriTarihUzun": "9 Cemaziyelahir 1447",
    "HicriTarihUzunIso8601": null,
    "AyinSekliURL": "https://namazvakti.diyanet.gov.tr/images/i2.gif",
    "MiladiTarihKisa": "29.11.2025",
    "MiladiTarihKisaIso8601": "29.11.2025",
    "MiladiTarihUzun": "29 Kasım 2025 Cumartesi",
    "MiladiTarihUzunIso8601": "2025-11-29T00:00:00.0000000+03:00",
    "GreenwichOrtalamaZamani": 3.0,
    "Aksam": "17:58",
    "Gunes": "07:52",
    "GunesBatis": "17:51",
    "GunesDogus": "07:59",
    "Ikindi": "15:36",
    "Imsak": "06:28",
    "KibleSaati": "10:32",
    "Ogle": "13:00",
    "Yatsi": "19:18"
  },
  {
    "HicriTarihKisa": "10.6.1447",
    "HicriTarihKisaIso8601": null,
    "HicriTarihUzun": "10 Cemaziyelahir 1447",
    "HicriTarihUzunIso8601": null,
    "AyinSekliURL": "https://namazvakti.diyanet.gov.tr/images/i3.gif",
    "MiladiTarihKisa": "30.11.2025",
    "MiladiTarihKisaIso8601": "30.11.2025",
    "MiladiTarihUzun": "30 Kasım 2025 Pazar",
    "MiladiTarihUzunIso8601": "2025-11-30T00:00:00.0000000+03:00",
    "GreenwichOrtalamaZamani": 3.0,
    "Aksam": "17:58",
    "Gunes": "07:53",
    "GunesBatis": "17:51",
    "GunesDogus": "08:00",
    "Ikindi": "15:36",
    "Imsak": "06:28",
    "KibleSaati": "10:31",
    "Ogle": "13:00",
    "Yatsi": "19:17"
  },
  {
    "HicriTarihKisa": "11.6.1447",
    "HicriTarihKisaIso8601": null,
    "HicriTarihUzun": "11 Cemaziyelahir 1447",
    "HicriTarihUzunIso8601": null,
    "AyinSekliURL": "https://namazvakti.diyanet.gov.tr/images/i4.gif",
    "MiladiTarihKisa": "01.12.2025",
    "MiladiTarihKisaIso8601": "01.12.2025",
    "MiladiTarihUzun": "01 Aralık 2025 Pazartesi",
    "MiladiTarihUzunIso8601": "2025-12-01T00:00:00.0000000+03:00",
    "GreenwichOrtalamaZamani": 3.0,
    "Aksam": "17:58",
    "Gunes": "07:54",
    "GunesBatis": "17:51",
    "GunesDogus": "08:01",
    "Ikindi": "15:36",
    "Imsak": "06:29",
    "KibleSaati": "10:31",
    "Ogle": "13:01",
    "Yatsi": "19:17"
  },
  {
    "HicriTarihKisa": "12.6.1447",
    "HicriTarihKisaIso8601": null,
    "HicriTarihUzun": "12 Cemaziyelahir 1447",
    "HicriTarihUzunIso8601": null,
    "AyinSekliURL": "https://namazvakti.diyanet.gov.tr/images/i5.gif",
    "MiladiTarihKisa": "02.12.2025",
    "MiladiTarihKisaIso8601": "02.12.2025",
    "MiladiTarihUzun": "02 Aralık 2025 Salı",
    "MiladiTarihUzunIso8601": "2025-12-02T00:00:00.0000000+03:00",
    "GreenwichOrtalamaZamani": 3.0,
    "Aksam": "17:58",
    "Gunes": "07:55",
    "GunesBatis": "17:51",
    "GunesDogus": "08:02",
    "Ikindi": "15:36",
    "Imsak": "06:30",
    "KibleSaati": "10:31",
    "Ogle": "13:01",
    "Yatsi": "19:17"
  },
  {
    "HicriTarihKisa": "13.6.1447",
    "HicriTarihKisaIso8601": null,
    "HicriTarihUzun": "13 Cemaziyelahir 1447",
    "HicriTarihUzunIso8601": null,
    "AyinSekliURL": "https://namazvakti.diyanet.gov.tr/images/i6.gif",
    "MiladiTarihKisa": "03.12.2025",
    "MiladiTarihKisaIso8601": "03.12.2025",
    "MiladiTarihUzun": "03 Aralık 2025 Çarşamba",
    "MiladiTarihUzunIso8601": "2025-12-03T00:00:00.0000000+03:00",
    "GreenwichOrtalamaZamani": 3.0,
    "Aksam": "17:57",
    "Gunes": "07:56",
    "GunesBatis": "17:50",
    "GunesDogus": "08:03",
    "Ikindi": "15:36",
    "Imsak": "06:31",
    "KibleSaati": "10:31",
    "Ogle": "13:02",
    "Yatsi": "19:17"
  },
  {
    "HicriTarihKisa": "14.6.1447",
    "HicriTarihKisaIso8601": null,
    "HicriTarihUzun": "14 Cemaziyelahir 1447",
    "HicriTarihUzunIso8601": null,
    "AyinSekliURL": "https://namazvakti.diyanet.gov.tr/images/dolunay.gif",
    "MiladiTarihKisa": "04.12.2025",
    "MiladiTarihKisaIso8601": "04.12.2025",
    "MiladiTarihUzun": "04 Aralık 2025 Perşembe",
    "MiladiTarihUzunIso8601": "2025-12-04T00:00:00.0000000+03:00",
    "GreenwichOrtalamaZamani": 3.0,
    "Aksam": "17:57",
    "Gunes": "07:57",
    "GunesBatis": "17:50",
    "GunesDogus": "08:04",
    "Ikindi": "15:36",
    "Imsak": "06:32",
    "KibleSaati": "10:31",
    "Ogle": "13:02",
    "Yatsi": "19:17"
  },
  {
    "HicriTarihKisa": "15.6.1447",
    "HicriTarihKisaIso8601": null,
    "HicriTarihUzun": "15 Cemaziyelahir 1447",
    "HicriTarihUzunIso8601": null,
    "AyinSekliURL": "https://namazvakti.diyanet.gov.tr/images/d1.gif",
    "MiladiTarihKisa": "05.12.2025",
    "MiladiTarihKisaIso8601": "05.12.2025",
    "MiladiTarihUzun": "05 Aralık 2025 Cuma",
    "MiladiTarihUzunIso8601": "2025-12-05T00:00:00.0000000+03:00",
    "GreenwichOrtalamaZamani": 3.0,
    "Aksam": "17:57",
    "Gunes": "07:58",
    "GunesBatis": "17:50",
    "GunesDogus": "08:05",
    "Ikindi": "15:36",
    "Imsak": "06:32",
    "KibleSaati": "10:32",
    "Ogle": "13:02",
    "Yatsi": "19:17"
  },
  {
    "HicriTarihKisa": "16.6.1447",
    "HicriTarihKisaIso8601": null,
    "HicriTarihUzun": "16 Cemaziyelahir 1447",
    "HicriTarihUzunIso8601": null,
    "AyinSekliURL": "https://namazvakti.diyanet.gov.tr/images/d2.gif",
    "MiladiTarihKisa": "06.12.2025",
    "MiladiTarihKisaIso8601": "06.12.2025",
    "MiladiTarihUzun": "06 Aralık 2025 Cumartesi",
    "MiladiTarihUzunIso8601": "2025-12-06T00:00:00.0000000+03:00",
    "GreenwichOrtalamaZamani": 3.0,
    "Aksam": "17:57",
    "Gunes": "07:58",
    "GunesBatis": "17:50",
    "GunesDogus": "08:05",
    "Ikindi": "15:36",
    "Imsak": "06:33",
    "KibleSaati": "10:32",
    "Ogle": "13:03",
    "Yatsi": "19:17"
  },
  {
    "HicriTarihKisa": "17.6.1447",
    "HicriTarihKisaIso8601": null,
    "HicriTarihUzun": "17 Cemaziyelahir 1447",
    "HicriTarihUzunIso8601": null,
    "AyinSekliURL": "https://namazvakti.diyanet.gov.tr/images/d3.gif",
    "MiladiTarihKisa": "07.12.2025",
    "MiladiTarihKisaIso8601": "07.12.2025",
    "MiladiTarihUzun": "07 Aralık 2025 Pazar",
    "MiladiTarihUzunIso8601": "2025-12-07T00:00:00.0000000+03:00",
    "GreenwichOrtalamaZamani": 3.0,
    "Aksam": "17:57",
    "Gunes": "07:59",
    "GunesBatis": "17:50",
    "GunesDogus": "08:06",
    "Ikindi": "15:36",
    "Imsak": "06:34",
    "KibleSaati": "10:32",
    "Ogle": "13:03",
    "Yatsi": "19:17"
  },
  {
    "HicriTarihKisa": "18.6.1447",
    "HicriTarihKisaIso8601": null,
    "HicriTarihUzun": "18 Cemaziyelahir 1447",
    "HicriTarihUzunIso8601": null,
    "AyinSekliURL": "https://namazvakti.diyanet.gov.tr/images/d4.gif",
    "MiladiTarihKisa": "08.12.2025",
    "MiladiTarihKisaIso8601": "08.12.2025",
    "MiladiTarihUzun": "08 Aralık 2025 Pazartesi",
    "MiladiTarihUzunIso8601": "2025-12-08T00:00:00.0000000+03:00",
    "GreenwichOrtalamaZamani": 3.0,
    "Aksam": "17:57",
    "Gunes": "08:00",
    "GunesBatis": "17:50",
    "GunesDogus": "08:07",
    "Ikindi": "15:36",
    "Imsak": "06:35",
    "KibleSaati": "10:32",
    "Ogle": "13:04",
    "Yatsi": "19:18"
  },
  {
    "HicriTarihKisa": "19.6.1447",
    "HicriTarihKisaIso8601": null,
    "HicriTarihUzun": "19 Cemaziyelahir 1447",
    "HicriTarihUzunIso8601": null,
    "AyinSekliURL": "https://namazvakti.diyanet.gov.tr/images/d5.gif",
    "MiladiTarihKisa": "09.12.2025",
    "MiladiTarihKisaIso8601": "09.12.2025",
    "MiladiTarihUzun": "09 Aralık 2025 Salı",
    "MiladiTarihUzunIso8601": "2025-12-09T00:00:00.0000000+03:00",
    "GreenwichOrtalamaZamani": 3.0,
    "Aksam": "17:57",
    "Gunes": "08:01",
    "GunesBatis": "17:50",
    "GunesDogus": "08:08",
    "Ikindi": "15:36",
    "Imsak": "06:35",
    "KibleSaati": "10:32",
    "Ogle": "13:04",
    "Yatsi": "19:18"
  },
  {
    "HicriTarihKisa": "20.6.1447",
    "HicriTarihKisaIso8601": null,
    "HicriTarihUzun": "20 Cemaziyelahir 1447",
    "HicriTarihUzunIso8601": null,
    "AyinSekliURL": "https://namazvakti.diyanet.gov.tr/images/d6.gif",
    "MiladiTarihKisa": "10.12.2025",
    "MiladiTarihKisaIso8601": "10.12.2025",
    "MiladiTarihUzun": "10 Aralık 2025 Çarşamba",
    "MiladiTarihUzunIso8601": "2025-12-10T00:00:00.0000000+03:00",
    "GreenwichOrtalamaZamani": 3.0,
    "Aksam": "17:57",
    "Gunes": "08:02",
    "GunesBatis": "17:50",
    "GunesDogus": "08:09",
    "Ikindi": "15:37",
    "Imsak": "06:36",
    "KibleSaati": "10:32",
    "Ogle": "13:05",
    "Yatsi": "19:18"
  },
  {
    "HicriTarihKisa": "21.6.1447",
    "HicriTarihKisaIso8601": null,
    "HicriTarihUzun": "21 Cemaziyelahir 1447",
    "HicriTarihUzunIso8601": null,
    "AyinSekliURL": "https://namazvakti.diyanet.gov.tr/images/d7.gif",
    "MiladiTarihKisa": "11.12.2025",
    "MiladiTarihKisaIso8601": "11.12.2025",
    "MiladiTarihUzun": "11 Aralık 2025 Perşembe",
    "MiladiTarihUzunIso8601": "2025-12-11T00:00:00.0000000+03:00",
    "GreenwichOrtalamaZamani": 3.0,
    "Aksam": "17:58",
    "Gunes": "08:03",
    "GunesBatis": "17:51",
    "GunesDogus": "08:10",
    "Ikindi": "15:37",
    "Imsak": "06:37",
    "KibleSaati": "10:33",
    "Ogle": "13:05",
    "Yatsi": "19:18"
  },
  {
    "HicriTarihKisa": "22.6.1447",
    "HicriTarihKisaIso8601": null,
    "HicriTarihUzun": "22 Cemaziyelahir 1447",
    "HicriTarihUzunIso8601": null,
    "AyinSekliURL": "https://namazvakti.diyanet.gov.tr/images/sondordun.gif",
    "MiladiTarihKisa": "12.12.2025",
    "MiladiTarihKisaIso8601": "12.12.2025",
    "MiladiTarihUzun": "12 Aralık 2025 Cuma",
    "MiladiTarihUzunIso8601": "2025-12-12T00:00:00.0000000+03:00",
    "GreenwichOrtalamaZamani": 3.0,
    "Aksam": "17:58",
    "Gunes": "08:03",
    "GunesBatis": "17:51",
    "GunesDogus": "08:10",
    "Ikindi": "15:37",
    "Imsak": "06:37",
    "KibleSaati": "10:33",
    "Ogle": "13:06",
    "Yatsi": "19:18"
  },
  {
    "HicriTarihKisa": "23.6.1447",
    "HicriTarihKisaIso8601": null,
    "HicriTarihUzun": "23 Cemaziyelahir 1447",
    "HicriTarihUzunIso8601": null,
    "AyinSekliURL": "https://namazvakti.diyanet.gov.tr/images/sd1.gif",
    "MiladiTarihKisa": "13.12.2025",
    "MiladiTarihKisaIso8601": "13.12.2025",
    "MiladiTarihUzun": "13 Aralık 2025 Cumartesi",
    "MiladiTarihUzunIso8601": "2025-12-13T00:00:00.0000000+03:00",
    "GreenwichOrtalamaZamani": 3.0,
    "Aksam": "17:58",
    "Gunes": "08:04",
    "GunesBatis": "17:51",
    "GunesDogus": "08:11",
    "Ikindi": "15:37",
    "Imsak": "06:38",
    "KibleSaati": "10:33",
    "Ogle": "13:06",
    "Yatsi": "19:19"
  },
  {
    "HicriTarihKisa": "24.6.1447",
    "HicriTarihKisaIso8601": null,
    "HicriTarihUzun": "24 Cemaziyelahir 1447",
    "HicriTarihUzunIso8601": null,
    "AyinSekliURL": "https://namazvakti.diyanet.gov.tr/images/sd2.gif",
    "MiladiTarihKisa": "14.12.2025",
    "MiladiTarihKisaIso8601": "14.12.2025",
    "MiladiTarihUzun": "14 Aralık 2025 Pazar",
    "MiladiTarihUzunIso8601": "2025-12-14T00:00:00.0000000+03:00",
    "GreenwichOrtalamaZamani": 3.0,
    "Aksam": "17:58",
    "Gunes": "08:05",
    "GunesBatis": "17:51",
    "GunesDogus": "08:12",
    "Ikindi": "15:37",
    "Imsak": "06:39",
    "KibleSaati": "10:33",
    "Ogle": "13:06",
    "Yatsi": "19:19"
  },
  {
    "HicriTarihKisa": "25.6.1447",
    "HicriTarihKisaIso8601": null,
    "HicriTarihUzun": "25 Cemaziyelahir 1447",
    "HicriTarihUzunIso8601": null,
    "AyinSekliURL": "https://namazvakti.diyanet.gov.tr/images/sd3.gif",
    "MiladiTarihKisa": "15.12.2025",
    "MiladiTarihKisaIso8601": "15.12.2025",
    "MiladiTarihUzun": "15 Aralık 2025 Pazartesi",
    "MiladiTarihUzunIso8601": "2025-12-15T00:00:00.0000000+03:00",
    "GreenwichOrtalamaZamani": 3.0,
    "Aksam": "17:59",
    "Gunes": "08:05",
    "GunesBatis": "17:52",
    "GunesDogus": "08:12",
    "Ikindi": "15:38",
    "Imsak": "06:39",
    "KibleSaati": "10:34",
    "Ogle": "13:07",
    "Yatsi": "19:19"
  },
  {
    "HicriTarihKisa": "26.6.1447",
    "HicriTarihKisaIso8601": null,
    "HicriTarihUzun": "26 Cemaziyelahir 1447",
    "HicriTarihUzunIso8601": null,
    "AyinSekliURL": "https://namazvakti.diyanet.gov.tr/images/sd4.gif",
    "MiladiTarihKisa": "16.12.2025",
    "MiladiTarihKisaIso8601": "16.12.2025",
    "MiladiTarihUzun": "16 Aralık 2025 Salı",
    "MiladiTarihUzunIso8601": "2025-12-16T00:00:00.0000000+03:00",
    "GreenwichOrtalamaZamani": 3.0,
    "Aksam": "17:59",
    "Gunes": "08:06",
    "GunesBatis": "17:52",
    "GunesDogus": "08:13",
    "Ikindi": "15:38",
    "Imsak": "06:40",
    "KibleSaati": "10:34",
    "Ogle": "13:07",
    "Yatsi": "19:20"
  },
  {
    "HicriTarihKisa": "27.6.1447",
    "HicriTarihKisaIso8601": null,
    "HicriTarihUzun": "27 Cemaziyelahir 1447",
    "HicriTarihUzunIso8601": null,
    "AyinSekliURL": "https://namazvakti.diyanet.gov.tr/images/sd5.gif",
    "MiladiTarihKisa": "17.12.2025",
    "MiladiTarihKisaIso8601": "17.12.2025",
    "MiladiTarihUzun": "17 Aralık 2025 Çarşamba",
    "MiladiTarihUzunIso8601": "2025-12-17T00:00:00.0000000+03:00",
    "GreenwichOrtalamaZamani": 3.0,
    "Aksam": "17:59",
    "Gunes": "08:07",
    "GunesBatis": "17:52",
    "GunesDogus": "08:14",
    "Ikindi": "15:38",
    "Imsak": "06:41",
    "KibleSaati": "10:34",
    "Ogle": "13:08",
    "Yatsi": "19:20"
  },
  {
    "HicriTarihKisa": "28.6.1447",
    "HicriTarihKisaIso8601": null,
    "HicriTarihUzun": "28 Cemaziyelahir 1447",
    "HicriTarihUzunIso8601": null,
    "AyinSekliURL": "https://namazvakti.diyanet.gov.tr/images/sd6.gif",
    "MiladiTarihKisa": "18.12.2025",
    "MiladiTarihKisaIso8601": "18.12.2025",
    "MiladiTarihUzun": "18 Aralık 2025 Perşembe",
    "MiladiTarihUzunIso8601": "2025-12-18T00:00:00.0000000+03:00",
    "GreenwichOrtalamaZamani": 3.0,
    "Aksam": "18:00",
    "Gunes": "08:07",
    "GunesBatis": "17:53",
    "GunesDogus": "08:14",
    "Ikindi": "15:39",
    "Imsak": "06:41",
    "KibleSaati": "10:35",
    "Ogle": "13:08",
    "Yatsi": "19:20"
  },
  {
    "HicriTarihKisa": "29.6.1447",
    "HicriTarihKisaIso8601": null,
    "HicriTarihUzun": "29 Cemaziyelahir 1447",
    "HicriTarihUzunIso8601": null,
    "AyinSekliURL": "https://namazvakti.diyanet.gov.tr/images/sd7.gif",
    "MiladiTarihKisa": "19.12.2025",
    "MiladiTarihKisaIso8601": "19.12.2025",
    "MiladiTarihUzun": "19 Aralık 2025 Cuma",
    "MiladiTarihUzunIso8601": "2025-12-19T00:00:00.0000000+03:00",
    "GreenwichOrtalamaZamani": 3.0,
    "Aksam": "18:00",
    "Gunes": "08:08",
    "GunesBatis": "17:53",
    "GunesDogus": "08:15",
    "Ikindi": "15:39",
    "Imsak": "06:42",
    "KibleSaati": "10:35",
    "Ogle": "13:09",
    "Yatsi": "19:21"
  },
  {
    "HicriTarihKisa": "30.6.1447",
    "HicriTarihKisaIso8601": null,
    "HicriTarihUzun": "30 Cemaziyelahir 1447",
    "HicriTarihUzunIso8601": null,
    "AyinSekliURL": "https://namazvakti.diyanet.gov.tr/images/ruyet.gif",
    "MiladiTarihKisa": "20.12.2025",
    "MiladiTarihKisaIso8601": "20.12.2025",
    "MiladiTarihUzun": "20 Aralık 2025 Cumartesi",
    "MiladiTarihUzunIso8601": "2025-12-20T00:00:00.0000000+03:00",
    "GreenwichOrtalamaZamani": 3.0,
    "Aksam": "18:00",
    "Gunes": "08:08",
    "GunesBatis": "17:53",
    "GunesDogus": "08:15",
    "Ikindi": "15:40",
    "Imsak": "06:42",
    "KibleSaati": "10:36",
    "Ogle": "13:09",
    "Yatsi": "19:21"
  },
  {
    "HicriTarihKisa": "1.7.1447",
    "HicriTarihKisaIso8601": null,
    "HicriTarihUzun": "1 Recep 1447",
    "HicriTarihUzunIso8601": null,
    "AyinSekliURL": "https://namazvakti.diyanet.gov.tr/images/r1.gif",
    "MiladiTarihKisa": "21.12.2025",
    "MiladiTarihKisaIso8601": "21.12.2025",
    "MiladiTarihUzun": "21 Aralık 2025 Pazar",
    "MiladiTarihUzunIso8601": "2025-12-21T00:00:00.0000000+03:00",
    "GreenwichOrtalamaZamani": 3.0,
    "Aksam": "18:01",
    "Gunes": "08:09",
    "GunesBatis": "17:54",
    "GunesDogus": "08:16",
    "Ikindi": "15:40",
    "Imsak": "06:43",
    "KibleSaati": "10:36",
    "Ogle": "13:10",
    "Yatsi": "19:22"
  },
  {
    "HicriTarihKisa": "2.7.1447",
    "HicriTarihKisaIso8601": null,
    "HicriTarihUzun": "2 Recep 1447",
    "HicriTarihUzunIso8601": null,
    "AyinSekliURL": "https://namazvakti.diyanet.gov.tr/images/r2.gif",
    "MiladiTarihKisa": "22.12.2025",
    "MiladiTarihKisaIso8601": "22.12.2025",
    "MiladiTarihUzun": "22 Aralık 2025 Pazartesi",
    "MiladiTarihUzunIso8601": "2025-12-22T00:00:00.0000000+03:00",
    "GreenwichOrtalamaZamani": 3.0,
    "Aksam": "18:01",
    "Gunes": "08:09",
    "GunesBatis": "17:54",
    "GunesDogus": "08:16",
    "Ikindi": "15:41",
    "Imsak": "06:43",
    "KibleSaati": "10:37",
    "Ogle": "13:10",
    "Yatsi": "19:22"
  },
  {
    "HicriTarihKisa": "3.7.1447",
    "HicriTarihKisaIso8601": null,
    "HicriTarihUzun": "3 Recep 1447",
    "HicriTarihUzunIso8601": null,
    "AyinSekliURL": "https://namazvakti.diyanet.gov.tr/images/r3.gif",
    "MiladiTarihKisa": "23.12.2025",
    "MiladiTarihKisaIso8601": "23.12.2025",
    "MiladiTarihUzun": "23 Aralık 2025 Salı",
    "MiladiTarihUzunIso8601": "2025-12-23T00:00:00.0000000+03:00",
    "GreenwichOrtalamaZamani": 3.0,
    "Aksam": "18:02",
    "Gunes": "08:10",
    "GunesBatis": "17:55",
    "GunesDogus": "08:17",
    "Ikindi": "15:41",
    "Imsak": "06:44",
    "KibleSaati": "10:37",
    "Ogle": "13:11",
    "Yatsi": "19:23"
  },
  {
    "HicriTarihKisa": "4.7.1447",
    "HicriTarihKisaIso8601": null,
    "HicriTarihUzun": "4 Recep 1447",
    "HicriTarihUzunIso8601": null,
    "AyinSekliURL": "https://namazvakti.diyanet.gov.tr/images/r4.gif",
    "MiladiTarihKisa": "24.12.2025",
    "MiladiTarihKisaIso8601": "24.12.2025",
    "MiladiTarihUzun": "24 Aralık 2025 Çarşamba",
    "MiladiTarihUzunIso8601": "2025-12-24T00:00:00.0000000+03:00",
    "GreenwichOrtalamaZamani": 3.0,
    "Aksam": "18:02",
    "Gunes": "08:10",
    "GunesBatis": "17:55",
    "GunesDogus": "08:17",
    "Ikindi": "15:42",
    "Imsak": "06:44",
    "KibleSaati": "10:38",
    "Ogle": "13:11",
    "Yatsi": "19:23"
  }
]