[
  {
    "HicriTarihKisa": "21.4.1447",
    "HicriTarihKisaIso8601": null,
    "HicriTarihUzun": "21 Rebiulahir 1447",
    "HicriTarihUzunIso8601": null,
    "AyinSekliURL": "https://namazvakti.diyanet.gov.tr/images/sondordun.gif",
    "MiladiTarihKisa": "13.10.2025",
    "MiladiTarihKisaIso8601": "13.10.2025",
    "MiladiTarihUzun": "13 Ekim 2025 Pazartesi",
    "MiladiTarihUzunIso8601": "2025-10-13T00:00:00.0000000+03:00",
    "GreenwichOrtalamaZamani": 3.0,
    "Aksam": "18:19",
    "Gunes": "06:51",
    "GunesBatis": "18:12",
    "GunesDogus": "06:58",
    "Ikindi": "15:46",
    "Imsak": "05:26",
    "KibleSaati": "11:37",
    "Ogle": "12:40",
    "Yatsi": "19:38"
  },
  {
    "HicriTarihKisa": "22.4.1447",
    "HicriTarihKisaIso8601": null,
    "HicriTarihUzun": "22 Rebiulahir 1447",
    "HicriTarihUzunIso8601": null,
    "AyinSekliURL": "https://namazvakti.diyanet.gov.tr/images/sd1.gif",
    "MiladiTarihKisa": "14.10.2025",
    "MiladiTarihKisaIso8601": "14.10.2025",
    "MiladiTarihUzun": "14 Ekim 2025 Salı",
    "MiladiTarihUzunIso8601": "2025-10-14T00:00:00.0000000+03:00",
    "GreenwichOrtalamaZamani": 3.0,
    "Aksam": "18:17",
    "Gunes": "06:52",
    "GunesBatis": "18:10",
    "GunesDogus": "06:59",
    "Ikindi": "15:45",
    "Imsak": "05:27",
    "KibleSaati": "11:36",
    "Ogle": "12:39",
    "Yatsi": "19:36"
  },
  {
    "HicriTarihKisa": "23.4.1447",
    "HicriTarihKisaIso8601": null,
    "HicriTarihUzun": "23 Rebiulahir 1447",
    "HicriTarihUzunIso8601": null,
    "AyinSekliURL": "https://namazvakti.diyanet.gov.tr/images/sd2.gif",
    "MiladiTarihKisa": "15.10.2025",
    "MiladiTarihKisaIso8601": "15.10.2025",
    "MiladiTarihUzun": "15 Ekim 2025 Çarşamba",
    "MiladiTarihUzunIso8601": "2025-10-15T00:00:00.0000000+03:00",
    "GreenwichOrtalamaZamani": 3.0,
    "Aksam": "18:16",
    "Gunes": "06:53",
    "GunesBatis": "18:09",
    "GunesDogus": "07:00",
    "Ikindi": "15:43",
    "Imsak": "05:28",
    "KibleSaati": "11:36",
    "Ogle": "12:39",
    "Yatsi": "19:35"
  },
  {
    "HicriTarihKisa": "24.4.1447",
    "HicriTarihKisaIso8601": null,
    "HicriTarihUzun": "24 Rebiulahir 1447",
    "HicriTarihUzunIso8601": null,
    "AyinSekliURL": "https://namazvakti.diyanet.gov.tr/images/sd3.gif",
    "MiladiTarihKisa": "16.10.2025",
    "MiladiTarihKisaIso8601": "16.10.2025",
    "MiladiTarihUzun": "16 Ekim 2025 Perşembe",
    "MiladiTarihUzunIso8601": "2025-10-16T00:00:00.0000000+03:00",
    "GreenwichOrtalamaZamani": 3.0,
    "Aksam": "18:14",
    "Gunes": "06:54",
    "GunesBatis": "18:07",
    "GunesDogus": "07:01",
    "Ikindi": "15:42",
    "Imsak": "05:29",
    "KibleSaati": "11:35",
    "Ogle": "12:39",
    "Yatsi": "19:33"
  },
  {
    "HicriTarihKisa": "25.4.1447",
    "HicriTarihKisaIso8601": null,
    "HicriTarihUzun": "25 Rebiulahir 1447",
    "HicriTarihUzunIso8601": null,
    "AyinSekliURL": "https://namazvakti.diyanet.gov.tr/images/sd4.gif",
    "MiladiTarihKisa": "17.10.2025",
    "MiladiTarihKisaIso8601": "17.10.2025",
    "MiladiTarihUzun": "17 Ekim 2025 Cuma",
    "MiladiTarihUzunIso8601": "2025-10-17T00:00:00.0000000+03:00",
    "GreenwichOrtalamaZamani": 3.0,
    "Aksam": "18:13",
    "Gunes": "06:55",
    "GunesBatis": "18:06",
    "GunesDogus": "07:02",
    "Ikindi": "15:41",
    "Imsak": "05:30",
    "KibleSaati": "11:34",
    "Ogle": "12:39",
    "Yatsi": "19:32"
  },
  {
    "HicriTarihKisa": "26.4.1447",
    "HicriTarihKisaIso8601": null,
    "HicriTarihUzun": "26 Rebiulahir 1447",
    "HicriTarihUzunIso8601": null,
    "AyinSekliURL": "https://namazvakti.diyanet.gov.tr/images/sd5.gif",
    "MiladiTarihKisa": "18.10.2025",
    "MiladiTarihKisaIso8601": "18.10.2025",
    "MiladiTarihUzun": "18 Ekim 2025 Cumartesi",
    "MiladiTarihUzunIso8601": "2025-10-18T00:00:00.0000000+03:00",
    "GreenwichOrtalamaZamani": 3.0,
    "Aksam": "18:11",
    "Gunes": "06:56",
    "GunesBatis": "18:04",
    "GunesDogus": "07:03",
    "Ikindi": "15:40",
    "Imsak": "05:31",
    "KibleSaati": "11:34",
    "Ogle": "12:39",
    "Yatsi": "19:30"
  },
  {
    "HicriTarihKisa": "27.4.1447",
    "HicriTarihKisaIso8601": null,
    "HicriTarihUzun": "27 Rebiulahir 1447",
    "HicriTarihUzunIso8601": null,
    "AyinSekliURL": "https://namazvakti.diyanet.gov.tr/images/sd6.gif",
    "MiladiTarihKisa": "19.10.2025",
    "MiladiTarihKisaIso8601": "19.10.2025",
    "MiladiTarihUzun": "19 Ekim 2025 Pazar",
    "MiladiTarihUzunIso8601": "2025-10-19T00:00:00.0000000+03:00",
    "GreenwichOrtalamaZamani": 3.0,
    "Aksam": "18:10",
    "Gunes": "06:57",
    "GunesBatis": "18:03",
    "GunesDogus": "07:04",
    "Ikindi": "15:39",
    "Imsak": "05:32",
    "KibleSaati": "11:33",
    "Ogle": "12:38",
    "Yatsi": "19:29"
  },
  {
    "HicriTarihKisa": "28.4.1447",
    "HicriTarihKisaIso8601": null,
    "HicriTarihUzun": "28 Rebiulahir 1447",
    "HicriTarihUzunIso8601": null,
    "AyinSekliURL": "https://namazvakti.diyanet.gov.tr/images/sd7.gif",
    "MiladiTarihKisa": "20.10.2025",
    "MiladiTarihKisaIso8601": "20.10.2025",
    "MiladiTarihUzun": "20 Ekim 2025 Pazartesi",
    "MiladiTarihUzunIso8601": "2025-10-20T00:00:00.0000000+03:00",
    "GreenwichOrtalamaZamani": 3.0,
    "Aksam": "18:08",
    "Gunes": "06:58",
    "GunesBatis": "18:01",
    "GunesDogus": "07:05",
    "Ikindi": "15:38",
    "Imsak": "05:34",
    "KibleSaati": "11:33",
    "Ogle": "12:38",
    "Yatsi": "19:28"
  },
  {
    "HicriTarihKisa": "29.4.1447",
    "HicriTarihKisaIso8601": null,
    "HicriTarihUzun": "29 Rebiulahir 1447",
    "HicriTarihUzunIso8601": null,
    "AyinSekliURL": "https://namazvakti.diyanet.gov.tr/images/ictima.gif",
    "MiladiTarihKisa": "21.10.2025",
    "MiladiTarihKisaIso8601": "21.10.2025",
    "MiladiTarihUzun": "21 Ekim 2025 Salı",
    "MiladiTarihUzunIso8601": "2025-10-21T00:00:00.0000000+03:00",
    "GreenwichOrtalamaZamani": 3.0,
    "Aksam": "18:07",
    "Gunes": "06:59",
    "GunesBatis": "18:00",
    "GunesDogus": "07:06",
    "Ikindi": "15:36",
    "Imsak": "05:35",
    "KibleSaati": "11:32",
    "Ogle": "12:38",
    "Yatsi": "19:26"
  },
  {
    "HicriTarihKisa": "30.4.1447",
    "HicriTarihKisaIso8601": null,
    "HicriTarihUzun": "30 Rebiulahir 1447",
    "HicriTarihUzunIso8601": null,
    "AyinSekliURL": "https://namazvakti.diyanet.gov.tr/images/ruyet.gif",
    "MiladiTarihKisa": "22.10.2025",
    "MiladiTarihKisaIso8601": "22.10.2025",
    "MiladiTarihUzun": "22 Ekim 2025 Çarşamba",
    "MiladiTarihUzunIso8601": "2025-10-22T00:00:00.0000000+03:00",
    "GreenwichOrtalamaZamani": 3.0,
    "Aksam": "18:05",
    "Gunes": "07:01",
    "GunesBatis": "17:58",
    "GunesDogus": "07:08",
    "Ikindi": "15:35",
    "Imsak": "05:36",
    "KibleSaati": "11:32",
    "Ogle": "12:38",
    "Yatsi": "19:25"
  },
  {
    "HicriTarihKisa": "1.5.1447",
    "HicriTarihKisaIso8601": null,
    "HicriTarihUzun": "1 Cemaziyelevvel 1447",
    "HicriTarihUzunIso8601": null,
    "AyinSekliURL": "https://namazvakti.diyanet.gov.tr/images/r1.gif",
    "MiladiTarihKisa": "23.10.2025",
    "MiladiTarihKisaIso8601": "23.10.2025",
    "MiladiTarihUzun": "23 Ekim 2025 Perşembe",
    "MiladiTarihUzunIso8601": "2025-10-23T00:00:00.0000000+03:00",
    "GreenwichOrtalamaZamani": 3.0,
    "Aksam": "18:04",
    "Gunes": "07:02",
    "GunesBatis": "17:57",
    "GunesDogus": "07:09",
    "Ikindi": "15:34",
    "Imsak": "05:37",
    "KibleSaati": "11:31",
    "Ogle": "12:38",
    "Yatsi": "19:23"
  },
  {
    "HicriTarihKisa": "2.5.1447",
    "HicriTarihKisaIso8601": null,
    "HicriTarihUzun": "2 Cemaziyelevvel 1447",
    "HicriTarihUzunIso8601": null,
    "AyinSekliURL": "https://namazvakti.diyanet.gov.tr/images/r2.gif",
    "MiladiTarihKisa": "24.10.2025",
    "MiladiTarihKisaIso8601": "24.10.2025",
    "MiladiTarihUzun": "24 Ekim 2025 Cuma",
    "MiladiTarihUzunIso8601": "2025-10-24T00:00:00.0000000+03:00",
    "GreenwichOrtalamaZamani": 3.0,
    "Aksam": "18:02",
    "Gunes": "07:03",
    "GunesBatis": "17:55",
    "GunesDogus": "07:10",
    "Ikindi": "15:33",
    "Imsak": "05:38",
    "KibleSaati": "11:31",
    "Ogle": "12:38",
    "Yatsi": "19:22"
  },
  {
    "HicriTarihKisa": "3.5.1447",
    "HicriTarihKisaIso8601": null,
    "HicriTarihUzun": "3 Cemaziyelevvel 1447",
    "HicriTarihUzunIso8601": null,
    "AyinSekliURL": "https://namazvakti.diyanet.gov.tr/images/r3.gif",
    "MiladiTarihKisa": "25.10.2025",
    "MiladiTarihKisaIso8601": "25.10.2025",
    "MiladiTarihUzun": "25 Ekim 2025 Cumartesi",
    "MiladiTarihUzunIso8601": "2025-10-25T00:00:00.0000000+03:00",
    "GreenwichOrtalamaZamani": 3.0,
    "Aksam": "18:01",
    "Gunes": "07:04",
    "GunesBatis": "17:54",
    "GunesDogus": "07:11",
    "Ikindi": "15:32",
    "Imsak": "05:39",
    "KibleSaati": "11:30",
    "Ogle": "12:37",
    "Yatsi": "19:21"
  },
  {
    "HicriTarihKisa": "4.5.1447",
    "HicriTarihKisaIso8601": null,
    "HicriTarihUzun": "4 Cemaziyelevvel 1447",
    "HicriTarihUzunIso8601": null,
    "AyinSekliURL": "https://namazvakti.diyanet.gov.tr/images/r4.gif",
    "MiladiTarihKisa": "26.10.2025",
    "MiladiTarihKisaIso8601": "26.10.2025",
    "MiladiTarihUzun": "26 Ekim 2025 Pazar",
    "MiladiTarihUzunIso8601": "2025-10-26T00:00:00.0000000+03:00",
    "GreenwichOrtalamaZamani": 3.0,
    "Aksam": "18:00",
    "Gunes": "07:05",
    "GunesBatis": "17:53",
    "GunesDogus": "07:12",
    "Ikindi": "15:31",
    "Imsak": "05:40",
    "KibleSaati": "11:30",
    "Ogle": "12:37",
    "Yatsi": "19:20"
  },
  {
    "HicriTarihKisa": "5.5.1447",
    "HicriTarihKisaIso8601": null,
    "HicriTarihUzun": "5 Cemaziyelevvel 1447",
    "HicriTarihUzunIso8601": null,
    "AyinSekliURL": "https://namazvakti.diyanet.gov.tr/images/r5.gif",
    "MiladiTarihKisa": "27.10.2025",
    "MiladiTarihKisaIso8601": "27.10.2025",
    "MiladiTarihUzun": "27 Ekim 2025 Pazartesi",
    "MiladiTarihUzunIso8601": "2025-10-27T00:00:00.0000000+03:00",
    "GreenwichOrtalamaZamani": 3.0,
    "Aksam": "17:58",
    "Gunes": "07:06",
    "GunesBatis": "17:51",
    "GunesDogus": "07:13",
    "Ikindi": "15:30",
    "Imsak": "05:41",
    "KibleSaati": "11:29",
    "Ogle": "12:37",
    "Yatsi": "19:18"
  },
  {
    "HicriTarihKisa": "6.5.1447",
    "HicriTarihKisaIso8601": null,
    "HicriTarihUzun": "6 Cemaziyelevvel 1447",
    "HicriTarihUzunIso8601": null,
    "AyinSekliURL": "https://namazvakti.diyanet.gov.tr/images/r6.gif",
    "MiladiTarihKisa": "28.10.2025",
    "MiladiTarihKisaIso8601": "28.10.2025",
    "MiladiTarihUzun": "28 Ekim 2025 Salı",
    "MiladiTarihUzunIso8601": "2025-10-28T00:00:00.0000000+03:00",
    "GreenwichOrtalamaZamani": 3.0,
    "Aksam": "17:57",
    "Gunes": "07:07",
    "GunesBatis": "17:50",
    "GunesDogus": "07:14",
    "Ikindi": "15:29",
    "Imsak": "05:42",
    "KibleSaati": "11:29",
    "Ogle": "12:37",
    "Yatsi": "19:17"
  },
  {
    "HicriTarihKisa": "7.5.1447",
    "HicriTarihKisaIso8601": null,
    "HicriTarihUzun": "7 Cemaziyelevvel 1447",
    "HicriTarihUzunIso8601": null,
    "AyinSekliURL": "https://namazvakti.diyanet.gov.tr/images/ilkdordun.gif",
    "MiladiTarihKisa": "29.10.2025",
    "MiladiTarihKisaIso8601": "29.10.2025",
    "MiladiTarihUzun": "29 Ekim 2025 Çarşamba",
    "MiladiTarihUzunIso8601": "2025-10-29T00:00:00.0000000+03:00",
    "GreenwichOrtalamaZamani": 3.0,
    "Aksam": "17:56",
    "Gunes": "07:09",
    "GunesBatis": "17:49",
    "GunesDogus": "07:16",
    "Ikindi": "15:28",
    "Imsak": "05:43",
    "KibleSaati": "11:28",
    "Ogle": "12:37",
    "Yatsi": "19:16"
  },
  {
    "HicriTarihKisa": "8.5.1447",
    "HicriTarihKisaIso8601": null,
    "HicriTarihUzun": "8 Cemaziyelevvel 1447",
    "HicriTarihUzunIso8601": null,
    "AyinSekliURL": "https://namazvakti.diyanet.gov.tr/images/i1.gif",
    "MiladiTarihKisa": "30.10.2025",
    "MiladiTarihKisaIso8601": "30.10.2025",
    "MiladiTarihUzun": "30 Ekim 2025 Perşembe",
    "MiladiTarihUzunIso8601": "2025-10-30T00:00:00.0000000+03:00",
    "GreenwichOrtalamaZamani": 3.0,
    "Aksam": "17:54",
    "Gunes": "07:10",
    "GunesBatis": "17:47",
    "GunesDogus": "07:17",
    "Ikindi": "15:27",
    "Imsak": "05:44",
    "KibleSaati": "11:28",
    "Ogle": "12:37",
    "Yatsi": "19:15"
  },
  {
    "HicriTarihKisa": "9.5.1447",
    "HicriTarihKisaIso8601": null,
    "HicriTarihUzun": "9 Cemaziyelevvel 1447",
    "HicriTarihUzunIso8601": null,
    "AyinSekliURL": "https://namazvakti.diyanet.gov.tr/images/i2.gif",
    "MiladiTarihKisa": "31.10.2025",
    "MiladiTarihKisaIso8601": "31.10.2025",
    "MiladiTarihUzun": "31 Ekim 2025 Cuma",
    "MiladiTarihUzunIso8601": "2025-10-31T00:00:00.0000000+03:00",
    "GreenwichOrtalamaZamani": 3.0,
    "Aksam": "17:53",
    "Gunes": "07:11",
    "GunesBatis": "17:46",
    "GunesDogus": "07:18",
    "Ikindi": "15:26",
    "Imsak": "05:45",
    "KibleSaati": "11:28",
    "Ogle": "12:37",
    "Yatsi": "19:14"
  },
  {
    "HicriTarihKisa": "10.5.1447",
    "HicriTarihKisaIso8601": null,
    "HicriTarihUzun": "10 Cemaziyelevvel 1447",
    "HicriTarihUzunIso8601": null,
    "AyinSekliURL": "https://namazvakti.diyanet.gov.tr/images/i3.gif",
    "MiladiTarihKisa": "01.11.2025",
    "MiladiTarihKisaIso8601": "01.11.2025",
    "MiladiTarihUzun": "01 Kasım 2025 Cumartesi",
    "MiladiTarihUzunIso8601": "2025-11-01T00:00:00.0000000+03:00",
    "GreenwichOrtalamaZamani": 3.0,
    "Aksam": "17:52",
    "Gunes": "07:12",
    "GunesBatis": "17:45",
    "GunesDogus": "07:19",
    "Ikindi": "15:25",
    "Imsak": "05:46",
    "KibleSaati": "11:27",
    "Ogle": "12:37",
    "Yatsi": "19:13"
  },
  {
    "HicriTarihKisa": "11.5.1447",
    "HicriTarihKisaIso8601": null,
    "HicriTarihUzun": "11 Cemaziyelevvel 1447",
    "HicriTarihUzunIso8601": null,
    "AyinSekliURL": "https://namazvakti.diyanet.gov.tr/images/i4.gif",
    "MiladiTarihKisa": "02.11.2025",
    "MiladiTarihKisaIso8601": "02.11.2025",
    "MiladiTarihUzun": "02 Kasım 2025 Pazar",
    "MiladiTarihUzunIso8601": "2025-11-02T00:00:00.0000000+03:00",
    "GreenwichOrtalamaZamani": 3.0,
    "Aksam": "17:51",
    "Gunes": "07:13",
    "GunesBatis": "17:44",
    "GunesDogus": "07:20",
    "Ikindi": "15:24",
    "Imsak": "05:47",
    "KibleSaati": "11:27",
    "Ogle": "12:37",
    "Yatsi": "19:11"
  },
  {
    "HicriTarihKisa": "12.5.1447",
    "HicriTarihKisaIso8601": null,
    "HicriTarihUzun": "12 Cemaziyelevvel 1447",
    "HicriTarihUzunIso8601": null,
    "AyinSekliURL": "https://namazvakti.diyanet.gov.tr/images/i5.gif",
    "MiladiTarihKisa": "03.11.2025",
    "MiladiTarihKisaIso8601": "03.11.2025",
    "MiladiTarihUzun": "03 Kasım 2025 Pazartesi",
    "MiladiTarihUzunIso8601": "2025-11-03T00:00:00.0000000+03:00",
    "GreenwichOrtalamaZamani": 3.0,
    "Aksam": "17:49",
    "Gunes": "07:15",
    "GunesBatis": "17:42",
    "GunesDogus": "07:22",
    "Ikindi": "15:23",
    "Imsak": "05:48",
    "KibleSaati": "11:27",
    "Ogle": "12:37",
    "Yatsi": "19:10"
  },
  {
    "HicriTarihKisa": "13.5.1447",
    "HicriTarihKisaIso8601": null,
    "HicriTarihUzun": "13 Cemaziyelevvel 1447",
    "HicriTarihUzunIso8601": null,
    "AyinSekliURL": "https://namazvakti.diyanet.gov.tr/images/i6.gif",
    "MiladiTarihKisa": "04.11.2025",
    "MiladiTarihKisaIso8601": "04.11.2025",
    "MiladiTarihUzun": "04 Kasım 2025 Salı",
    "MiladiTarihUzunIso8601": "2025-11-04T00:00:00.0000000+03:00",
    "GreenwichOrtalamaZamani": 3.0,
    "Aksam": "17:48",
    "Gunes": "07:16",
    "GunesBatis": "17:41",
    "GunesDogus": "07:23",
    "Ikindi": "15:22",
    "Imsak": "05:49",
    "KibleSaati": "11:26",
    "Ogle": "12:37",
    "Yatsi": "19:09"
  },
  {
    "HicriTarihKisa": "14.5.1447",
    "HicriTarihKisaIso8601": null,
    "HicriTarihUzun": "14 Cemaziyelevvel 1447",
    "HicriTarihUzunIso8601": null,
    "AyinSekliURL": "https://namazvakti.diyanet.gov.tr/images/dolunay.gif",
    "MiladiTarihKisa": "05.11.2025",
    "MiladiTarihKisaIso8601": "05.11.2025",
    "MiladiTarihUzun": "05 Kasım 2025 Çarşamba",
    "MiladiTarihUzunIso8601": "2025-11-05T00:00:00.0000000+03:00",
    "GreenwichOrtalamaZamani": 3.0,
    "Aksam": "17:47",
    "Gunes": "07:17",
    "GunesBatis": "17:40",
    "GunesDogus": "07:24",
    "Ikindi": "15:21",
    "Imsak": "05:50",
    "KibleSaati": "11:26",
    "Ogle": "12:37",
    "Yatsi": "19:08"
  },
  {
    "HicriTarihKisa": "15.5.1447",
    "HicriTarihKisaIso8601": null,
    "HicriTarihUzun": "15 Cemaziyelevvel 1447",
    "HicriTarihUzunIso8601": null,
    "AyinSekliURL": "https://namazvakti.diyanet.gov.tr/images/d1.gif",
    "MiladiTarihKisa": "06.11.2025",
    "MiladiTarihKisaIso8601": "06.11.2025",
    "MiladiTarihUzun": "06 Kasım 2025 Perşembe",
    "MiladiTarihUzunIso8601": "2025-11-06T00:00:00.0000000+03:00",
    "GreenwichOrtalamaZamani": 3.0,
    "Aksam": "17:46",
    "Gunes": "07:18",
    "GunesBatis": "17:39",
    "GunesDogus": "07:25",
    "Ikindi": "15:20",
    "Imsak": "05:51",
    "KibleSaati": "11:26",
    "Ogle": "12:37",
    "Yatsi": "19:07"
  },
  {
    "HicriTarihKisa": "16.5.1447",
    "HicriTarihKisaIso8601": null,
    "HicriTarihUzun": "16 Cemaziyelevvel 1447",
    "HicriTarihUzunIso8601": null,
    "AyinSekliURL": "https://namazvakti.diyanet.gov.tr/images/d2.gif",
    "MiladiTarihKisa": "07.11.2025",
    "MiladiTarihKisaIso8601": "07.11.2025",
    "MiladiTarihUzun": "07 Kasım 2025 Cuma",
    "MiladiTarihUzunIso8601": "2025-11-07T00:00:00.0000000+03:00",
    "GreenwichOrtalamaZamani": 3.0,
    "Aksam": "17:45",
    "Gunes": "07:19",
    "GunesBatis": "17:38",
    "GunesDogus": "07:26",
    "Ikindi": "15:19",
    "Imsak": "05:52",
    "KibleSaati": "11:25",
    "Ogle": "12:37",
    "Yatsi": "19:06"
  },
  {
    "HicriTarihKisa": "17.5.1447",
    "HicriTarihKisaIso8601": null,
    "HicriTarihUzun": "17 Cemaziyelevvel 1447",
    "HicriTarihUzunIso8601": null,
    "AyinSekliURL": "https://namazvakti.diyanet.gov.tr/images/d3.gif",
    "MiladiTarihKisa": "08.11.2025",
    "MiladiTarihKisaIso8601": "08.11.2025",
    "MiladiTarihUzun": "08 Kasım 2025 Cumartesi",
    "MiladiTarihUzunIso8601": "2025-11-08T00:00:00.0000000+03:00",
    "GreenwichOrtalamaZamani": 3.0,
    "Aksam": "17:44",
    "Gunes": "07:20",
    "GunesBatis": "17:37",
    "GunesDogus": "07:27",
    "Ikindi": "15:18",
    "Imsak": "05:53",
    "KibleSaati": "11:25",
    "Ogle": "12:37",
    "Yatsi": "19:05"
  },
  {
    "HicriTarihKisa": "18.5.1447",
    "HicriTarihKisaIso8601": null,
    "HicriTarihUzun": "18 Cemaziyelevvel 1447",
    "HicriTarihUzunIso8601": null,
    "AyinSekliURL": "https://namazvakti.diyanet.gov.tr/images/d4.gif",
    "MiladiTarihKisa": "09.11.2025",
    "MiladiTarihKisaIso8601": "09.11.2025",
    "MiladiTarihUzun": "09 Kasım 2025 Pazar",
    "MiladiTarihUzunIso8601": "2025-11-09T00:00:00.0000000+03:00",
    "GreenwichOrtalamaZamani": 3.0,
    "Aksam": "17:43",
    "Gunes": "07:22",
    "GunesBatis": "17:36",
    "GunesDogus": "07:29",
    "Ikindi": "15:17",
    "Imsak": "05:54",
    "KibleSaati": "11:25",
    "Ogle": "12:37",
    "Yatsi": "19:05"
  },
  {
    "HicriTarihKisa": "19.5.1447",
    "HicriTarihKisaIso8601": null,
    "HicriTarihUzun": "19 Cemaziyelevvel 1447",
    "HicriTarihUzunIso8601": null,
    "AyinSekliURL": "https://namazvakti.diyanet.gov.tr/images/d5.gif",
    "MiladiTarihKisa": "10.11.2025",
    "MiladiTarihKisaIso8601": "10.11.2025",
    "MiladiTarihUzun": "10 Kasım 2025 Pazartesi",
    "MiladiTarihUzunIso8601": "2025-11-10T00:00:00.0000000+03:00",
    "GreenwichOrtalamaZamani": 3.0,
    "Aksam": "17:42",
    "Gunes": "07:23",
    "GunesBatis": "17:35",
    "GunesDogus": "07:30",
    "Ikindi": "15:17",
    "Imsak": "05:55",
    "KibleSaati": "11:25",
    "Ogle": "12:37",
    "Yatsi": "19:04"
  },
  {
    "HicriTarihKisa": "20.5.1447",
    "HicriTarihKisaIso8601": null,
    "HicriTarihUzun": "20 Cemaziyelevvel 1447",
    "HicriTarihUzunIso8601": null,
    "AyinSekliURL": "https://namazvakti.diyanet.gov.tr/images/d6.gif",
    "MiladiTarihKisa": "11.11.2025",
    "MiladiTarihKisaIso8601": "11.11.2025",
    "MiladiTarihUzun": "11 Kasım 2025 Salı",
    "MiladiTarihUzunIso8601": "2025-11-11T00:00:00.0000000+03:00",
    "GreenwichOrtalamaZamani": 3.0,
    "Aksam": "17:41",
    "Gunes": "07:24",
    "GunesBatis": "17:34",
    "GunesDogus": "07:31",
    "Ikindi": "15:16",
    "Imsak": "05:56",
    "KibleSaati": "11:24",
    "Ogle": "12:37",
    "Yatsi": "19:03"
  },
  {
    "HicriTarihKisa": "21.5.1447",
    "HicriTarihKisaIso8601": null,
    "HicriTarihUzun": "21 Cemaziyelevvel 1447",
    "HicriTarihUzunIso8601": null,
    "AyinSekliURL": "https://namazvakti.diyanet.gov.tr/images/sondordun.gif",
    "MiladiTarihKisa": "12.11.2025",
    "MiladiTarihKisaIso8601": "12.11.2025",
    "MiladiTarihUzun": "12 Kasım 2025 Çarşamba",
    "MiladiTarihUzunIso8601": "2025-11-12T00:00:00.0000000+03:00",
    "GreenwichOrtalamaZamani": 3.0,
    "Aksam": "17:40",
    "Gunes": "07:25",
    "GunesBatis": "17:33",
    "GunesDogus": "07:32",
    "Ikindi": "15:15",
    "Imsak": "05:57",
    "KibleSaati": "11:24",
    "Ogle": "12:37",
    "Yatsi": "19:02"
  },
  {
    "HicriTarihKisa": "22.5.1447",
    "HicriTarihKisaIso8601": null,
    "HicriTarihUzun": "22 Cemaziyelevvel 1447",
    "HicriTarihUzunIso8601": null,
    "AyinSekliURL": "https://namazvakti.diyanet.gov.tr/images/sd1.gif",
    "MiladiTarihKisa": "13.11.2025",
    "MiladiTarihKisaIso8601": "13.11.2025",
    "MiladiTarihUzun": "13 Kasım 2025 Perşembe",
    "MiladiTarihUzunIso8601": "2025-11-13T00:00:00.0000000+03:00",
    "GreenwichOrtalamaZamani": 3.0,
    "Aksam": "17:39",
    "Gunes": "07:26",
    "GunesBatis": "17:32",
    "GunesDogus": "07:33",
    "Ikindi": "15:14",
    "Imsak": "05:58",
    "KibleSaati": "11:24",
    "Ogle": "12:38",
    "Yatsi": "19:01"
  }
]