[
  {
    "HicriTarihKisa": "27.4.1447",
    "HicriTarihKisaIso8601": null,
    "HicriTarihUzun": "27 Rebiulahir 1447",
    "HicriTarihUzunIso8601": null,
    "AyinSekliURL": "https://namazvakti.diyanet.gov.tr/images/sd6.gif",
    "MiladiTarihKisa": "19.10.2025",
    "MiladiTarihKisaIso8601": "19.10.2025",
    "MiladiTarihUzun": "19 Ekim 2025 Pazar",
    "MiladiTarihUzunIso8601": "2025-10-19T00:00:00.0000000+02:00",
    "GreenwichOrtalamaZamani": 3.0,
    "Aksam": "17:59",
    "Gunes": "08:13",
    "GunesBatis": "17:52",
    "GunesDogus": "08:20",
    "Ikindi": "15:13",
    "Imsak": "05:44",
    "KibleSaati": "10:26",
    "Ogle": "13:11",
    "Yatsi": "20:09"
  },
  {
    "HicriTarihKisa": "28.4.1447",
    "HicriTarihKisaIso8601": null,
    "HicriTarihUzun": "28 Rebiulahir 1447",
    "HicriTarihUzunIso8601": null,
    "AyinSekliURL": "https://namazvakti.diyanet.gov.tr/images/sd7.gif",
    "MiladiTarihKisa": "20.10.2025",
    "MiladiTarihKisaIso8601": "20.10.2025",
    "MiladiTarihUzun": "20 Ekim 2025 Pazartesi",
    "MiladiTarihUzunIso8601": "2025-10-20T00:00:00.0000000+02:00",
    "GreenwichOrtalamaZamani": 3.0,
    "Aksam": "17:55",
    "Gunes": "08:16",
    "GunesBatis": "17:48",
    "GunesDogus": "08:23",
    "Ikindi": "15:10",
    "Imsak": "05:47",
    "KibleSaati": "10:26",
    "Ogle": "13:10",
    "Yatsi": "20:06"
  },
  {
    "HicriTarihKisa": "29.4.1447",
    "HicriTarihKisaIso8601": null,
    "HicriTarihUzun": "29 Rebiulahir 1447",
    "HicriTarihUzunIso8601": null,
    "AyinSekliURL": "https://namazvakti.diyanet.gov.tr/images/ictima.gif",
    "MiladiTarihKisa": "21.10.2025",
    "MiladiTarihKisaIso8601": "21.10.2025",
    "MiladiTarihUzun": "21 Ekim 2025 Salı",
    "MiladiTarihUzunIso8601": "2025-10-21T00:00:00.0000000+02:00",
    "GreenwichOrtalamaZamani": 3.0,
    "Aksam": "17:52",
    "Gunes": "08:19",
    "GunesBatis": "17:45",
    "GunesDogus": "08:26",
    "Ikindi": "15:08",
    "Imsak": "05:50",
    "KibleSaati": "10:25",
    "Ogle": "13:10",
    "Yatsi": "20:03"
  },
  {
    "HicriTarihKisa": "30.4.1447",
    "HicriTarihKisaIso8601": null,
    "HicriTarihUzun": "30 Rebiulahir 1447",
    "HicriTarihUzunIso8601": null,
    "AyinSekliURL": "https://namazvakti.diyanet.gov.tr/images/ruyet.gif",
    "MiladiTarihKisa": "22.10.2025",
    "MiladiTarihKisaIso8601": "22.10.2025",
    "MiladiTarihUzun": "22 Ekim 2025 Çarşamba",
    "MiladiTarihUzunIso8601": "2025-10-22T00:00:00.0000000+02:00",
    "GreenwichOrtalamaZamani": 3.0,
    "Aksam": "17:49",
    "Gunes": "08:22",
    "GunesBatis": "17:42",
    "GunesDogus": "08:29",
    "Ikindi": "15:06",
    "Imsak": "05:52",
    "KibleSaati": "10:25",
    "Ogle": "13:10",
    "Yatsi": "20:00"
  },
  {
    "HicriTarihKisa": "1.5.1447",
    "HicriTarihKisaIso8601": null,
    "HicriTarihUzun": "1 Cemaziyelevvel 1447",
    "HicriTarihUzunIso8601": null,
    "AyinSekliURL": "https://namazvakti.diyanet.gov.tr/images/r1.gif",
    "MiladiTarihKisa": "23.10.2025",
    "MiladiTarihKisaIso8601": "23.10.2025",
    "MiladiTarihUzun": "23 Ekim 2025 Perşembe",
    "MiladiTarihUzunIso8601": "2025-10-23T00:00:00.0000000+02:00",
    "GreenwichOrtalamaZamani": 3.0,
    "Aksam": "17:45",
    "Gunes": "08:24",
    "GunesBatis": "17:38",
    "GunesDogus": "08:31",
    "Ikindi": "15:03",
    "Imsak": "05:55",
    "KibleSaati": "10:24",
    "Ogle": "13:10",
    "Yatsi": "19:57"
  },
  {
    "HicriTarihKisa": "2.5.1447",
    "HicriTarihKisaIso8601": null,
    "HicriTarihUzun": "2 Cemaziyelevvel 1447",
    "HicriTarihUzunIso8601": null,
    "AyinSekliURL": "https://namazvakti.diyanet.gov.tr/images/r2.gif",
    "MiladiTarihKisa": "24.10.2025",
    "MiladiTarihKisaIso8601": "24.10.2025",
    "MiladiTarihUzun": "24 Ekim 2025 Cuma",
    "MiladiTarihUzunIso8601": "2025-10-24T00:00:00.0000000+02:00",
    "GreenwichOrtalamaZamani": 3.0,
    "Aksam": "17:42",
    "Gunes": "08:27",
    "GunesBatis": "17:35",
    "GunesDogus": "08:34",
    "Ikindi": "15:01",
    "Imsak": "05:58",
    "KibleSaati": "10:23",
    "Ogle": "13:10",
    "Yatsi": "19:54"
  },
  {
    "HicriTarihKisa": "3.5.1447",
    "HicriTarihKisaIso8601": null,
    "HicriTarihUzun": "3 Cemaziyelevvel 1447",
    "HicriTarihUzunIso8601": null,
    "AyinSekliURL": "https://namazvakti.diyanet.gov.tr/images/r3.gif",
    "MiladiTarihKisa": "25.10.2025",
    "MiladiTarihKisaIso8601": "25.10.2025",
    "MiladiTarihUzun": "25 Ekim 2025 Cumartesi",
    "MiladiTarihUzunIso8601": "2025-10-25T00:00:00.0000000+02:00",
    "GreenwichOrtalamaZamani": 3.0,
    "Aksam": "17:39",
    "Gunes": "08:30",
    "GunesBatis": "17:32",
    "GunesDogus": "08:37",
    "Ikindi": "14:59",
    "Imsak": "06:00",
    "KibleSaati": "10:23",
    "Ogle": "13:10",
    "Yatsi": "19:51"
  },
  {
    "HicriTarihKisa": "4.5.1447",
    "HicriTarihKisaIso8601": null,
    "HicriTarihUzun": "4 Cemaziyelevvel 1447",
    "HicriTarihUzunIso8601": null,
    "AyinSekliURL": "https://namazvakti.diyanet.gov.tr/images/r4.gif",
    "MiladiTarihKisa": "26.10.2025",
    "MiladiTarihKisaIso8601": "26.10.2025",
    "MiladiTarihUzun": "26 Ekim 2025 Pazar",
    "MiladiTarihUzunIso8601": "2025-10-26T00:00:00.0000000+02:00",
    "GreenwichOrtalamaZamani": 3.0,
    "Aksam": "16:36",
    "Gunes": "07:33",
    "GunesBatis": "16:29",
    "GunesDogus": "07:40",
    "Ikindi": "13:56",
    "Imsak": "05:03",
    "KibleSaati": "09:22",
    "Ogle": "12:10",
    "Yatsi": "18:48"
  },
  {
    "HicriTarihKisa": "5.5.1447",
    "HicriTarihKisaIso8601": null,
    "HicriTarihUzun": "5 Cemaziyelevvel 1447",
    "HicriTarihUzunIso8601": null,
    "AyinSekliURL": "https://namazvakti.diyanet.gov.tr/images/r5.gif",
    "MiladiTarihKisa": "27.10.2025",
    "MiladiTarihKisaIso8601": "27.10.2025",
    "MiladiTarihUzun": "27 Ekim 2025 Pazartesi",
    "MiladiTarihUzunIso8601": "2025-10-27T00:00:00.0000000+02:00",
    "GreenwichOrtalamaZamani": 3.0,
    "Aksam": "16:33",
    "Gunes": "07:36",
    "GunesBatis": "16:26",
    "GunesDogus": "07:43",
    "Ikindi": "13:54",
    "Imsak": "05:06",
    "KibleSaati": "09:22",
    "Ogle": "12:09",
    "Yatsi": "18:45"
  },
  {
    "HicriTarihKisa": "6.5.1447",
    "HicriTarihKisaIso8601": null,
    "HicriTarihUzun": "6 Cemaziyelevvel 1447",
    "HicriTarihUzunIso8601": null,
    "AyinSekliURL": "https://namazvakti.diyanet.gov.tr/images/r6.gif",
    "MiladiTarihKisa": "28.10.2025",
    "MiladiTarihKisaIso8601": "28.10.2025",
    "MiladiTarihUzun": "28 Ekim 2025 Salı",
    "MiladiTarihUzunIso8601": "2025-10-28T00:00:00.0000000+02:00",
    "GreenwichOrtalamaZamani": 3.0,
    "Aksam": "16:29",
    "Gunes": "07:39",
    "GunesBatis": "16:22",
    "GunesDogus": "07:46",
    "Ikindi": "13:52",
    "Imsak": "05:08",
    "KibleSaati": "09:21",
    "Ogle": "12:09",
    "Yatsi": "18:43"
  },
  {
    "HicriTarihKisa": "7.5.1447",
    "HicriTarihKisaIso8601": null,
    "HicriTarihUzun": "7 Cemaziyelevvel 1447",
    "HicriTarihUzunIso8601": null,
    "AyinSekliURL": "https://namazvakti.diyanet.gov.tr/images/ilkdordun.gif",
    "MiladiTarihKisa": "29.10.2025",
    "MiladiTarihKisaIso8601": "29.10.2025",
    "MiladiTarihUzun": "29 Ekim 2025 Çarşamba",
    "MiladiTarihUzunIso8601": "2025-10-29T00:00:00.0000000+02:00",
    "GreenwichOrtalamaZamani": 3.0,
    "Aksam": "16:26",
    "Gunes": "07:42",
    "GunesBatis": "16:19",
    "GunesDogus": "07:49",
    "Ikindi": "13:49",
    "Imsak": "05:11",
    "KibleSaati": "09:21",
    "Ogle": "12:09",
    "Yatsi": "18:40"
  },
  {
    "HicriTarihKisa": "8.5.1447",
    "HicriTarihKisaIso8601": null,
    "HicriTarihUzun": "8 Cemaziyelevvel 1447",
    "HicriTarihUzunIso8601": null,
    "AyinSekliURL": "https://namazvakti.diyanet.gov.tr/images/i1.gif",
    "MiladiTarihKisa": "30.10.2025",
    "MiladiTarihKisaIso8601": "30.10.2025",
    "MiladiTarihUzun": "30 Ekim 2025 Perşembe",
    "MiladiTarihUzunIso8601": "2025-10-30T00:00:00.0000000+02:00",
    "GreenwichOrtalamaZamani": 3.0,
    "Aksam": "16:23",
    "Gunes": "07:45",
    "GunesBatis": "16:16",
    "GunesDogus": "07:52",
    "Ikindi": "13:47",
    "Imsak": "05:13",
    "KibleSaati": "09:20",
    "Ogle": "12:09",
    "Yatsi": "18:37"
  },
  {
    "HicriTarihKisa": "9.5.1447",
    "HicriTarihKisaIso8601": null,
    "HicriTarihUzun": "9 Cemaziyelevvel 1447",
    "HicriTarihUzunIso8601": null,
    "AyinSekliURL": "https://namazvakti.diyanet.gov.tr/images/i2.gif",
    "MiladiTarihKisa": "31.10.2025",
    "MiladiTarihKisaIso8601": "31.10.2025",
    "MiladiTarihUzun": "31 Ekim 2025 Cuma",
    "MiladiTarihUzunIso8601": "2025-10-31T00:00:00.0000000+02:00",
    "GreenwichOrtalamaZamani": 3.0,
    "Aksam": "16:20",
    "Gunes": "07:49",
    "GunesBatis": "16:13",
    "GunesDogus": "07:56",
    "Ikindi": "13:45",
    "Imsak": "05:16",
    "KibleSaati": "09:20",
    "Ogle": "12:09",
    "Yatsi": "18:35"
  },
  {
    "HicriTarihKisa": "10.5.1447",
    "HicriTarihKisaIso8601": null,
    "HicriTarihUzun": "10 Cemaziyelevvel 1447",
    "HicriTarihUzunIso8601": null,
    "AyinSekliURL": "https://namazvakti.diyanet.gov.tr/images/i3.gif",
    "MiladiTarihKisa": "01.11.2025",
    "MiladiTarihKisaIso8601": "01.11.2025",
    "MiladiTarihUzun": "01 Kasım 2025 Cumartesi",
    "MiladiTarihUzunIso8601": "2025-11-01T00:00:00.0000000+02:00",
    "GreenwichOrtalamaZamani": 3.0,
    "Aksam": "16:17",
    "Gunes": "07:52",
    "GunesBatis": "16:10",
    "GunesDogus": "07:59",
    "Ikindi": "13:43",
    "Imsak": "05:18",
    "KibleSaati": "09:19",
    "Ogle": "12:09",
    "Yatsi": "18:32"
  },
  {
    "HicriTarihKisa": "11.5.1447",
    "HicriTarihKisaIso8601": null,
    "HicriTarihUzun": "11 Cemaziyelevvel 1447",
    "HicriTarihUzunIso8601": null,
    "AyinSekliURL": "https://namazvakti.diyanet.gov.tr/images/i4.gif",
    "MiladiTarihKisa": "02.11.2025",
    "MiladiTarihKisaIso8601": "02.11.2025",
    "MiladiTarihUzun": "02 Kasım 2025 Pazar",
    "MiladiTarihUzunIso8601": "2025-11-02T00:00:00.0000000+02:00",
    "GreenwichOrtalamaZamani": 3.0,
    "Aksam": "16:14",
    "Gunes": "07:55",
    "GunesBatis": "16:07",
    "GunesDogus": "08:02",
    "Ikindi": "13:41",
    "Imsak": "05:21",
    "KibleSaati": "09:19",
    "Ogle": "12:09",
    "Yatsi": "18:30"
  },
  {
    "HicriTarihKisa": "12.5.1447",
    "HicriTarihKisaIso8601": null,
    "HicriTarihUzun": "12 Cemaziyelevvel 1447",
    "HicriTarihUzunIso8601": null,
    "AyinSekliURL": "https://namazvakti.diyanet.gov.tr/images/i5.gif",
    "MiladiTarihKisa": "03.11.2025",
    "MiladiTarihKisaIso8601": "03.11.2025",
    "MiladiTarihUzun": "03 Kasım 2025 Pazartesi",
    "MiladiTarihUzunIso8601": "2025-11-03T00:00:00.0000000+02:00",
    "GreenwichOrtalamaZamani": 3.0,
    "Aksam": "16:11",
    "Gunes": "07:58",
    "GunesBatis": "16:04",
    "GunesDogus": "08:05",
    "Ikindi": "13:39",
    "Imsak": "05:23",
    "KibleSaati": "09:19",
    "Ogle": "12:09",
    "Yatsi": "18:27"
  },
  {
    "HicriTarihKisa": "13.5.1447",
    "HicriTarihKisaIso8601": null,
    "HicriTarihUzun": "13 Cemaziyelevvel 1447",
    "HicriTarihUzunIso8601": null,
    "AyinSekliURL": "https://namazvakti.diyanet.gov.tr/images/i6.gif",
    "MiladiTarihKisa": "04.11.2025",
    "MiladiTarihKisaIso8601": "04.11.2025",
    "MiladiTarihUzun": "04 Kasım 2025 Salı",
    "MiladiTarihUzunIso8601": "2025-11-04T00:00:00.0000000+02:00",
    "GreenwichOrtalamaZamani": 3.0,
    "Aksam": "16:08",
    "Gunes": "08:01",
    "GunesBatis": "16:01",
    "GunesDogus": "08:08",
    "Ikindi": "13:36",
    "Imsak": "05:26",
    "KibleSaati": "09:18",
    "Ogle": "12:09",
    "Yatsi": "18:25"
  },
  {
    "HicriTarihKisa": "14.5.1447",
    "HicriTarihKisaIso8601": null,
    "HicriTarihUzun": "14 Cemaziyelevvel 1447",
    "HicriTarihUzunIso8601": null,
    "AyinSekliURL": "https://namazvakti.diyanet.gov.tr/images/dolunay.gif",
    "MiladiTarihKisa": "05.11.2025",
    "MiladiTarihKisaIso8601": "05.11.2025",
    "MiladiTarihUzun": "05 Kasım 2025 Çarşamba",
    "MiladiTarihUzunIso8601": "2025-11-05T00:00:00.0000000+02:00",
    "GreenwichOrtalamaZamani": 3.0,
    "Aksam": "16:05",
    "Gunes": "08:04",
    "GunesBatis": "15:58",
    "GunesDogus": "08:11",
    "Ikindi": "13:34",
    "Imsak": "05:28",
    "KibleSaati": "09:18",
    "Ogle": "12:09",
    "Yatsi": "18:22"
  },
  {
    "HicriTarihKisa": "15.5.1447",
    "HicriTarihKisaIso8601": null,
    "HicriTarihUzun": "15 Cemaziyelevvel 1447",
    "HicriTarihUzunIso8601": null,
    "AyinSekliURL": "https://namazvakti.diyanet.gov.tr/images/d1.gif",
    "MiladiTarihKisa": "06.11.2025",
    "MiladiTarihKisaIso8601": "06.11.2025",
    "MiladiTarihUzun": "06 Kasım 2025 Perşembe",
    "MiladiTarihUzunIso8601": "2025-11-06T00:00:00.0000000+02:00",
    "GreenwichOrtalamaZamani": 3.0,
    "Aksam": "16:01",
    "Gunes": "08:07",
    "GunesBatis": "15:54",
    "GunesDogus": "08:14",
    "Ikindi": "13:32",
    "Imsak": "05:31",
    "KibleSaati": "09:17",
    "Ogle": "12:09",
    "Yatsi": "18:20"
  },
  {
    "HicriTarihKisa": "16.5.1447",
    "HicriTarihKisaIso8601": null,
    "HicriTarihUzun": "16 Cemaziyelevvel 1447",
    "HicriTarihUzunIso8601": null,
    "AyinSekliURL": "https://namazvakti.diyanet.gov.tr/images/d2.gif",
    "MiladiTarihKisa": "07.11.2025",
    "MiladiTarihKisaIso8601": "07.11.2025",
    "MiladiTarihUzun": "07 Kasım 2025 Cuma",
    "MiladiTarihUzunIso8601": "2025-11-07T00:00:00.0000000+02:00",
    "GreenwichOrtalamaZamani": 3.0,
    "Aksam": "15:59",
    "Gunes": "08:10",
    "GunesBatis": "15:52",
    "GunesDogus": "08:17",
    "Ikindi": "13:30",
    "Imsak": "05:33",
    "KibleSaati": "09:17",
    "Ogle": "12:09",
    "Yatsi": "18:18"
  },
  {
    "HicriTarihKisa": "17.5.1447",
    "HicriTarihKisaIso8601": null,
    "HicriTarihUzun": "17 Cemaziyelevvel 1447",
    "HicriTarihUzunIso8601": null,
    "AyinSekliURL": "https://namazvakti.diyanet.gov.tr/images/d3.gif",
    "MiladiTarihKisa": "08.11.2025",
    "MiladiTarihKisaIso8601": "08.11.2025",
    "MiladiTarihUzun": "08 Kasım 2025 Cumartesi",
    "MiladiTarihUzunIso8601": "2025-11-08T00:00:00.0000000+02:00",
    "GreenwichOrtalamaZamani": 3.0,
    "Aksam": "15:56",
    "Gunes": "08:13",
    "GunesBatis": "15:49",
    "GunesDogus": "08:20",
    "Ikindi": "13:28",
    "Imsak": "05:35",
    "KibleSaati": "09:17",
    "Ogle": "12:09",
    "Yatsi": "18:15"
  },
  {
    "HicriTarihKisa": "18.5.1447",
    "HicriTarihKisaIso8601": null,
    "HicriTarihUzun": "18 Cemaziyelevvel 1447",
    "HicriTarihUzunIso8601": null,
    "AyinSekliURL": "https://namazvakti.diyanet.gov.tr/images/d4.gif",
    "MiladiTarihKisa": "09.11.2025",
    "MiladiTarihKisaIso8601": "09.11.2025",
    "MiladiTarihUzun": "09 Kasım 2025 Pazar",
    "MiladiTarihUzunIso8601": "2025-11-09T00:00:00.0000000+02:00",
    "GreenwichOrtalamaZamani": 3.0,
    "Aksam": "15:53",
    "Gunes": "08:16",
    "GunesBatis": "15:46",
    "GunesDogus": "08:23",
    "Ikindi": "13:26",
    "Imsak": "05:38",
    "KibleSaati": "09:16",
    "Ogle": "12:09",
    "Yatsi": "18:13"
  },
  {
    "HicriTarihKisa": "19.5.1447",
    "HicriTarihKisaIso8601": null,
    "HicriTarihUzun": "19 Cemaziyelevvel 1447",
    "HicriTarihUzunIso8601": null,
    "AyinSekliURL": "https://namazvakti.diyanet.gov.tr/images/d5.gif",
    "MiladiTarihKisa": "10.11.2025",
    "MiladiTarihKisaIso8601": "10.11.2025",
    "MiladiTarihUzun": "10 Kasım 2025 Pazartesi",
    "MiladiTarihUzunIso8601": "2025-11-10T00:00:00.0000000+02:00",
    "GreenwichOrtalamaZamani": 3.0,
    "Aksam": "15:50",
    "Gunes": "08:19",
    "GunesBatis": "15:43",
    "GunesDogus": "08:26",
    "Ikindi": "13:24",
    "Imsak": "05:40",
    "KibleSaati": "09:16",
    "Ogle": "12:09",
    "Yatsi": "18:11"
  },
  {
    "HicriTarihKisa": "20.5.1447",
    "HicriTarihKisaIso8601": null,
    "HicriTarihUzun": "20 Cemaziyelevvel 1447",
    "HicriTarihUzunIso8601": null,
    "AyinSekliURL": "https://namazvakti.diyanet.gov.tr/images/d6.gif",
    "MiladiTarihKisa": "11.11.2025",
    "MiladiTarihKisaIso8601": "11.11.2025",
    "MiladiTarihUzun": "11 Kasım 2025 Salı",
    "MiladiTarihUzunIso8601": "2025-11-11T00:00:00.0000000+02:00",
    "GreenwichOrtalamaZamani": 3.0,
    "Aksam": "15:47",
    "Gunes": "08:22",
    "GunesBatis": "15:40",
    "GunesDogus": "08:29",
    "Ikindi": "13:23",
    "Imsak": "05:42",
    "KibleSaati": "09:16",
    "Ogle": "12:10",
    "Yatsi": "18:09"
  },
  {
    "HicriTarihKisa": "21.5.1447",
    "HicriTarihKisaIso8601": null,
    "HicriTarihUzun": "21 Cemaziyelevvel 1447",
    "HicriTarihUzunIso8601": null,
    "AyinSekliURL": "https://namazvakti.diyanet.gov.tr/images/sondordun.gif",
    "MiladiTarihKisa": "12.11.2025",
    "MiladiTarihKisaIso8601": "12.11.2025",
    "MiladiTarihUzun": "12 Kasım 2025 Çarşamba",
    "MiladiTarihUzunIso8601": "2025-11-12T00:00:00.0000000+02:00",
    "GreenwichOrtalamaZamani": 3.0,
    "Aksam": "15:44",
    "Gunes": "08:25",
    "GunesBatis": "15:37",
    "GunesDogus": "08:32",
    "Ikindi": "13:21",
    "Imsak": "05:45",
    "KibleSaati": "09:16",
    "Ogle": "12:10",
    "Yatsi": "18:07"
  },
  {
    "HicriTarihKisa": "22.5.1447",
    "HicriTarihKisaIso8601": null,
    "HicriTarihUzun": "22 Cemaziyelevvel 1447",
    "HicriTarihUzunIso8601": null,
    "AyinSekliURL": "https://namazvakti.diyanet.gov.tr/images/sd1.gif",
    "MiladiTarihKisa": "13.11.2025",
    "MiladiTarihKisaIso8601": "13.11.2025",
    "MiladiTarihUzun": "13 Kasım 2025 Perşembe",
    "MiladiTarihUzunIso8601": "2025-11-13T00:00:00.0000000+02:00",
    "GreenwichOrtalamaZamani": 3.0,
    "Aksam": "15:41",
    "Gunes": "08:28",
    "GunesBatis": "15:34",
    "GunesDogus": "08:35",
    "Ikindi": "13:19",
    "Imsak": "05:47",
    "KibleSaati": "09:15",
    "Ogle": "12:10",
    "Yatsi": "18:05"
  },
  {
    "HicriTarihKisa": "23.5.1447",
    "HicriTarihKisaIso8601": null,
    "HicriTarihUzun": "23 Cemaziyelevvel 1447",
    "HicriTarihUzunIso8601": null,
    "AyinSekliURL": "https://namazvakti.diyanet.gov.tr/images/sd2.gif",
    "MiladiTarihKisa": "14.11.2025",
    "MiladiTarihKisaIso8601": "14.11.2025",
    "MiladiTarihUzun": "14 Kasım 2025 Cuma",
    "MiladiTarihUzunIso8601": "2025-11-14T00:00:00.0000000+02:00",
    "GreenwichOrtalamaZamani": 3.0,
    "Aksam": "15:38",
    "Gunes": "08:32",
    "GunesBatis": "15:31",
    "GunesDogus": "08:39",
    "Ikindi": "13:17",
    "Imsak": "05:49",
    "KibleSaati": "09:15",
    "Ogle": "12:10",
    "Yatsi": "18:03"
  },
  {
    "HicriTarihKisa": "24.5.1447",
    "HicriTarihKisaIso8601": null,
    "HicriTarihUzun": "24 Cemaziyelevvel 1447",
    "HicriTarihUzunIso8601": null,
    "AyinSekliURL": "https://namazvakti.diyanet.gov.tr/images/sd3.gif",
    "MiladiTarihKisa": "15.11.2025",
    "MiladiTarihKisaIso8601": "15.11.2025",
    "MiladiTarihUzun": "15 Kasım 2025 Cumartesi",
    "MiladiTarihUzunIso8601": "2025-11-15T00:00:00.0000000+02:00",
    "GreenwichOrtalamaZamani": 3.0,
    "Aksam": "15:36",
    "Gunes": "08:35",
    "GunesBatis": "15:29",
    "GunesDogus": "08:42",
    "Ikindi": "13:15",
    "Imsak": "05:51",
    "KibleSaati": "09:15",
    "Ogle": "12:10",
    "Yatsi": "18:01"
  },
  {
    "HicriTarihKisa": "25.5.1447",
    "HicriTarihKisaIso8601": null,
    "HicriTarihUzun": "25 Cemaziyelevvel 1447",
    "HicriTarihUzunIso8601": null,
    "AyinSekliURL": "https://namazvakti.diyanet.gov.tr/images/sd4.gif",
    "MiladiTarihKisa": "16.11.2025",
    "MiladiTarihKisaIso8601": "16.11.2025",
    "MiladiTarihUzun": "16 Kasım 2025 Pazar",
    "MiladiTarihUzunIso8601": "2025-11-16T00:00:00.0000000+02:00",
    "GreenwichOrtalamaZamani": 3.0,
    "Aksam": "15:33",
    "Gunes": "08:38",
    "GunesBatis": "15:26",
    "GunesDogus": "08:45",
    "Ikindi": "13:14",
    "Imsak": "05:53",
    "KibleSaati": "09:15",
    "Ogle": "12:10",
    "Yatsi": "17:59"
  },
  {
    "HicriTarihKisa": "26.5.1447",
    "HicriTarihKisaIso8601": null,
    "HicriTarihUzun": "26 Cemaziyelevvel 1447",
    "HicriTarihUzunIso8601": null,
    "AyinSekliURL": "https://namazvakti.diyanet.gov.tr/images/sd5.gif",
    "MiladiTarihKisa": "17.11.2025",
    "MiladiTarihKisaIso8601": "17.11.2025",
    "MiladiTarihUzun": "17 Kasım 2025 Pazartesi",
    "MiladiTarihUzunIso8601": "2025-11-17T00:00:00.0000000+02:00",
    "GreenwichOrtalamaZamani": 3.0,
    "Aksam": "15:30",
    "Gunes": "08:41",
    "GunesBatis": "15:23",
    "GunesDogus": "08:48",
    "Ikindi": "13:12",
    "Imsak": "05:56",
    "KibleSaati": "09:15",
    "Ogle": "12:10",
    "Yatsi": "17:57"
  },
  {
    "HicriTarihKisa": "27.5.1447",
    "HicriTarihKisaIso8601": null,
    "HicriTarihUzun": "27 Cemaziyelevvel 1447",
    "HicriTarihUzunIso8601": null,
    "AyinSekliURL": "https://namazvakti.diyanet.gov.tr/images/sd6.gif",
    "MiladiTarihKisa": "18.11.2025",
    "MiladiTarihKisaIso8601": "18.11.2025",
    "MiladiTarihUzun": "18 Kasım 2025 Salı",
    "MiladiTarihUzunIso8601": "2025-11-18T00:00:00.0000000+02:00",
    "GreenwichOrtalamaZamani": 3.0,
    "Aksam": "15:28",
    "Gunes": "08:44",
    "GunesBatis": "15:21",
    "GunesDogus": "08:51",
    "Ikindi": "13:10",
    "Imsak": "05:58",
    "KibleSaati": "09:15",
    "Ogle": "12:11",
    "Yatsi": "17:56"
  },
  {
    "HicriTarihKisa": "28.5.1447",
    "HicriTarihKisaIso8601": null,
    "HicriTarihUzun": "28 Cemaziyelevvel 1447",
    "HicriTarihUzunIso8601": null,
    "AyinSekliURL": "https://namazvakti.diyanet.gov.tr/images/sd7.gif",
    "MiladiTarihKisa": "19.11.2025",
    "MiladiTarihKisaIso8601": "19.11.2025",
    "MiladiTarihUzun": "19 Kasım 2025 Çarşamba",
    "MiladiTarihUzunIso8601": "2025-11-19T00:00:00.0000000+02:00",
    "GreenwichOrtalamaZamani": 3.0,
    "Aksam": "15:25",
    "Gunes": "08:47",
    "GunesBatis": "15:18",
    "GunesDogus": "08:54",
    "Ikindi": "13:09",
    "Imsak": "06:00",
    "KibleSaati": "09:15",
    "Ogle": "12:11",
    "Yatsi": "17:54"
  }
]