[
  {
    "HicriTarihKisa": "4.6.1447",
    "HicriTarihKisaIso8601": null,
    "HicriTarihUzun": "4 Cemaziyelahir 1447",
    "HicriTarihUzunIso8601": null,
    "AyinSekliURL": "https://namazvakti.diyanet.gov.tr/images/r4.gif",
    "MiladiTarihKisa": "24.11.2025",
    "MiladiTarihKisaIso8601": "24.11.2025",
    "MiladiTarihUzun": "24 Kasım 2025 Pazartesi",
    "MiladiTarihUzunIso8601": "2025-11-24T00:00:00.0000000+03:00",
    "GreenwichOrtalamaZamani": 3.0,
    "Aksam": "18:46",
    "Gunes": "06:26",
    "GunesBatis": "18:39",
    "GunesDogus": "06:33",
    "Ikindi": "16:05",
    "Imsak": "05:20",
    "KibleSaati": "13:05",
    "Ogle": "12:41",
    "Yatsi": "19:49"
  },
  {
    "HicriTarihKisa": "5.6.1447",
    "HicriTarihKisaIso8601": null,
    "HicriTarihUzun": "5 Cemaziyelahir 1447",
    "HicriTarihUzunIso8601": null,
    "AyinSekliURL": "https://namazvakti.diyanet.gov.tr/images/r5.gif",
    "MiladiTarihKisa": "25.11.2025",
    "MiladiTarihKisaIso8601": "25.11.2025",
    "MiladiTarihUzun": "25 Kasım 2025 Salı",
    "MiladiTarihUzunIso8601": "2025-11-25T00:00:00.0000000+03:00",
    "GreenwichOrtalamaZamani": 3.0,
    "Aksam": "18:47",
    "Gunes": "06:27",
    "GunesBatis": "18:40",
    "GunesDogus": "06:34",
    "Ikindi": "16:05",
    "Imsak": "05:20",
    "KibleSaati": "13:05",
    "Ogle": "12:42",
    "Yatsi": "19:49"
  },
  {
    "HicriTarihKisa": "6.6.1447",
    "HicriTarihKisaIso8601": null,
    "HicriTarihUzun": "6 Cemaziyelahir 1447",
    "HicriTarihUzunIso8601": null,
    "AyinSekliURL": "https://namazvakti.diyanet.gov.tr/images/r6.gif",
    "MiladiTarihKisa": "26.11.2025",
    "MiladiTarihKisaIso8601": "26.11.2025",
    "MiladiTarihUzun": "26 Kasım 2025 Çarşamba",
    "MiladiTarihUzunIso8601": "2025-11-26T00:00:00.0000000+03:00",
    "GreenwichOrtalamaZamani": 3.0,
    "Aksam": "18:47",
    "Gunes": "06:27",
    "GunesBatis": "18:40",
    "GunesDogus": "06:34",
    "Ikindi": "16:05",
    "Imsak": "05:20",
    "KibleSaati": "13:06",
    "Ogle": "12:42",
    "Yatsi": "19:49"
  },
  {
    "HicriTarihKisa": "7.6.1447",
    "HicriTarihKisaIso8601": null,
    "HicriTarihUzun": "7 Cemaziyelahir 1447",
    "HicriTarihUzunIso8601": null,
    "AyinSekliURL": "https://namazvakti.diyanet.gov.tr/images/ilkdordun.gif",
    "MiladiTarihKisa": "27.11.2025",
    "MiladiTarihKisaIso8601": "27.11.2025",
    "MiladiTarihUzun": "27 Kasım 2025 Perşembe",
    "MiladiTarihUzunIso8601": "2025-11-27T00:00:00.0000000+03:00",
    "GreenwichOrtalamaZamani": 3.0,
    "Aksam": "18:47",
    "Gunes": "06:27",
    "GunesBatis": "18:40",
    "GunesDogus": "06:34",
    "Ikindi": "16:06",
    "Imsak": "05:20",
    "KibleSaati": "13:07",
    "Ogle": "12:42",
    "Yatsi": "19:50"
  },
  {
    "HicriTarihKisa": "8.6.1447",
    "HicriTarihKisaIso8601": null,
    "HicriTarihUzun": "8 Cemaziyelahir 1447",
    "HicriTarihUzunIso8601": null,
    "AyinSekliURL": "https://namazvakti.diyanet.gov.tr/images/i1.gif",
    "MiladiTarihKisa": "28.11.2025",
    "MiladiTarihKisaIso8601": "28.11.2025",
    "MiladiTarihUzun": "28 Kasım 2025 Cuma",
    "MiladiTarihUzunIso8601": "2025-11-28T00:00:00.0000000+03:00",
    "GreenwichOrtalamaZamani": 3.0,
    "Aksam": "18:48",
    "Gunes": "06:28",
    "GunesBatis": "18:41",
    "GunesDogus": "06:35",
    "Ikindi": "16:06",
    "Imsak": "05:21",
    "KibleSaati": "13:07",
    "Ogle": "12:43",
    "Yatsi": "19:50"
  },
  {
    "HicriTarihKisa": "9.6.1447",
    "HicriTarihKisaIso8601": null,
    "HicriTarihUzun": "9 Cemaziyelahir 1447",
    "HicriTarihUzunIso8601": null,
    "AyinSekliURL": "https://namazvakti.diyanet.gov.tr/images/i2.gif",
    "MiladiTarihKisa": "29.11.2025",
    "MiladiTarihKisaIso8601": "29.11.2025",
    "MiladiTarihUzun": "29 Kasım 2025 Cumartesi",
    "MiladiTarihUzunIso8601": "2025-11-29T00:00:00.0000000+03:00",
    "GreenwichOrtalamaZamani": 3.0,
    "Aksam": "18:48",
    "Gunes": "06:28",
    "GunesBatis": "18:41",
    "GunesDogus": "06:35",
    "Ikindi": "16:07",
    "Imsak": "05:21",
    "KibleSaati": "13:08",
    "Ogle": "12:43",
    "Yatsi": "19:51"
  },
  {
    "HicriTarihKisa": "10.6.1447",
    "HicriTarihKisaIso8601": null,
    "HicriTarihUzun": "10 Cemaziyelahir 1447",
    "HicriTarihUzunIso8601": null,
    "AyinSekliURL": "https://namazvakti.diyanet.gov.tr/images/i3.gif",
    "MiladiTarihKisa": "30.11.2025",
    "MiladiTarihKisaIso8601": "30.11.2025",
    "MiladiTarihUzun": "30 Kasım 2025 Pazar",
    "MiladiTarihUzunIso8601": "2025-11-30T00:00:00.0000000+03:00",
    "GreenwichOrtalamaZamani": 3.0,
    "Aksam": "18:48",
    "Gunes": "06:28",
    "GunesBatis": "18:41",
    "GunesDogus": "06:35",
    "Ikindi": "16:07",
    "Imsak": "05:21",
    "KibleSaati": "13:08",
    "Ogle": "12:43",
    "Yatsi": "19:51"
  },
  {
    "HicriTarihKisa": "11.6.1447",
    "HicriTarihKisaIso8601": null,
    "HicriTarihUzun": "11 Cemaziyelahir 1447",
    "HicriTarihUzunIso8601": null,
    "AyinSekliURL": "https://namazvakti.diyanet.gov.tr/images/i4.gif",
    "MiladiTarihKisa": "01.12.2025",
    "MiladiTarihKisaIso8601": "01.12.2025",
    "MiladiTarihUzun": "01 Aralık 2025 Pazartesi",
    "MiladiTarihUzunIso8601": "2025-12-01T00:00:00.0000000+03:00",
    "GreenwichOrtalamaZamani": 3.0,
    "Aksam": "18:49",
    "Gunes": "06:29",
    "GunesBatis": "18:42",
    "GunesDogus": "06:36",
    "Ikindi": "16:08",
    "Imsak": "05:21",
    "KibleSaati": "13:09",
    "Ogle": "12:44",
    "Yatsi": "19:52"
  },
  {
    "HicriTarihKisa": "12.6.1447",
    "HicriTarihKisaIso8601": null,
    "HicriTarihUzun": "12 Cemaziyelahir 1447",
    "HicriTarihUzunIso8601": null,
    "AyinSekliURL": "https://namazvakti.diyanet.gov.tr/images/i5.gif",
    "MiladiTarihKisa": "02.12.2025",
    "MiladiTarihKisaIso8601": "02.12.2025",
    "MiladiTarihUzun": "02 Aralık 2025 Salı",
    "MiladiTarihUzunIso8601": "2025-12-02T00:00:00.0000000+03:00",
    "GreenwichOrtalamaZamani": 3.0,
    "Aksam": "18:49",
    "Gunes": "06:29",
    "GunesBatis": "18:42",
    "GunesDogus": "06:36",
    "Ikindi": "16:08",
    "Imsak": "05:22",
    "KibleSaati": "13:10",
    "Ogle": "12:44",
    "Yatsi": "19:52"
  },
  {
    "HicriTarihKisa": "13.6.1447",
    "HicriTarihKisaIso8601": null,
    "HicriTarihUzun": "13 Cemaziyelahir 1447",
    "HicriTarihUzunIso8601": null,
    "AyinSekliURL": "https://namazvakti.diyanet.gov.tr/images/i6.gif",
    "MiladiTarihKisa": "03.12.2025",
    "MiladiTarihKisaIso8601": "03.12.2025",
    "MiladiTarihUzun": "03 Aralık 2025 Çarşamba",
    "MiladiTarihUzunIso8601": "2025-12-03T00:00:00.0000000+03:00",
    "GreenwichOrtalamaZamani": 3.0,
    "Aksam": "18:49",
    "Gunes": "06:29",
    "GunesBatis": "18:42",
    "GunesDogus": "06:36",
    "Ikindi": "16:08",
    "Imsak": "05:22",
    "KibleSaati": "13:10",
    "Ogle": "12:44",
    "Yatsi": "19:52"
  },
  {
    "HicriTarihKisa": "14.6.1447",
    "HicriTarihKisaIso8601": null,
    "HicriTarihUzun": "14 Cemaziyelahir 1447",
    "HicriTarihUzunIso8601": null,
    "AyinSekliURL": "https://namazvakti.diyanet.gov.tr/images/dolunay.gif",
    "MiladiTarihKisa": "04.12.2025",
    "MiladiTarihKisaIso8601": "04.12.2025",
    "MiladiTarihUzun": "04 Aralık 2025 Perşembe",
    "MiladiTarihUzunIso8601": "2025-12-04T00:00:00.0000000+03:00",
    "GreenwichOrtalamaZamani": 3.0,
    "Aksam": "18:50",
    "Gunes": "06:30",
    "GunesBatis": "18:43",
    "GunesDogus": "06:37",
    "Ikindi": "16:09",
    "Imsak": "05:22",
    "KibleSaati": "13:11",
    "Ogle": "12:45",
    "Yatsi": "19:53"
  },
  {
    "HicriTarihKisa": "15.6.1447",
    "HicriTarihKisaIso8601": null,
    "HicriTarihUzun": "15 Cemaziyelahir 1447",
    "HicriTarihUzunIso8601": null,
    "AyinSekliURL": "https://namazvakti.diyanet.gov.tr/images/d1.gif",
    "MiladiTarihKisa": "05.12.2025",
    "MiladiTarihKisaIso8601": "05.12.2025",
    "MiladiTarihUzun": "05 Aralık 2025 Cuma",
    "MiladiTarihUzunIso8601": "2025-12-05T00:00:00.0000000+03:00",
    "GreenwichOrtalamaZamani": 3.0,
    "Aksam": "18:50",
    "Gunes": "06:30",
    "GunesBatis": "18:43",
    "GunesDogus": "06:37",
    "Ikindi": "16:09",
    "Imsak": "05:23",
    "KibleSaati": "13:12",
    "Ogle": "12:45",
    "Yatsi": "19:53"
  },
  {
    "HicriTarihKisa": "16.6.1447",
    "HicriTarihKisaIso8601": null,
    "HicriTarihUzun": "16 Cemaziyelahir 1447",
    "HicriTarihUzunIso8601": null,
    "AyinSekliURL": "https://namazvakti.diyanet.gov.tr/images/d2.gif",
    "MiladiTarihKisa": "06.12.2025",
    "MiladiTarihKisaIso8601": "06.12.2025",
    "MiladiTarihUzun": "06 Aralık 2025 Cumartesi",
    "MiladiTarihUzunIso8601": "2025-12-06T00:00:00.0000000+03:00",
    "GreenwichOrtalamaZamani": 3.0,
    "Aksam": "18:51",
    "Gunes": "06:31",
    "GunesBatis": "18:44",
    "GunesDogus": "06:38",
    "Ikindi": "16:10",
    "Imsak": "05:23",
    "KibleSaati": "13:12",
    "Ogle": "12:46",
    "Yatsi": "19:54"
  },
  {
    "HicriTarihKisa": "17.6.1447",
    "HicriTarihKisaIso8601": null,
    "HicriTarihUzun": "17 Cemaziyelahir 1447",
    "HicriTarihUzunIso8601": null,
    "AyinSekliURL": "https://namazvakti.diyanet.gov.tr/images/d3.gif",
    "MiladiTarihKisa": "07.12.2025",
    "MiladiTarihKisaIso8601": "07.12.2025",
    "MiladiTarihUzun": "07 Aralık 2025 Pazar",
    "MiladiTarihUzunIso8601": "2025-12-07T00:00:00.0000000+03:00",
    "GreenwichOrtalamaZamani": 3.0,
    "Aksam": "18:51",
    "Gunes": "06:31",
    "GunesBatis": "18:44",
    "GunesDogus": "06:38",
    "Ikindi": "16:10",
    "Imsak": "05:23",
    "KibleSaati": "13:13",
    "Ogle": "12:46",
    "Yatsi": "19:54"
  },
  {
    "HicriTarihKisa": "18.6.1447",
    "HicriTarihKisaIso8601": null,
    "HicriTarihUzun": "18 Cemaziyelahir 1447",
    "HicriTarihUzunIso8601": null,
    "AyinSekliURL": "https://namazvakti.diyanet.gov.tr/images/d4.gif",
    "MiladiTarihKisa": "08.12.2025",
    "MiladiTarihKisaIso8601": "08.12.2025",
    "MiladiTarihUzun": "08 Aralık 2025 Pazartesi",
    "MiladiTarihUzunIso8601": "2025-12-08T00:00:00.0000000+03:00",
    "GreenwichOrtalamaZamani": 3.0,
    "Aksam": "18:52",
    "Gunes": "06:31",
    "GunesBatis": "18:45",
    "GunesDogus": "06:38",
    "Ikindi": "16:11",
    "Imsak": "05:24",
    "KibleSaati": "13:13",
    "Ogle": "12:46",
    "Yatsi": "19:55"
  },
  {
    "HicriTarihKisa": "19.6.1447",
    "HicriTarihKisaIso8601": null,
    "HicriTarihUzun": "19 Cemaziyelahir 1447",
    "HicriTarihUzunIso8601": null,
    "AyinSekliURL": "https://namazvakti.diyanet.gov.tr/images/d5.gif",
    "MiladiTarihKisa": "09.12.2025",
    "MiladiTarihKisaIso8601": "09.12.2025",
    "MiladiTarihUzun": "09 Aralık 2025 Salı",
    "MiladiTarihUzunIso8601": "2025-12-09T00:00:00.0000000+03:00",
    "GreenwichOrtalamaZamani": 3.0,
    "Aksam": "18:52",
    "Gunes": "06:32",
    "GunesBatis": "18:45",
    "GunesDogus": "06:39",
    "Ikindi": "16:11",
    "Imsak": "05:24",
    "KibleSaati": "13:14",
    "Ogle": "12:47",
    "Yatsi": "19:55"
  },
  {
    "HicriTarihKisa": "20.6.1447",
    "HicriTarihKisaIso8601": null,
    "HicriTarihUzun": "20 Cemaziyelahir 1447",
    "HicriTarihUzunIso8601": null,
    "AyinSekliURL": "https://namazvakti.diyanet.gov.tr/images/d6.gif",
    "MiladiTarihKisa": "10.12.2025",
    "MiladiTarihKisaIso8601": "10.12.2025",
    "MiladiTarihUzun": "10 Aralık 2025 Çarşamba",
    "MiladiTarihUzunIso8601": "2025-12-10T00:00:00.0000000+03:00",
    "GreenwichOrtalamaZamani": 3.0,
    "Aksam": "18:52",
    "Gunes": "06:32",
    "GunesBatis": "18:45",
    "GunesDogus": "06:39",
    "Ikindi": "16:12",
    "Imsak": "05:25",
    "KibleSaati": "13:15",
    "Ogle": "12:47",
    "Yatsi": "19:56"
  },
  {
    "HicriTarihKisa": "21.6.1447",
    "HicriTarihKisaIso8601": null,
    "HicriTarihUzun": "21 Cemaziyelahir 1447",
    "HicriTarihUzunIso8601": null,
    "AyinSekliURL": "https://namazvakti.diyanet.gov.tr/images/d7.gif",
    "MiladiTarihKisa": "11.12.2025",
    "MiladiTarihKisaIso8601": "11.12.2025",
    "MiladiTarihUzun": "11 Aralık 2025 Perşembe",
    "MiladiTarihUzunIso8601": "2025-12-11T00:00:00.0000000+03:00",
    "GreenwichOrtalamaZamani": 3.0,
    "Aksam": "18:53",
    "Gunes": "06:33",
    "GunesBatis": "18:46",
    "GunesDogus": "06:40",
    "Ikindi": "16:12",
    "Imsak": "05:25",
    "KibleSaati": "13:15",
    "Ogle": "12:48",
    "Yatsi": "19:56"
  },
  {
    "HicriTarihKisa": "22.6.1447",
    "HicriTarihKisaIso8601": null,
    "HicriTarihUzun": "22 Cemaziyelahir 1447",
    "HicriTarihUzunIso8601": null,
    "AyinSekliURL": "https://namazvakti.diyanet.gov.tr/images/sondordun.gif",
    "MiladiTarihKisa": "12.12.2025",
    "MiladiTarihKisaIso8601": "12.12.2025",
    "MiladiTarihUzun": "12 Aralık 2025 Cuma",
    "MiladiTarihUzunIso8601": "2025-12-12T00:00:00.0000000+03:00",
    "GreenwichOrtalamaZamani": 3.0,
    "Aksam": "18:53",
    "Gunes": "06:33",
    "GunesBatis": "18:46",
    "GunesDogus": "06:40",
    "Ikindi": "16:13",
    "Imsak": "05:25",
    "KibleSaati": "13:16",
    "Ogle": "12:48",
    "Yatsi": "19:57"
  },
  {
    "HicriTarihKisa": "23.6.1447",
    "HicriTarihKisaIso8601": null,
    "HicriTarihUzun": "23 Cemaziyelahir 1447",
    "HicriTarihUzunIso8601": null,
    "AyinSekliURL": "https://namazvakti.diyanet.gov.tr/images/sd1.gif",
    "MiladiTarihKisa": "13.12.2025",
    "MiladiTarihKisaIso8601": "13.12.2025",
    "MiladiTarihUzun": "13 Aralık 2025 Cumartesi",
    "MiladiTarihUzunIso8601": "2025-12-13T00:00:00.0000000+03:00",
    "GreenwichOrtalamaZamani": 3.0,
    "Aksam": "18:54",
    "Gunes": "06:34",
    "GunesBatis": "18:47",
    "GunesDogus": "06:41",
    "Ikindi": "16:13",
    "Imsak": "05:26",
    "KibleSaati": "13:16",
    "Ogle": "12:49",
    "Yatsi": "19:57"
  },
  {
    "HicriTarihKisa": "24.6.1447",
    "HicriTarihKisaIso8601": null,
    "HicriTarihUzun": "24 Cemaziyelahir 1447",
    "HicriTarihUzunIso8601": null,
    "AyinSekliURL": "https://namazvakti.diyanet.gov.tr/images/sd2.gif",
    "MiladiTarihKisa": "14.12.2025",
    "MiladiTarihKisaIso8601": "14.12.2025",
    "MiladiTarihUzun": "14 Aralık 2025 Pazar",
    "MiladiTarihUzunIso8601": "2025-12-14T00:00:00.0000000+03:00",
    "GreenwichOrtalamaZamani": 3.0,
    "Aksam": "18:54",
    "Gunes": "06:34",
    "GunesBatis": "18:47",
    "GunesDogus": "06:41",
    "Ikindi": "16:14",
    "Imsak": "05:26",
    "KibleSaati": "13:17",
    "Ogle": "12:49",
    "Yatsi": "19:58"
  },
  {
    "HicriTarihKisa": "25.6.1447",
    "HicriTarihKisaIso8601": null,
    "HicriTarihUzun": "25 Cemaziyelahir 1447",
    "HicriTarihUzunIso8601": null,
    "AyinSekliURL": "https://namazvakti.diyanet.gov.tr/images/sd3.gif",
    "MiladiTarihKisa": "15.12.2025",
    "MiladiTarihKisaIso8601": "15.12.2025",
    "MiladiTarihUzun": "15 Aralık 2025 Pazartesi",
    "MiladiTarihUzunIso8601": "2025-12-15T00:00:00.0000000+03:00",
    "GreenwichOrtalamaZamani": 3.0,
    "Aksam": "18:55",
    "Gunes": "06:35",
    "GunesBatis": "18:48",
    "GunesDogus": "06:42",
    "Ikindi": "16:14",
    "Imsak": "05:27",
    "KibleSaati": "13:17",
    "Ogle": "12:50",
    "Yatsi": "19:58"
  },
  {
    "HicriTarihKisa": "26.6.1447",
    "HicriTarihKisaIso8601": null,
    "HicriTarihUzun": "26 Cemaziyelahir 1447",
    "HicriTarihUzunIso8601": null,
    "AyinSekliURL": "https://namazvakti.diyanet.gov.tr/images/sd4.gif",
    "MiladiTarihKisa": "16.12.2025",
    "MiladiTarihKisaIso8601": "16.12.2025",
    "MiladiTarihUzun": "16 Aralık 2025 Salı",
    "MiladiTarihUzunIso8601": "2025-12-16T00:00:00.0000000+03:00",
    "GreenwichOrtalamaZamani": 3.0,
    "Aksam": "18:55",
    "Gunes": "06:35",
    "GunesBatis": "18:48",
    "GunesDogus": "06:42",
    "Ikindi": "16:15",
    "Imsak": "05:27",
    "KibleSaati": "13:18",
    "Ogle": "12:50",
    "Yatsi": "19:59"
  },
  {
    "HicriTarihKisa": "27.6.1447",
    "HicriTarihKisaIso8601": null,
    "HicriTarihUzun": "27 Cemaziyelahir 1447",
    "HicriTarihUzunIso8601": null,
    "AyinSekliURL": "https://namazvakti.diyanet.gov.tr/images/sd5.gif",
    "MiladiTarihKisa": "17.12.2025",
    "MiladiTarihKisaIso8601": "17.12.2025",
    "MiladiTarihUzun": "17 Aralık 2025 Çarşamba",
    "MiladiTarihUzunIso8601": "2025-12-17T00:00:00.0000000+03:00",
    "GreenwichOrtalamaZamani": 3.0,
    "Aksam": "18:56",
    "Gunes": "06:36",
    "GunesBatis": "18:49",
    "GunesDogus": "06:43",
    "Ikindi": "16:15",
    "Imsak": "05:28",
    "KibleSaati": "13:19",
    "Ogle": "12:51",
    "Yatsi": "19:59"
  },
  {
    "HicriTarihKisa": "28.6.1447",
    "HicriTarihKisaIso8601": null,
    "HicriTarihUzun": "28 Cemaziyelahir 1447",
    "HicriTarihUzunIso8601": null,
    "AyinSekliURL": "https://namazvakti.diyanet.gov.tr/images/sd6.gif",
    "MiladiTarihKisa": "18.12.2025",
    "MiladiTarihKisaIso8601": "18.12.2025",
    "MiladiTarihUzun": "18 Aralık 2025 Perşembe",
    "MiladiTarihUzunIso8601": "2025-12-18T00:00:00.0000000+03:00",
    "GreenwichOrtalamaZamani": 3.0,
    "Aksam": "18:56",
    "Gunes": "06:36",
    "GunesBatis": "18:49",
    "GunesDogus": "06:43",
    "Ikindi": "16:16",
    "Imsak": "05:28",
    "KibleSaati": "13:19",
    "Ogle": "12:51",
    "Yatsi": "20:00"
  },
  {
    "HicriTarihKisa": "29.6.1447",
    "HicriTarihKisaIso8601": null,
    "HicriTarihUzun": "29 Cemaziyelahir 1447",
    "HicriTarihUzunIso8601": null,
    "AyinSekliURL": "https://namazvakti.diyanet.gov.tr/images/sd7.gif",
    "MiladiTarihKisa": "19.12.2025",
    "MiladiTarihKisaIso8601": "19.12.2025",
    "MiladiTarihUzun": "19 Aralık 2025 Cuma",
    "MiladiTarihUzunIso8601": "2025-12-19T00:00:00.0000000+03:00",
    "GreenwichOrtalamaZamani": 3.0,
    "Aksam": "18:57",
    "Gunes": "06:37",
    "GunesBatis": "18:50",
    "GunesDogus": "06:44",
    "Ikindi": "16:16",
    "Imsak": "05:29",
    "KibleSaati": "13:20",
    "Ogle": "12:52",
    "Yatsi": "20:00"
  },
  {
    "HicriTarihKisa": "30.6.1447",
    "HicriTarihKisaIso8601": null,
    "HicriTarihUzun": "30 Cemaziyelahir 1447",
    "HicriTarihUzunIso8601": null,
    "AyinSekliURL": "https://namazvakti.diyanet.gov.tr/images/ruyet.gif",
    "MiladiTarihKisa": "20.12.2025",
    "MiladiTarihKisaIso8601": "20.12.2025",
    "MiladiTarihUzun": "20 Aralık 2025 Cumartesi",
    "MiladiTarihUzunIso8601": "2025-12-20T00:00:00.0000000+03:00",
    "GreenwichOrtalamaZamani": 3.0,
    "Aksam": "18:57",
    "Gunes": "06:37",
    "GunesBatis": "18:50",
    "GunesDogus": "06:44",
    "Ikindi": "16:17",
    "Imsak": "05:29",
    "KibleSaati": "13:20",
    "Ogle": "12:52",
    "Yatsi": "20:01"
  },
  {
    "HicriTarihKisa": "1.7.1447",
    "HicriTarihKisaIso8601": null,
    "HicriTarihUzun": "1 Recep 1447",
    "HicriTarihUzunIso8601": null,
    "AyinSekliURL": "https://namazvakti.diyanet.gov.tr/images/r1.gif",
    "MiladiTarihKisa": "21.12.2025",
    "MiladiTarihKisaIso8601": "21.12.2025",
    "MiladiTarihUzun": "21 Aralık 2025 Pazar",
    "MiladiTarihUzunIso8601": "2025-12-21T00:00:00.0000000+03:00",
    "GreenwichOrtalamaZamani": 3.0,
    "Aksam": "18:58",
    "Gunes": "06:38",
    "GunesBatis": "18:51",
    "GunesDogus": "06:45",
    "Ikindi": "16:17",
    "Imsak": "05:30",
    "KibleSaati": "13:21",
    "Ogle": "12:53",
    "Yatsi": "20:01"
  },
  {
    "HicriTarihKisa": "2.7.1447",
    "HicriTarihKisaIso8601": null,
    "HicriTarihUzun": "2 Recep 1447",
    "HicriTarihUzunIso8601": null,
    "AyinSekliURL": "https://namazvakti.diyanet.gov.tr/images/r2.gif",
    "MiladiTarihKisa": "22.12.2025",
    "MiladiTarihKisaIso8601": "22.12.2025",
    "MiladiTarihUzun": "22 Aralık 2025 Pazartesi",
    "MiladiTarihUzunIso8601": "2025-12-22T00:00:00.0000000+03:00",
    "GreenwichOrtalamaZamani": 3.0,
    "Aksam": "18:58",
    "Gunes": "06:38",
    "GunesBatis": "18:51",
    "GunesDogus": "06:45",
    "Ikindi": "16:18",
    "Imsak": "05:30",
    "KibleSaati": "13:21",
    "Ogle": "12:53",
    "Yatsi": "20:02"
  },
  {
    "HicriTarihKisa": "3.7.1447",
    "HicriTarihKisaIso8601": null,
    "HicriTarihUzun": "3 Recep 1447",
    "HicriTarihUzunIso8601": null,
    "AyinSekliURL": "https://namazvakti.diyanet.gov.tr/images/r3.gif",
    "MiladiTarihKisa": "23.12.2025",
    "MiladiTarihKisaIso8601": "23.12.2025",
    "MiladiTarihUzun": "23 Aralık 2025 Salı",
    "MiladiTarihUzunIso8601": "2025-12-23T00:00:00.0000000+03:00",
    "GreenwichOrtalamaZamani": 3.0,
    "Aksam": "18:59",
    "Gunes": "06:39",
    "GunesBatis": "18:52",
    "GunesDogus": "06:46",
    "Ikindi": "16:18",
    "Imsak": "05:31",
    "KibleSaati": "13:22",
    "Ogle": "12:54",
    "Yatsi": "20:02"
  },
  {
    "HicriTarihKisa": "4.7.1447",
    "HicriTarihKisaIso8601": null,
    "HicriTarihUzun": "4 Recep 1447",
    "HicriTarihUzunIso8601": null,
    "AyinSekliURL": "https://namazvakti.diyanet.gov.tr/images/r4.gif",
    "MiladiTarihKisa": "24.12.2025",
    "MiladiTarihKisaIso8601": "24.12.2025",
    "MiladiTarihUzun": "24 Aralık 2025 Çarşamba",
    "MiladiTarihUzunIso8601": "2025-12-24T00:00:00.0000000+03:00",
    "GreenwichOrtalamaZamani": 3.0,
    "Aksam": "18:59",
    "Gunes": "06:39",
    "GunesBatis": "18:52",
    "GunesDogus": "06:46",
    "Ikindi": "16:19",
    "Imsak": "05:31",
    "KibleSaati": "13:22",
    "Ogle": "12:54",
    "Yatsi": "20:03"
  },
  {
    "HicriTarihKisa": "5.7.1447",
    "HicriTarihKisaIso8601": null,
    "HicriTarihUzun": "5 Recep 1447",
    "HicriTarihUzunIso8601": null,
    "AyinSekliURL": "https://namazvakti.diyanet.gov.tr/images/r5.gif",
    "MiladiTarihKisa": "25.12.2025",
    "MiladiTarihKisaIso8601": "25.12.2025",
    "MiladiTarihUzun": "25 Aralık 2025 Perşembe",
    "MiladiTarihUzunIso8601": "2025-12-25T00:00:00.0000000+03:00",
    "GreenwichOrtalamaZamani": 3.0,
    "Aksam": "19:00",
    "Gunes": "06:40",
    "GunesBatis": "18:53",
    "GunesDogus": "06:47",
    "Ikindi": "16:19",
    "Imsak": "05:32",
    "KibleSaati": "13:23",
    "Ogle": "12:55",
    "Yatsi": "20:03"
  }
]