[
  {
    "HicriTarihKisa": "28.5.1447",
    "HicriTarihKisaIso8601": null,
    "HicriTarihUzun": "28 Cemaziyelevvel 1447",
    "HicriTarihUzunIso8601": null,
    "AyinSekliURL": "https://namazvakti.diyanet.gov.tr/images/sd7.gif",
    "MiladiTarihKisa": "19.11.2025",
    "MiladiTarihKisaIso8601": "19.11.2025",
    "MiladiTarihUzun": "19 Kasım 2025 Çarşamba",
    "MiladiTarihUzunIso8601": "2025-11-19T00:00:00.0000000+08:00",
    "GreenwichOrtalamaZamani": 3.0,
    "Aksam": "17:05",
    "Gunes": "08:52",
    "GunesBatis": "16:58",
    "GunesDogus": "08:59",
    "Ikindi": "14:41",
    "Imsak": "06:45",
    "KibleSaati": "18:58",
    "Ogle": "13:04",
    "Yatsi": "18:58"
  },
  {
    "HicriTarihKisa": "29.5.1447",
    "HicriTarihKisaIso8601": null,
    "HicriTarihUzun": "29 Cemaziyelevvel 1447",
    "HicriTarihUzunIso8601": null,
    "AyinSekliURL": "https://namazvakti.diyanet.gov.tr/images/ruyet.gif",
    "MiladiTarihKisa": "20.11.2025",
    "MiladiTarihKisaIso8601": "20.11.2025",
    "MiladiTarihUzun": "20 Kasım 2025 Perşembe",
    "MiladiTarihUzunIso8601": "2025-11-20T00:00:00.0000000+08:00",
    "GreenwichOrtalamaZamani": 3.0,
    "Aksam": "17:03",
    "Gunes": "08:54",
    "GunesBatis": "16:56",
    "GunesDogus": "09:01",
    "Ikindi": "14:40",
    "Imsak": "06:46",
    "KibleSaati": "18:59",
    "Ogle": "13:04",
    "Yatsi": "18:57"
  },
  {
    "HicriTarihKisa": "1.6.1447",
    "HicriTarihKisaIso8601": null,
    "HicriTarihUzun": "1 Cemaziyelahir 1447",
    "HicriTarihUzunIso8601": null,
    "AyinSekliURL": "https://namazvakti.diyanet.gov.tr/images/r1.gif",
    "MiladiTarihKisa": "21.11.2025",
    "MiladiTarihKisaIso8601": "21.11.2025",
    "MiladiTarihUzun": "21 Kasım 2025 Cuma",
    "MiladiTarihUzunIso8601": "2025-11-21T00:00:00.0000000+08:00",
    "GreenwichOrtalamaZamani": 3.0,
    "Aksam": "17:02",
    "Gunes": "08:56",
    "GunesBatis": "16:55",
    "GunesDogus": "09:03",
    "Ikindi": "14:39",
    "Imsak": "06:48",
    "KibleSaati": "19:00",
    "Ogle": "13:04",
    "Yatsi": "18:56"
  },
  {
    "HicriTarihKisa": "2.6.1447",
    "HicriTarihKisaIso8601": null,
    "HicriTarihUzun": "2 Cemaziyelahir 1447",
    "HicriTarihUzunIso8601": null,
    "AyinSekliURL": "https://namazvakti.diyanet.gov.tr/images/r2.gif",
    "MiladiTarihKisa": "22.11.2025",
    "MiladiTarihKisaIso8601": "22.11.2025",
    "MiladiTarihUzun": "22 Kasım 2025 Cumartesi",
    "MiladiTarihUzunIso8601": "2025-11-22T00:00:00.0000000+08:00",
    "GreenwichOrtalamaZamani": 3.0,
    "Aksam": "17:00",
    "Gunes": "08:58",
    "GunesBatis": "16:53",
    "GunesDogus": "09:05",
    "Ikindi": "14:38",
    "Imsak": "06:49",
    "KibleSaati": "19:01",
    "Ogle": "13:04",
    "Yatsi": "18:54"
  },
  {
    "HicriTarihKisa": "3.6.1447",
    "HicriTarihKisaIso8601": null,
    "HicriTarihUzun": "3 Cemaziyelahir 1447",
    "HicriTarihUzunIso8601": null,
    "AyinSekliURL": "https://namazvakti.diyanet.gov.tr/images/r3.gif",
    "MiladiTarihKisa": "23.11.2025",
    "MiladiTarihKisaIso8601": "23.11.2025",
    "MiladiTarihUzun": "23 Kasım 2025 Pazar",
    "MiladiTarihUzunIso8601": "2025-11-23T00:00:00.0000000+08:00",
    "GreenwichOrtalamaZamani": 3.0,
    "Aksam": "16:59",
    "Gunes": "09:00",
    "GunesBatis": "16:52",
    "GunesDogus": "09:07",
    "Ikindi": "14:37",
    "Imsak": "06:51",
    "KibleSaati": "19:02",
    "Ogle": "13:05",
    "Yatsi": "18:53"
  },
  {
    "HicriTarihKisa": "4.6.1447",
    "HicriTarihKisaIso8601": null,
    "HicriTarihUzun": "4 Cemaziyelahir 1447",
    "HicriTarihUzunIso8601": null,
    "AyinSekliURL": "https://namazvakti.diyanet.gov.tr/images/r4.gif",
    "MiladiTarihKisa": "24.11.2025",
    "MiladiTarihKisaIso8601": "24.11.2025",
    "MiladiTarihUzun": "24 Kasım 2025 Pazartesi",
    "MiladiTarihUzunIso8601": "2025-11-24T00:00:00.0000000+08:00",
    "GreenwichOrtalamaZamani": 3.0,
    "Aksam": "16:58",
    "Gunes": "09:02",
    "GunesBatis": "16:51",
    "GunesDogus": "09:09",
    "Ikindi": "14:36",
    "Imsak": "06:52",
    "KibleSaati": "19:03",
    "Ogle": "13:05",
    "Yatsi": "18:53"
  },
  {
    "HicriTarihKisa": "5.6.1447",
    "HicriTarihKisaIso8601": null,
    "HicriTarihUzun": "5 Cemaziyelahir 1447",
    "HicriTarihUzunIso8601": null,
    "AyinSekliURL": "https://namazvakti.diyanet.gov.tr/images/r5.gif",
    "MiladiTarihKisa": "25.11.2025",
    "MiladiTarihKisaIso8601": "25.11.2025",
    "MiladiTarihUzun": "25 Kasım 2025 Salı",
    "MiladiTarihUzunIso8601": "2025-11-25T00:00:00.0000000+08:00",
    "GreenwichOrtalamaZamani": 3.0,
    "Aksam": "16:56",
    "Gunes": "09:04",
    "GunesBatis": "16:49",
    "GunesDogus": "09:11",
    "Ikindi": "14:35",
    "Imsak": "06:54",
    "KibleSaati": "19:04",
    "Ogle": "13:05",
    "Yatsi": "18:52"
  },
  {
    "HicriTarihKisa": "6.6.1447",
    "HicriTarihKisaIso8601": null,
    "HicriTarihUzun": "6 Cemaziyelahir 1447",
    "HicriTarihUzunIso8601": null,
    "AyinSekliURL": "https://namazvakti.diyanet.gov.tr/images/r6.gif",
    "MiladiTarihKisa": "26.11.2025",
    "MiladiTarihKisaIso8601": "26.11.2025",
    "MiladiTarihUzun": "26 Kasım 2025 Çarşamba",
    "MiladiTarihUzunIso8601": "2025-11-26T00:00:00.0000000+08:00",
    "GreenwichOrtalamaZamani": 3.0,
    "Aksam": "16:55",
    "Gunes": "09:06",
    "GunesBatis": "16:48",
    "GunesDogus": "09:13",
    "Ikindi": "14:34",
    "Imsak": "06:55",
    "KibleSaati": "19:04",
    "Ogle": "13:05",
    "Yatsi": "18:51"
  },
  {
    "HicriTarihKisa": "7.6.1447",
    "HicriTarihKisaIso8601": null,
    "HicriTarihUzun": "7 Cemaziyelahir 1447",
    "HicriTarihUzunIso8601": null,
    "AyinSekliURL": "https://namazvakti.diyanet.gov.tr/images/ilkdordun.gif",
    "MiladiTarihKisa": "27.11.2025",
    "MiladiTarihKisaIso8601": "27.11.2025",
    "MiladiTarihUzun": "27 Kasım 2025 Perşembe",
    "MiladiTarihUzunIso8601": "2025-11-27T00:00:00.0000000+08:00",
    "GreenwichOrtalamaZamani": 3.0,
    "Aksam": "16:54",
    "Gunes": "09:08",
    "GunesBatis": "16:47",
    "GunesDogus": "09:15",
    "Ikindi": "14:33",
    "Imsak": "06:57",
    "KibleSaati": "19:05",
    "Ogle": "13:06",
    "Yatsi": "18:50"
  },
  {
    "HicriTarihKisa": "8.6.1447",
    "HicriTarihKisaIso8601": null,
    "HicriTarihUzun": "8 Cemaziyelahir 1447",
    "HicriTarihUzunIso8601": null,
    "AyinSekliURL": "https://namazvakti.diyanet.gov.tr/images/i1.gif",
    "MiladiTarihKisa": "28.11.2025",
    "MiladiTarihKisaIso8601": "28.11.2025",
    "MiladiTarihUzun": "28 Kasım 2025 Cuma",
    "MiladiTarihUzunIso8601": "2025-11-28T00:00:00.0000000+08:00",
    "GreenwichOrtalamaZamani": 3.0,
    "Aksam": "16:53",
    "Gunes": "09:09",
    "GunesBatis": "16:46",
    "GunesDogus": "09:16",
    "Ikindi": "14:33",
    "Imsak": "06:58",
    "KibleSaati": "19:06",
    "Ogle": "13:06",
    "Yatsi": "18:49"
  },
  {
    "HicriTarihKisa": "9.6.1447",
    "HicriTarihKisaIso8601": null,
    "HicriTarihUzun": "9 Cemaziyelahir 1447",
    "HicriTarihUzunIso8601": null,
    "AyinSekliURL": "https://namazvakti.diyanet.gov.tr/images/i2.gif",
    "MiladiTarihKisa": "29.11.2025",
    "MiladiTarihKisaIso8601": "29.11.2025",
    "MiladiTarihUzun": "29 Kasım 2025 Cumartesi",
    "MiladiTarihUzunIso8601": "2025-11-29T00:00:00.0000000+08:00",
    "GreenwichOrtalamaZamani": 3.0,
    "Aksam": "16:52",
    "Gunes": "09:11",
    "GunesBatis": "16:45",
    "GunesDogus": "09:18",
    "Ikindi": "14:32",
    "Imsak": "06:59",
    "KibleSaati": "19:07",
    "Ogle": "13:06",
    "Yatsi": "18:48"
  },
  {
    "HicriTarihKisa": "10.6.1447",
    "HicriTarihKisaIso8601": null,
    "HicriTarihUzun": "10 Cemaziyelahir 1447",
    "HicriTarihUzunIso8601": null,
    "AyinSekliURL": "https://namazvakti.diyanet.gov.tr/images/i3.gif",
    "MiladiTarihKisa": "30.11.2025",
    "MiladiTarihKisaIso8601": "30.11.2025",
    "MiladiTarihUzun": "30 Kasım 2025 Pazar",
    "MiladiTarihUzunIso8601": "2025-11-30T00:00:00.0000000+08:00",
    "GreenwichOrtalamaZamani": 3.0,
    "Aksam": "16:51",
    "Gunes": "09:13",
    "GunesBatis": "16:44",
    "GunesDogus": "09:20",
    "Ikindi": "14:31",
    "Imsak": "07:01",
    "KibleSaati": "19:08",
    "Ogle": "13:07",
    "Yatsi": "18:48"
  },
  {
    "HicriTarihKisa": "11.6.1447",
    "HicriTarihKisaIso8601": null,
    "HicriTarihUzun": "11 Cemaziyelahir 1447",
    "HicriTarihUzunIso8601": null,
    "AyinSekliURL": "https://namazvakti.diyanet.gov.tr/images/i4.gif",
    "MiladiTarihKisa": "01.12.2025",
    "MiladiTarihKisaIso8601": "01.12.2025",
    "MiladiTarihUzun": "01 Aralık 2025 Pazartesi",
    "MiladiTarihUzunIso8601": "2025-12-01T00:00:00.0000000+08:00",
    "GreenwichOrtalamaZamani": 3.0,
    "Aksam": "16:50",
    "Gunes": "09:15",
    "GunesBatis": "16:43",
    "GunesDogus": "09:22",
    "Ikindi": "14:31",
    "Imsak": "07:02",
    "KibleSaati": "19:09",
    "Ogle": "13:07",
    "Yatsi": "18:47"
  },
  {
    "HicriTarihKisa": "12.6.1447",
    "HicriTarihKisaIso8601": null,
    "HicriTarihUzun": "12 Cemaziyelahir 1447",
    "HicriTarihUzunIso8601": null,
    "AyinSekliURL": "https://namazvakti.diyanet.gov.tr/images/i5.gif",
    "MiladiTarihKisa": "02.12.2025",
    "MiladiTarihKisaIso8601": "02.12.2025",
    "MiladiTarihUzun": "02 Aralık 2025 Salı",
    "MiladiTarihUzunIso8601": "2025-12-02T00:00:00.0000000+08:00",
    "GreenwichOrtalamaZamani": 3.0,
    "Aksam": "16:49",
    "Gunes": "09:16",
    "GunesBatis": "16:42",
    "GunesDogus": "09:23",
    "Ikindi": "14:30",
    "Imsak": "07:03",
    "KibleSaati": "19:10",
    "Ogle": "13:07",
    "Yatsi": "18:47"
  },
  {
    "HicriTarihKisa": "13.6.1447",
    "HicriTarihKisaIso8601": null,
    "HicriTarihUzun": "13 Cemaziyelahir 1447",
    "HicriTarihUzunIso8601": null,
    "AyinSekliURL": "https://namazvakti.diyanet.gov.tr/images/i6.gif",
    "MiladiTarihKisa": "03.12.2025",
    "MiladiTarihKisaIso8601": "03.12.2025",
    "MiladiTarihUzun": "03 Aralık 2025 Çarşamba",
    "MiladiTarihUzunIso8601": "2025-12-03T00:00:00.0000000+08:00",
    "GreenwichOrtalamaZamani": 3.0,
    "Aksam": "16:48",
    "Gunes": "09:18",
    "GunesBatis": "16:41",
    "GunesDogus": "09:25",
    "Ikindi": "14:30",
    "Imsak": "07:05",
    "KibleSaati": "19:11",
    "Ogle": "13:08",
    "Yatsi": "18:46"
  },
  {
    "HicriTarihKisa": "14.6.1447",
    "HicriTarihKisaIso8601": null,
    "HicriTarihUzun": "14 Cemaziyelahir 1447",
    "HicriTarihUzunIso8601": null,
    "AyinSekliURL": "https://namazvakti.diyanet.gov.tr/images/dolunay.gif",
    "MiladiTarihKisa": "04.12.2025",
    "MiladiTarihKisaIso8601": "04.12.2025",
    "MiladiTarihUzun": "04 Aralık 2025 Perşembe",
    "MiladiTarihUzunIso8601": "2025-12-04T00:00:00.0000000+08:00",
    "GreenwichOrtalamaZamani": 3.0,
    "Aksam": "16:47",
    "Gunes": "09:19",
    "GunesBatis": "16:40",
    "GunesDogus": "09:26",
    "Ikindi": "14:29",
    "Imsak": "07:06",
    "KibleSaati": "19:11",
    "Ogle": "13:08",
    "Yatsi": "18:46"
  },
  {
    "HicriTarihKisa": "15.6.1447",
    "HicriTarihKisaIso8601": null,
    "HicriTarihUzun": "15 Cemaziyelahir 1447",
    "HicriTarihUzunIso8601": null,
    "AyinSekliURL": "https://namazvakti.diyanet.gov.tr/images/d1.gif",
    "MiladiTarihKisa": "05.12.2025",
    "MiladiTarihKisaIso8601": "05.12.2025",
    "MiladiTarihUzun": "05 Aralık 2025 Cuma",
    "MiladiTarihUzunIso8601": "2025-12-05T00:00:00.0000000+08:00",
    "GreenwichOrtalamaZamani": 3.0,
    "Aksam": "16:46",
    "Gunes": "09:21",
    "GunesBatis": "16:39",
    "GunesDogus": "09:28",
    "Ikindi": "14:29",
    "Imsak": "07:07",
    "KibleSaati": "19:12",
    "Ogle": "13:09",
    "Yatsi": "18:45"
  },
  {
    "HicriTarihKisa": "16.6.1447",
    "HicriTarihKisaIso8601": null,
    "HicriTarihUzun": "16 Cemaziyelahir 1447",
    "HicriTarihUzunIso8601": null,
    "AyinSekliURL": "https://namazvakti.diyanet.gov.tr/images/d2.gif",
    "MiladiTarihKisa": "06.12.2025",
    "MiladiTarihKisaIso8601": "06.12.2025",
    "MiladiTarihUzun": "06 Aralık 2025 Cumartesi",
    "MiladiTarihUzunIso8601": "2025-12-06T00:00:00.0000000+08:00",
    "GreenwichOrtalamaZamani": 3.0,
    "Aksam": "16:46",
    "Gunes": "09:22",
    "GunesBatis": "16:39",
    "GunesDogus": "09:29",
    "Ikindi": "14:28",
    "Imsak": "07:08",
    "KibleSaati": "19:13",
    "Ogle": "13:09",
    "Yatsi": "18:45"
  },
  {
    "HicriTarihKisa": "17.6.1447",
    "HicriTarihKisaIso8601": null,
    "HicriTarihUzun": "17 Cemaziyelahir 1447",
    "HicriTarihUzunIso8601": null,
    "AyinSekliURL": "https://namazvakti.diyanet.gov.tr/images/d3.gif",
    "MiladiTarihKisa": "07.12.2025",
    "MiladiTarihKisaIso8601": "07.12.2025",
    "MiladiTarihUzun": "07 Aralık 2025 Pazar",
    "MiladiTarihUzunIso8601": "2025-12-07T00:00:00.0000000+08:00",
    "GreenwichOrtalamaZamani": 3.0,
    "Aksam": "16:45",
    "Gunes": "09:24",
    "GunesBatis": "16:38",
    "GunesDogus": "09:31",
    "Ikindi": "14:28",
    "Imsak": "07:09",
    "KibleSaati": "19:14",
    "Ogle": "13:10",
    "Yatsi": "18:45"
  },
  {
    "HicriTarihKisa": "18.6.1447",
    "HicriTarihKisaIso8601": null,
    "HicriTarihUzun": "18 Cemaziyelahir 1447",
    "HicriTarihUzunIso8601": null,
    "AyinSekliURL": "https://namazvakti.diyanet.gov.tr/images/d4.gif",
    "MiladiTarihKisa": "08.12.2025",
    "MiladiTarihKisaIso8601": "08.12.2025",
    "MiladiTarihUzun": "08 Aralık 2025 Pazartesi",
    "MiladiTarihUzunIso8601": "2025-12-08T00:00:00.0000000+08:00",
    "GreenwichOrtalamaZamani": 3.0,
    "Aksam": "16:45",
    "Gunes": "09:25",
    "GunesBatis": "16:38",
    "GunesDogus": "09:32",
    "Ikindi": "14:28",
    "Imsak": "07:10",
    "KibleSaati": "19:15",
    "Ogle": "13:10",
    "Yatsi": "18:44"
  },
  {
    "HicriTarihKisa": "19.6.1447",
    "HicriTarihKisaIso8601": null,
    "HicriTarihUzun": "19 Cemaziyelahir 1447",
    "HicriTarihUzunIso8601": null,
    "AyinSekliURL": "https://namazvakti.diyanet.gov.tr/images/d5.gif",
    "MiladiTarihKisa": "09.12.2025",
    "MiladiTarihKisaIso8601": "09.12.2025",
    "MiladiTarihUzun": "09 Aralık 2025 Salı",
    "MiladiTarihUzunIso8601": "2025-12-09T00:00:00.0000000+08:00",
    "GreenwichOrtalamaZamani": 3.0,
    "Aksam": "16:44",
    "Gunes": "09:27",
    "GunesBatis": "16:37",
    "GunesDogus": "09:34",
    "Ikindi": "14:28",
    "Imsak": "07:11",
    "KibleSaati": "19:15",
    "Ogle": "13:10",
    "Yatsi": "18:44"
  },
  {
    "HicriTarihKisa": "20.6.1447",
    "HicriTarihKisaIso8601": null,
    "HicriTarihUzun": "20 Cemaziyelahir 1447",
    "HicriTarihUzunIso8601": null,
    "AyinSekliURL": "https://namazvakti.diyanet.gov.tr/images/d6.gif",
    "MiladiTarihKisa": "10.12.2025",
    "MiladiTarihKisaIso8601": "10.12.2025",
    "MiladiTarihUzun": "10 Aralık 2025 Çarşamba",
    "MiladiTarihUzunIso8601": "2025-12-10T00:00:00.0000000+08:00",
    "GreenwichOrtalamaZamani": 3.0,
    "Aksam": "16:44",
    "Gunes": "09:28",
    "GunesBatis": "16:37",
    "GunesDogus": "09:35",
    "Ikindi": "14:28",
    "Imsak": "07:13",
    "KibleSaati": "19:16",
    "Ogle": "13:11",
    "Yatsi": "18:44"
  },
  {
    "HicriTarihKisa": "21.6.1447",
    "HicriTarihKisaIso8601": null,
    "HicriTarihUzun": "21 Cemaziyelahir 1447",
    "HicriTarihUzunIso8601": null,
    "AyinSekliURL": "https://namazvakti.diyanet.gov.tr/images/d7.gif",
    "MiladiTarihKisa": "11.12.2025",
    "MiladiTarihKisaIso8601": "11.12.2025",
    "MiladiTarihUzun": "11 Aralık 2025 Perşembe",
    "MiladiTarihUzunIso8601": "2025-12-11T00:00:00.0000000+08:00",
    "GreenwichOrtalamaZamani": 3.0,
    "Aksam": "16:44",
    "Gunes": "09:29",
    "GunesBatis": "16:37",
    "GunesDogus": "09:36",
    "Ikindi": "14:28",
    "Imsak": "07:13",
    "KibleSaati": "19:17",
    "Ogle": "13:11",
    "Yatsi": "18:44"
  },
  {
    "HicriTarihKisa": "22.6.1447",
    "HicriTarihKisaIso8601": null,
    "HicriTarihUzun": "22 Cemaziyelahir 1447",
    "HicriTarihUzunIso8601": null,
    "AyinSekliURL": "https://namazvakti.diyanet.gov.tr/images/sondordun.gif",
    "MiladiTarihKisa": "12.12.2025",
    "MiladiTarihKisaIso8601": "12.12.2025",
    "MiladiTarihUzun": "12 Aralık 2025 Cuma",
    "MiladiTarihUzunIso8601": "2025-12-12T00:00:00.0000000+08:00",
    "GreenwichOrtalamaZamani": 3.0,
    "Aksam": "16:43",
    "Gunes": "09:30",
    "GunesBatis": "16:36",
    "GunesDogus": "09:37",
    "Ikindi": "14:27",
    "Imsak": "07:14",
    "KibleSaati": "19:17",
    "Ogle": "13:12",
    "Yatsi": "18:44"
  },
  {
    "HicriTarihKisa": "23.6.1447",
    "HicriTarihKisaIso8601": null,
    "HicriTarihUzun": "23 Cemaziyelahir 1447",
    "HicriTarihUzunIso8601": null,
    "AyinSekliURL": "https://namazvakti.diyanet.gov.tr/images/sd1.gif",
    "MiladiTarihKisa": "13.12.2025",
    "MiladiTarihKisaIso8601": "13.12.2025",
    "MiladiTarihUzun": "13 Aralık 2025 Cumartesi",
    "MiladiTarihUzunIso8601": "2025-12-13T00:00:00.0000000+08:00",
    "GreenwichOrtalamaZamani": 3.0,
    "Aksam": "16:43",
    "Gunes": "09:31",
    "GunesBatis": "16:36",
    "GunesDogus": "09:38",
    "Ikindi": "14:28",
    "Imsak": "07:15",
    "KibleSaati": "19:18",
    "Ogle": "13:12",
    "Yatsi": "18:44"
  },
  {
    "HicriTarihKisa": "24.6.1447",
    "HicriTarihKisaIso8601": null,
    "HicriTarihUzun": "24 Cemaziyelahir 1447",
    "HicriTarihUzunIso8601": null,
    "AyinSekliURL": "https://namazvakti.diyanet.gov.tr/images/sd2.gif",
    "MiladiTarihKisa": "14.12.2025",
    "MiladiTarihKisaIso8601": "14.12.2025",
    "MiladiTarihUzun": "14 Aralık 2025 Pazar",
    "MiladiTarihUzunIso8601": "2025-12-14T00:00:00.0000000+08:00",
    "GreenwichOrtalamaZamani": 3.0,
    "Aksam": "16:43",
    "Gunes": "09:32",
    "GunesBatis": "16:36",
    "GunesDogus": "09:39",
    "Ikindi": "14:28",
    "Imsak": "07:16",
    "KibleSaati": "19:19",
    "Ogle": "13:13",
    "Yatsi": "18:44"
  },
  {
    "HicriTarihKisa": "25.6.1447",
    "HicriTarihKisaIso8601": null,
    "HicriTarihUzun": "25 Cemaziyelahir 1447",
    "HicriTarihUzunIso8601": null,
    "AyinSekliURL": "https://namazvakti.diyanet.gov.tr/images/sd3.gif",
    "MiladiTarihKisa": "15.12.2025",
    "MiladiTarihKisaIso8601": "15.12.2025",
    "MiladiTarihUzun": "15 Aralık 2025 Pazartesi",
    "MiladiTarihUzunIso8601": "2025-12-15T00:00:00.0000000+08:00",
    "GreenwichOrtalamaZamani": 3.0,
    "Aksam": "16:43",
    "Gunes": "09:33",
    "GunesBatis": "16:36",
    "GunesDogus": "09:40",
    "Ikindi": "14:28",
    "Imsak": "07:17",
    "KibleSaati": "19:20",
    "Ogle": "13:13",
    "Yatsi": "18:44"
  },
  {
    "HicriTarihKisa": "26.6.1447",
    "HicriTarihKisaIso8601": null,
    "HicriTarihUzun": "26 Cemaziyelahir 1447",
    "HicriTarihUzunIso8601": null,
    "AyinSekliURL": "https://namazvakti.diyanet.gov.tr/images/sd4.gif",
    "MiladiTarihKisa": "16.12.2025",
    "MiladiTarihKisaIso8601": "16.12.2025",
    "MiladiTarihUzun": "16 Aralık 2025 Salı",
    "MiladiTarihUzunIso8601": "2025-12-16T00:00:00.0000000+08:00",
    "GreenwichOrtalamaZamani": 3.0,
    "Aksam": "16:43",
    "Gunes": "09:34",
    "GunesBatis": "16:36",
    "GunesDogus": "09:41",
    "Ikindi": "14:28",
    "Imsak": "07:18",
    "KibleSaati": "19:20",
    "Ogle": "13:14",
    "Yatsi": "18:44"
  },
  {
    "HicriTarihKisa": "27.6.1447",
    "HicriTarihKisaIso8601": null,
    "HicriTarihUzun": "27 Cemaziyelahir 1447",
    "HicriTarihUzunIso8601": null,
    "AyinSekliURL": "https://namazvakti.diyanet.gov.tr/images/sd5.gif",
    "MiladiTarihKisa": "17.12.2025",
    "MiladiTarihKisaIso8601": "17.12.2025",
    "MiladiTarihUzun": "17 Aralık 2025 Çarşamba",
    "MiladiTarihUzunIso8601": "2025-12-17T00:00:00.0000000+08:00",
    "GreenwichOrtalamaZamani": 3.0,
    "Aksam": "16:43",
    "Gunes": "09:35",
    "GunesBatis": "16:36",
    "GunesDogus": "09:42",
    "Ikindi": "14:28",
    "Imsak": "07:19",
    "KibleSaati": "19:21",
    "Ogle": "13:14",
    "Yatsi": "18:45"
  },
  {
    "HicriTarihKisa": "28.6.1447",
    "HicriTarihKisaIso8601": null,
    "HicriTarihUzun": "28 Cemaziyelahir 1447",
    "HicriTarihUzunIso8601": null,
    "AyinSekliURL": "https://namazvakti.diyanet.gov.tr/images/sd6.gif",
    "MiladiTarihKisa": "18.12.2025",
    "MiladiTarihKisaIso8601": "18.12.2025",
    "MiladiTarihUzun": "18 Aralık 2025 Perşembe",
    "MiladiTarihUzunIso8601": "2025-12-18T00:00:00.0000000+08:00",
    "GreenwichOrtalamaZamani": 3.0,
    "Aksam": "16:43",
    "Gunes": "09:36",
    "GunesBatis": "16:36",
    "GunesDogus": "09:43",
    "Ikindi": "14:28",
    "Imsak": "07:19",
    "KibleSaati": "19:21",
    "Ogle": "13:15",
    "Yatsi": "18:45"
  },
  {
    "HicriTarihKisa": "29.6.1447",
    "HicriTarihKisaIso8601": null,
    "HicriTarihUzun": "29 Cemaziyelahir 1447",
    "HicriTarihUzunIso8601": null,
    "AyinSekliURL": "https://namazvakti.diyanet.gov.tr/images/sd7.gif",
    "MiladiTarihKisa": "19.12.2025",
    "MiladiTarihKisaIso8601": "19.12.2025",
    "MiladiTarihUzun": "19 Aralık 2025 Cuma",
    "MiladiTarihUzunIso8601": "2025-12-19T00:00:00.0000000+08:00",
    "GreenwichOrtalamaZamani": 3.0,
    "Aksam": "16:44",
    "Gunes": "09:37",
    "GunesBatis": "16:37",
    "GunesDogus": "09:44",
    "Ikindi": "14:29",
    "Imsak": "07:20",
    "KibleSaati": "19:22",
    "Ogle": "13:15",
    "Yatsi": "18:45"
  },
  {
    "HicriTarihKisa": "30.6.1447",
    "HicriTarihKisaIso8601": null,
    "HicriTarihUzun": "30 Cemaziyelahir 1447",
    "HicriTarihUzunIso8601": null,
    "AyinSekliURL": "https://namazvakti.diyanet.gov.tr/images/ruyet.gif",
    "MiladiTarihKisa": "20.12.2025",
    "MiladiTarihKisaIso8601": "20.12.2025",
    "MiladiTarihUzun": "20 Aralık 2025 Cumartesi",
    "MiladiTarihUzunIso8601": "2025-12-20T00:00:00.0000000+08:00",
    "GreenwichOrtalamaZamani": 3.0,
    "Aksam": "16:44",
    "Gunes": "09:37",
    "GunesBatis": "16:37",
    "GunesDogus": "09:44",
    "Ikindi": "14:29",
    "Imsak": "07:20",
    "KibleSaati": "19:22",
    "Ogle": "13:16",
    "Yatsi": "18:46"
  }
]