[
  {
    "HicriTarihKisa": "22.4.1447",
    "HicriTarihKisaIso8601": null,
    "HicriTarihUzun": "22 Rebiulahir 1447",
    "HicriTarihUzunIso8601": null,
    "AyinSekliURL": "https://namazvakti.diyanet.gov.tr/images/sd1.gif",
    "MiladiTarihKisa": "14.10.2025",
    "MiladiTarihKisaIso8601": "14.10.2025",
    "MiladiTarihUzun": "14 Ekim 2025 Salı",
    "MiladiTarihUzunIso8601": "2025-10-14T00:00:00.0000000+08:00",
    "GreenwichOrtalamaZamani": 3.0,
    "Aksam": "18:21",
    "Gunes": "05:50",
    "GunesBatis": "18:14",
    "GunesDogus": "05:57",
    "Ikindi": "15:12",
    "Imsak": "04:46",
    "KibleSaati": "14:32",
    "Ogle": "12:10",
    "Yatsi": "19:20"
  },
  {
    "HicriTarihKisa": "23.4.1447",
    "HicriTarihKisaIso8601": null,
    "HicriTarihUzun": "23 Rebiulahir 1447",
    "HicriTarihUzunIso8601": null,
    "AyinSekliURL": "https://namazvakti.diyanet.gov.tr/images/sd2.gif",
    "MiladiTarihKisa": "15.10.2025",
    "MiladiTarihKisaIso8601": "15.10.2025",
    "MiladiTarihUzun": "15 Ekim 2025 Çarşamba",
    "MiladiTarihUzunIso8601": "2025-10-15T00:00:00.0000000+08:00",
    "GreenwichOrtalamaZamani": 3.0,
    "Aksam": "18:21",
    "Gunes": "05:49",
    "GunesBatis": "18:14",
    "GunesDogus": "05:56",
    "Ikindi": "15:11",
    "Imsak": "04:46",
    "KibleSaati": "14:35",
    "Ogle": "12:10",
    "Yatsi": "19:20"
  },
  {
    "HicriTarihKisa": "24.4.1447",
    "HicriTarihKisaIso8601": null,
    "HicriTarihUzun": "24 Rebiulahir 1447",
    "HicriTarihUzunIso8601": null,
    "AyinSekliURL": "https://namazvakti.diyanet.gov.tr/images/sd3.gif",
    "MiladiTarihKisa": "16.10.2025",
    "MiladiTarihKisaIso8601": "16.10.2025",
    "MiladiTarihUzun": "16 Ekim 2025 Perşembe",
    "MiladiTarihUzunIso8601": "2025-10-16T00:00:00.0000000+08:00",
    "GreenwichOrtalamaZamani": 3.0,
    "Aksam": "18:21",
    "Gunes": "05:49",
    "GunesBatis": "18:14",
    "GunesDogus": "05:56",
    "Ikindi": "15:12",
    "Imsak": "04:45",
    "KibleSaati": "14:38",
    "Ogle": "12:10",
    "Yatsi": "19:20"
  },
  {
    "HicriTarihKisa": "25.4.1447",
    "HicriTarihKisaIso8601": null,
    "HicriTarihUzun": "25 Rebiulahir 1447",
    "HicriTarihUzunIso8601": null,
    "AyinSekliURL": "https://namazvakti.diyanet.gov.tr/images/sd4.gif",
    "MiladiTarihKisa": "17.10.2025",
    "MiladiTarihKisaIso8601": "17.10.2025",
    "MiladiTarihUzun": "17 Ekim 2025 Cuma",
    "MiladiTarihUzunIso8601": "2025-10-17T00:00:00.0000000+08:00",
    "GreenwichOrtalamaZamani": 3.0,
    "Aksam": "18:21",
    "Gunes": "05:48",
    "GunesBatis": "18:14",
    "GunesDogus": "05:55",
    "Ikindi": "15:12",
    "Imsak": "04:45",
    "KibleSaati": "14:41",
    "Ogle": "12:10",
    "Yatsi": "19:20"
  },
  {
    "HicriTarihKisa": "26.4.1447",
    "HicriTarihKisaIso8601": null,
    "HicriTarihUzun": "26 Rebiulahir 1447",
    "HicriTarihUzunIso8601": null,
    "AyinSekliURL": "https://namazvakti.diyanet.gov.tr/images/sd5.gif",
    "MiladiTarihKisa": "18.10.2025",
    "MiladiTarihKisaIso8601": "18.10.2025",
    "MiladiTarihUzun": "18 Ekim 2025 Cumartesi",
    "MiladiTarihUzunIso8601": "2025-10-18T00:00:00.0000000+08:00",
    "GreenwichOrtalamaZamani": 3.0,
    "Aksam": "18:21",
    "Gunes": "05:48",
    "GunesBatis": "18:14",
    "GunesDogus": "05:55",
    "Ikindi": "15:13",
    "Imsak": "04:44",
    "KibleSaati": "14:44",
    "Ogle": "12:09",
    "Yatsi": "19:20"
  },
  {
    "HicriTarihKisa": "27.4.1447",
    "HicriTarihKisaIso8601": null,
    "HicriTarihUzun": "27 Rebiulahir 1447",
    "HicriTarihUzunIso8601": null,
    "AyinSekliURL": "https://namazvakti.diyanet.gov.tr/images/sd6.gif",
    "MiladiTarihKisa": "19.10.2025",
    "MiladiTarihKisaIso8601": "19.10.2025",
    "MiladiTarihUzun": "19 Ekim 2025 Pazar",
    "MiladiTarihUzunIso8601": "2025-10-19T00:00:00.0000000+08:00",
    "GreenwichOrtalamaZamani": 3.0,
    "Aksam": "18:21",
    "Gunes": "05:48",
    "GunesBatis": "18:14",
    "GunesDogus": "05:55",
    "Ikindi": "15:13",
    "Imsak": "04:44",
    "KibleSaati": "14:48",
    "Ogle": "12:09",
    "Yatsi": "19:21"
  },
  {
    "HicriTarihKisa": "28.4.1447",
    "HicriTarihKisaIso8601": null,
    "HicriTarihUzun": "28 Rebiulahir 1447",
    "HicriTarihUzunIso8601": null,
    "AyinSekliURL": "https://namazvakti.diyanet.gov.tr/images/sd7.gif",
    "MiladiTarihKisa": "20.10.2025",
    "MiladiTarihKisaIso8601": "20.10.2025",
    "MiladiTarihUzun": "20 Ekim 2025 Pazartesi",
    "MiladiTarihUzunIso8601": "2025-10-20T00:00:00.0000000+08:00",
    "GreenwichOrtalamaZamani": 3.0,
    "Aksam": "18:21",
    "Gunes": "05:47",
    "GunesBatis": "18:14",
    "GunesDogus": "05:54",
    "Ikindi": "15:14",
    "Imsak": "04:43",
    "KibleSaati": "14:51",
    "Ogle": "12:09",
    "Yatsi": "19:21"
  },
  {
    "HicriTarihKisa": "29.4.1447",
    "HicriTarihKisaIso8601": null,
    "HicriTarihUzun": "29 Rebiulahir 1447",
    "HicriTarihUzunIso8601": null,
    "AyinSekliURL": "https://namazvakti.diyanet.gov.tr/images/ictima.gif",
    "MiladiTarihKisa": "21.10.2025",
    "MiladiTarihKisaIso8601": "21.10.2025",
    "MiladiTarihUzun": "21 Ekim 2025 Salı",
    "MiladiTarihUzunIso8601": "2025-10-21T00:00:00.0000000+08:00",
    "GreenwichOrtalamaZamani": 3.0,
    "Aksam": "18:21",
    "Gunes": "05:47",
    "GunesBatis": "18:14",
    "GunesDogus": "05:54",
    "Ikindi": "15:15",
    "Imsak": "04:43",
    "KibleSaati": "14:54",
    "Ogle": "12:09",
    "Yatsi": "19:21"
  },
  {
    "HicriTarihKisa": "30.4.1447",
    "HicriTarihKisaIso8601": null,
    "HicriTarihUzun": "30 Rebiulahir 1447",
    "HicriTarihUzunIso8601": null,
    "AyinSekliURL": "https://namazvakti.diyanet.gov.tr/images/ruyet.gif",
    "MiladiTarihKisa": "22.10.2025",
    "MiladiTarihKisaIso8601": "22.10.2025",
    "MiladiTarihUzun": "22 Ekim 2025 Çarşamba",
    "MiladiTarihUzunIso8601": "2025-10-22T00:00:00.0000000+08:00",
    "GreenwichOrtalamaZamani": 3.0,
    "Aksam": "18:21",
    "Gunes": "05:46",
    "GunesBatis": "18:14",
    "GunesDogus": "05:53",
    "Ikindi": "15:15",
    "Imsak": "04:42",
    "KibleSaati": "14:57",
    "Ogle": "12:09",
    "Yatsi": "19:21"
  },
  {
    "HicriTarihKisa": "1.5.1447",
    "HicriTarihKisaIso8601": null,
    "HicriTarihUzun": "1 Cemaziyelevvel 1447",
    "HicriTarihUzunIso8601": null,
    "AyinSekliURL": "https://namazvakti.diyanet.gov.tr/images/r1.gif",
    "MiladiTarihKisa": "23.10.2025",
    "MiladiTarihKisaIso8601": "23.10.2025",
    "MiladiTarihUzun": "23 Ekim 2025 Perşembe",
    "MiladiTarihUzunIso8601": "2025-10-23T00:00:00.0000000+08:00",
    "GreenwichOrtalamaZamani": 3.0,
    "Aksam": "18:21",
    "Gunes": "05:46",
    "GunesBatis": "18:14",
    "GunesDogus": "05:53",
    "Ikindi": "15:16",
    "Imsak": "04:42",
    "KibleSaati": "15:01",
    "Ogle": "12:09",
    "Yatsi": "19:21"
  },
  {
    "HicriTarihKisa": "2.5.1447",
    "HicriTarihKisaIso8601": null,
    "HicriTarihUzun": "2 Cemaziyelevvel 1447",
    "HicriTarihUzunIso8601": null,
    "AyinSekliURL": "https://namazvakti.diyanet.gov.tr/images/r2.gif",
    "MiladiTarihKisa": "24.10.2025",
    "MiladiTarihKisaIso8601": "24.10.2025",
    "MiladiTarihUzun": "24 Ekim 2025 Cuma",
    "MiladiTarihUzunIso8601": "2025-10-24T00:00:00.0000000+08:00",
    "GreenwichOrtalamaZamani": 3.0,
    "Aksam": "18:21",
    "Gunes": "05:46",
    "GunesBatis": "18:14",
    "GunesDogus": "05:53",
    "Ikindi": "15:16",
    "Imsak": "04:41",
    "KibleSaati": "15:04",
    "Ogle": "12:08",
    "Yatsi": "19:21"
  },
  {
    "HicriTarihKisa": "3.5.1447",
    "HicriTarihKisaIso8601": null,
    "HicriTarihUzun": "3 Cemaziyelevvel 1447",
    "HicriTarihUzunIso8601": null,
    "AyinSekliURL": "https://namazvakti.diyanet.gov.tr/images/r3.gif",
    "MiladiTarihKisa": "25.10.2025",
    "MiladiTarihKisaIso8601": "25.10.2025",
    "MiladiTarihUzun": "25 Ekim 2025 Cumartesi",
    "MiladiTarihUzunIso8601": "2025-10-25T00:00:00.0000000+08:00",
    "GreenwichOrtalamaZamani": 3.0,
    "Aksam": "18:21",
    "Gunes": "05:45",
    "GunesBatis": "18:14",
    "GunesDogus": "05:52",
    "Ikindi": "15:17",
    "Imsak": "04:41",
    "KibleSaati": "15:07",
    "Ogle": "12:08",
    "Yatsi": "19:22"
  },
  {
    "HicriTarihKisa": "4.5.1447",
    "HicriTarihKisaIso8601": null,
    "HicriTarihUzun": "4 Cemaziyelevvel 1447",
    "HicriTarihUzunIso8601": null,
    "AyinSekliURL": "https://namazvakti.diyanet.gov.tr/images/r4.gif",
    "MiladiTarihKisa": "26.10.2025",
    "MiladiTarihKisaIso8601": "26.10.2025",
    "MiladiTarihUzun": "26 Ekim 2025 Pazar",
    "MiladiTarihUzunIso8601": "2025-10-26T00:00:00.0000000+08:00",
    "GreenwichOrtalamaZamani": 3.0,
    "Aksam": "18:21",
    "Gunes": "05:45",
    "GunesBatis": "18:14",
    "GunesDogus": "05:52",
    "Ikindi": "15:17",
    "Imsak": "04:40",
    "KibleSaati": "15:11",
    "Ogle": "12:08",
    "Yatsi": "19:22"
  },
  {
    "HicriTarihKisa": "5.5.1447",
    "HicriTarihKisaIso8601": null,
    "HicriTarihUzun": "5 Cemaziyelevvel 1447",
    "HicriTarihUzunIso8601": null,
    "AyinSekliURL": "https://namazvakti.diyanet.gov.tr/images/r5.gif",
    "MiladiTarihKisa": "27.10.2025",
    "MiladiTarihKisaIso8601": "27.10.2025",
    "MiladiTarihUzun": "27 Ekim 2025 Pazartesi",
    "MiladiTarihUzunIso8601": "2025-10-27T00:00:00.0000000+08:00",
    "GreenwichOrtalamaZamani": 3.0,
    "Aksam": "18:21",
    "Gunes": "05:45",
    "GunesBatis": "18:14",
    "GunesDogus": "05:52",
    "Ikindi": "15:18",
    "Imsak": "04:40",
    "KibleSaati": "15:14",
    "Ogle": "12:08",
    "Yatsi": "19:22"
  },
  {
    "HicriTarihKisa": "6.5.1447",
    "HicriTarihKisaIso8601": null,
    "HicriTarihUzun": "6 Cemaziyelevvel 1447",
    "HicriTarihUzunIso8601": null,
    "AyinSekliURL": "https://namazvakti.diyanet.gov.tr/images/r6.gif",
    "MiladiTarihKisa": "28.10.2025",
    "MiladiTarihKisaIso8601": "28.10.2025",
    "MiladiTarihUzun": "28 Ekim 2025 Salı",
    "MiladiTarihUzunIso8601": "2025-10-28T00:00:00.0000000+08:00",
    "GreenwichOrtalamaZamani": 3.0,
    "Aksam": "18:22",
    "Gunes": "05:44",
    "GunesBatis": "18:15",
    "GunesDogus": "05:51",
    "Ikindi": "15:18",
    "Imsak": "04:39",
    "KibleSaati": "15:17",
    "Ogle": "12:08",
    "Yatsi": "19:22"
  },
  {
    "HicriTarihKisa": "7.5.1447",
    "HicriTarihKisaIso8601": null,
    "HicriTarihUzun": "7 Cemaziyelevvel 1447",
    "HicriTarihUzunIso8601": null,
    "AyinSekliURL": "https://namazvakti.diyanet.gov.tr/images/ilkdordun.gif",
    "MiladiTarihKisa": "29.10.2025",
    "MiladiTarihKisaIso8601": "29.10.2025",
    "MiladiTarihUzun": "29 Ekim 2025 Çarşamba",
    "MiladiTarihUzunIso8601": "2025-10-29T00:00:00.0000000+08:00",
    "GreenwichOrtalamaZamani": 3.0,
    "Aksam": "18:22",
    "Gunes": "05:44",
    "GunesBatis": "18:15",
    "GunesDogus": "05:51",
    "Ikindi": "15:19",
    "Imsak": "04:39",
    "KibleSaati": "15:21",
    "Ogle": "12:08",
    "Yatsi": "19:23"
  },
  {
    "HicriTarihKisa": "8.5.1447",
    "HicriTarihKisaIso8601": null,
    "HicriTarihUzun": "8 Cemaziyelevvel 1447",
    "HicriTarihUzunIso8601": null,
    "AyinSekliURL": "https://namazvakti.diyanet.gov.tr/images/i1.gif",
    "MiladiTarihKisa": "30.10.2025",
    "MiladiTarihKisaIso8601": "30.10.2025",
    "MiladiTarihUzun": "30 Ekim 2025 Perşembe",
    "MiladiTarihUzunIso8601": "2025-10-30T00:00:00.0000000+08:00",
    "GreenwichOrtalamaZamani": 3.0,
    "Aksam": "18:22",
    "Gunes": "05:44",
    "GunesBatis": "18:15",
    "GunesDogus": "05:51",
    "Ikindi": "15:20",
    "Imsak": "04:39",
    "KibleSaati": "15:24",
    "Ogle": "12:08",
    "Yatsi": "19:23"
  },
  {
    "HicriTarihKisa": "9.5.1447",
    "HicriTarihKisaIso8601": null,
    "HicriTarihUzun": "9 Cemaziyelevvel 1447",
    "HicriTarihUzunIso8601": null,
    "AyinSekliURL": "https://namazvakti.diyanet.gov.tr/images/i2.gif",
    "MiladiTarihKisa": "31.10.2025",
    "MiladiTarihKisaIso8601": "31.10.2025",
    "MiladiTarihUzun": "31 Ekim 2025 Cuma",
    "MiladiTarihUzunIso8601": "2025-10-31T00:00:00.0000000+08:00",
    "GreenwichOrtalamaZamani": 3.0,
    "Aksam": "18:22",
    "Gunes": "05:44",
    "GunesBatis": "18:15",
    "GunesDogus": "05:51",
    "Ikindi": "15:20",
    "Imsak": "04:38",
    "KibleSaati": "15:28",
    "Ogle": "12:08",
    "Yatsi": "19:23"
  },
  {
    "HicriTarihKisa": "10.5.1447",
    "HicriTarihKisaIso8601": null,
    "HicriTarihUzun": "10 Cemaziyelevvel 1447",
    "HicriTarihUzunIso8601": null,
    "AyinSekliURL": "https://namazvakti.diyanet.gov.tr/images/i3.gif",
    "MiladiTarihKisa": "01.11.2025",
    "MiladiTarihKisaIso8601": "01.11.2025",
    "MiladiTarihUzun": "01 Kasım 2025 Cumartesi",
    "MiladiTarihUzunIso8601": "2025-11-01T00:00:00.0000000+08:00",
    "GreenwichOrtalamaZamani": 3.0,
    "Aksam": "18:22",
    "Gunes": "05:43",
    "GunesBatis": "18:15",
    "GunesDogus": "05:50",
    "Ikindi": "15:21",
    "Imsak": "04:38",
    "KibleSaati": "15:31",
    "Ogle": "12:08",
    "Yatsi": "19:23"
  },
  {
    "HicriTarihKisa": "11.5.1447",
    "HicriTarihKisaIso8601": null,
    "HicriTarihUzun": "11 Cemaziyelevvel 1447",
    "HicriTarihUzunIso8601": null,
    "AyinSekliURL": "https://namazvakti.diyanet.gov.tr/images/i4.gif",
    "MiladiTarihKisa": "02.11.2025",
    "MiladiTarihKisaIso8601": "02.11.2025",
    "MiladiTarihUzun": "02 Kasım 2025 Pazar",
    "MiladiTarihUzunIso8601": "2025-11-02T00:00:00.0000000+08:00",
    "GreenwichOrtalamaZamani": 3.0,
    "Aksam": "18:22",
    "Gunes": "05:43",
    "GunesBatis": "18:15",
    "GunesDogus": "05:50",
    "Ikindi": "15:21",
    "Imsak": "04:38",
    "KibleSaati": "15:34",
    "Ogle": "12:08",
    "Yatsi": "19:24"
  },
  {
    "HicriTarihKisa": "12.5.1447",
    "HicriTarihKisaIso8601": null,
    "HicriTarihUzun": "12 Cemaziyelevvel 1447",
    "HicriTarihUzunIso8601": null,
    "AyinSekliURL": "https://namazvakti.diyanet.gov.tr/images/i5.gif",
    "MiladiTarihKisa": "03.11.2025",
    "MiladiTarihKisaIso8601": "03.11.2025",
    "MiladiTarihUzun": "03 Kasım 2025 Pazartesi",
    "MiladiTarihUzunIso8601": "2025-11-03T00:00:00.0000000+08:00",
    "GreenwichOrtalamaZamani": 3.0,
    "Aksam": "18:23",
    "Gunes": "05:43",
    "GunesBatis": "18:16",
    "GunesDogus": "05:50",
    "Ikindi": "15:22",
    "Imsak": "04:37",
    "KibleSaati": "15:38",
    "Ogle": "12:08",
    "Yatsi": "19:24"
  },
  {
    "HicriTarihKisa": "13.5.1447",
    "HicriTarihKisaIso8601": null,
    "HicriTarihUzun": "13 Cemaziyelevvel 1447",
    "HicriTarihUzunIso8601": null,
    "AyinSekliURL": "https://namazvakti.diyanet.gov.tr/images/i6.gif",
    "MiladiTarihKisa": "04.11.2025",
    "MiladiTarihKisaIso8601": "04.11.2025",
    "MiladiTarihUzun": "04 Kasım 2025 Salı",
    "MiladiTarihUzunIso8601": "2025-11-04T00:00:00.0000000+08:00",
    "GreenwichOrtalamaZamani": 3.0,
    "Aksam": "18:23",
    "Gunes": "05:43",
    "GunesBatis": "18:16",
    "GunesDogus": "05:50",
    "Ikindi": "15:22",
    "Imsak": "04:37",
    "KibleSaati": "15:41",
    "Ogle": "12:08",
    "Yatsi": "19:24"
  },
  {
    "HicriTarihKisa": "14.5.1447",
    "HicriTarihKisaIso8601": null,
    "HicriTarihUzun": "14 Cemaziyelevvel 1447",
    "HicriTarihUzunIso8601": null,
    "AyinSekliURL": "https://namazvakti.diyanet.gov.tr/images/dolunay.gif",
    "MiladiTarihKisa": "05.11.2025",
    "MiladiTarihKisaIso8601": "05.11.2025",
    "MiladiTarihUzun": "05 Kasım 2025 Çarşamba",
    "MiladiTarihUzunIso8601": "2025-11-05T00:00:00.0000000+08:00",
    "GreenwichOrtalamaZamani": 3.0,
    "Aksam": "18:23",
    "Gunes": "05:42",
    "GunesBatis": "18:16",
    "GunesDogus": "05:49",
    "Ikindi": "15:23",
    "Imsak": "04:37",
    "KibleSaati": "15:45",
    "Ogle": "12:08",
    "Yatsi": "19:25"
  },
  {
    "HicriTarihKisa": "15.5.1447",
    "HicriTarihKisaIso8601": null,
    "HicriTarihUzun": "15 Cemaziyelevvel 1447",
    "HicriTarihUzunIso8601": null,
    "AyinSekliURL": "https://namazvakti.diyanet.gov.tr/images/d1.gif",
    "MiladiTarihKisa": "06.11.2025",
    "MiladiTarihKisaIso8601": "06.11.2025",
    "MiladiTarihUzun": "06 Kasım 2025 Perşembe",
    "MiladiTarihUzunIso8601": "2025-11-06T00:00:00.0000000+08:00",
    "GreenwichOrtalamaZamani": 3.0,
    "Aksam": "18:23",
    "Gunes": "05:42",
    "GunesBatis": "18:16",
    "GunesDogus": "05:49",
    "Ikindi": "15:23",
    "Imsak": "04:36",
    "KibleSaati": "15:48",
    "Ogle": "12:08",
    "Yatsi": "19:25"
  },
  {
    "HicriTarihKisa": "16.5.1447",
    "HicriTarihKisaIso8601": null,
    "HicriTarihUzun": "16 Cemaziyelevvel 1447",
    "HicriTarihUzunIso8601": null,
    "AyinSekliURL": "https://namazvakti.diyanet.gov.tr/images/d2.gif",
    "MiladiTarihKisa": "07.11.2025",
    "MiladiTarihKisaIso8601": "07.11.2025",
    "MiladiTarihUzun": "07 Kasım 2025 Cuma",
    "MiladiTarihUzunIso8601": "2025-11-07T00:00:00.0000000+08:00",
    "GreenwichOrtalamaZamani": 3.0,
    "Aksam": "18:24",
    "Gunes": "05:42",
    "GunesBatis": "18:17",
    "GunesDogus": "05:49",
    "Ikindi": "15:24",
    "Imsak": "04:36",
    "KibleSaati": "15:52",
    "Ogle": "12:08",
    "Yatsi": "19:25"
  },
  {
    "HicriTarihKisa": "17.5.1447",
    "HicriTarihKisaIso8601": null,
    "HicriTarihUzun": "17 Cemaziyelevvel 1447",
    "HicriTarihUzunIso8601": null,
    "AyinSekliURL": "https://namazvakti.diyanet.gov.tr/images/d3.gif",
    "MiladiTarihKisa": "08.11.2025",
    "MiladiTarihKisaIso8601": "08.11.2025",
    "MiladiTarihUzun": "08 Kasım 2025 Cumartesi",
    "MiladiTarihUzunIso8601": "2025-11-08T00:00:00.0000000+08:00",
    "GreenwichOrtalamaZamani": 3.0,
    "Aksam": "18:24",
    "Gunes": "05:42",
    "GunesBatis": "18:17",
    "GunesDogus": "05:49",
    "Ikindi": "15:24",
    "Imsak": "04:36",
    "KibleSaati": "15:55",
    "Ogle": "12:08",
    "Yatsi": "19:26"
  },
  {
    "HicriTarihKisa": "18.5.1447",
    "HicriTarihKisaIso8601": null,
    "HicriTarihUzun": "18 Cemaziyelevvel 1447",
    "HicriTarihUzunIso8601": null,
    "AyinSekliURL": "https://namazvakti.diyanet.gov.tr/images/d4.gif",
    "MiladiTarihKisa": "09.11.2025",
    "MiladiTarihKisaIso8601": "09.11.2025",
    "MiladiTarihUzun": "09 Kasım 2025 Pazar",
    "MiladiTarihUzunIso8601": "2025-11-09T00:00:00.0000000+08:00",
    "GreenwichOrtalamaZamani": 3.0,
    "Aksam": "18:24",
    "Gunes": "05:42",
    "GunesBatis": "18:17",
    "GunesDogus": "05:49",
    "Ikindi": "15:25",
    "Imsak": "04:35",
    "KibleSaati": "15:59",
    "Ogle": "12:08",
    "Yatsi": "19:26"
  },
  {
    "HicriTarihKisa": "19.5.1447",
    "HicriTarihKisaIso8601": null,
    "HicriTarihUzun": "19 Cemaziyelevvel 1447",
    "HicriTarihUzunIso8601": null,
    "AyinSekliURL": "https://namazvakti.diyanet.gov.tr/images/d5.gif",
    "MiladiTarihKisa": "10.11.2025",
    "MiladiTarihKisaIso8601": "10.11.2025",
    "MiladiTarihUzun": "10 Kasım 2025 Pazartesi",
    "MiladiTarihUzunIso8601": "2025-11-10T00:00:00.0000000+08:00",
    "GreenwichOrtalamaZamani": 3.0,
    "Aksam": "18:24",
    "Gunes": "05:42",
    "GunesBatis": "18:17",
    "GunesDogus": "05:49",
    "Ikindi": "15:26",
    "Imsak": "04:35",
    "KibleSaati": "16:03",
    "Ogle": "12:08",
    "Yatsi": "19:27"
  },
  {
    "HicriTarihKisa": "20.5.1447",
    "HicriTarihKisaIso8601": null,
    "HicriTarihUzun": "20 Cemaziyelevvel 1447",
    "HicriTarihUzunIso8601": null,
    "AyinSekliURL": "https://namazvakti.diyanet.gov.tr/images/d6.gif",
    "MiladiTarihKisa": "11.11.2025",
    "MiladiTarihKisaIso8601": "11.11.2025",
    "MiladiTarihUzun": "11 Kasım 2025 Salı",
    "MiladiTarihUzunIso8601": "2025-11-11T00:00:00.0000000+08:00",
    "GreenwichOrtalamaZamani": 3.0,
    "Aksam": "18:25",
    "Gunes": "05:42",
    "GunesBatis": "18:18",
    "GunesDogus": "05:49",
    "Ikindi": "15:26",
    "Imsak": "04:35",
    "KibleSaati": "16:06",
    "Ogle": "12:08",
    "Yatsi": "19:27"
  },
  {
    "HicriTarihKisa": "21.5.1447",
    "HicriTarihKisaIso8601": null,
    "HicriTarihUzun": "21 Cemaziyelevvel 1447",
    "HicriTarihUzunIso8601": null,
    "AyinSekliURL": "https://namazvakti.diyanet.gov.tr/images/sondordun.gif",
    "MiladiTarihKisa": "12.11.2025",
    "MiladiTarihKisaIso8601": "12.11.2025",
    "MiladiTarihUzun": "12 Kasım 2025 Çarşamba",
    "MiladiTarihUzunIso8601": "2025-11-12T00:00:00.0000000+08:00",
    "GreenwichOrtalamaZamani": 3.0,
    "Aksam": "18:25",
    "Gunes": "05:42",
    "GunesBatis": "18:18",
    "GunesDogus": "05:49",
    "Ikindi": "15:27",
    "Imsak": "04:35",
    "KibleSaati": "16:10",
    "Ogle": "12:08",
    "Yatsi": "19:27"
  },
  {
    "HicriTarihKisa": "22.5.1447",
    "HicriTarihKisaIso8601": null,
    "HicriTarihUzun": "22 Cemaziyelevvel 1447",
    "HicriTarihUzunIso8601": null,
    "AyinSekliURL": "https://namazvakti.diyanet.gov.tr/images/sd1.gif",
    "MiladiTarihKisa": "13.11.2025",
    "MiladiTarihKisaIso8601": "13.11.2025",
    "MiladiTarihUzun": "13 Kasım 2025 Perşembe",
    "MiladiTarihUzunIso8601": "2025-11-13T00:00:00.0000000+08:00",
    "GreenwichOrtalamaZamani": 3.0,
    "Aksam": "18:25",
    "Gunes": "05:42",
    "GunesBatis": "18:18",
    "GunesDogus": "05:49",
    "Ikindi": "15:27",
    "Imsak": "04:35",
    "KibleSaati": "16:13",
    "Ogle": "12:08",
    "Yatsi": "19:28"
  },
  {
    "HicriTarihKisa": "23.5.1447",
    "HicriTarihKisaIso8601": null,
    "HicriTarihUzun": "23 Cemaziyelevvel 1447",
    "HicriTarihUzunIso8601": null,
    "AyinSekliURL": "https://namazvakti.diyanet.gov.tr/images/sd2.gif",
    "MiladiTarihKisa": "14.11.2025",
    "MiladiTarihKisaIso8601": "14.11.2025",
    "MiladiTarihUzun": "14 Kasım 2025 Cuma",
    "MiladiTarihUzunIso8601": "2025-11-14T00:00:00.0000000+08:00",
    "GreenwichOrtalamaZamani": 3.0,
    "Aksam": "18:26",
    "Gunes": "05:42",
    "GunesBatis": "18:19",
    "GunesDogus": "05:49",
    "Ikindi": "15:28",
    "Imsak": "04:34",
    "KibleSaati": "16:17",
    "Ogle": "12:09",
    "Yatsi": "19:28"
  }
]