[
  {
    "HicriTarihKisa": "26.4.1447",
    "HicriTarihKisaIso8601": null,
    "HicriTarihUzun": "26 Rebiulahir 1447",
    "HicriTarihUzunIso8601": null,
    "AyinSekliURL": "https://namazvakti.diyanet.gov.tr/images/sd5.gif",
    "MiladiTarihKisa": "18.10.2025",
    "MiladiTarihKisaIso8601": "18.10.2025",
    "MiladiTarihUzun": "18 Ekim 2025 Cumartesi",
    "MiladiTarihUzunIso8601": "2025-10-18T00:00:00.0000000-04:00",
    "GreenwichOrtalamaZamani": 3.0,
    "Aksam": "18:03",
    "Gunes": "06:13",
    "GunesBatis": "17:56",
    "GunesDogus": "06:20",
    "Ikindi": "15:32",
    "Imsak": "05:05",
    "KibleSaati": "15:38",
    "Ogle": "12:13",
    "Yatsi": "19:06"
  },
  {
    "HicriTarihKisa": "27.4.1447",
    "HicriTarihKisaIso8601": null,
    "HicriTarihUzun": "27 Rebiulahir 1447",
    "HicriTarihUzunIso8601": null,
    "AyinSekliURL": "https://namazvakti.diyanet.gov.tr/images/sd6.gif",
    "MiladiTarihKisa": "19.10.2025",
    "MiladiTarihKisaIso8601": "19.10.2025",
    "MiladiTarihUzun": "19 Ekim 2025 Pazar",
    "MiladiTarihUzunIso8601": "2025-10-19T00:00:00.0000000-04:00",
    "GreenwichOrtalamaZamani": 3.0,
    "Aksam": "18:03",
    "Gunes": "06:13",
    "GunesBatis": "17:56",
    "GunesDogus": "06:20",
    "Ikindi": "15:31",
    "Imsak": "05:06",
    "KibleSaati": "15:40",
    "Ogle": "12:13",
    "Yatsi": "19:06"
  },
  {
    "HicriTarihKisa": "28.4.1447",
    "HicriTarihKisaIso8601": null,
    "HicriTarihUzun": "28 Rebiulahir 1447",
    "HicriTarihUzunIso8601": null,
    "AyinSekliURL": "https://namazvakti.diyanet.gov.tr/images/sd7.gif",
    "MiladiTarihKisa": "20.10.2025",
    "MiladiTarihKisaIso8601": "20.10.2025",
    "MiladiTarihUzun": "20 Ekim 2025 Pazartesi",
    "MiladiTarihUzunIso8601": "2025-10-20T00:00:00.0000000-04:00",
    "GreenwichOrtalamaZamani": 3.0,
    "Aksam": "18:02",
    "Gunes": "06:14",
    "GunesBatis": "17:55",
    "GunesDogus": "06:21",
    "Ikindi": "15:31",
    "Imsak": "05:06",
    "KibleSaati": "15:42",
    "Ogle": "12:13",
    "Yatsi": "19:05"
  },
  {
    "HicriTarihKisa": "29.4.1447",
    "HicriTarihKisaIso8601": null,
    "HicriTarihUzun": "29 Rebiulahir 1447",
    "HicriTarihUzunIso8601": null,
    "AyinSekliURL": "https://namazvakti.diyanet.gov.tr/images/ictima.gif",
    "MiladiTarihKisa": "21.10.2025",
    "MiladiTarihKisaIso8601": "21.10.2025",
    "MiladiTarihUzun": "21 Ekim 2025 Salı",
    "MiladiTarihUzunIso8601": "2025-10-21T00:00:00.0000000-04:00",
    "GreenwichOrtalamaZamani": 3.0,
    "Aksam": "18:01",
    "Gunes": "06:14",
    "GunesBatis": "17:54",
    "GunesDogus": "06:21",
    "Ikindi": "15:30",
    "Imsak": "05:06",
    "KibleSaati": "15:44",
    "Ogle": "12:13",
    "Yatsi": "19:04"
  },
  {
    "HicriTarihKisa": "30.4.1447",
    "HicriTarihKisaIso8601": null,
    "HicriTarihUzun": "30 Rebiulahir 1447",
    "HicriTarihUzunIso8601": null,
    "AyinSekliURL": "https://namazvakti.diyanet.gov.tr/images/ruyet.gif",
    "MiladiTarihKisa": "22.10.2025",
    "MiladiTarihKisaIso8601": "22.10.2025",
    "MiladiTarihUzun": "22 Ekim 2025 Çarşamba",
    "MiladiTarihUzunIso8601": "2025-10-22T00:00:00.0000000-04:00",
    "GreenwichOrtalamaZamani": 3.0,
    "Aksam": "18:00",
    "Gunes": "06:14",
    "GunesBatis": "17:53",
    "GunesDogus": "06:21",
    "Ikindi": "15:30",
    "Imsak": "05:07",
    "KibleSaati": "15:47",
    "Ogle": "12:12",
    "Yatsi": "19:04"
  },
  {
    "HicriTarihKisa": "1.5.1447",
    "HicriTarihKisaIso8601": null,
    "HicriTarihUzun": "1 Cemaziyelevvel 1447",
    "HicriTarihUzunIso8601": null,
    "AyinSekliURL": "https://namazvakti.diyanet.gov.tr/images/r1.gif",
    "MiladiTarihKisa": "23.10.2025",
    "MiladiTarihKisaIso8601": "23.10.2025",
    "MiladiTarihUzun": "23 Ekim 2025 Perşembe",
    "MiladiTarihUzunIso8601": "2025-10-23T00:00:00.0000000-04:00",
    "GreenwichOrtalamaZamani": 3.0,
    "Aksam": "18:00",
    "Gunes": "06:15",
    "GunesBatis": "17:53",
    "GunesDogus": "06:22",
    "Ikindi": "15:30",
    "Imsak": "05:07",
    "KibleSaati": "15:49",
    "Ogle": "12:12",
    "Yatsi": "19:03"
  },
  {
    "HicriTarihKisa": "2.5.1447",
    "HicriTarihKisaIso8601": null,
    "HicriTarihUzun": "2 Cemaziyelevvel 1447",
    "HicriTarihUzunIso8601": null,
    "AyinSekliURL": "https://namazvakti.diyanet.gov.tr/images/r2.gif",
    "MiladiTarihKisa": "24.10.2025",
    "MiladiTarihKisaIso8601": "24.10.2025",
    "MiladiTarihUzun": "24 Ekim 2025 Cuma",
    "MiladiTarihUzunIso8601": "2025-10-24T00:00:00.0000000-04:00",
    "GreenwichOrtalamaZamani": 3.0,
    "Aksam": "17:59",
    "Gunes": "06:15",
    "GunesBatis": "17:52",
    "GunesDogus": "06:22",
    "Ikindi": "15:29",
    "Imsak": "05:07",
    "KibleSaati": "15:51",
    "Ogle": "12:12",
    "Yatsi": "19:02"
  },
  {
    "HicriTarihKisa": "3.5.1447",
    "HicriTarihKisaIso8601": null,
    "HicriTarihUzun": "3 Cemaziyelevvel 1447",
    "HicriTarihUzunIso8601": null,
    "AyinSekliURL": "https://namazvakti.diyanet.gov.tr/images/r3.gif",
    "MiladiTarihKisa": "25.10.2025",
    "MiladiTarihKisaIso8601": "25.10.2025",
    "MiladiTarihUzun": "25 Ekim 2025 Cumartesi",
    "MiladiTarihUzunIso8601": "2025-10-25T00:00:00.0000000-04:00",
    "GreenwichOrtalamaZamani": 3.0,
    "Aksam": "17:58",
    "Gunes": "06:16",
    "GunesBatis": "17:51",
    "GunesDogus": "06:23",
    "Ikindi": "15:29",
    "Imsak": "05:08",
    "KibleSaati": "15:53",
    "Ogle": "12:12",
    "Yatsi": "19:02"
  },
  {
    "HicriTarihKisa": "4.5.1447",
    "HicriTarihKisaIso8601": null,
    "HicriTarihUzun": "4 Cemaziyelevvel 1447",
    "HicriTarihUzunIso8601": null,
    "AyinSekliURL": "https://namazvakti.diyanet.gov.tr/images/r4.gif",
    "MiladiTarihKisa": "26.10.2025",
    "MiladiTarihKisaIso8601": "26.10.2025",
    "MiladiTarihUzun": "26 Ekim 2025 Pazar",
    "MiladiTarihUzunIso8601": "2025-10-26T00:00:00.0000000-04:00",
    "GreenwichOrtalamaZamani": 3.0,
    "Aksam": "17:58",
    "Gunes": "06:16",
    "GunesBatis": "17:51",
    "GunesDogus": "06:23",
    "Ikindi": "15:28",
    "Imsak": "05:08",
    "KibleSaati": "15:55",
    "Ogle": "12:12",
    "Yatsi": "19:01"
  },
  {
    "HicriTarihKisa": "5.5.1447",
    "HicriTarihKisaIso8601": null,
    "HicriTarihUzun": "5 Cemaziyelevvel 1447",
    "HicriTarihUzunIso8601": null,
    "AyinSekliURL": "https://namazvakti.diyanet.gov.tr/images/r5.gif",
    "MiladiTarihKisa": "27.10.2025",
    "MiladiTarihKisaIso8601": "27.10.2025",
    "MiladiTarihUzun": "27 Ekim 2025 Pazartesi",
    "MiladiTarihUzunIso8601": "2025-10-27T00:00:00.0000000-04:00",
    "GreenwichOrtalamaZamani": 3.0,
    "Aksam": "17:57",
    "Gunes": "06:17",
    "GunesBatis": "17:50",
    "GunesDogus": "06:24",
    "Ikindi": "15:28",
    "Imsak": "05:09",
    "KibleSaati": "15:58",
    "Ogle": "12:12",
    "Yatsi": "19:01"
  },
  {
    "HicriTarihKisa": "6.5.1447",
    "HicriTarihKisaIso8601": null,
    "HicriTarihUzun": "6 Cemaziyelevvel 1447",
    "HicriTarihUzunIso8601": null,
    "AyinSekliURL": "https://namazvakti.diyanet.gov.tr/images/r6.gif",
    "MiladiTarihKisa": "28.10.2025",
    "MiladiTarihKisaIso8601": "28.10.2025",
    "MiladiTarihUzun": "28 Ekim 2025 Salı",
    "MiladiTarihUzunIso8601": "2025-10-28T00:00:00.0000000-04:00",
    "GreenwichOrtalamaZamani": 3.0,
    "Aksam": "17:56",
    "Gunes": "06:17",
    "GunesBatis": "17:49",
    "GunesDogus": "06:24",
    "Ikindi": "15:27",
    "Imsak": "05:09",
    "KibleSaati": "16:00",
    "Ogle": "12:12",
    "Yatsi": "19:00"
  },
  {
    "HicriTarihKisa": "7.5.1447",
    "HicriTarihKisaIso8601": null,
    "HicriTarihUzun": "7 Cemaziyelevvel 1447",
    "HicriTarihUzunIso8601": null,
    "AyinSekliURL": "https://namazvakti.diyanet.gov.tr/images/ilkdordun.gif",
    "MiladiTarihKisa": "29.10.2025",
    "MiladiTarihKisaIso8601": "29.10.2025",
    "MiladiTarihUzun": "29 Ekim 2025 Çarşamba",
    "MiladiTarihUzunIso8601": "2025-10-29T00:00:00.0000000-04:00",
    "GreenwichOrtalamaZamani": 3.0,
    "Aksam": "17:56",
    "Gunes": "06:17",
    "GunesBatis": "17:49",
    "GunesDogus": "06:24",
    "Ikindi": "15:27",
    "Imsak": "05:09",
    "KibleSaati": "16:02",
    "Ogle": "12:12",
    "Yatsi": "19:00"
  },
  {
    "HicriTarihKisa": "8.5.1447",
    "HicriTarihKisaIso8601": null,
    "HicriTarihUzun": "8 Cemaziyelevvel 1447",
    "HicriTarihUzunIso8601": null,
    "AyinSekliURL": "https://namazvakti.diyanet.gov.tr/images/i1.gif",
    "MiladiTarihKisa": "30.10.2025",
    "MiladiTarihKisaIso8601": "30.10.2025",
    "MiladiTarihUzun": "30 Ekim 2025 Perşembe",
    "MiladiTarihUzunIso8601": "2025-10-30T00:00:00.0000000-04:00",
    "GreenwichOrtalamaZamani": 3.0,
    "Aksam": "17:55",
    "Gunes": "06:18",
    "GunesBatis": "17:48",
    "GunesDogus": "06:25",
    "Ikindi": "15:27",
    "Imsak": "05:10",
    "KibleSaati": "16:04",
    "Ogle": "12:12",
    "Yatsi": "18:59"
  },
  {
    "HicriTarihKisa": "9.5.1447",
    "HicriTarihKisaIso8601": null,
    "HicriTarihUzun": "9 Cemaziyelevvel 1447",
    "HicriTarihUzunIso8601": null,
    "AyinSekliURL": "https://namazvakti.diyanet.gov.tr/images/i2.gif",
    "MiladiTarihKisa": "31.10.2025",
    "MiladiTarihKisaIso8601": "31.10.2025",
    "MiladiTarihUzun": "31 Ekim 2025 Cuma",
    "MiladiTarihUzunIso8601": "2025-10-31T00:00:00.0000000-04:00",
    "GreenwichOrtalamaZamani": 3.0,
    "Aksam": "17:55",
    "Gunes": "06:18",
    "GunesBatis": "17:48",
    "GunesDogus": "06:25",
    "Ikindi": "15:26",
    "Imsak": "05:10",
    "KibleSaati": "16:07",
    "Ogle": "12:12",
    "Yatsi": "18:59"
  },
  {
    "HicriTarihKisa": "10.5.1447",
    "HicriTarihKisaIso8601": null,
    "HicriTarihUzun": "10 Cemaziyelevvel 1447",
    "HicriTarihUzunIso8601": null,
    "AyinSekliURL": "https://namazvakti.diyanet.gov.tr/images/i3.gif",
    "MiladiTarihKisa": "01.11.2025",
    "MiladiTarihKisaIso8601": "01.11.2025",
    "MiladiTarihUzun": "01 Kasım 2025 Cumartesi",
    "MiladiTarihUzunIso8601": "2025-11-01T00:00:00.0000000-04:00",
    "GreenwichOrtalamaZamani": 3.0,
    "Aksam": "17:54",
    "Gunes": "06:19",
    "GunesBatis": "17:47",
    "GunesDogus": "06:26",
    "Ikindi": "15:26",
    "Imsak": "05:11",
    "KibleSaati": "16:09",
    "Ogle": "12:11",
    "Yatsi": "18:58"
  },
  {
    "HicriTarihKisa": "11.5.1447",
    "HicriTarihKisaIso8601": null,
    "HicriTarihUzun": "11 Cemaziyelevvel 1447",
    "HicriTarihUzunIso8601": null,
    "AyinSekliURL": "https://namazvakti.diyanet.gov.tr/images/i4.gif",
    "MiladiTarihKisa": "02.11.2025",
    "MiladiTarihKisaIso8601": "02.11.2025",
    "MiladiTarihUzun": "02 Kasım 2025 Pazar",
    "MiladiTarihUzunIso8601": "2025-11-02T00:00:00.0000000-04:00",
    "GreenwichOrtalamaZamani": 3.0,
    "Aksam": "17:53",
    "Gunes": "06:19",
    "GunesBatis": "17:46",
    "GunesDogus": "06:26",
    "Ikindi": "15:26",
    "Imsak": "05:11",
    "KibleSaati": "16:11",
    "Ogle": "12:11",
    "Yatsi": "18:58"
  },
  {
    "HicriTarihKisa": "12.5.1447",
    "HicriTarihKisaIso8601": null,
    "HicriTarihUzun": "12 Cemaziyelevvel 1447",
    "HicriTarihUzunIso8601": null,
    "AyinSekliURL": "https://namazvakti.diyanet.gov.tr/images/i5.gif",
    "MiladiTarihKisa": "03.11.2025",
    "MiladiTarihKisaIso8601": "03.11.2025",
    "MiladiTarihUzun": "03 Kasım 2025 Pazartesi",
    "MiladiTarihUzunIso8601": "2025-11-03T00:00:00.0000000-04:00",
    "GreenwichOrtalamaZamani": 3.0,
    "Aksam": "17:53",
    "Gunes": "06:20",
    "GunesBatis": "17:46",
    "GunesDogus": "06:27",
    "Ikindi": "15:25",
    "Imsak": "05:11",
    "KibleSaati": "16:14",
    "Ogle": "12:11",
    "Yatsi": "18:57"
  },
  {
    "HicriTarihKisa": "13.5.1447",
    "HicriTarihKisaIso8601": null,
    "HicriTarihUzun": "13 Cemaziyelevvel 1447",
    "HicriTarihUzunIso8601": null,
    "AyinSekliURL": "https://namazvakti.diyanet.gov.tr/images/i6.gif",
    "MiladiTarihKisa": "04.11.2025",
    "MiladiTarihKisaIso8601": "04.11.2025",
    "MiladiTarihUzun": "04 Kasım 2025 Salı",
    "MiladiTarihUzunIso8601": "2025-11-04T00:00:00.0000000-04:00",
    "GreenwichOrtalamaZamani": 3.0,
    "Aksam": "17:52",
    "Gunes": "06:21",
    "GunesBatis": "17:45",
    "GunesDogus": "06:28",
    "Ikindi": "15:25",
    "Imsak": "05:12",
    "KibleSaati": "16:16",
    "Ogle": "12:11",
    "Yatsi": "18:57"
  },
  {
    "HicriTarihKisa": "14.5.1447",
    "HicriTarihKisaIso8601": null,
    "HicriTarihUzun": "14 Cemaziyelevvel 1447",
    "HicriTarihUzunIso8601": null,
    "AyinSekliURL": "https://namazvakti.diyanet.gov.tr/images/dolunay.gif",
    "MiladiTarihKisa": "05.11.2025",
    "MiladiTarihKisaIso8601": "05.11.2025",
    "MiladiTarihUzun": "05 Kasım 2025 Çarşamba",
    "MiladiTarihUzunIso8601": "2025-11-05T00:00:00.0000000-04:00",
    "GreenwichOrtalamaZamani": 3.0,
    "Aksam": "17:52",
    "Gunes": "06:21",
    "GunesBatis": "17:45",
    "GunesDogus": "06:28",
    "Ikindi": "15:25",
    "Imsak": "05:12",
    "KibleSaati": "16:18",
    "Ogle": "12:11",
    "Yatsi": "18:56"
  },
  {
    "HicriTarihKisa": "15.5.1447",
    "HicriTarihKisaIso8601": null,
    "HicriTarihUzun": "15 Cemaziyelevvel 1447",
    "HicriTarihUzunIso8601": null,
    "AyinSekliURL": "https://namazvakti.diyanet.gov.tr/images/d1.gif",
    "MiladiTarihKisa": "06.11.2025",
    "MiladiTarihKisaIso8601": "06.11.2025",
    "MiladiTarihUzun": "06 Kasım 2025 Perşembe",
    "MiladiTarihUzunIso8601": "2025-11-06T00:00:00.0000000-04:00",
    "GreenwichOrtalamaZamani": 3.0,
    "Aksam": "17:51",
    "Gunes": "06:22",
    "GunesBatis": "17:44",
    "GunesDogus": "06:29",
    "Ikindi": "15:24",
    "Imsak": "05:13",
    "KibleSaati": "16:20",
    "Ogle": "12:12",
    "Yatsi": "18:56"
  },
  {
    "HicriTarihKisa": "16.5.1447",
    "HicriTarihKisaIso8601": null,
    "HicriTarihUzun": "16 Cemaziyelevvel 1447",
    "HicriTarihUzunIso8601": null,
    "AyinSekliURL": "https://namazvakti.diyanet.gov.tr/images/d2.gif",
    "MiladiTarihKisa": "07.11.2025",
    "MiladiTarihKisaIso8601": "07.11.2025",
    "MiladiTarihUzun": "07 Kasım 2025 Cuma",
    "MiladiTarihUzunIso8601": "2025-11-07T00:00:00.0000000-04:00",
    "GreenwichOrtalamaZamani": 3.0,
    "Aksam": "17:51",
    "Gunes": "06:22",
    "GunesBatis": "17:44",
    "GunesDogus": "06:29",
    "Ikindi": "15:24",
    "Imsak": "05:13",
    "KibleSaati": "16:23",
    "Ogle": "12:12",
    "Yatsi": "18:56"
  },
  {
    "HicriTarihKisa": "17.5.1447",
    "HicriTarihKisaIso8601": null,
    "HicriTarihUzun": "17 Cemaziyelevvel 1447",
    "HicriTarihUzunIso8601": null,
    "AyinSekliURL": "https://namazvakti.diyanet.gov.tr/images/d3.gif",
    "MiladiTarihKisa": "08.11.2025",
    "MiladiTarihKisaIso8601": "08.11.2025",
    "MiladiTarihUzun": "08 Kasım 2025 Cumartesi",
    "MiladiTarihUzunIso8601": "2025-11-08T00:00:00.0000000-04:00",
    "GreenwichOrtalamaZamani": 3.0,
    "Aksam": "17:51",
    "Gunes": "06:23",
    "GunesBatis": "17:44",
    "GunesDogus": "06:30",
    "Ikindi": "15:24",
    "Imsak": "05:14",
    "KibleSaati": "16:25",
    "Ogle": "12:12",
    "Yatsi": "18:55"
  },
  {
    "HicriTarihKisa": "18.5.1447",
    "HicriTarihKisaIso8601": null,
    "HicriTarihUzun": "18 Cemaziyelevvel 1447",
    "HicriTarihUzunIso8601": null,
    "AyinSekliURL": "https://namazvakti.diyanet.gov.tr/images/d4.gif",
    "MiladiTarihKisa": "09.11.2025",
    "MiladiTarihKisaIso8601": "09.11.2025",
    "MiladiTarihUzun": "09 Kasım 2025 Pazar",
    "MiladiTarihUzunIso8601": "2025-11-09T00:00:00.0000000-04:00",
    "GreenwichOrtalamaZamani": 3.0,
    "Aksam": "17:50",
    "Gunes": "06:23",
    "GunesBatis": "17:43",
    "GunesDogus": "06:30",
    "Ikindi": "15:23",
    "Imsak": "05:14",
    "KibleSaati": "16:27",
    "Ogle": "12:12",
    "Yatsi": "18:55"
  },
  {
    "HicriTarihKisa": "19.5.1447",
    "HicriTarihKisaIso8601": null,
    "HicriTarihUzun": "19 Cemaziyelevvel 1447",
    "HicriTarihUzunIso8601": null,
    "AyinSekliURL": "https://namazvakti.diyanet.gov.tr/images/d5.gif",
    "MiladiTarihKisa": "10.11.2025",
    "MiladiTarihKisaIso8601": "10.11.2025",
    "MiladiTarihUzun": "10 Kasım 2025 Pazartesi",
    "MiladiTarihUzunIso8601": "2025-11-10T00:00:00.0000000-04:00",
    "GreenwichOrtalamaZamani": 3.0,
    "Aksam": "17:50",
    "Gunes": "06:24",
    "GunesBatis": "17:43",
    "GunesDogus": "06:31",
    "Ikindi": "15:23",
    "Imsak": "05:14",
    "KibleSaati": "16:29",
    "Ogle": "12:12",
    "Yatsi": "18:55"
  },
  {
    "HicriTarihKisa": "20.5.1447",
    "HicriTarihKisaIso8601": null,
    "HicriTarihUzun": "20 Cemaziyelevvel 1447",
    "HicriTarihUzunIso8601": null,
    "AyinSekliURL": "https://namazvakti.diyanet.gov.tr/images/d6.gif",
    "MiladiTarihKisa": "11.11.2025",
    "MiladiTarihKisaIso8601": "11.11.2025",
    "MiladiTarihUzun": "11 Kasım 2025 Salı",
    "MiladiTarihUzunIso8601": "2025-11-11T00:00:00.0000000-04:00",
    "GreenwichOrtalamaZamani": 3.0,
    "Aksam": "17:49",
    "Gunes": "06:24",
    "GunesBatis": "17:42",
    "GunesDogus": "06:31",
    "Ikindi": "15:23",
    "Imsak": "05:15",
    "KibleSaati": "16:32",
    "Ogle": "12:12",
    "Yatsi": "18:54"
  },
  {
    "HicriTarihKisa": "21.5.1447",
    "HicriTarihKisaIso8601": null,
    "HicriTarihUzun": "21 Cemaziyelevvel 1447",
    "HicriTarihUzunIso8601": null,
    "AyinSekliURL": "https://namazvakti.diyanet.gov.tr/images/sondordun.gif",
    "MiladiTarihKisa": "12.11.2025",
    "MiladiTarihKisaIso8601": "12.11.2025",
    "MiladiTarihUzun": "12 Kasım 2025 Çarşamba",
    "MiladiTarihUzunIso8601": "2025-11-12T00:00:00.0000000-04:00",
    "GreenwichOrtalamaZamani": 3.0,
    "Aksam": "17:49",
    "Gunes": "06:25",
    "GunesBatis": "17:42",
    "GunesDogus": "06:32",
    "Ikindi": "15:23",
    "Imsak": "05:15",
    "KibleSaati": "16:34",
    "Ogle": "12:12",
    "Yatsi": "18:54"
  },
  {
    "HicriTarihKisa": "22.5.1447",
    "HicriTarihKisaIso8601": null,
    "HicriTarihUzun": "22 Cemaziyelevvel 1447",
    "HicriTarihUzunIso8601": null,
    "AyinSekliURL": "https://namazvakti.diyanet.gov.tr/images/sd1.gif",
    "MiladiTarihKisa": "13.11.2025",
    "MiladiTarihKisaIso8601": "13.11.2025",
    "MiladiTarihUzun": "13 Kasım 2025 Perşembe",
    "MiladiTarihUzunIso8601": "2025-11-13T00:00:00.0000000-04:00",
    "GreenwichOrtalamaZamani": 3.0,
    "Aksam": "17:49",
    "Gunes": "06:26",
    "GunesBatis": "17:42",
    "GunesDogus": "06:33",
    "Ikindi": "15:23",
    "Imsak": "05:16",
    "KibleSaati": "16:36",
    "Ogle": "12:12",
    "Yatsi": "18:54"
  },
  {
    "HicriTarihKisa": "23.5.1447",
    "HicriTarihKisaIso8601": null,
    "HicriTarihUzun": "23 Cemaziyelevvel 1447",
    "HicriTarihUzunIso8601": null,
    "AyinSekliURL": "https://namazvakti.diyanet.gov.tr/images/sd2.gif",
    "MiladiTarihKisa": "14.11.2025",
    "MiladiTarihKisaIso8601": "14.11.2025",
    "MiladiTarihUzun": "14 Kasım 2025 Cuma",
    "MiladiTarihUzunIso8601": "2025-11-14T00:00:00.0000000-04:00",
    "GreenwichOrtalamaZamani": 3.0,
    "Aksam": "17:48",
    "Gunes": "06:26",
    "GunesBatis": "17:41",
    "GunesDogus": "06:33",
    "Ikindi": "15:22",
    "Imsak": "05:16",
    "KibleSaati": "16:38",
    "Ogle": "12:12",
    "Yatsi": "18:54"
  },
  {
    "HicriTarihKisa": "24.5.1447",
    "HicriTarihKisaIso8601": null,
    "HicriTarihUzun": "24 Cemaziyelevvel 1447",
    "HicriTarihUzunIso8601": null,
    "AyinSekliURL": "https://namazvakti.diyanet.gov.tr/images/sd3.gif",
    "MiladiTarihKisa": "15.11.2025",
    "MiladiTarihKisaIso8601": "15.11.2025",
    "MiladiTarihUzun": "15 Kasım 2025 Cumartesi",
    "MiladiTarihUzunIso8601": "2025-11-15T00:00:00.0000000-04:00",
    "GreenwichOrtalamaZamani": 3.0,
    "Aksam": "17:48",
    "Gunes": "06:27",
    "GunesBatis": "17:41",
    "GunesDogus": "06:34",
    "Ikindi": "15:22",
    "Imsak": "05:17",
    "KibleSaati": "16:41",
    "Ogle": "12:12",
    "Yatsi": "18:54"
  },
  {
    "HicriTarihKisa": "25.5.1447",
    "HicriTarihKisaIso8601": null,
    "HicriTarihUzun": "25 Cemaziyelevvel 1447",
    "HicriTarihUzunIso8601": null,
    "AyinSekliURL": "https://namazvakti.diyanet.gov.tr/images/sd4.gif",
    "MiladiTarihKisa": "16.11.2025",
    "MiladiTarihKisaIso8601": "16.11.2025",
    "MiladiTarihUzun": "16 Kasım 2025 Pazar",
    "MiladiTarihUzunIso8601": "2025-11-16T00:00:00.0000000-04:00",
    "GreenwichOrtalamaZamani": 3.0,
    "Aksam": "17:48",
    "Gunes": "06:27",
    "GunesBatis": "17:41",
    "GunesDogus": "06:34",
    "Ikindi": "15:22",
    "Imsak": "05:17",
    "KibleSaati": "16:43",
    "Ogle": "12:13",
    "Yatsi": "18:53"
  },
  {
    "HicriTarihKisa": "26.5.1447",
    "HicriTarihKisaIso8601": null,
    "HicriTarihUzun": "26 Cemaziyelevvel 1447",
    "HicriTarihUzunIso8601": null,
    "AyinSekliURL": "https://namazvakti.diyanet.gov.tr/images/sd5.gif",
    "MiladiTarihKisa": "17.11.2025",
    "MiladiTarihKisaIso8601": "17.11.2025",
    "MiladiTarihUzun": "17 Kasım 2025 Pazartesi",
    "MiladiTarihUzunIso8601": "2025-11-17T00:00:00.0000000-04:00",
    "GreenwichOrtalamaZamani": 3.0,
    "Aksam": "17:48",
    "Gunes": "06:28",
    "GunesBatis": "17:41",
    "GunesDogus": "06:35",
    "Ikindi": "15:22",
    "Imsak": "05:18",
    "KibleSaati": "16:45",
    "Ogle": "12:13",
    "Yatsi": "18:53"
  },
  {
    "HicriTarihKisa": "27.5.1447",
    "HicriTarihKisaIso8601": null,
    "HicriTarihUzun": "27 Cemaziyelevvel 1447",
    "HicriTarihUzunIso8601": null,
    "AyinSekliURL": "https://namazvakti.diyanet.gov.tr/images/sd6.gif",
    "MiladiTarihKisa": "18.11.2025",
    "MiladiTarihKisaIso8601": "18.11.2025",
    "MiladiTarihUzun": "18 Kasım 2025 Salı",
    "MiladiTarihUzunIso8601": "2025-11-18T00:00:00.0000000-04:00",
    "GreenwichOrtalamaZamani": 3.0,
    "Aksam": "17:47",
    "Gunes": "06:29",
    "GunesBatis": "17:40",
    "GunesDogus": "06:36",
    "Ikindi": "15:22",
    "Imsak": "05:18",
    "KibleSaati": "16:47",
    "Ogle": "12:13",
    "Yatsi": "18:53"
  }
]