[
  {
    "Aksam": "17:46",
    "AyinSekliURL": "http://namazvakti.diyanet.gov.tr/images/d5.gif",
    "GreenwichOrtalamaZamani": -4.0,
    "Gunes": "06:14",
    "GunesBatis": "17:39",
    "GunesDogus": "06:21",
    "HicriTarihKisa": "19.8.1446",
    "HicriTarihKisaIso8601": null,
    "HicriTarihUzun": "19 Şaban 1446",
    "HicriTarihUzunIso8601": null,
    "Ikindi": "15:17",
    "Imsak": "05:02",
    "KibleSaati": "16:26",
    "MiladiTarihKisa": "18.02.2025",
    "MiladiTarihKisaIso8601": "18.02.2025",
    "MiladiTarihUzun": "18 Şubat 2025 Salı",
    "MiladiTarihUzunIso8601": "2025-02-18T00:00:00.0000000+03:00",
    "Ogle": "12:05",
    "Yatsi": "18:53"
  },
  {
    "Aksam": "17:46",
    "AyinSekliURL": "http://namazvakti.diyanet.gov.tr/images/d6.gif",
    "GreenwichOrtalamaZamani": -4.0,
    "Gunes": "06:13",
    "GunesBatis": "17:39",
    "GunesDogus": "06:20",
    "HicriTarihKisa": "20.8.1446",
    "HicriTarihKisaIso8601": null,
    "HicriTarihUzun": "20 Şaban 1446",
    "HicriTarihUzunIso8601": null,
    "Ikindi": "15:18",
    "Imsak": "05:02",
    "KibleSaati": "16:24",
    "MiladiTarihKisa": "19.02.2025",
    "MiladiTarihKisaIso8601": "19.02.2025",
    "MiladiTarihUzun": "19 Şubat 2025 Çarşamba",
    "MiladiTarihUzunIso8601": "2025-02-19T00:00:00.0000000+03:00",
    "Ogle": "12:05",
    "Yatsi": "18:53"
  },
  {
    "Aksam": "17:47",
    "AyinSekliURL": "http://namazvakti.diyanet.gov.tr/images/sondordun.gif",
    "GreenwichOrtalamaZamani": -4.0,
    "Gunes": "06:12",
    "GunesBatis": "17:40",
    "GunesDogus": "06:19",
    "HicriTarihKisa": "21.8.1446",
    "HicriTarihKisaIso8601": null,
    "HicriTarihUzun": "21 Şaban 1446",
    "HicriTarihUzunIso8601": null,
    "Ikindi": "15:18",
    "Imsak": "05:01",
    "KibleSaati": "16:22",
    "MiladiTarihKisa": "20.02.2025",
    "MiladiTarihKisaIso8601": "20.02.2025",
    "MiladiTarihUzun": "20 Şubat 2025 Perşembe",
    "MiladiTarihUzunIso8601": "2025-02-20T00:00:00.0000000+03:00",
    "Ogle": "12:05",
    "Yatsi": "18:54"
  },
  {
    "Aksam": "17:48",
    "AyinSekliURL": "http://namazvakti.diyanet.gov.tr/images/sd1.gif",
    "GreenwichOrtalamaZamani": -4.0,
    "Gunes": "06:11",
    "GunesBatis": "17:41",
    "GunesDogus": "06:18",
    "HicriTarihKisa": "22.8.1446",
    "HicriTarihKisaIso8601": null,
    "HicriTarihUzun": "22 Şaban 1446",
    "HicriTarihUzunIso8601": null,
    "Ikindi": "15:19",
    "Imsak": "05:00",
    "KibleSaati": "16:20",
    "MiladiTarihKisa": "21.02.2025",
    "MiladiTarihKisaIso8601": "21.02.2025",
    "MiladiTarihUzun": "21 Şubat 2025 Cuma",
    "MiladiTarihUzunIso8601": "2025-02-21T00:00:00.0000000+03:00",
    "Ogle": "12:05",
    "Yatsi": "18:55"
  },
  {
    "Aksam": "17:48",
    "AyinSekliURL": "http://namazvakti.diyanet.gov.tr/images/sd2.gif",
    "GreenwichOrtalamaZamani": -4.0,
    "Gunes": "06:11",
    "GunesBatis": "17:41",
    "GunesDogus": "06:18",
    "HicriTarihKisa": "23.8.1446",
    "HicriTarihKisaIso8601": null,
    "HicriTarihUzun": "23 Şaban 1446",
    "HicriTarihUzunIso8601": null,
    "Ikindi": "15:19",
    "Imsak": "04:59",
    "KibleSaati": "16:17",
    "MiladiTarihKisa": "22.02.2025",
    "MiladiTarihKisaIso8601": "22.02.2025",
    "MiladiTarihUzun": "22 Şubat 2025 Cumartesi",
    "MiladiTarihUzunIso8601": "2025-02-22T00:00:00.0000000+03:00",
    "Ogle": "12:05",
    "Yatsi": "18:55"
  },
  {
    "Aksam": "17:49",
    "AyinSekliURL": "http://namazvakti.diyanet.gov.tr/images/sd3.gif",
    "GreenwichOrtalamaZamani": -4.0,
    "Gunes": "06:10",
    "GunesBatis": "17:42",
    "GunesDogus": "06:17",
    "HicriTarihKisa": "24.8.1446",
    "HicriTarihKisaIso8601": null,
    "HicriTarihUzun": "24 Şaban 1446",
    "HicriTarihUzunIso8601": null,
    "Ikindi": "15:19",
    "Imsak": "04:58",
    "KibleSaati": "16:15",
    "MiladiTarihKisa": "23.02.2025",
    "MiladiTarihKisaIso8601": "23.02.2025",
    "MiladiTarihUzun": "23 Şubat 2025 Pazar",
    "MiladiTarihUzunIso8601": "2025-02-23T00:00:00.0000000+03:00",
    "Ogle": "12:04",
    "Yatsi": "18:56"
  },
  {
    "Aksam": "17:50",
    "AyinSekliURL": "http://namazvakti.diyanet.gov.tr/images/sd4.gif",
    "GreenwichOrtalamaZamani": -4.0,
    "Gunes": "06:09",
    "GunesBatis": "17:43",
    "GunesDogus": "06:16",
    "HicriTarihKisa": "25.8.1446",
    "HicriTarihKisaIso8601": null,
    "HicriTarihUzun": "25 Şaban 1446",
    "HicriTarihUzunIso8601": null,
    "Ikindi": "15:20",
    "Imsak": "04:57",
    "KibleSaati": "16:12",
    "MiladiTarihKisa": "24.02.2025",
    "MiladiTarihKisaIso8601": "24.02.2025",
    "MiladiTarihUzun": "24 Şubat 2025 Pazartesi",
    "MiladiTarihUzunIso8601": "2025-02-24T00:00:00.0000000+03:00",
    "Ogle": "12:04",
    "Yatsi": "18:56"
  },
  {
    "Aksam": "17:50",
    "AyinSekliURL": "http://namazvakti.diyanet.gov.tr/images/sd5.gif",
    "GreenwichOrtalamaZamani": -4.0,
    "Gunes": "06:08",
    "GunesBatis": "17:43",
    "GunesDogus": "06:15",
    "HicriTarihKisa": "26.8.1446",
    "HicriTarihKisaIso8601": null,
    "HicriTarihUzun": "26 Şaban 1446",
    "HicriTarihUzunIso8601": null,
    "Ikindi": "15:20",
    "Imsak": "04:57",
    "KibleSaati": "16:10",
    "MiladiTarihKisa": "25.02.2025",
    "MiladiTarihKisaIso8601": "25.02.2025",
    "MiladiTarihUzun": "25 Şubat 2025 Salı",
    "MiladiTarihUzunIso8601": "2025-02-25T00:00:00.0000000+03:00",
    "Ogle": "12:04",
    "Yatsi": "18:57"
  },
  {
    "Aksam": "17:51",
    "AyinSekliURL": "http://namazvakti.diyanet.gov.tr/images/sd6.gif",
    "GreenwichOrtalamaZamani": -4.0,
    "Gunes": "06:07",
    "GunesBatis": "17:44",
    "GunesDogus": "06:14",
    "HicriTarihKisa": "27.8.1446",
    "HicriTarihKisaIso8601": null,
    "HicriTarihUzun": "27 Şaban 1446",
    "HicriTarihUzunIso8601": null,
    "Ikindi": "15:20",
    "Imsak": "04:56",
    "KibleSaati": "16:08",
    "MiladiTarihKisa": "26.02.2025",
    "MiladiTarihKisaIso8601": "26.02.2025",
    "MiladiTarihUzun": "26 Şubat 2025 Çarşamba",
    "MiladiTarihUzunIso8601": "2025-02-26T00:00:00.0000000+03:00",
    "Ogle": "12:04",
    "Yatsi": "18:58"
  },
  {
    "Aksam": "17:52",
    "AyinSekliURL": "http://namazvakti.diyanet.gov.tr/images/sd7.gif",
    "GreenwichOrtalamaZamani": -4.0,
    "Gunes": "06:06",
    "GunesBatis": "17:45",
    "GunesDogus": "06:13",
    "HicriTarihKisa": "28.8.1446",
    "HicriTarihKisaIso8601": null,
    "HicriTarihUzun": "28 Şaban 1446",
    "HicriTarihUzunIso8601": null,
    "Ikindi": "15:21",
    "Imsak": "04:55",
    "KibleSaati": "16:05",
    "MiladiTarihKisa": "27.02.2025",
    "MiladiTarihKisaIso8601": "27.02.2025",
    "MiladiTarihUzun": "27 Şubat 2025 Perşembe",
    "MiladiTarihUzunIso8601": "2025-02-27T00:00:00.0000000+03:00",
    "Ogle": "12:04",
    "Yatsi": "18:58"
  },
  {
    "Aksam": "17:52",
    "AyinSekliURL": "http://namazvakti.diyanet.gov.tr/images/ruyet.gif",
    "GreenwichOrtalamaZamani": -4.0,
    "Gunes": "06:05",
    "GunesBatis": "17:45",
    "GunesDogus": "06:12",
    "HicriTarihKisa": "29.8.1446",
    "HicriTarihKisaIso8601": null,
    "HicriTarihUzun": "29 Şaban 1446",
    "HicriTarihUzunIso8601": null,
    "Ikindi": "15:21",
    "Imsak": "04:54",
    "KibleSaati": "16:03",
    "MiladiTarihKisa": "28.02.2025",
    "MiladiTarihKisaIso8601": "28.02.2025",
    "MiladiTarihUzun": "28 Şubat 2025 Cuma",
    "MiladiTarihUzunIso8601": "2025-02-28T00:00:00.0000000+03:00",
    "Ogle": "12:04",
    "Yatsi": "18:59"
  },
  {
    "Aksam": "17:53",
    "AyinSekliURL": "http://namazvakti.diyanet.gov.tr/images/r1.gif",
    "GreenwichOrtalamaZamani": -4.0,
    "Gunes": "06:04",
    "GunesBatis": "17:46",
    "GunesDogus": "06:11",
    "HicriTarihKisa": "1.9.1446",
    "HicriTarihKisaIso8601": null,
    "HicriTarihUzun": "1 Ramazan 1446",
    "HicriTarihUzunIso8601": null,
    "Ikindi": "15:21",
    "Imsak": "04:53",
    "KibleSaati": "16:00",
    "MiladiTarihKisa": "01.03.2025",
    "MiladiTarihKisaIso8601": "01.03.2025",
    "MiladiTarihUzun": "01 Mart 2025 Cumartesi",
    "MiladiTarihUzunIso8601": "2025-03-01T00:00:00.0000000+03:00",
    "Ogle": "12:03",
    "Yatsi": "18:59"
  },
  {
    "Aksam": "17:54",
    "AyinSekliURL": "http://namazvakti.diyanet.gov.tr/images/r2.gif",
    "GreenwichOrtalamaZamani": -4.0,
    "Gunes": "06:03",
    "GunesBatis": "17:47",
    "GunesDogus": "06:10",
    "HicriTarihKisa": "2.9.1446",
    "HicriTarihKisaIso8601": null,
    "HicriTarihUzun": "2 Ramazan 1446",
    "HicriTarihUzunIso8601": null,
    "Ikindi": "15:22",
    "Imsak": "04:52",
    "KibleSaati": "15:58",
    "MiladiTarihKisa": "02.03.2025",
    "MiladiTarihKisaIso8601": "02.03.2025",
    "MiladiTarihUzun": "02 Mart 2025 Pazar",
    "MiladiTarihUzunIso8601": "2025-03-02T00:00:00.0000000+03:00",
    "Ogle": "12:03",
    "Yatsi": "19:00"
  },
  {
    "Aksam": "17:54",
    "AyinSekliURL": "http://namazvakti.diyanet.gov.tr/images/r3.gif",
    "GreenwichOrtalamaZamani": -4.0,
    "Gunes": "06:02",
    "GunesBatis": "17:47",
    "GunesDogus": "06:09",
    "HicriTarihKisa": "3.9.1446",
    "HicriTarihKisaIso8601": null,
    "HicriTarihUzun": "3 Ramazan 1446",
    "HicriTarihUzunIso8601": null,
    "Ikindi": "15:22",
    "Imsak": "04:51",
    "KibleSaati": "15:55",
    "MiladiTarihKisa": "03.03.2025",
    "MiladiTarihKisaIso8601": "03.03.2025",
    "MiladiTarihUzun": "03 Mart 2025 Pazartesi",
    "MiladiTarihUzunIso8601": "2025-03-03T00:00:00.0000000+03:00",
    "Ogle": "12:03",
    "Yatsi": "19:01"
  },
  {
    "Aksam": "17:55",
    "AyinSekliURL": "http://namazvakti.diyanet.gov.tr/images/r4.gif",
    "GreenwichOrtalamaZamani": -4.0,
    "Gunes": "06:01",
    "GunesBatis": "17:48",
    "GunesDogus": "06:08",
    "HicriTarihKisa": "4.9.1446",
    "HicriTarihKisaIso8601": null,
    "HicriTarihUzun": "4 Ramazan 1446",
    "HicriTarihUzunIso8601": null,
    "Ikindi": "15:22",
    "Imsak": "04:50",
    "KibleSaati": "15:53",
    "MiladiTarihKisa": "04.03.2025",
    "MiladiTarihKisaIso8601": "04.03.2025",
    "MiladiTarihUzun": "04 Mart 2025 Salı",
    "MiladiTarihUzunIso8601": "2025-03-04T00:00:00.0000000+03:00",
    "Ogle": "12:03",
    "Yatsi": "19:01"
  },
  {
    "Aksam": "17:55",
    "AyinSekliURL": "http://namazvakti.diyanet.gov.tr/images/r5.gif",
    "GreenwichOrtalamaZamani": -4.0,
    "Gunes": "06:00",
    "GunesBatis": "17:48",
    "GunesDogus": "06:07",
    "HicriTarihKisa": "5.9.1446",
    "HicriTarihKisaIso8601": null,
    "HicriTarihUzun": "5 Ramazan 1446",
    "HicriTarihUzunIso8601": null,
    "Ikindi": "15:22",
    "Imsak": "04:49",
    "KibleSaati": "15:50",
    "MiladiTarihKisa": "05.03.2025",
    "MiladiTarihKisaIso8601": "05.03.2025",
    "MiladiTarihUzun": "05 Mart 2025 Çarşamba",
    "MiladiTarihUzunIso8601": "2025-03-05T00:00:00.0000000+03:00",
    "Ogle": "12:03",
    "Yatsi": "19:02"
  },
  {
    "Aksam": "17:56",
    "AyinSekliURL": "http://namazvakti.diyanet.gov.tr/images/r6.gif",
    "GreenwichOrtalamaZamani": -4.0,
    "Gunes": "05:59",
    "GunesBatis": "17:49",
    "GunesDogus": "06:06",
    "HicriTarihKisa": "6.9.1446",
    "HicriTarihKisaIso8601": null,
    "HicriTarihUzun": "6 Ramazan 1446",
    "HicriTarihUzunIso8601": null,
    "Ikindi": "15:23",
    "Imsak": "04:48",
    "KibleSaati": "15:48",
    "MiladiTarihKisa": "06.03.2025",
    "MiladiTarihKisaIso8601": "06.03.2025",
    "MiladiTarihUzun": "06 Mart 2025 Perşembe",
    "MiladiTarihUzunIso8601": "2025-03-06T00:00:00.0000000+03:00",
    "Ogle": "12:02",
    "Yatsi": "19:02"
  },
  {
    "Aksam": "17:57",
    "AyinSekliURL": "http://namazvakti.diyanet.gov.tr/images/ilkdordun.gif",
    "GreenwichOrtalamaZamani": -4.0,
    "Gunes": "05:58",
    "GunesBatis": "17:50",
    "GunesDogus": "06:05",
    "HicriTarihKisa": "7.9.1446",
    "HicriTarihKisaIso8601": null,
    "HicriTarihUzun": "7 Ramazan 1446",
    "HicriTarihUzunIso8601": null,
    "Ikindi": "15:23",
    "Imsak": "04:47",
    "KibleSaati": "15:45",
    "MiladiTarihKisa": "07.03.2025",
    "MiladiTarihKisaIso8601": "07.03.2025",
    "MiladiTarihUzun": "07 Mart 2025 Cuma",
    "MiladiTarihUzunIso8601": "2025-03-07T00:00:00.0000000+03:00",
    "Ogle": "12:02",
    "Yatsi": "19:03"
  },
  {
    "Aksam": "17:57",
    "AyinSekliURL": "http://namazvakti.diyanet.gov.tr/images/i1.gif",
    "GreenwichOrtalamaZamani": -4.0,
    "Gunes": "05:56",
    "GunesBatis": "17:50",
    "GunesDogus": "06:03",
    "HicriTarihKisa": "8.9.1446",
    "HicriTarihKisaIso8601": null,
    "HicriTarihUzun": "8 Ramazan 1446",
    "HicriTarihUzunIso8601": null,
    "Ikindi": "15:23",
    "Imsak": "04:46",
    "KibleSaati": "15:43",
    "MiladiTarihKisa": "08.03.2025",
    "MiladiTarihKisaIso8601": "08.03.2025",
    "MiladiTarihUzun": "08 Mart 2025 Cumartesi",
    "MiladiTarihUzunIso8601": "2025-03-08T00:00:00.0000000+03:00",
    "Ogle": "12:02",
    "Yatsi": "19:04"
  },
  {
    "Aksam": "17:58",
    "AyinSekliURL": "http://namazvakti.diyanet.gov.tr/images/i2.gif",
    "GreenwichOrtalamaZamani": -4.0,
    "Gunes": "05:55",
    "GunesBatis": "17:51",
    "GunesDogus": "06:02",
    "HicriTarihKisa": "9.9.1446",
    "HicriTarihKisaIso8601": null,
    "HicriTarihUzun": "9 Ramazan 1446",
    "HicriTarihUzunIso8601": null,
    "Ikindi": "15:23",
    "Imsak": "04:45",
    "KibleSaati": "15:40",
    "MiladiTarihKisa": "09.03.2025",
    "MiladiTarihKisaIso8601": "09.03.2025",
    "MiladiTarihUzun": "09 Mart 2025 Pazar",
    "MiladiTarihUzunIso8601": "2025-03-09T00:00:00.0000000+03:00",
    "Ogle": "12:02",
    "Yatsi": "19:04"
  },
  {
    "Aksam": "17:58",
    "AyinSekliURL": "http://namazvakti.diyanet.gov.tr/images/i3.gif",
    "GreenwichOrtalamaZamani": -4.0,
    "Gunes": "05:54",
    "GunesBatis": "17:51",
    "GunesDogus": "06:01",
    "HicriTarihKisa": "10.9.1446",
    "HicriTarihKisaIso8601": null,
    "HicriTarihUzun": "10 Ramazan 1446",
    "HicriTarihUzunIso8601": null,
    "Ikindi": "15:23",
    "Imsak": "04:43",
    "KibleSaati": "15:38",
    "MiladiTarihKisa": "10.03.2025",
    "MiladiTarihKisaIso8601": "10.03.2025",
    "MiladiTarihUzun": "10 Mart 2025 Pazartesi",
    "MiladiTarihUzunIso8601": "2025-03-10T00:00:00.0000000+03:00",
    "Ogle": "12:01",
    "Yatsi": "19:05"
  },
  {
    "Aksam": "17:59",
    "AyinSekliURL": "http://namazvakti.diyanet.gov.tr/images/i4.gif",
    "GreenwichOrtalamaZamani": -4.0,
    "Gunes": "05:53",
    "GunesBatis": "17:52",
    "GunesDogus": "06:00",
    "HicriTarihKisa": "11.9.1446",
    "HicriTarihKisaIso8601": null,
    "HicriTarihUzun": "11 Ramazan 1446",
    "HicriTarihUzunIso8601": null,
    "Ikindi": "15:24",
    "Imsak": "04:42",
    "KibleSaati": "15:35",
    "MiladiTarihKisa": "11.03.2025",
    "MiladiTarihKisaIso8601": "11.03.2025",
    "MiladiTarihUzun": "11 Mart 2025 Salı",
    "MiladiTarihUzunIso8601": "2025-03-11T00:00:00.0000000+03:00",
    "Ogle": "12:01",
    "Yatsi": "19:05"
  },
  {
    "Aksam": "18:00",
    "AyinSekliURL": "http://namazvakti.diyanet.gov.tr/images/i5.gif",
    "GreenwichOrtalamaZamani": -4.0,
    "Gunes": "05:52",
    "GunesBatis": "17:53",
    "GunesDogus": "05:59",
    "HicriTarihKisa": "12.9.1446",
    "HicriTarihKisaIso8601": null,
    "HicriTarihUzun": "12 Ramazan 1446",
    "HicriTarihUzunIso8601": null,
    "Ikindi": "15:24",
    "Imsak": "04:41",
    "KibleSaati": "15:33",
    "MiladiTarihKisa": "12.03.2025",
    "MiladiTarihKisaIso8601": "12.03.2025",
    "MiladiTarihUzun": "12 Mart 2025 Çarşamba",
    "MiladiTarihUzunIso8601": "2025-03-12T00:00:00.0000000+03:00",
    "Ogle": "12:01",
    "Yatsi": "19:06"
  },
  {
    "Aksam": "18:00",
    "AyinSekliURL": "http://namazvakti.diyanet.gov.tr/images/i6.gif",
    "GreenwichOrtalamaZamani": -4.0,
    "Gunes": "05:51",
    "GunesBatis": "17:53",
    "GunesDogus": "05:58",
    "HicriTarihKisa": "13.9.1446",
    "HicriTarihKisaIso8601": null,
    "HicriTarihUzun": "13 Ramazan 1446",
    "HicriTarihUzunIso8601": null,
    "Ikindi": "15:24",
    "Imsak": "04:40",
    "KibleSaati": "15:30",
    "MiladiTarihKisa": "13.03.2025",
    "MiladiTarihKisaIso8601": "13.03.2025",
    "MiladiTarihUzun": "13 Mart 2025 Perşembe",
    "MiladiTarihUzunIso8601": "2025-03-13T00:00:00.0000000+03:00",
    "Ogle": "12:01",
    "Yatsi": "19:06"
  },
  {
    "Aksam": "18:01",
    "AyinSekliURL": "http://namazvakti.diyanet.gov.tr/images/dolunay.gif",
    "GreenwichOrtalamaZamani": -4.0,
    "Gunes": "05:50",
    "GunesBatis": "17:54",
    "GunesDogus": "05:57",
    "HicriTarihKisa": "14.9.1446",
    "HicriTarihKisaIso8601": null,
    "HicriTarihUzun": "14 Ramazan 1446",
    "HicriTarihUzunIso8601": null,
    "Ikindi": "15:24",
    "Imsak": "04:39",
    "KibleSaati": "15:28",
    "MiladiTarihKisa": "14.03.2025",
    "MiladiTarihKisaIso8601": "14.03.2025",
    "MiladiTarihUzun": "14 Mart 2025 Cuma",
    "MiladiTarihUzunIso8601": "2025-03-14T00:00:00.0000000+03:00",
    "Ogle": "12:00",
    "Yatsi": "19:07"
  },
  {
    "Aksam": "18:01",
    "AyinSekliURL": "http://namazvakti.diyanet.gov.tr/images/d1.gif",
    "GreenwichOrtalamaZamani": -4.0,
    "Gunes": "05:49",
    "GunesBatis": "17:54",
    "GunesDogus": "05:56",
    "HicriTarihKisa": "15.9.1446",
    "HicriTarihKisaIso8601": null,
    "HicriTarihUzun": "15 Ramazan 1446",
    "HicriTarihUzunIso8601": null,
    "Ikindi": "15:24",
    "Imsak": "04:38",
    "KibleSaati": "15:25",
    "MiladiTarihKisa": "15.03.2025",
    "MiladiTarihKisaIso8601": "15.03.2025",
    "MiladiTarihUzun": "15 Mart 2025 Cumartesi",
    "MiladiTarihUzunIso8601": "2025-03-15T00:00:00.0000000+03:00",
    "Ogle": "12:00",
    "Yatsi": "19:08"
  },
  {
    "Aksam": "18:02",
    "AyinSekliURL": "http://namazvakti.diyanet.gov.tr/images/d2.gif",
    "GreenwichOrtalamaZamani": -4.0,
    "Gunes": "05:48",
    "GunesBatis": "17:55",
    "GunesDogus": "05:55",
    "HicriTarihKisa": "16.9.1446",
    "HicriTarihKisaIso8601": null,
    "HicriTarihUzun": "16 Ramazan 1446",
    "HicriTarihUzunIso8601": null,
    "Ikindi": "15:24",
    "Imsak": "04:37",
    "KibleSaati": "15:23",
    "MiladiTarihKisa": "16.03.2025",
    "MiladiTarihKisaIso8601": "16.03.2025",
    "MiladiTarihUzun": "16 Mart 2025 Pazar",
    "MiladiTarihUzunIso8601": "2025-03-16T00:00:00.0000000+03:00",
    "Ogle": "12:00",
    "Yatsi": "19:08"
  },
  {
    "Aksam": "18:02",
    "AyinSekliURL": "http://namazvakti.diyanet.gov.tr/images/d3.gif",
    "GreenwichOrtalamaZamani": -4.0,
    "Gunes": "05:46",
    "GunesBatis": "17:55",
    "GunesDogus": "05:53",
    "HicriTarihKisa": "17.9.1446",
    "HicriTarihKisaIso8601": null,
    "HicriTarihUzun": "17 Ramazan 1446",
    "HicriTarihUzunIso8601": null,
    "Ikindi": "15:24",
    "Imsak": "04:35",
    "KibleSaati": "15:20",
    "MiladiTarihKisa": "17.03.2025",
    "MiladiTarihKisaIso8601": "17.03.2025",
    "MiladiTarihUzun": "17 Mart 2025 Pazartesi",
    "MiladiTarihUzunIso8601": "2025-03-17T00:00:00.0000000+03:00",
    "Ogle": "11:59",
    "Yatsi": "19:09"
  },
  {
    "Aksam": "18:03",
    "AyinSekliURL": "http://namazvakti.diyanet.gov.tr/images/d4.gif",
    "GreenwichOrtalamaZamani": -4.0,
    "Gunes": "05:45",
    "GunesBatis": "17:56",
    "GunesDogus": "05:52",
    "HicriTarihKisa": "18.9.1446",
    "HicriTarihKisaIso8601": null,
    "HicriTarihUzun": "18 Ramazan 1446",
    "HicriTarihUzunIso8601": null,
    "Ikindi": "15:24",
    "Imsak": "04:34",
    "KibleSaati": "15:18",
    "MiladiTarihKisa": "18.03.2025",
    "MiladiTarihKisaIso8601": "18.03.2025",
    "MiladiTarihUzun": "18 Mart 2025 Salı",
    "MiladiTarihUzunIso8601": "2025-03-18T00:00:00.0000000+03:00",
    "Ogle": "11:59",
    "Yatsi": "19:09"
  },
  {
    "Aksam": "18:03",
    "AyinSekliURL": "http://namazvakti.diyanet.gov.tr/images/d5.gif",
    "GreenwichOrtalamaZamani": -4.0,
    "Gunes": "05:44",
    "GunesBatis": "17:56",
    "GunesDogus": "05:51",
    "HicriTarihKisa": "19.9.1446",
    "HicriTarihKisaIso8601": null,
    "HicriTarihUzun": "19 Ramazan 1446",
    "HicriTarihUzunIso8601": null,
    "Ikindi": "15:24",
    "Imsak": "04:33",
    "KibleSaati": "15:15",
    "MiladiTarihKisa": "19.03.2025",
    "MiladiTarihKisaIso8601": "19.03.2025",
    "MiladiTarihUzun": "19 Mart 2025 Çarşamba",
    "MiladiTarihUzunIso8601": "2025-03-19T00:00:00.0000000+03:00",
    "Ogle": "11:59",
    "Yatsi": "19:10"
  },
  {
    "Aksam": "18:04",
    "AyinSekliURL": "http://namazvakti.diyanet.gov.tr/images/d6.gif",
    "GreenwichOrtalamaZamani": -4.0,
    "Gunes": "05:43",
    "GunesBatis": "17:57",
    "GunesDogus": "05:50",
    "HicriTarihKisa": "20.9.1446",
    "HicriTarihKisaIso8601": null,
    "HicriTarihUzun": "20 Ramazan 1446",
    "HicriTarihUzunIso8601": null,
    "Ikindi": "15:24",
    "Imsak": "04:32",
    "KibleSaati": "15:12",
    "MiladiTarihKisa": "20.03.2025",
    "MiladiTarihKisaIso8601": "20.03.2025",
    "MiladiTarihUzun": "20 Mart 2025 Perşembe",
    "MiladiTarihUzunIso8601": "2025-03-20T00:00:00.0000000+03:00",
    "Ogle": "11:59",
    "Yatsi": "19:11"
  }
]