[
  {
    "HicriTarihKisa": "27.5.1447",
    "HicriTarihKisaIso8601": null,
    "HicriTarihUzun": "27 Cemaziyelevvel 1447",
    "HicriTarihUzunIso8601": null,
    "AyinSekliURL": "https://namazvakti.diyanet.gov.tr/images/sd6.gif",
    "MiladiTarihKisa": "18.11.2025",
    "MiladiTarihKisaIso8601": "18.11.2025",
    "MiladiTarihUzun": "18 Kasım 2025 Salı",
    "MiladiTarihUzunIso8601": "2025-11-18T00:00:00.0000000+01:00",
    "GreenwichOrtalamaZamani": 3.0,
    "Aksam": "18:47",
    "Gunes": "08:00",
    "GunesBatis": "18:40",
    "GunesDogus": "08:07",
    "Ikindi": "16:24",
    "Imsak": "06:43",
    "KibleSaati": "21:44",
    "Ogle": "13:29",
    "Yatsi": "19:59"
  },
  {
    "HicriTarihKisa": "28.5.1447",
    "HicriTarihKisaIso8601": null,
    "HicriTarihUzun": "28 Cemaziyelevvel 1447",
    "HicriTarihUzunIso8601": null,
    "AyinSekliURL": "https://namazvakti.diyanet.gov.tr/images/sd7.gif",
    "MiladiTarihKisa": "19.11.2025",
    "MiladiTarihKisaIso8601": "19.11.2025",
    "MiladiTarihUzun": "19 Kasım 2025 Çarşamba",
    "MiladiTarihUzunIso8601": "2025-11-19T00:00:00.0000000+01:00",
    "GreenwichOrtalamaZamani": 3.0,
    "Aksam": "18:47",
    "Gunes": "08:01",
    "GunesBatis": "18:40",
    "GunesDogus": "08:08",
    "Ikindi": "16:24",
    "Imsak": "06:44",
    "KibleSaati": "21:46",
    "Ogle": "13:29",
    "Yatsi": "19:59"
  },
  {
    "HicriTarihKisa": "29.5.1447",
    "HicriTarihKisaIso8601": null,
    "HicriTarihUzun": "29 Cemaziyelevvel 1447",
    "HicriTarihUzunIso8601": null,
    "AyinSekliURL": "https://namazvakti.diyanet.gov.tr/images/ruyet.gif",
    "MiladiTarihKisa": "20.11.2025",
    "MiladiTarihKisaIso8601": "20.11.2025",
    "MiladiTarihUzun": "20 Kasım 2025 Perşembe",
    "MiladiTarihUzunIso8601": "2025-11-20T00:00:00.0000000+01:00",
    "GreenwichOrtalamaZamani": 3.0,
    "Aksam": "18:47",
    "Gunes": "08:01",
    "GunesBatis": "18:40",
    "GunesDogus": "08:08",
    "Ikindi": "16:24",
    "Imsak": "06:45",
    "KibleSaati": "21:49",
    "Ogle": "13:29",
    "Yatsi": "19:59"
  },
  {
    "HicriTarihKisa": "1.6.1447",
    "HicriTarihKisaIso8601": null,
    "HicriTarihUzun": "1 Cemaziyelahir 1447",
    "HicriTarihUzunIso8601": null,
    "AyinSekliURL": "https://namazvakti.diyanet.gov.tr/images/r1.gif",
    "MiladiTarihKisa": "21.11.2025",
    "MiladiTarihKisaIso8601": "21.11.2025",
    "MiladiTarihUzun": "21 Kasım 2025 Cuma",
    "MiladiTarihUzunIso8601": "2025-11-21T00:00:00.0000000+01:00",
    "GreenwichOrtalamaZamani": 3.0,
    "Aksam": "18:46",
    "Gunes": "08:02",
    "GunesBatis": "18:39",
    "GunesDogus": "08:09",
    "Ikindi": "16:23",
    "Imsak": "06:45",
    "KibleSaati": "21:51",
    "Ogle": "13:29",
    "Yatsi": "19:58"
  },
  {
    "HicriTarihKisa": "2.6.1447",
    "HicriTarihKisaIso8601": null,
    "HicriTarihUzun": "2 Cemaziyelahir 1447",
    "HicriTarihUzunIso8601": null,
    "AyinSekliURL": "https://namazvakti.diyanet.gov.tr/images/r2.gif",
    "MiladiTarihKisa": "22.11.2025",
    "MiladiTarihKisaIso8601": "22.11.2025",
    "MiladiTarihUzun": "22 Kasım 2025 Cumartesi",
    "MiladiTarihUzunIso8601": "2025-11-22T00:00:00.0000000+01:00",
    "GreenwichOrtalamaZamani": 3.0,
    "Aksam": "18:46",
    "Gunes": "08:03",
    "GunesBatis": "18:39",
    "GunesDogus": "08:10",
    "Ikindi": "16:23",
    "Imsak": "06:46",
    "KibleSaati": "21:54",
    "Ogle": "13:30",
    "Yatsi": "19:58"
  },
  {
    "HicriTarihKisa": "3.6.1447",
    "HicriTarihKisaIso8601": null,
    "HicriTarihUzun": "3 Cemaziyelahir 1447",
    "HicriTarihUzunIso8601": null,
    "AyinSekliURL": "https://namazvakti.diyanet.gov.tr/images/r3.gif",
    "MiladiTarihKisa": "23.11.2025",
    "MiladiTarihKisaIso8601": "23.11.2025",
    "MiladiTarihUzun": "23 Kasım 2025 Pazar",
    "MiladiTarihUzunIso8601": "2025-11-23T00:00:00.0000000+01:00",
    "GreenwichOrtalamaZamani": 3.0,
    "Aksam": "18:46",
    "Gunes": "08:04",
    "GunesBatis": "18:39",
    "GunesDogus": "08:11",
    "Ikindi": "16:23",
    "Imsak": "06:47",
    "KibleSaati": "21:56",
    "Ogle": "13:30",
    "Yatsi": "19:58"
  },
  {
    "HicriTarihKisa": "4.6.1447",
    "HicriTarihKisaIso8601": null,
    "HicriTarihUzun": "4 Cemaziyelahir 1447",
    "HicriTarihUzunIso8601": null,
    "AyinSekliURL": "https://namazvakti.diyanet.gov.tr/images/r4.gif",
    "MiladiTarihKisa": "24.11.2025",
    "MiladiTarihKisaIso8601": "24.11.2025",
    "MiladiTarihUzun": "24 Kasım 2025 Pazartesi",
    "MiladiTarihUzunIso8601": "2025-11-24T00:00:00.0000000+01:00",
    "GreenwichOrtalamaZamani": 3.0,
    "Aksam": "18:45",
    "Gunes": "08:05",
    "GunesBatis": "18:38",
    "GunesDogus": "08:12",
    "Ikindi": "16:23",
    "Imsak": "06:48",
    "KibleSaati": "21:58",
    "Ogle": "13:30",
    "Yatsi": "19:58"
  },
  {
    "HicriTarihKisa": "5.6.1447",
    "HicriTarihKisaIso8601": null,
    "HicriTarihUzun": "5 Cemaziyelahir 1447",
    "HicriTarihUzunIso8601": null,
    "AyinSekliURL": "https://namazvakti.diyanet.gov.tr/images/r5.gif",
    "MiladiTarihKisa": "25.11.2025",
    "MiladiTarihKisaIso8601": "25.11.2025",
    "MiladiTarihUzun": "25 Kasım 2025 Salı",
    "MiladiTarihUzunIso8601": "2025-11-25T00:00:00.0000000+01:00",
    "GreenwichOrtalamaZamani": 3.0,
    "Aksam": "18:45",
    "Gunes": "08:06",
    "GunesBatis": "18:38",
    "GunesDogus": "08:13",
    "Ikindi": "16:23",
    "Imsak": "06:48",
    "KibleSaati": "22:01",
    "Ogle": "13:30",
    "Yatsi": "19:58"
  },
  {
    "HicriTarihKisa": "6.6.1447",
    "HicriTarihKisaIso8601": null,
    "HicriTarihUzun": "6 Cemaziyelahir 1447",
    "HicriTarihUzunIso8601": null,
    "AyinSekliURL": "https://namazvakti.diyanet.gov.tr/images/r6.gif",
    "MiladiTarihKisa": "26.11.2025",
    "MiladiTarihKisaIso8601": "26.11.2025",
    "MiladiTarihUzun": "26 Kasım 2025 Çarşamba",
    "MiladiTarihUzunIso8601": "2025-11-26T00:00:00.0000000+01:00",
    "GreenwichOrtalamaZamani": 3.0,
    "Aksam": "18:45",
    "Gunes": "08:06",
    "GunesBatis": "18:38",
    "GunesDogus": "08:13",
    "Ikindi": "16:23",
    "Imsak": "06:49",
    "KibleSaati": "22:03",
    "Ogle": "13:31",
    "Yatsi": "19:57"
  },
  {
    "HicriTarihKisa": "7.6.1447",
    "HicriTarihKisaIso8601": null,
    "HicriTarihUzun": "7 Cemaziyelahir 1447",
    "HicriTarihUzunIso8601": null,
    "AyinSekliURL": "https://namazvakti.diyanet.gov.tr/images/ilkdordun.gif",
    "MiladiTarihKisa": "27.11.2025",
    "MiladiTarihKisaIso8601": "27.11.2025",
    "MiladiTarihUzun": "27 Kasım 2025 Perşembe",
    "MiladiTarihUzunIso8601": "2025-11-27T00:00:00.0000000+01:00",
    "GreenwichOrtalamaZamani": 3.0,
    "Aksam": "18:45",
    "Gunes": "08:07",
    "GunesBatis": "18:38",
    "GunesDogus": "08:14",
    "Ikindi": "16:22",
    "Imsak": "06:50",
    "KibleSaati": "22:05",
    "Ogle": "13:31",
    "Yatsi": "19:57"
  },
  {
    "HicriTarihKisa": "8.6.1447",
    "HicriTarihKisaIso8601": null,
    "HicriTarihUzun": "8 Cemaziyelahir 1447",
    "HicriTarihUzunIso8601": null,
    "AyinSekliURL": "https://namazvakti.diyanet.gov.tr/images/i1.gif",
    "MiladiTarihKisa": "28.11.2025",
    "MiladiTarihKisaIso8601": "28.11.2025",
    "MiladiTarihUzun": "28 Kasım 2025 Cuma",
    "MiladiTarihUzunIso8601": "2025-11-28T00:00:00.0000000+01:00",
    "GreenwichOrtalamaZamani": 3.0,
    "Aksam": "18:45",
    "Gunes": "08:08",
    "GunesBatis": "18:38",
    "GunesDogus": "08:15",
    "Ikindi": "16:22",
    "Imsak": "06:51",
    "KibleSaati": "22:07",
    "Ogle": "13:31",
    "Yatsi": "19:57"
  },
  {
    "HicriTarihKisa": "9.6.1447",
    "HicriTarihKisaIso8601": null,
    "HicriTarihUzun": "9 Cemaziyelahir 1447",
    "HicriTarihUzunIso8601": null,
    "AyinSekliURL": "https://namazvakti.diyanet.gov.tr/images/i2.gif",
    "MiladiTarihKisa": "29.11.2025",
    "MiladiTarihKisaIso8601": "29.11.2025",
    "MiladiTarihUzun": "29 Kasım 2025 Cumartesi",
    "MiladiTarihUzunIso8601": "2025-11-29T00:00:00.0000000+01:00",
    "GreenwichOrtalamaZamani": 3.0,
    "Aksam": "18:44",
    "Gunes": "08:09",
    "GunesBatis": "18:37",
    "GunesDogus": "08:16",
    "Ikindi": "16:22",
    "Imsak": "06:51",
    "KibleSaati": "22:10",
    "Ogle": "13:32",
    "Yatsi": "19:57"
  },
  {
    "HicriTarihKisa": "10.6.1447",
    "HicriTarihKisaIso8601": null,
    "HicriTarihUzun": "10 Cemaziyelahir 1447",
    "HicriTarihUzunIso8601": null,
    "AyinSekliURL": "https://namazvakti.diyanet.gov.tr/images/i3.gif",
    "MiladiTarihKisa": "30.11.2025",
    "MiladiTarihKisaIso8601": "30.11.2025",
    "MiladiTarihUzun": "30 Kasım 2025 Pazar",
    "MiladiTarihUzunIso8601": "2025-11-30T00:00:00.0000000+01:00",
    "GreenwichOrtalamaZamani": 3.0,
    "Aksam": "18:44",
    "Gunes": "08:10",
    "GunesBatis": "18:37",
    "GunesDogus": "08:17",
    "Ikindi": "16:22",
    "Imsak": "06:52",
    "KibleSaati": "22:12",
    "Ogle": "13:32",
    "Yatsi": "19:57"
  },
  {
    "HicriTarihKisa": "11.6.1447",
    "HicriTarihKisaIso8601": null,
    "HicriTarihUzun": "11 Cemaziyelahir 1447",
    "HicriTarihUzunIso8601": null,
    "AyinSekliURL": "https://namazvakti.diyanet.gov.tr/images/i4.gif",
    "MiladiTarihKisa": "01.12.2025",
    "MiladiTarihKisaIso8601": "01.12.2025",
    "MiladiTarihUzun": "01 Aralık 2025 Pazartesi",
    "MiladiTarihUzunIso8601": "2025-12-01T00:00:00.0000000+01:00",
    "GreenwichOrtalamaZamani": 3.0,
    "Aksam": "18:44",
    "Gunes": "08:10",
    "GunesBatis": "18:37",
    "GunesDogus": "08:17",
    "Ikindi": "16:22",
    "Imsak": "06:53",
    "KibleSaati": "22:14",
    "Ogle": "13:32",
    "Yatsi": "19:57"
  },
  {
    "HicriTarihKisa": "12.6.1447",
    "HicriTarihKisaIso8601": null,
    "HicriTarihUzun": "12 Cemaziyelahir 1447",
    "HicriTarihUzunIso8601": null,
    "AyinSekliURL": "https://namazvakti.diyanet.gov.tr/images/i5.gif",
    "MiladiTarihKisa": "02.12.2025",
    "MiladiTarihKisaIso8601": "02.12.2025",
    "MiladiTarihUzun": "02 Aralık 2025 Salı",
    "MiladiTarihUzunIso8601": "2025-12-02T00:00:00.0000000+01:00",
    "GreenwichOrtalamaZamani": 3.0,
    "Aksam": "18:44",
    "Gunes": "08:11",
    "GunesBatis": "18:37",
    "GunesDogus": "08:18",
    "Ikindi": "16:22",
    "Imsak": "06:53",
    "KibleSaati": "22:16",
    "Ogle": "13:33",
    "Yatsi": "19:57"
  },
  {
    "HicriTarihKisa": "13.6.1447",
    "HicriTarihKisaIso8601": null,
    "HicriTarihUzun": "13 Cemaziyelahir 1447",
    "HicriTarihUzunIso8601": null,
    "AyinSekliURL": "https://namazvakti.diyanet.gov.tr/images/i6.gif",
    "MiladiTarihKisa": "03.12.2025",
    "MiladiTarihKisaIso8601": "03.12.2025",
    "MiladiTarihUzun": "03 Aralık 2025 Çarşamba",
    "MiladiTarihUzunIso8601": "2025-12-03T00:00:00.0000000+01:00",
    "GreenwichOrtalamaZamani": 3.0,
    "Aksam": "18:44",
    "Gunes": "08:12",
    "GunesBatis": "18:37",
    "GunesDogus": "08:19",
    "Ikindi": "16:22",
    "Imsak": "06:54",
    "KibleSaati": "22:18",
    "Ogle": "13:33",
    "Yatsi": "19:57"
  },
  {
    "HicriTarihKisa": "14.6.1447",
    "HicriTarihKisaIso8601": null,
    "HicriTarihUzun": "14 Cemaziyelahir 1447",
    "HicriTarihUzunIso8601": null,
    "AyinSekliURL": "https://namazvakti.diyanet.gov.tr/images/dolunay.gif",
    "MiladiTarihKisa": "04.12.2025",
    "MiladiTarihKisaIso8601": "04.12.2025",
    "MiladiTarihUzun": "04 Aralık 2025 Perşembe",
    "MiladiTarihUzunIso8601": "2025-12-04T00:00:00.0000000+01:00",
    "GreenwichOrtalamaZamani": 3.0,
    "Aksam": "18:44",
    "Gunes": "08:13",
    "GunesBatis": "18:37",
    "GunesDogus": "08:20",
    "Ikindi": "16:22",
    "Imsak": "06:55",
    "KibleSaati": "22:20",
    "Ogle": "13:34",
    "Yatsi": "19:58"
  },
  {
    "HicriTarihKisa": "15.6.1447",
    "HicriTarihKisaIso8601": null,
    "HicriTarihUzun": "15 Cemaziyelahir 1447",
    "HicriTarihUzunIso8601": null,
    "AyinSekliURL": "https://namazvakti.diyanet.gov.tr/images/d1.gif",
    "MiladiTarihKisa": "05.12.2025",
    "MiladiTarihKisaIso8601": "05.12.2025",
    "MiladiTarihUzun": "05 Aralık 2025 Cuma",
    "MiladiTarihUzunIso8601": "2025-12-05T00:00:00.0000000+01:00",
    "GreenwichOrtalamaZamani": 3.0,
    "Aksam": "18:44",
    "Gunes": "08:14",
    "GunesBatis": "18:37",
    "GunesDogus": "08:21",
    "Ikindi": "16:23",
    "Imsak": "06:55",
    "KibleSaati": "22:21",
    "Ogle": "13:34",
    "Yatsi": "19:58"
  },
  {
    "HicriTarihKisa": "16.6.1447",
    "HicriTarihKisaIso8601": null,
    "HicriTarihUzun": "16 Cemaziyelahir 1447",
    "HicriTarihUzunIso8601": null,
    "AyinSekliURL": "https://namazvakti.diyanet.gov.tr/images/d2.gif",
    "MiladiTarihKisa": "06.12.2025",
    "MiladiTarihKisaIso8601": "06.12.2025",
    "MiladiTarihUzun": "06 Aralık 2025 Cumartesi",
    "MiladiTarihUzunIso8601": "2025-12-06T00:00:00.0000000+01:00",
    "GreenwichOrtalamaZamani": 3.0,
    "Aksam": "18:44",
    "Gunes": "08:14",
    "GunesBatis": "18:37",
    "GunesDogus": "08:21",
    "Ikindi": "16:23",
    "Imsak": "06:56",
    "KibleSaati": "22:23",
    "Ogle": "13:34",
    "Yatsi": "19:58"
  },
  {
    "HicriTarihKisa": "17.6.1447",
    "HicriTarihKisaIso8601": null,
    "HicriTarihUzun": "17 Cemaziyelahir 1447",
    "HicriTarihUzunIso8601": null,
    "AyinSekliURL": "https://namazvakti.diyanet.gov.tr/images/d3.gif",
    "MiladiTarihKisa": "07.12.2025",
    "MiladiTarihKisaIso8601": "07.12.2025",
    "MiladiTarihUzun": "07 Aralık 2025 Pazar",
    "MiladiTarihUzunIso8601": "2025-12-07T00:00:00.0000000+01:00",
    "GreenwichOrtalamaZamani": 3.0,
    "Aksam": "18:45",
    "Gunes": "08:15",
    "GunesBatis": "18:38",
    "GunesDogus": "08:22",
    "Ikindi": "16:23",
    "Imsak": "06:57",
    "KibleSaati": "22:25",
    "Ogle": "13:35",
    "Yatsi": "19:58"
  },
  {
    "HicriTarihKisa": "18.6.1447",
    "HicriTarihKisaIso8601": null,
    "HicriTarihUzun": "18 Cemaziyelahir 1447",
    "HicriTarihUzunIso8601": null,
    "AyinSekliURL": "https://namazvakti.diyanet.gov.tr/images/d4.gif",
    "MiladiTarihKisa": "08.12.2025",
    "MiladiTarihKisaIso8601": "08.12.2025",
    "MiladiTarihUzun": "08 Aralık 2025 Pazartesi",
    "MiladiTarihUzunIso8601": "2025-12-08T00:00:00.0000000+01:00",
    "GreenwichOrtalamaZamani": 3.0,
    "Aksam": "18:45",
    "Gunes": "08:16",
    "GunesBatis": "18:38",
    "GunesDogus": "08:23",
    "Ikindi": "16:23",
    "Imsak": "06:57",
    "KibleSaati": "22:27",
    "Ogle": "13:35",
    "Yatsi": "19:58"
  },
  {
    "HicriTarihKisa": "19.6.1447",
    "HicriTarihKisaIso8601": null,
    "HicriTarihUzun": "19 Cemaziyelahir 1447",
    "HicriTarihUzunIso8601": null,
    "AyinSekliURL": "https://namazvakti.diyanet.gov.tr/images/d5.gif",
    "MiladiTarihKisa": "09.12.2025",
    "MiladiTarihKisaIso8601": "09.12.2025",
    "MiladiTarihUzun": "09 Aralık 2025 Salı",
    "MiladiTarihUzunIso8601": "2025-12-09T00:00:00.0000000+01:00",
    "GreenwichOrtalamaZamani": 3.0,
    "Aksam": "18:45",
    "Gunes": "08:17",
    "GunesBatis": "18:38",
    "GunesDogus": "08:24",
    "Ikindi": "16:23",
    "Imsak": "06:58",
    "KibleSaati": "22:28",
    "Ogle": "13:36",
    "Yatsi": "19:58"
  },
  {
    "HicriTarihKisa": "20.6.1447",
    "HicriTarihKisaIso8601": null,
    "HicriTarihUzun": "20 Cemaziyelahir 1447",
    "HicriTarihUzunIso8601": null,
    "AyinSekliURL": "https://namazvakti.diyanet.gov.tr/images/d6.gif",
    "MiladiTarihKisa": "10.12.2025",
    "MiladiTarihKisaIso8601": "10.12.2025",
    "MiladiTarihUzun": "10 Aralık 2025 Çarşamba",
    "MiladiTarihUzunIso8601": "2025-12-10T00:00:00.0000000+01:00",
    "GreenwichOrtalamaZamani": 3.0,
    "Aksam": "18:45",
    "Gunes": "08:17",
    "GunesBatis": "18:38",
    "GunesDogus": "08:24",
    "Ikindi": "16:23",
    "Imsak": "06:59",
    "KibleSaati": "22:30",
    "Ogle": "13:36",
    "Yatsi": "19:59"
  },
  {
    "HicriTarihKisa": "21.6.1447",
    "HicriTarihKisaIso8601": null,
    "HicriTarihUzun": "21 Cemaziyelahir 1447",
    "HicriTarihUzunIso8601": null,
    "AyinSekliURL": "https://namazvakti.diyanet.gov.tr/images/d7.gif",
    "MiladiTarihKisa": "11.12.2025",
    "MiladiTarihKisaIso8601": "11.12.2025",
    "MiladiTarihUzun": "11 Aralık 2025 Perşembe",
    "MiladiTarihUzunIso8601": "2025-12-11T00:00:00.0000000+01:00",
    "GreenwichOrtalamaZamani": 3.0,
    "Aksam": "18:45",
    "Gunes": "08:18",
    "GunesBatis": "18:38",
    "GunesDogus": "08:25",
    "Ikindi": "16:24",
    "Imsak": "06:59",
    "KibleSaati": "22:31",
    "Ogle": "13:37",
    "Yatsi": "19:59"
  },
  {
    "HicriTarihKisa": "22.6.1447",
    "HicriTarihKisaIso8601": null,
    "HicriTarihUzun": "22 Cemaziyelahir 1447",
    "HicriTarihUzunIso8601": null,
    "AyinSekliURL": "https://namazvakti.diyanet.gov.tr/images/sondordun.gif",
    "MiladiTarihKisa": "12.12.2025",
    "MiladiTarihKisaIso8601": "12.12.2025",
    "MiladiTarihUzun": "12 Aralık 2025 Cuma",
    "MiladiTarihUzunIso8601": "2025-12-12T00:00:00.0000000+01:00",
    "GreenwichOrtalamaZamani": 3.0,
    "Aksam": "18:45",
    "Gunes": "08:19",
    "GunesBatis": "18:38",
    "GunesDogus": "08:26",
    "Ikindi": "16:24",
    "Imsak": "07:00",
    "KibleSaati": "22:33",
    "Ogle": "13:37",
    "Yatsi": "19:59"
  },
  {
    "HicriTarihKisa": "23.6.1447",
    "HicriTarihKisaIso8601": null,
    "HicriTarihUzun": "23 Cemaziyelahir 1447",
    "HicriTarihUzunIso8601": null,
    "AyinSekliURL": "https://namazvakti.diyanet.gov.tr/images/sd1.gif",
    "MiladiTarihKisa": "13.12.2025",
    "MiladiTarihKisaIso8601": "13.12.2025",
    "MiladiTarihUzun": "13 Aralık 2025 Cumartesi",
    "MiladiTarihUzunIso8601": "2025-12-13T00:00:00.0000000+01:00",
    "GreenwichOrtalamaZamani": 3.0,
    "Aksam": "18:46",
    "Gunes": "08:19",
    "GunesBatis": "18:39",
    "GunesDogus": "08:26",
    "Ikindi": "16:24",
    "Imsak": "07:01",
    "KibleSaati": "22:34",
    "Ogle": "13:38",
    "Yatsi": "20:00"
  },
  {
    "HicriTarihKisa": "24.6.1447",
    "HicriTarihKisaIso8601": null,
    "HicriTarihUzun": "24 Cemaziyelahir 1447",
    "HicriTarihUzunIso8601": null,
    "AyinSekliURL": "https://namazvakti.diyanet.gov.tr/images/sd2.gif",
    "MiladiTarihKisa": "14.12.2025",
    "MiladiTarihKisaIso8601": "14.12.2025",
    "MiladiTarihUzun": "14 Aralık 2025 Pazar",
    "MiladiTarihUzunIso8601": "2025-12-14T00:00:00.0000000+01:00",
    "GreenwichOrtalamaZamani": 3.0,
    "Aksam": "18:46",
    "Gunes": "08:20",
    "GunesBatis": "18:39",
    "GunesDogus": "08:27",
    "Ikindi": "16:25",
    "Imsak": "07:01",
    "KibleSaati": "22:35",
    "Ogle": "13:38",
    "Yatsi": "20:00"
  },
  {
    "HicriTarihKisa": "25.6.1447",
    "HicriTarihKisaIso8601": null,
    "HicriTarihUzun": "25 Cemaziyelahir 1447",
    "HicriTarihUzunIso8601": null,
    "AyinSekliURL": "https://namazvakti.diyanet.gov.tr/images/sd3.gif",
    "MiladiTarihKisa": "15.12.2025",
    "MiladiTarihKisaIso8601": "15.12.2025",
    "MiladiTarihUzun": "15 Aralık 2025 Pazartesi",
    "MiladiTarihUzunIso8601": "2025-12-15T00:00:00.0000000+01:00",
    "GreenwichOrtalamaZamani": 3.0,
    "Aksam": "18:46",
    "Gunes": "08:21",
    "GunesBatis": "18:39",
    "GunesDogus": "08:28",
    "Ikindi": "16:25",
    "Imsak": "07:02",
    "KibleSaati": "22:36",
    "Ogle": "13:38",
    "Yatsi": "20:00"
  },
  {
    "HicriTarihKisa": "26.6.1447",
    "HicriTarihKisaIso8601": null,
    "HicriTarihUzun": "26 Cemaziyelahir 1447",
    "HicriTarihUzunIso8601": null,
    "AyinSekliURL": "https://namazvakti.diyanet.gov.tr/images/sd4.gif",
    "MiladiTarihKisa": "16.12.2025",
    "MiladiTarihKisaIso8601": "16.12.2025",
    "MiladiTarihUzun": "16 Aralık 2025 Salı",
    "MiladiTarihUzunIso8601": "2025-12-16T00:00:00.0000000+01:00",
    "GreenwichOrtalamaZamani": 3.0,
    "Aksam": "18:47",
    "Gunes": "08:21",
    "GunesBatis": "18:40",
    "GunesDogus": "08:28",
    "Ikindi": "16:25",
    "Imsak": "07:02",
    "KibleSaati": "22:37",
    "Ogle": "13:39",
    "Yatsi": "20:01"
  },
  {
    "HicriTarihKisa": "27.6.1447",
    "HicriTarihKisaIso8601": null,
    "HicriTarihUzun": "27 Cemaziyelahir 1447",
    "HicriTarihUzunIso8601": null,
    "AyinSekliURL": "https://namazvakti.diyanet.gov.tr/images/sd5.gif",
    "MiladiTarihKisa": "17.12.2025",
    "MiladiTarihKisaIso8601": "17.12.2025",
    "MiladiTarihUzun": "17 Aralık 2025 Çarşamba",
    "MiladiTarihUzunIso8601": "2025-12-17T00:00:00.0000000+01:00",
    "GreenwichOrtalamaZamani": 3.0,
    "Aksam": "18:47",
    "Gunes": "08:22",
    "GunesBatis": "18:40",
    "GunesDogus": "08:29",
    "Ikindi": "16:26",
    "Imsak": "07:03",
    "KibleSaati": "22:38",
    "Ogle": "13:39",
    "Yatsi": "20:01"
  },
  {
    "HicriTarihKisa": "28.6.1447",
    "HicriTarihKisaIso8601": null,
    "HicriTarihUzun": "28 Cemaziyelahir 1447",
    "HicriTarihUzunIso8601": null,
    "AyinSekliURL": "https://namazvakti.diyanet.gov.tr/images/sd6.gif",
    "MiladiTarihKisa": "18.12.2025",
    "MiladiTarihKisaIso8601": "18.12.2025",
    "MiladiTarihUzun": "18 Aralık 2025 Perşembe",
    "MiladiTarihUzunIso8601": "2025-12-18T00:00:00.0000000+01:00",
    "GreenwichOrtalamaZamani": 3.0,
    "Aksam": "18:47",
    "Gunes": "08:22",
    "GunesBatis": "18:40",
    "GunesDogus": "08:29",
    "Ikindi": "16:26",
    "Imsak": "07:04",
    "KibleSaati": "22:39",
    "Ogle": "13:40",
    "Yatsi": "20:01"
  },
  {
    "HicriTarihKisa": "29.6.1447",
    "HicriTarihKisaIso8601": null,
    "HicriTarihUzun": "29 Cemaziyelahir 1447",
    "HicriTarihUzunIso8601": null,
    "AyinSekliURL": "https://namazvakti.diyanet.gov.tr/images/sd7.gif",
    "MiladiTarihKisa": "19.12.2025",
    "MiladiTarihKisaIso8601": "19.12.2025",
    "MiladiTarihUzun": "19 Aralık 2025 Cuma",
    "MiladiTarihUzunIso8601": "2025-12-19T00:00:00.0000000+01:00",
    "GreenwichOrtalamaZamani": 3.0,
    "Aksam": "18:48",
    "Gunes": "08:23",
    "GunesBatis": "18:41",
    "GunesDogus": "08:30",
    "Ikindi": "16:26",
    "Imsak": "07:04",
    "KibleSaati": "22:40",
    "Ogle": "13:40",
    "Yatsi": "20:02"
  }
]