[
  {
    "HicriTarihKisa": "23.4.1447",
    "HicriTarihKisaIso8601": null,
    "HicriTarihUzun": "23 Rebiulahir 1447",
    "HicriTarihUzunIso8601": null,
    "AyinSekliURL": "https://namazvakti.diyanet.gov.tr/images/sd2.gif",
    "MiladiTarihKisa": "15.10.2025",
    "MiladiTarihKisaIso8601": "15.10.2025",
    "MiladiTarihUzun": "15 Ekim 2025 Çarşamba",
    "MiladiTarihUzunIso8601": "2025-10-15T00:00:00.0000000+02:00",
    "GreenwichOrtalamaZamani": 3.0,
    "Aksam": "17:50",
    "Gunes": "07:19",
    "GunesBatis": "17:43",
    "GunesDogus": "07:26",
    "Ikindi": "15:05",
    "Imsak": "05:10",
    "KibleSaati": "10:31",
    "Ogle": "12:40",
    "Yatsi": "19:43"
  },
  {
    "HicriTarihKisa": "24.4.1447",
    "HicriTarihKisaIso8601": null,
    "HicriTarihUzun": "24 Rebiulahir 1447",
    "HicriTarihUzunIso8601": null,
    "AyinSekliURL": "https://namazvakti.diyanet.gov.tr/images/sd3.gif",
    "MiladiTarihKisa": "16.10.2025",
    "MiladiTarihKisaIso8601": "16.10.2025",
    "MiladiTarihUzun": "16 Ekim 2025 Perşembe",
    "MiladiTarihUzunIso8601": "2025-10-16T00:00:00.0000000+02:00",
    "GreenwichOrtalamaZamani": 3.0,
    "Aksam": "17:47",
    "Gunes": "07:22",
    "GunesBatis": "17:40",
    "GunesDogus": "07:29",
    "Ikindi": "15:03",
    "Imsak": "05:13",
    "KibleSaati": "10:31",
    "Ogle": "12:39",
    "Yatsi": "19:40"
  },
  {
    "HicriTarihKisa": "25.4.1447",
    "HicriTarihKisaIso8601": null,
    "HicriTarihUzun": "25 Rebiulahir 1447",
    "HicriTarihUzunIso8601": null,
    "AyinSekliURL": "https://namazvakti.diyanet.gov.tr/images/sd4.gif",
    "MiladiTarihKisa": "17.10.2025",
    "MiladiTarihKisaIso8601": "17.10.2025",
    "MiladiTarihUzun": "17 Ekim 2025 Cuma",
    "MiladiTarihUzunIso8601": "2025-10-17T00:00:00.0000000+02:00",
    "GreenwichOrtalamaZamani": 3.0,
    "Aksam": "17:44",
    "Gunes": "07:24",
    "GunesBatis": "17:37",
    "GunesDogus": "07:31",
    "Ikindi": "15:01",
    "Imsak": "05:15",
    "KibleSaati": "10:30",
    "Ogle": "12:39",
    "Yatsi": "19:37"
  },
  {
    "HicriTarihKisa": "26.4.1447",
    "HicriTarihKisaIso8601": null,
    "HicriTarihUzun": "26 Rebiulahir 1447",
    "HicriTarihUzunIso8601": null,
    "AyinSekliURL": "https://namazvakti.diyanet.gov.tr/images/sd5.gif",
    "MiladiTarihKisa": "18.10.2025",
    "MiladiTarihKisaIso8601": "18.10.2025",
    "MiladiTarihUzun": "18 Ekim 2025 Cumartesi",
    "MiladiTarihUzunIso8601": "2025-10-18T00:00:00.0000000+02:00",
    "GreenwichOrtalamaZamani": 3.0,
    "Aksam": "17:42",
    "Gunes": "07:26",
    "GunesBatis": "17:35",
    "GunesDogus": "07:33",
    "Ikindi": "14:59",
    "Imsak": "05:17",
    "KibleSaati": "10:29",
    "Ogle": "12:39",
    "Yatsi": "19:35"
  },
  {
    "HicriTarihKisa": "27.4.1447",
    "HicriTarihKisaIso8601": null,
    "HicriTarihUzun": "27 Rebiulahir 1447",
    "HicriTarihUzunIso8601": null,
    "AyinSekliURL": "https://namazvakti.diyanet.gov.tr/images/sd6.gif",
    "MiladiTarihKisa": "19.10.2025",
    "MiladiTarihKisaIso8601": "19.10.2025",
    "MiladiTarihUzun": "19 Ekim 2025 Pazar",
    "MiladiTarihUzunIso8601": "2025-10-19T00:00:00.0000000+02:00",
    "GreenwichOrtalamaZamani": 3.0,
    "Aksam": "17:39",
    "Gunes": "07:29",
    "GunesBatis": "17:32",
    "GunesDogus": "07:36",
    "Ikindi": "14:56",
    "Imsak": "05:20",
    "KibleSaati": "10:29",
    "Ogle": "12:39",
    "Yatsi": "19:32"
  },
  {
    "HicriTarihKisa": "28.4.1447",
    "HicriTarihKisaIso8601": null,
    "HicriTarihUzun": "28 Rebiulahir 1447",
    "HicriTarihUzunIso8601": null,
    "AyinSekliURL": "https://namazvakti.diyanet.gov.tr/images/sd7.gif",
    "MiladiTarihKisa": "20.10.2025",
    "MiladiTarihKisaIso8601": "20.10.2025",
    "MiladiTarihUzun": "20 Ekim 2025 Pazartesi",
    "MiladiTarihUzunIso8601": "2025-10-20T00:00:00.0000000+02:00",
    "GreenwichOrtalamaZamani": 3.0,
    "Aksam": "17:36",
    "Gunes": "07:31",
    "GunesBatis": "17:29",
    "GunesDogus": "07:38",
    "Ikindi": "14:54",
    "Imsak": "05:22",
    "KibleSaati": "10:28",
    "Ogle": "12:39",
    "Yatsi": "19:29"
  },
  {
    "HicriTarihKisa": "29.4.1447",
    "HicriTarihKisaIso8601": null,
    "HicriTarihUzun": "29 Rebiulahir 1447",
    "HicriTarihUzunIso8601": null,
    "AyinSekliURL": "https://namazvakti.diyanet.gov.tr/images/ictima.gif",
    "MiladiTarihKisa": "21.10.2025",
    "MiladiTarihKisaIso8601": "21.10.2025",
    "MiladiTarihUzun": "21 Ekim 2025 Salı",
    "MiladiTarihUzunIso8601": "2025-10-21T00:00:00.0000000+02:00",
    "GreenwichOrtalamaZamani": 3.0,
    "Aksam": "17:33",
    "Gunes": "07:34",
    "GunesBatis": "17:26",
    "GunesDogus": "07:41",
    "Ikindi": "14:52",
    "Imsak": "05:24",
    "KibleSaati": "10:28",
    "Ogle": "12:38",
    "Yatsi": "19:27"
  },
  {
    "HicriTarihKisa": "30.4.1447",
    "HicriTarihKisaIso8601": null,
    "HicriTarihUzun": "30 Rebiulahir 1447",
    "HicriTarihUzunIso8601": null,
    "AyinSekliURL": "https://namazvakti.diyanet.gov.tr/images/ruyet.gif",
    "MiladiTarihKisa": "22.10.2025",
    "MiladiTarihKisaIso8601": "22.10.2025",
    "MiladiTarihUzun": "22 Ekim 2025 Çarşamba",
    "MiladiTarihUzunIso8601": "2025-10-22T00:00:00.0000000+02:00",
    "GreenwichOrtalamaZamani": 3.0,
    "Aksam": "17:31",
    "Gunes": "07:36",
    "GunesBatis": "17:24",
    "GunesDogus": "07:43",
    "Ikindi": "14:50",
    "Imsak": "05:27",
    "KibleSaati": "10:27",
    "Ogle": "12:38",
    "Yatsi": "19:24"
  },
  {
    "HicriTarihKisa": "1.5.1447",
    "HicriTarihKisaIso8601": null,
    "HicriTarihUzun": "1 Cemaziyelevvel 1447",
    "HicriTarihUzunIso8601": null,
    "AyinSekliURL": "https://namazvakti.diyanet.gov.tr/images/r1.gif",
    "MiladiTarihKisa": "23.10.2025",
    "MiladiTarihKisaIso8601": "23.10.2025",
    "MiladiTarihUzun": "23 Ekim 2025 Perşembe",
    "MiladiTarihUzunIso8601": "2025-10-23T00:00:00.0000000+02:00",
    "GreenwichOrtalamaZamani": 3.0,
    "Aksam": "17:28",
    "Gunes": "07:38",
    "GunesBatis": "17:21",
    "GunesDogus": "07:45",
    "Ikindi": "14:48",
    "Imsak": "05:29",
    "KibleSaati": "10:26",
    "Ogle": "12:38",
    "Yatsi": "19:22"
  },
  {
    "HicriTarihKisa": "2.5.1447",
    "HicriTarihKisaIso8601": null,
    "HicriTarihUzun": "2 Cemaziyelevvel 1447",
    "HicriTarihUzunIso8601": null,
    "AyinSekliURL": "https://namazvakti.diyanet.gov.tr/images/r2.gif",
    "MiladiTarihKisa": "24.10.2025",
    "MiladiTarihKisaIso8601": "24.10.2025",
    "MiladiTarihUzun": "24 Ekim 2025 Cuma",
    "MiladiTarihUzunIso8601": "2025-10-24T00:00:00.0000000+02:00",
    "GreenwichOrtalamaZamani": 3.0,
    "Aksam": "17:25",
    "Gunes": "07:41",
    "GunesBatis": "17:18",
    "GunesDogus": "07:48",
    "Ikindi": "14:46",
    "Imsak": "05:31",
    "KibleSaati": "10:26",
    "Ogle": "12:38",
    "Yatsi": "19:19"
  },
  {
    "HicriTarihKisa": "3.5.1447",
    "HicriTarihKisaIso8601": null,
    "HicriTarihUzun": "3 Cemaziyelevvel 1447",
    "HicriTarihUzunIso8601": null,
    "AyinSekliURL": "https://namazvakti.diyanet.gov.tr/images/r3.gif",
    "MiladiTarihKisa": "25.10.2025",
    "MiladiTarihKisaIso8601": "25.10.2025",
    "MiladiTarihUzun": "25 Ekim 2025 Cumartesi",
    "MiladiTarihUzunIso8601": "2025-10-25T00:00:00.0000000+02:00",
    "GreenwichOrtalamaZamani": 3.0,
    "Aksam": "17:22",
    "Gunes": "07:43",
    "GunesBatis": "17:15",
    "GunesDogus": "07:50",
    "Ikindi": "14:44",
    "Imsak": "05:33",
    "KibleSaati": "10:25",
    "Ogle": "12:38",
    "Yatsi": "19:17"
  },
  {
    "HicriTarihKisa": "4.5.1447",
    "HicriTarihKisaIso8601": null,
    "HicriTarihUzun": "4 Cemaziyelevvel 1447",
    "HicriTarihUzunIso8601": null,
    "AyinSekliURL": "https://namazvakti.diyanet.gov.tr/images/r4.gif",
    "MiladiTarihKisa": "26.10.2025",
    "MiladiTarihKisaIso8601": "26.10.2025",
    "MiladiTarihUzun": "26 Ekim 2025 Pazar",
    "MiladiTarihUzunIso8601": "2025-10-26T00:00:00.0000000+02:00",
    "GreenwichOrtalamaZamani": 3.0,
    "Aksam": "16:20",
    "Gunes": "06:46",
    "GunesBatis": "16:13",
    "GunesDogus": "06:53",
    "Ikindi": "13:42",
    "Imsak": "04:35",
    "KibleSaati": "09:25",
    "Ogle": "11:38",
    "Yatsi": "18:14"
  },
  {
    "HicriTarihKisa": "5.5.1447",
    "HicriTarihKisaIso8601": null,
    "HicriTarihUzun": "5 Cemaziyelevvel 1447",
    "HicriTarihUzunIso8601": null,
    "AyinSekliURL": "https://namazvakti.diyanet.gov.tr/images/r5.gif",
    "MiladiTarihKisa": "27.10.2025",
    "MiladiTarihKisaIso8601": "27.10.2025",
    "MiladiTarihUzun": "27 Ekim 2025 Pazartesi",
    "MiladiTarihUzunIso8601": "2025-10-27T00:00:00.0000000+02:00",
    "GreenwichOrtalamaZamani": 3.0,
    "Aksam": "16:17",
    "Gunes": "06:48",
    "GunesBatis": "16:10",
    "GunesDogus": "06:55",
    "Ikindi": "13:40",
    "Imsak": "04:38",
    "KibleSaati": "09:24",
    "Ogle": "11:38",
    "Yatsi": "18:12"
  },
  {
    "HicriTarihKisa": "6.5.1447",
    "HicriTarihKisaIso8601": null,
    "HicriTarihUzun": "6 Cemaziyelevvel 1447",
    "HicriTarihUzunIso8601": null,
    "AyinSekliURL": "https://namazvakti.diyanet.gov.tr/images/r6.gif",
    "MiladiTarihKisa": "28.10.2025",
    "MiladiTarihKisaIso8601": "28.10.2025",
    "MiladiTarihUzun": "28 Ekim 2025 Salı",
    "MiladiTarihUzunIso8601": "2025-10-28T00:00:00.0000000+02:00",
    "GreenwichOrtalamaZamani": 3.0,
    "Aksam": "16:14",
    "Gunes": "06:51",
    "GunesBatis": "16:07",
    "GunesDogus": "06:58",
    "Ikindi": "13:38",
    "Imsak": "04:40",
    "KibleSaati": "09:24",
    "Ogle": "11:38",
    "Yatsi": "18:10"
  },
  {
    "HicriTarihKisa": "7.5.1447",
    "HicriTarihKisaIso8601": null,
    "HicriTarihUzun": "7 Cemaziyelevvel 1447",
    "HicriTarihUzunIso8601": null,
    "AyinSekliURL": "https://namazvakti.diyanet.gov.tr/images/ilkdordun.gif",
    "MiladiTarihKisa": "29.10.2025",
    "MiladiTarihKisaIso8601": "29.10.2025",
    "MiladiTarihUzun": "29 Ekim 2025 Çarşamba",
    "MiladiTarihUzunIso8601": "2025-10-29T00:00:00.0000000+02:00",
    "GreenwichOrtalamaZamani": 3.0,
    "Aksam": "16:12",
    "Gunes": "06:53",
    "GunesBatis": "16:05",
    "GunesDogus": "07:00",
    "Ikindi": "13:36",
    "Imsak": "04:42",
    "KibleSaati": "09:23",
    "Ogle": "11:38",
    "Yatsi": "18:07"
  },
  {
    "HicriTarihKisa": "8.5.1447",
    "HicriTarihKisaIso8601": null,
    "HicriTarihUzun": "8 Cemaziyelevvel 1447",
    "HicriTarihUzunIso8601": null,
    "AyinSekliURL": "https://namazvakti.diyanet.gov.tr/images/i1.gif",
    "MiladiTarihKisa": "30.10.2025",
    "MiladiTarihKisaIso8601": "30.10.2025",
    "MiladiTarihUzun": "30 Ekim 2025 Perşembe",
    "MiladiTarihUzunIso8601": "2025-10-30T00:00:00.0000000+02:00",
    "GreenwichOrtalamaZamani": 3.0,
    "Aksam": "16:09",
    "Gunes": "06:56",
    "GunesBatis": "16:02",
    "GunesDogus": "07:03",
    "Ikindi": "13:34",
    "Imsak": "04:44",
    "KibleSaati": "09:23",
    "Ogle": "11:37",
    "Yatsi": "18:05"
  },
  {
    "HicriTarihKisa": "9.5.1447",
    "HicriTarihKisaIso8601": null,
    "HicriTarihUzun": "9 Cemaziyelevvel 1447",
    "HicriTarihUzunIso8601": null,
    "AyinSekliURL": "https://namazvakti.diyanet.gov.tr/images/i2.gif",
    "MiladiTarihKisa": "31.10.2025",
    "MiladiTarihKisaIso8601": "31.10.2025",
    "MiladiTarihUzun": "31 Ekim 2025 Cuma",
    "MiladiTarihUzunIso8601": "2025-10-31T00:00:00.0000000+02:00",
    "GreenwichOrtalamaZamani": 3.0,
    "Aksam": "16:07",
    "Gunes": "06:58",
    "GunesBatis": "16:00",
    "GunesDogus": "07:05",
    "Ikindi": "13:32",
    "Imsak": "04:46",
    "KibleSaati": "09:23",
    "Ogle": "11:37",
    "Yatsi": "18:03"
  },
  {
    "HicriTarihKisa": "10.5.1447",
    "HicriTarihKisaIso8601": null,
    "HicriTarihUzun": "10 Cemaziyelevvel 1447",
    "HicriTarihUzunIso8601": null,
    "AyinSekliURL": "https://namazvakti.diyanet.gov.tr/images/i3.gif",
    "MiladiTarihKisa": "01.11.2025",
    "MiladiTarihKisaIso8601": "01.11.2025",
    "MiladiTarihUzun": "01 Kasım 2025 Cumartesi",
    "MiladiTarihUzunIso8601": "2025-11-01T00:00:00.0000000+02:00",
    "GreenwichOrtalamaZamani": 3.0,
    "Aksam": "16:04",
    "Gunes": "07:01",
    "GunesBatis": "15:57",
    "GunesDogus": "07:08",
    "Ikindi": "13:30",
    "Imsak": "04:48",
    "KibleSaati": "09:22",
    "Ogle": "11:37",
    "Yatsi": "18:01"
  },
  {
    "HicriTarihKisa": "11.5.1447",
    "HicriTarihKisaIso8601": null,
    "HicriTarihUzun": "11 Cemaziyelevvel 1447",
    "HicriTarihUzunIso8601": null,
    "AyinSekliURL": "https://namazvakti.diyanet.gov.tr/images/i4.gif",
    "MiladiTarihKisa": "02.11.2025",
    "MiladiTarihKisaIso8601": "02.11.2025",
    "MiladiTarihUzun": "02 Kasım 2025 Pazar",
    "MiladiTarihUzunIso8601": "2025-11-02T00:00:00.0000000+02:00",
    "GreenwichOrtalamaZamani": 3.0,
    "Aksam": "16:02",
    "Gunes": "07:03",
    "GunesBatis": "15:55",
    "GunesDogus": "07:10",
    "Ikindi": "13:29",
    "Imsak": "04:50",
    "KibleSaati": "09:22",
    "Ogle": "11:37",
    "Yatsi": "17:59"
  },
  {
    "HicriTarihKisa": "12.5.1447",
    "HicriTarihKisaIso8601": null,
    "HicriTarihUzun": "12 Cemaziyelevvel 1447",
    "HicriTarihUzunIso8601": null,
    "AyinSekliURL": "https://namazvakti.diyanet.gov.tr/images/i5.gif",
    "MiladiTarihKisa": "03.11.2025",
    "MiladiTarihKisaIso8601": "03.11.2025",
    "MiladiTarihUzun": "03 Kasım 2025 Pazartesi",
    "MiladiTarihUzunIso8601": "2025-11-03T00:00:00.0000000+02:00",
    "GreenwichOrtalamaZamani": 3.0,
    "Aksam": "15:59",
    "Gunes": "07:05",
    "GunesBatis": "15:52",
    "GunesDogus": "07:12",
    "Ikindi": "13:27",
    "Imsak": "04:52",
    "KibleSaati": "09:21",
    "Ogle": "11:37",
    "Yatsi": "17:57"
  },
  {
    "HicriTarihKisa": "13.5.1447",
    "HicriTarihKisaIso8601": null,
    "HicriTarihUzun": "13 Cemaziyelevvel 1447",
    "HicriTarihUzunIso8601": null,
    "AyinSekliURL": "https://namazvakti.diyanet.gov.tr/images/i6.gif",
    "MiladiTarihKisa": "04.11.2025",
    "MiladiTarihKisaIso8601": "04.11.2025",
    "MiladiTarihUzun": "04 Kasım 2025 Salı",
    "MiladiTarihUzunIso8601": "2025-11-04T00:00:00.0000000+02:00",
    "GreenwichOrtalamaZamani": 3.0,
    "Aksam": "15:57",
    "Gunes": "07:08",
    "GunesBatis": "15:50",
    "GunesDogus": "07:15",
    "Ikindi": "13:25",
    "Imsak": "04:54",
    "KibleSaati": "09:21",
    "Ogle": "11:37",
    "Yatsi": "17:55"
  },
  {
    "HicriTarihKisa": "14.5.1447",
    "HicriTarihKisaIso8601": null,
    "HicriTarihUzun": "14 Cemaziyelevvel 1447",
    "HicriTarihUzunIso8601": null,
    "AyinSekliURL": "https://namazvakti.diyanet.gov.tr/images/dolunay.gif",
    "MiladiTarihKisa": "05.11.2025",
    "MiladiTarihKisaIso8601": "05.11.2025",
    "MiladiTarihUzun": "05 Kasım 2025 Çarşamba",
    "MiladiTarihUzunIso8601": "2025-11-05T00:00:00.0000000+02:00",
    "GreenwichOrtalamaZamani": 3.0,
    "Aksam": "15:54",
    "Gunes": "07:10",
    "GunesBatis": "15:47",
    "GunesDogus": "07:17",
    "Ikindi": "13:23",
    "Imsak": "04:57",
    "KibleSaati": "09:21",
    "Ogle": "11:37",
    "Yatsi": "17:53"
  },
  {
    "HicriTarihKisa": "15.5.1447",
    "HicriTarihKisaIso8601": null,
    "HicriTarihUzun": "15 Cemaziyelevvel 1447",
    "HicriTarihUzunIso8601": null,
    "AyinSekliURL": "https://namazvakti.diyanet.gov.tr/images/d1.gif",
    "MiladiTarihKisa": "06.11.2025",
    "MiladiTarihKisaIso8601": "06.11.2025",
    "MiladiTarihUzun": "06 Kasım 2025 Perşembe",
    "MiladiTarihUzunIso8601": "2025-11-06T00:00:00.0000000+02:00",
    "GreenwichOrtalamaZamani": 3.0,
    "Aksam": "15:52",
    "Gunes": "07:13",
    "GunesBatis": "15:45",
    "GunesDogus": "07:20",
    "Ikindi": "13:21",
    "Imsak": "04:59",
    "KibleSaati": "09:20",
    "Ogle": "11:37",
    "Yatsi": "17:51"
  },
  {
    "HicriTarihKisa": "16.5.1447",
    "HicriTarihKisaIso8601": null,
    "HicriTarihUzun": "16 Cemaziyelevvel 1447",
    "HicriTarihUzunIso8601": null,
    "AyinSekliURL": "https://namazvakti.diyanet.gov.tr/images/d2.gif",
    "MiladiTarihKisa": "07.11.2025",
    "MiladiTarihKisaIso8601": "07.11.2025",
    "MiladiTarihUzun": "07 Kasım 2025 Cuma",
    "MiladiTarihUzunIso8601": "2025-11-07T00:00:00.0000000+02:00",
    "GreenwichOrtalamaZamani": 3.0,
    "Aksam": "15:50",
    "Gunes": "07:15",
    "GunesBatis": "15:43",
    "GunesDogus": "07:22",
    "Ikindi": "13:20",
    "Imsak": "05:01",
    "KibleSaati": "09:20",
    "Ogle": "11:37",
    "Yatsi": "17:49"
  },
  {
    "HicriTarihKisa": "17.5.1447",
    "HicriTarihKisaIso8601": null,
    "HicriTarihUzun": "17 Cemaziyelevvel 1447",
    "HicriTarihUzunIso8601": null,
    "AyinSekliURL": "https://namazvakti.diyanet.gov.tr/images/d3.gif",
    "MiladiTarihKisa": "08.11.2025",
    "MiladiTarihKisaIso8601": "08.11.2025",
    "MiladiTarihUzun": "08 Kasım 2025 Cumartesi",
    "MiladiTarihUzunIso8601": "2025-11-08T00:00:00.0000000+02:00",
    "GreenwichOrtalamaZamani": 3.0,
    "Aksam": "15:47",
    "Gunes": "07:18",
    "GunesBatis": "15:40",
    "GunesDogus": "07:25",
    "Ikindi": "13:18",
    "Imsak": "05:03",
    "KibleSaati": "09:20",
    "Ogle": "11:37",
    "Yatsi": "17:47"
  },
  {
    "HicriTarihKisa": "18.5.1447",
    "HicriTarihKisaIso8601": null,
    "HicriTarihUzun": "18 Cemaziyelevvel 1447",
    "HicriTarihUzunIso8601": null,
    "AyinSekliURL": "https://namazvakti.diyanet.gov.tr/images/d4.gif",
    "MiladiTarihKisa": "09.11.2025",
    "MiladiTarihKisaIso8601": "09.11.2025",
    "MiladiTarihUzun": "09 Kasım 2025 Pazar",
    "MiladiTarihUzunIso8601": "2025-11-09T00:00:00.0000000+02:00",
    "GreenwichOrtalamaZamani": 3.0,
    "Aksam": "15:45",
    "Gunes": "07:20",
    "GunesBatis": "15:38",
    "GunesDogus": "07:27",
    "Ikindi": "13:16",
    "Imsak": "05:05",
    "KibleSaati": "09:19",
    "Ogle": "11:38",
    "Yatsi": "17:45"
  },
  {
    "HicriTarihKisa": "19.5.1447",
    "HicriTarihKisaIso8601": null,
    "HicriTarihUzun": "19 Cemaziyelevvel 1447",
    "HicriTarihUzunIso8601": null,
    "AyinSekliURL": "https://namazvakti.diyanet.gov.tr/images/d5.gif",
    "MiladiTarihKisa": "10.11.2025",
    "MiladiTarihKisaIso8601": "10.11.2025",
    "MiladiTarihUzun": "10 Kasım 2025 Pazartesi",
    "MiladiTarihUzunIso8601": "2025-11-10T00:00:00.0000000+02:00",
    "GreenwichOrtalamaZamani": 3.0,
    "Aksam": "15:43",
    "Gunes": "07:23",
    "GunesBatis": "15:36",
    "GunesDogus": "07:30",
    "Ikindi": "13:15",
    "Imsak": "05:07",
    "KibleSaati": "09:19",
    "Ogle": "11:38",
    "Yatsi": "17:43"
  },
  {
    "HicriTarihKisa": "20.5.1447",
    "HicriTarihKisaIso8601": null,
    "HicriTarihUzun": "20 Cemaziyelevvel 1447",
    "HicriTarihUzunIso8601": null,
    "AyinSekliURL": "https://namazvakti.diyanet.gov.tr/images/d6.gif",
    "MiladiTarihKisa": "11.11.2025",
    "MiladiTarihKisaIso8601": "11.11.2025",
    "MiladiTarihUzun": "11 Kasım 2025 Salı",
    "MiladiTarihUzunIso8601": "2025-11-11T00:00:00.0000000+02:00",
    "GreenwichOrtalamaZamani": 3.0,
    "Aksam": "15:40",
    "Gunes": "07:25",
    "GunesBatis": "15:33",
    "GunesDogus": "07:32",
    "Ikindi": "13:13",
    "Imsak": "05:08",
    "KibleSaati": "09:19",
    "Ogle": "11:38",
    "Yatsi": "17:41"
  },
  {
    "HicriTarihKisa": "21.5.1447",
    "HicriTarihKisaIso8601": null,
    "HicriTarihUzun": "21 Cemaziyelevvel 1447",
    "HicriTarihUzunIso8601": null,
    "AyinSekliURL": "https://namazvakti.diyanet.gov.tr/images/sondordun.gif",
    "MiladiTarihKisa": "12.11.2025",
    "MiladiTarihKisaIso8601": "12.11.2025",
    "MiladiTarihUzun": "12 Kasım 2025 Çarşamba",
    "MiladiTarihUzunIso8601": "2025-11-12T00:00:00.0000000+02:00",
    "GreenwichOrtalamaZamani": 3.0,
    "Aksam": "15:38",
    "Gunes": "07:28",
    "GunesBatis": "15:31",
    "GunesDogus": "07:35",
    "Ikindi": "13:11",
    "Imsak": "05:10",
    "KibleSaati": "09:19",
    "Ogle": "11:38",
    "Yatsi": "17:40"
  },
  {
    "HicriTarihKisa": "22.5.1447",
    "HicriTarihKisaIso8601": null,
    "HicriTarihUzun": "22 Cemaziyelevvel 1447",
    "HicriTarihUzunIso8601": null,
    "AyinSekliURL": "https://namazvakti.diyanet.gov.tr/images/sd1.gif",
    "MiladiTarihKisa": "13.11.2025",
    "MiladiTarihKisaIso8601": "13.11.2025",
    "MiladiTarihUzun": "13 Kasım 2025 Perşembe",
    "MiladiTarihUzunIso8601": "2025-11-13T00:00:00.0000000+02:00",
    "GreenwichOrtalamaZamani": 3.0,
    "Aksam": "15:36",
    "Gunes": "07:30",
    "GunesBatis": "15:29",
    "GunesDogus": "07:37",
    "Ikindi": "13:10",
    "Imsak": "05:12",
    "KibleSaati": "09:18",
    "Ogle": "11:38",
    "Yatsi": "17:38"
  },
  {
    "HicriTarihKisa": "23.5.1447",
    "HicriTarihKisaIso8601": null,
    "HicriTarihUzun": "23 Cemaziyelevvel 1447",
    "HicriTarihUzunIso8601": null,
    "AyinSekliURL": "https://namazvakti.diyanet.gov.tr/images/sd2.gif",
    "MiladiTarihKisa": "14.11.2025",
    "MiladiTarihKisaIso8601": "14.11.2025",
    "MiladiTarihUzun": "14 Kasım 2025 Cuma",
    "MiladiTarihUzunIso8601": "2025-11-14T00:00:00.0000000+02:00",
    "GreenwichOrtalamaZamani": 3.0,
    "Aksam": "15:34",
    "Gunes": "07:33",
    "GunesBatis": "15:27",
    "GunesDogus": "07:40",
    "Ikindi": "13:08",
    "Imsak": "05:14",
    "KibleSaati": "09:18",
    "Ogle": "11:38",
    "Yatsi": "17:36"
  },
  {
    "HicriTarihKisa": "24.5.1447",
    "HicriTarihKisaIso8601": null,
    "HicriTarihUzun": "24 Cemaziyelevvel 1447",
    "HicriTarihUzunIso8601": null,
    "AyinSekliURL": "https://namazvakti.diyanet.gov.tr/images/sd3.gif",
    "MiladiTarihKisa": "15.11.2025",
    "MiladiTarihKisaIso8601": "15.11.2025",
    "MiladiTarihUzun": "15 Kasım 2025 Cumartesi",
    "MiladiTarihUzunIso8601": "2025-11-15T00:00:00.0000000+02:00",
    "GreenwichOrtalamaZamani": 3.0,
    "Aksam": "15:32",
    "Gunes": "07:35",
    "GunesBatis": "15:25",
    "GunesDogus": "07:42",
    "Ikindi": "13:07",
    "Imsak": "05:16",
    "KibleSaati": "09:18",
    "Ogle": "11:38",
    "Yatsi": "17:35"
  }
]