[
  {
    "HicriTarihKisa": "7.6.1447",
    "HicriTarihKisaIso8601": null,
    "HicriTarihUzun": "7 Cemaziyelahir 1447",
    "HicriTarihUzunIso8601": null,
    "AyinSekliURL": "https://namazvakti.diyanet.gov.tr/images/ilkdordun.gif",
    "MiladiTarihKisa": "27.11.2025",
    "MiladiTarihKisaIso8601": "27.11.2025",
    "MiladiTarihUzun": "27 Kasım 2025 Perşembe",
    "MiladiTarihUzunIso8601": "2025-11-27T00:00:00.0000000+10:30",
    "GreenwichOrtalamaZamani": 3.0,
    "Aksam": "20:16",
    "Gunes": "05:33",
    "GunesBatis": "20:09",
    "GunesDogus": "05:40",
    "Ikindi": "16:51",
    "Imsak": "03:50",
    "KibleSaati": "19:36",
    "Ogle": "12:59",
    "Yatsi": "21:51"
  },
  {
    "HicriTarihKisa": "8.6.1447",
    "HicriTarihKisaIso8601": null,
    "HicriTarihUzun": "8 Cemaziyelahir 1447",
    "HicriTarihUzunIso8601": null,
    "AyinSekliURL": "https://namazvakti.diyanet.gov.tr/images/i1.gif",
    "MiladiTarihKisa": "28.11.2025",
    "MiladiTarihKisaIso8601": "28.11.2025",
    "MiladiTarihUzun": "28 Kasım 2025 Cuma",
    "MiladiTarihUzunIso8601": "2025-11-28T00:00:00.0000000+10:30",
    "GreenwichOrtalamaZamani": 3.0,
    "Aksam": "20:17",
    "Gunes": "05:32",
    "GunesBatis": "20:10",
    "GunesDogus": "05:39",
    "Ikindi": "16:52",
    "Imsak": "03:50",
    "KibleSaati": "19:38",
    "Ogle": "13:00",
    "Yatsi": "21:53"
  },
  {
    "HicriTarihKisa": "9.6.1447",
    "HicriTarihKisaIso8601": null,
    "HicriTarihUzun": "9 Cemaziyelahir 1447",
    "HicriTarihUzunIso8601": null,
    "AyinSekliURL": "https://namazvakti.diyanet.gov.tr/images/i2.gif",
    "MiladiTarihKisa": "29.11.2025",
    "MiladiTarihKisaIso8601": "29.11.2025",
    "MiladiTarihUzun": "29 Kasım 2025 Cumartesi",
    "MiladiTarihUzunIso8601": "2025-11-29T00:00:00.0000000+10:30",
    "GreenwichOrtalamaZamani": 3.0,
    "Aksam": "20:18",
    "Gunes": "05:32",
    "GunesBatis": "20:11",
    "GunesDogus": "05:39",
    "Ikindi": "16:52",
    "Imsak": "03:49",
    "KibleSaati": "19:39",
    "Ogle": "13:00",
    "Yatsi": "21:54"
  },
  {
    "HicriTarihKisa": "10.6.1447",
    "HicriTarihKisaIso8601": null,
    "HicriTarihUzun": "10 Cemaziyelahir 1447",
    "HicriTarihUzunIso8601": null,
    "AyinSekliURL": "https://namazvakti.diyanet.gov.tr/images/i3.gif",
    "MiladiTarihKisa": "30.11.2025",
    "MiladiTarihKisaIso8601": "30.11.2025",
    "MiladiTarihUzun": "30 Kasım 2025 Pazar",
    "MiladiTarihUzunIso8601": "2025-11-30T00:00:00.0000000+10:30",
    "GreenwichOrtalamaZamani": 3.0,
    "Aksam": "20:19",
    "Gunes": "05:32",
    "GunesBatis": "20:12",
    "GunesDogus": "05:39",
    "Ikindi": "16:52",
    "Imsak": "03:48",
    "KibleSaati": "19:41",
    "Ogle": "13:00",
    "Yatsi": "21:55"
  },
  {
    "HicriTarihKisa": "11.6.1447",
    "HicriTarihKisaIso8601": null,
    "HicriTarihUzun": "11 Cemaziyelahir 1447",
    "HicriTarihUzunIso8601": null,
    "AyinSekliURL": "https://namazvakti.diyanet.gov.tr/images/i4.gif",
    "MiladiTarihKisa": "01.12.2025",
    "MiladiTarihKisaIso8601": "01.12.2025",
    "MiladiTarihUzun": "01 Aralık 2025 Pazartesi",
    "MiladiTarihUzunIso8601": "2025-12-01T00:00:00.0000000+10:30",
    "GreenwichOrtalamaZamani": 3.0,
    "Aksam": "20:20",
    "Gunes": "05:32",
    "GunesBatis": "20:13",
    "GunesDogus": "05:39",
    "Ikindi": "16:53",
    "Imsak": "03:48",
    "KibleSaati": "19:42",
    "Ogle": "13:01",
    "Yatsi": "21:57"
  },
  {
    "HicriTarihKisa": "12.6.1447",
    "HicriTarihKisaIso8601": null,
    "HicriTarihUzun": "12 Cemaziyelahir 1447",
    "HicriTarihUzunIso8601": null,
    "AyinSekliURL": "https://namazvakti.diyanet.gov.tr/images/i5.gif",
    "MiladiTarihKisa": "02.12.2025",
    "MiladiTarihKisaIso8601": "02.12.2025",
    "MiladiTarihUzun": "02 Aralık 2025 Salı",
    "MiladiTarihUzunIso8601": "2025-12-02T00:00:00.0000000+10:30",
    "GreenwichOrtalamaZamani": 3.0,
    "Aksam": "20:21",
    "Gunes": "05:31",
    "GunesBatis": "20:14",
    "GunesDogus": "05:38",
    "Ikindi": "16:53",
    "Imsak": "03:47",
    "KibleSaati": "19:43",
    "Ogle": "13:01",
    "Yatsi": "21:58"
  },
  {
    "HicriTarihKisa": "13.6.1447",
    "HicriTarihKisaIso8601": null,
    "HicriTarihUzun": "13 Cemaziyelahir 1447",
    "HicriTarihUzunIso8601": null,
    "AyinSekliURL": "https://namazvakti.diyanet.gov.tr/images/i6.gif",
    "MiladiTarihKisa": "03.12.2025",
    "MiladiTarihKisaIso8601": "03.12.2025",
    "MiladiTarihUzun": "03 Aralık 2025 Çarşamba",
    "MiladiTarihUzunIso8601": "2025-12-03T00:00:00.0000000+10:30",
    "GreenwichOrtalamaZamani": 3.0,
    "Aksam": "20:22",
    "Gunes": "05:31",
    "GunesBatis": "20:15",
    "GunesDogus": "05:38",
    "Ikindi": "16:54",
    "Imsak": "03:46",
    "KibleSaati": "19:45",
    "Ogle": "13:02",
    "Yatsi": "21:59"
  },
  {
    "HicriTarihKisa": "14.6.1447",
    "HicriTarihKisaIso8601": null,
    "HicriTarihUzun": "14 Cemaziyelahir 1447",
    "HicriTarihUzunIso8601": null,
    "AyinSekliURL": "https://namazvakti.diyanet.gov.tr/images/dolunay.gif",
    "MiladiTarihKisa": "04.12.2025",
    "MiladiTarihKisaIso8601": "04.12.2025",
    "MiladiTarihUzun": "04 Aralık 2025 Perşembe",
    "MiladiTarihUzunIso8601": "2025-12-04T00:00:00.0000000+10:30",
    "GreenwichOrtalamaZamani": 3.0,
    "Aksam": "20:23",
    "Gunes": "05:31",
    "GunesBatis": "20:16",
    "GunesDogus": "05:38",
    "Ikindi": "16:54",
    "Imsak": "03:46",
    "KibleSaati": "19:46",
    "Ogle": "13:02",
    "Yatsi": "22:00"
  },
  {
    "HicriTarihKisa": "15.6.1447",
    "HicriTarihKisaIso8601": null,
    "HicriTarihUzun": "15 Cemaziyelahir 1447",
    "HicriTarihUzunIso8601": null,
    "AyinSekliURL": "https://namazvakti.diyanet.gov.tr/images/d1.gif",
    "MiladiTarihKisa": "05.12.2025",
    "MiladiTarihKisaIso8601": "05.12.2025",
    "MiladiTarihUzun": "05 Aralık 2025 Cuma",
    "MiladiTarihUzunIso8601": "2025-12-05T00:00:00.0000000+10:30",
    "GreenwichOrtalamaZamani": 3.0,
    "Aksam": "20:24",
    "Gunes": "05:31",
    "GunesBatis": "20:17",
    "GunesDogus": "05:38",
    "Ikindi": "16:55",
    "Imsak": "03:46",
    "KibleSaati": "19:47",
    "Ogle": "13:02",
    "Yatsi": "22:02"
  },
  {
    "HicriTarihKisa": "16.6.1447",
    "HicriTarihKisaIso8601": null,
    "HicriTarihUzun": "16 Cemaziyelahir 1447",
    "HicriTarihUzunIso8601": null,
    "AyinSekliURL": "https://namazvakti.diyanet.gov.tr/images/d2.gif",
    "MiladiTarihKisa": "06.12.2025",
    "MiladiTarihKisaIso8601": "06.12.2025",
    "MiladiTarihUzun": "06 Aralık 2025 Cumartesi",
    "MiladiTarihUzunIso8601": "2025-12-06T00:00:00.0000000+10:30",
    "GreenwichOrtalamaZamani": 3.0,
    "Aksam": "20:25",
    "Gunes": "05:31",
    "GunesBatis": "20:18",
    "GunesDogus": "05:38",
    "Ikindi": "16:55",
    "Imsak": "03:45",
    "KibleSaati": "19:49",
    "Ogle": "13:03",
    "Yatsi": "22:03"
  },
  {
    "HicriTarihKisa": "17.6.1447",
    "HicriTarihKisaIso8601": null,
    "HicriTarihUzun": "17 Cemaziyelahir 1447",
    "HicriTarihUzunIso8601": null,
    "AyinSekliURL": "https://namazvakti.diyanet.gov.tr/images/d3.gif",
    "MiladiTarihKisa": "07.12.2025",
    "MiladiTarihKisaIso8601": "07.12.2025",
    "MiladiTarihUzun": "07 Aralık 2025 Pazar",
    "MiladiTarihUzunIso8601": "2025-12-07T00:00:00.0000000+10:30",
    "GreenwichOrtalamaZamani": 3.0,
    "Aksam": "20:26",
    "Gunes": "05:31",
    "GunesBatis": "20:19",
    "GunesDogus": "05:38",
    "Ikindi": "16:56",
    "Imsak": "03:45",
    "KibleSaati": "19:50",
    "Ogle": "13:03",
    "Yatsi": "22:04"
  },
  {
    "HicriTarihKisa": "18.6.1447",
    "HicriTarihKisaIso8601": null,
    "HicriTarihUzun": "18 Cemaziyelahir 1447",
    "HicriTarihUzunIso8601": null,
    "AyinSekliURL": "https://namazvakti.diyanet.gov.tr/images/d4.gif",
    "MiladiTarihKisa": "08.12.2025",
    "MiladiTarihKisaIso8601": "08.12.2025",
    "MiladiTarihUzun": "08 Aralık 2025 Pazartesi",
    "MiladiTarihUzunIso8601": "2025-12-08T00:00:00.0000000+10:30",
    "GreenwichOrtalamaZamani": 3.0,
    "Aksam": "20:26",
    "Gunes": "05:31",
    "GunesBatis": "20:19",
    "GunesDogus": "05:38",
    "Ikindi": "16:56",
    "Imsak": "03:45",
    "KibleSaati": "19:51",
    "Ogle": "13:04",
    "Yatsi": "22:05"
  },
  {
    "HicriTarihKisa": "19.6.1447",
    "HicriTarihKisaIso8601": null,
    "HicriTarihUzun": "19 Cemaziyelahir 1447",
    "HicriTarihUzunIso8601": null,
    "AyinSekliURL": "https://namazvakti.diyanet.gov.tr/images/d5.gif",
    "MiladiTarihKisa": "09.12.2025",
    "MiladiTarihKisaIso8601": "09.12.2025",
    "MiladiTarihUzun": "09 Aralık 2025 Salı",
    "MiladiTarihUzunIso8601": "2025-12-09T00:00:00.0000000+10:30",
    "GreenwichOrtalamaZamani": 3.0,
    "Aksam": "20:27",
    "Gunes": "05:31",
    "GunesBatis": "20:20",
    "GunesDogus": "05:38",
    "Ikindi": "16:57",
    "Imsak": "03:44",
    "KibleSaati": "19:52",
    "Ogle": "13:04",
    "Yatsi": "22:06"
  },
  {
    "HicriTarihKisa": "20.6.1447",
    "HicriTarihKisaIso8601": null,
    "HicriTarihUzun": "20 Cemaziyelahir 1447",
    "HicriTarihUzunIso8601": null,
    "AyinSekliURL": "https://namazvakti.diyanet.gov.tr/images/d6.gif",
    "MiladiTarihKisa": "10.12.2025",
    "MiladiTarihKisaIso8601": "10.12.2025",
    "MiladiTarihUzun": "10 Aralık 2025 Çarşamba",
    "MiladiTarihUzunIso8601": "2025-12-10T00:00:00.0000000+10:30",
    "GreenwichOrtalamaZamani": 3.0,
    "Aksam": "20:28",
    "Gunes": "05:31",
    "GunesBatis": "20:21",
    "GunesDogus": "05:38",
    "Ikindi": "16:57",
    "Imsak": "03:44",
    "KibleSaati": "19:53",
    "Ogle": "13:05",
    "Yatsi": "22:07"
  },
  {
    "HicriTarihKisa": "21.6.1447",
    "HicriTarihKisaIso8601": null,
    "HicriTarihUzun": "21 Cemaziyelahir 1447",
    "HicriTarihUzunIso8601": null,
    "AyinSekliURL": "https://namazvakti.diyanet.gov.tr/images/d7.gif",
    "MiladiTarihKisa": "11.12.2025",
    "MiladiTarihKisaIso8601": "11.12.2025",
    "MiladiTarihUzun": "11 Aralık 2025 Perşembe",
    "MiladiTarihUzunIso8601": "2025-12-11T00:00:00.0000000+10:30",
    "GreenwichOrtalamaZamani": 3.0,
    "Aksam": "20:29",
    "Gunes": "05:31",
    "GunesBatis": "20:22",
    "GunesDogus": "05:38",
    "Ikindi": "16:58",
    "Imsak": "03:44",
    "KibleSaati": "19:54",
    "Ogle": "13:05",
    "Yatsi": "22:08"
  },
  {
    "HicriTarihKisa": "22.6.1447",
    "HicriTarihKisaIso8601": null,
    "HicriTarihUzun": "22 Cemaziyelahir 1447",
    "HicriTarihUzunIso8601": null,
    "AyinSekliURL": "https://namazvakti.diyanet.gov.tr/images/sondordun.gif",
    "MiladiTarihKisa": "12.12.2025",
    "MiladiTarihKisaIso8601": "12.12.2025",
    "MiladiTarihUzun": "12 Aralık 2025 Cuma",
    "MiladiTarihUzunIso8601": "2025-12-12T00:00:00.0000000+10:30",
    "GreenwichOrtalamaZamani": 3.0,
    "Aksam": "20:30",
    "Gunes": "05:31",
    "GunesBatis": "20:23",
    "GunesDogus": "05:38",
    "Ikindi": "16:58",
    "Imsak": "03:44",
    "KibleSaati": "19:55",
    "Ogle": "13:05",
    "Yatsi": "22:09"
  },
  {
    "HicriTarihKisa": "23.6.1447",
    "HicriTarihKisaIso8601": null,
    "HicriTarihUzun": "23 Cemaziyelahir 1447",
    "HicriTarihUzunIso8601": null,
    "AyinSekliURL": "https://namazvakti.diyanet.gov.tr/images/sd1.gif",
    "MiladiTarihKisa": "13.12.2025",
    "MiladiTarihKisaIso8601": "13.12.2025",
    "MiladiTarihUzun": "13 Aralık 2025 Cumartesi",
    "MiladiTarihUzunIso8601": "2025-12-13T00:00:00.0000000+10:30",
    "GreenwichOrtalamaZamani": 3.0,
    "Aksam": "20:30",
    "Gunes": "05:32",
    "GunesBatis": "20:23",
    "GunesDogus": "05:39",
    "Ikindi": "16:59",
    "Imsak": "03:44",
    "KibleSaati": "19:56",
    "Ogle": "13:06",
    "Yatsi": "22:10"
  },
  {
    "HicriTarihKisa": "24.6.1447",
    "HicriTarihKisaIso8601": null,
    "HicriTarihUzun": "24 Cemaziyelahir 1447",
    "HicriTarihUzunIso8601": null,
    "AyinSekliURL": "https://namazvakti.diyanet.gov.tr/images/sd2.gif",
    "MiladiTarihKisa": "14.12.2025",
    "MiladiTarihKisaIso8601": "14.12.2025",
    "MiladiTarihUzun": "14 Aralık 2025 Pazar",
    "MiladiTarihUzunIso8601": "2025-12-14T00:00:00.0000000+10:30",
    "GreenwichOrtalamaZamani": 3.0,
    "Aksam": "20:31",
    "Gunes": "05:32",
    "GunesBatis": "20:24",
    "GunesDogus": "05:39",
    "Ikindi": "16:59",
    "Imsak": "03:44",
    "KibleSaati": "19:57",
    "Ogle": "13:06",
    "Yatsi": "22:11"
  },
  {
    "HicriTarihKisa": "25.6.1447",
    "HicriTarihKisaIso8601": null,
    "HicriTarihUzun": "25 Cemaziyelahir 1447",
    "HicriTarihUzunIso8601": null,
    "AyinSekliURL": "https://namazvakti.diyanet.gov.tr/images/sd3.gif",
    "MiladiTarihKisa": "15.12.2025",
    "MiladiTarihKisaIso8601": "15.12.2025",
    "MiladiTarihUzun": "15 Aralık 2025 Pazartesi",
    "MiladiTarihUzunIso8601": "2025-12-15T00:00:00.0000000+10:30",
    "GreenwichOrtalamaZamani": 3.0,
    "Aksam": "20:32",
    "Gunes": "05:32",
    "GunesBatis": "20:25",
    "GunesDogus": "05:39",
    "Ikindi": "17:00",
    "Imsak": "03:44",
    "KibleSaati": "19:58",
    "Ogle": "13:07",
    "Yatsi": "22:12"
  },
  {
    "HicriTarihKisa": "26.6.1447",
    "HicriTarihKisaIso8601": null,
    "HicriTarihUzun": "26 Cemaziyelahir 1447",
    "HicriTarihUzunIso8601": null,
    "AyinSekliURL": "https://namazvakti.diyanet.gov.tr/images/sd4.gif",
    "MiladiTarihKisa": "16.12.2025",
    "MiladiTarihKisaIso8601": "16.12.2025",
    "MiladiTarihUzun": "16 Aralık 2025 Salı",
    "MiladiTarihUzunIso8601": "2025-12-16T00:00:00.0000000+10:30",
    "GreenwichOrtalamaZamani": 3.0,
    "Aksam": "20:33",
    "Gunes": "05:32",
    "GunesBatis": "20:26",
    "GunesDogus": "05:39",
    "Ikindi": "17:00",
    "Imsak": "03:44",
    "KibleSaati": "19:59",
    "Ogle": "13:07",
    "Yatsi": "22:13"
  },
  {
    "HicriTarihKisa": "27.6.1447",
    "HicriTarihKisaIso8601": null,
    "HicriTarihUzun": "27 Cemaziyelahir 1447",
    "HicriTarihUzunIso8601": null,
    "AyinSekliURL": "https://namazvakti.diyanet.gov.tr/images/sd5.gif",
    "MiladiTarihKisa": "17.12.2025",
    "MiladiTarihKisaIso8601": "17.12.2025",
    "MiladiTarihUzun": "17 Aralık 2025 Çarşamba",
    "MiladiTarihUzunIso8601": "2025-12-17T00:00:00.0000000+10:30",
    "GreenwichOrtalamaZamani": 3.0,
    "Aksam": "20:33",
    "Gunes": "05:33",
    "GunesBatis": "20:26",
    "GunesDogus": "05:40",
    "Ikindi": "17:01",
    "Imsak": "03:44",
    "KibleSaati": "20:00",
    "Ogle": "13:08",
    "Yatsi": "22:13"
  },
  {
    "HicriTarihKisa": "28.6.1447",
    "HicriTarihKisaIso8601": null,
    "HicriTarihUzun": "28 Cemaziyelahir 1447",
    "HicriTarihUzunIso8601": null,
    "AyinSekliURL": "https://namazvakti.diyanet.gov.tr/images/sd6.gif",
    "MiladiTarihKisa": "18.12.2025",
    "MiladiTarihKisaIso8601": "18.12.2025",
    "MiladiTarihUzun": "18 Aralık 2025 Perşembe",
    "MiladiTarihUzunIso8601": "2025-12-18T00:00:00.0000000+10:30",
    "GreenwichOrtalamaZamani": 3.0,
    "Aksam": "20:34",
    "Gunes": "05:33",
    "GunesBatis": "20:27",
    "GunesDogus": "05:40",
    "Ikindi": "17:01",
    "Imsak": "03:45",
    "KibleSaati": "20:00",
    "Ogle": "13:08",
    "Yatsi": "22:14"
  },
  {
    "HicriTarihKisa": "29.6.1447",
    "HicriTarihKisaIso8601": null,
    "HicriTarihUzun": "29 Cemaziyelahir 1447",
    "HicriTarihUzunIso8601": null,
    "AyinSekliURL": "https://namazvakti.diyanet.gov.tr/images/sd7.gif",
    "MiladiTarihKisa": "19.12.2025",
    "MiladiTarihKisaIso8601": "19.12.2025",
    "MiladiTarihUzun": "19 Aralık 2025 Cuma",
    "MiladiTarihUzunIso8601": "2025-12-19T00:00:00.0000000+10:30",
    "GreenwichOrtalamaZamani": 3.0,
    "Aksam": "20:34",
    "Gunes": "05:33",
    "GunesBatis": "20:27",
    "GunesDogus": "05:40",
    "Ikindi": "17:02",
    "Imsak": "03:45",
    "KibleSaati": "20:01",
    "Ogle": "13:09",
    "Yatsi": "22:15"
  },
  {
    "HicriTarihKisa": "30.6.1447",
    "HicriTarihKisaIso8601": null,
    "HicriTarihUzun": "30 Cemaziyelahir 1447",
    "HicriTarihUzunIso8601": null,
    "AyinSekliURL": "https://namazvakti.diyanet.gov.tr/images/ruyet.gif",
    "MiladiTarihKisa": "20.12.2025",
    "MiladiTarihKisaIso8601": "20.12.2025",
    "MiladiTarihUzun": "20 Aralık 2025 Cumartesi",
    "MiladiTarihUzunIso8601": "2025-12-20T00:00:00.0000000+10:30",
    "GreenwichOrtalamaZamani": 3.0,
    "Aksam": "20:35",
    "Gunes": "05:34",
    "GunesBatis": "20:28",
    "GunesDogus": "05:41",
    "Ikindi": "17:02",
    "Imsak": "03:45",
    "KibleSaati": "20:01",
    "Ogle": "13:09",
    "Yatsi": "22:15"
  },
  {
    "HicriTarihKisa": "1.7.1447",
    "HicriTarihKisaIso8601": null,
    "HicriTarihUzun": "1 Recep 1447",
    "HicriTarihUzunIso8601": null,
    "AyinSekliURL": "https://namazvakti.diyanet.gov.tr/images/r1.gif",
    "MiladiTarihKisa": "21.12.2025",
    "MiladiTarihKisaIso8601": "21.12.2025",
    "MiladiTarihUzun": "21 Aralık 2025 Pazar",
    "MiladiTarihUzunIso8601": "2025-12-21T00:00:00.0000000+10:30",
    "GreenwichOrtalamaZamani": 3.0,
    "Aksam": "20:35",
    "Gunes": "05:34",
    "GunesBatis": "20:28",
    "GunesDogus": "05:41",
    "Ikindi": "17:03",
    "Imsak": "03:46",
    "KibleSaati": "20:02",
    "Ogle": "13:10",
    "Yatsi": "22:16"
  },
  {
    "HicriTarihKisa": "2.7.1447",
    "HicriTarihKisaIso8601": null,
    "HicriTarihUzun": "2 Recep 1447",
    "HicriTarihUzunIso8601": null,
    "AyinSekliURL": "https://namazvakti.diyanet.gov.tr/images/r2.gif",
    "MiladiTarihKisa": "22.12.2025",
    "MiladiTarihKisaIso8601": "22.12.2025",
    "MiladiTarihUzun": "22 Aralık 2025 Pazartesi",
    "MiladiTarihUzunIso8601": "2025-12-22T00:00:00.0000000+10:30",
    "GreenwichOrtalamaZamani": 3.0,
    "Aksam": "20:36",
    "Gunes": "05:35",
    "GunesBatis": "20:29",
    "GunesDogus": "05:42",
    "Ikindi": "17:03",
    "Imsak": "03:46",
    "KibleSaati": "20:03",
    "Ogle": "13:10",
    "Yatsi": "22:16"
  },
  {
    "HicriTarihKisa": "3.7.1447",
    "HicriTarihKisaIso8601": null,
    "HicriTarihUzun": "3 Recep 1447",
    "HicriTarihUzunIso8601": null,
    "AyinSekliURL": "https://namazvakti.diyanet.gov.tr/images/r3.gif",
    "MiladiTarihKisa": "23.12.2025",
    "MiladiTarihKisaIso8601": "23.12.2025",
    "MiladiTarihUzun": "23 Aralık 2025 Salı",
    "MiladiTarihUzunIso8601": "2025-12-23T00:00:00.0000000+10:30",
    "GreenwichOrtalamaZamani": 3.0,
    "Aksam": "20:36",
    "Gunes": "05:35",
    "GunesBatis": "20:29",
    "GunesDogus": "05:42",
    "Ikindi": "17:04",
    "Imsak": "03:47",
    "KibleSaati": "20:03",
    "Ogle": "13:11",
    "Yatsi": "22:17"
  },
  {
    "HicriTarihKisa": "4.7.1447",
    "HicriTarihKisaIso8601": null,
    "HicriTarihUzun": "4 Recep 1447",
    "HicriTarihUzunIso8601": null,
    "AyinSekliURL": "https://namazvakti.diyanet.gov.tr/images/r4.gif",
    "MiladiTarihKisa": "24.12.2025",
    "MiladiTarihKisaIso8601": "24.12.2025",
    "MiladiTarihUzun": "24 Aralık 2025 Çarşamba",
    "MiladiTarihUzunIso8601": "2025-12-24T00:00:00.0000000+10:30",
    "GreenwichOrtalamaZamani": 3.0,
    "Aksam": "20:37",
    "Gunes": "05:36",
    "GunesBatis": "20:30",
    "GunesDogus": "05:43",
    "Ikindi": "17:04",
    "Imsak": "03:48",
    "KibleSaati": "20:03",
    "Ogle": "13:11",
    "Yatsi": "22:17"
  },
  {
    "HicriTarihKisa": "5.7.1447",
    "HicriTarihKisaIso8601": null,
    "HicriTarihUzun": "5 Recep 1447",
    "HicriTarihUzunIso8601": null,
    "AyinSekliURL": "https://namazvakti.diyanet.gov.tr/images/r5.gif",
    "MiladiTarihKisa": "25.12.2025",
    "MiladiTarihKisaIso8601": "25.12.2025",
    "MiladiTarihUzun": "25 Aralık 2025 Perşembe",
    "MiladiTarihUzunIso8601": "2025-12-25T00:00:00.0000000+10:30",
    "GreenwichOrtalamaZamani": 3.0,
    "Aksam": "20:37",
    "Gunes": "05:36",
    "GunesBatis": "20:30",
    "GunesDogus": "05:43",
    "Ikindi": "17:05",
    "Imsak": "03:48",
    "KibleSaati": "20:04",
    "Ogle": "13:12",
    "Yatsi": "22:18"
  },
  {
    "HicriTarihKisa": "6.7.1447",
    "HicriTarihKisaIso8601": null,
    "HicriTarihUzun": "6 Recep 1447",
    "HicriTarihUzunIso8601": null,
    "AyinSekliURL": "https://namazvakti.diyanet.gov.tr/images/r6.gif",
    "MiladiTarihKisa": "26.12.2025",
    "MiladiTarihKisaIso8601": "26.12.2025",
    "MiladiTarihUzun": "26 Aralık 2025 Cuma",
    "MiladiTarihUzunIso8601": "2025-12-26T00:00:00.0000000+10:30",
    "GreenwichOrtalamaZamani": 3.0,
    "Aksam": "20:38",
    "Gunes": "05:37",
    "GunesBatis": "20:31",
    "GunesDogus": "05:44",
    "Ikindi": "17:05",
    "Imsak": "03:49",
    "KibleSaati": "20:04",
    "Ogle": "13:12",
    "Yatsi": "22:18"
  },
  {
    "HicriTarihKisa": "7.7.1447",
    "HicriTarihKisaIso8601": null,
    "HicriTarihUzun": "7 Recep 1447",
    "HicriTarihUzunIso8601": null,
    "AyinSekliURL": "https://namazvakti.diyanet.gov.tr/images/ilkdordun.gif",
    "MiladiTarihKisa": "27.12.2025",
    "MiladiTarihKisaIso8601": "27.12.2025",
    "MiladiTarihUzun": "27 Aralık 2025 Cumartesi",
    "MiladiTarihUzunIso8601": "2025-12-27T00:00:00.0000000+10:30",
    "GreenwichOrtalamaZamani": 3.0,
    "Aksam": "20:38",
    "Gunes": "05:38",
    "GunesBatis": "20:31",
    "GunesDogus": "05:45",
    "Ikindi": "17:06",
    "Imsak": "03:50",
    "KibleSaati": "20:04",
    "Ogle": "13:13",
    "Yatsi": "22:18"
  },
  {
    "HicriTarihKisa": "8.7.1447",
    "HicriTarihKisaIso8601": null,
    "HicriTarihUzun": "8 Recep 1447",
    "HicriTarihUzunIso8601": null,
    "AyinSekliURL": "https://namazvakti.diyanet.gov.tr/images/i1.gif",
    "MiladiTarihKisa": "28.12.2025",
    "MiladiTarihKisaIso8601": "28.12.2025",
    "MiladiTarihUzun": "28 Aralık 2025 Pazar",
    "MiladiTarihUzunIso8601": "2025-12-28T00:00:00.0000000+10:30",
    "GreenwichOrtalamaZamani": 3.0,
    "Aksam": "20:38",
    "Gunes": "05:38",
    "GunesBatis": "20:31",
    "GunesDogus": "05:45",
    "Ikindi": "17:06",
    "Imsak": "03:50",
    "KibleSaati": "20:04",
    "Ogle": "13:13",
    "Yatsi": "22:18"
  }
]