[
  {
    "HicriTarihKisa": "24.5.1447",
    "HicriTarihKisaIso8601": null,
    "HicriTarihUzun": "24 Cemaziyelevvel 1447",
    "HicriTarihUzunIso8601": null,
    "AyinSekliURL": "https://namazvakti.diyanet.gov.tr/images/sd3.gif",
    "MiladiTarihKisa": "15.11.2025",
    "MiladiTarihKisaIso8601": "15.11.2025",
    "MiladiTarihUzun": "15 Kasım 2025 Cumartesi",
    "MiladiTarihUzunIso8601": "2025-11-15T00:00:00.0000000+01:00",
    "GreenwichOrtalamaZamani": 3.0,
    "Aksam": "16:49",
    "Gunes": "07:41",
    "GunesBatis": "16:42",
    "GunesDogus": "07:48",
    "Ikindi": "14:23",
    "Imsak": "05:51",
    "KibleSaati": "08:30",
    "Ogle": "12:20",
    "Yatsi": "18:26"
  },
  {
    "HicriTarihKisa": "25.5.1447",
    "HicriTarihKisaIso8601": null,
    "HicriTarihUzun": "25 Cemaziyelevvel 1447",
    "HicriTarihUzunIso8601": null,
    "AyinSekliURL": "https://namazvakti.diyanet.gov.tr/images/sd4.gif",
    "MiladiTarihKisa": "16.11.2025",
    "MiladiTarihKisaIso8601": "16.11.2025",
    "MiladiTarihUzun": "16 Kasım 2025 Pazar",
    "MiladiTarihUzunIso8601": "2025-11-16T00:00:00.0000000+01:00",
    "GreenwichOrtalamaZamani": 3.0,
    "Aksam": "16:48",
    "Gunes": "07:42",
    "GunesBatis": "16:41",
    "GunesDogus": "07:49",
    "Ikindi": "14:22",
    "Imsak": "05:53",
    "KibleSaati": "08:30",
    "Ogle": "12:20",
    "Yatsi": "18:25"
  },
  {
    "HicriTarihKisa": "26.5.1447",
    "HicriTarihKisaIso8601": null,
    "HicriTarihUzun": "26 Cemaziyelevvel 1447",
    "HicriTarihUzunIso8601": null,
    "AyinSekliURL": "https://namazvakti.diyanet.gov.tr/images/sd5.gif",
    "MiladiTarihKisa": "17.11.2025",
    "MiladiTarihKisaIso8601": "17.11.2025",
    "MiladiTarihUzun": "17 Kasım 2025 Pazartesi",
    "MiladiTarihUzunIso8601": "2025-11-17T00:00:00.0000000+01:00",
    "GreenwichOrtalamaZamani": 3.0,
    "Aksam": "16:46",
    "Gunes": "07:44",
    "GunesBatis": "16:39",
    "GunesDogus": "07:51",
    "Ikindi": "14:21",
    "Imsak": "05:54",
    "KibleSaati": "08:29",
    "Ogle": "12:20",
    "Yatsi": "18:23"
  },
  {
    "HicriTarihKisa": "27.5.1447",
    "HicriTarihKisaIso8601": null,
    "HicriTarihUzun": "27 Cemaziyelevvel 1447",
    "HicriTarihUzunIso8601": null,
    "AyinSekliURL": "https://namazvakti.diyanet.gov.tr/images/sd6.gif",
    "MiladiTarihKisa": "18.11.2025",
    "MiladiTarihKisaIso8601": "18.11.2025",
    "MiladiTarihUzun": "18 Kasım 2025 Salı",
    "MiladiTarihUzunIso8601": "2025-11-18T00:00:00.0000000+01:00",
    "GreenwichOrtalamaZamani": 3.0,
    "Aksam": "16:45",
    "Gunes": "07:46",
    "GunesBatis": "16:38",
    "GunesDogus": "07:53",
    "Ikindi": "14:20",
    "Imsak": "05:55",
    "KibleSaati": "08:29",
    "Ogle": "12:20",
    "Yatsi": "18:22"
  },
  {
    "HicriTarihKisa": "28.5.1447",
    "HicriTarihKisaIso8601": null,
    "HicriTarihUzun": "28 Cemaziyelevvel 1447",
    "HicriTarihUzunIso8601": null,
    "AyinSekliURL": "https://namazvakti.diyanet.gov.tr/images/sd7.gif",
    "MiladiTarihKisa": "19.11.2025",
    "MiladiTarihKisaIso8601": "19.11.2025",
    "MiladiTarihUzun": "19 Kasım 2025 Çarşamba",
    "MiladiTarihUzunIso8601": "2025-11-19T00:00:00.0000000+01:00",
    "GreenwichOrtalamaZamani": 3.0,
    "Aksam": "16:44",
    "Gunes": "07:47",
    "GunesBatis": "16:37",
    "GunesDogus": "07:54",
    "Ikindi": "14:19",
    "Imsak": "05:57",
    "KibleSaati": "08:28",
    "Ogle": "12:21",
    "Yatsi": "18:22"
  },
  {
    "HicriTarihKisa": "29.5.1447",
    "HicriTarihKisaIso8601": null,
    "HicriTarihUzun": "29 Cemaziyelevvel 1447",
    "HicriTarihUzunIso8601": null,
    "AyinSekliURL": "https://namazvakti.diyanet.gov.tr/images/ruyet.gif",
    "MiladiTarihKisa": "20.11.2025",
    "MiladiTarihKisaIso8601": "20.11.2025",
    "MiladiTarihUzun": "20 Kasım 2025 Perşembe",
    "MiladiTarihUzunIso8601": "2025-11-20T00:00:00.0000000+01:00",
    "GreenwichOrtalamaZamani": 3.0,
    "Aksam": "16:43",
    "Gunes": "07:49",
    "GunesBatis": "16:36",
    "GunesDogus": "07:56",
    "Ikindi": "14:18",
    "Imsak": "05:58",
    "KibleSaati": "08:28",
    "Ogle": "12:21",
    "Yatsi": "18:21"
  },
  {
    "HicriTarihKisa": "1.6.1447",
    "HicriTarihKisaIso8601": null,
    "HicriTarihUzun": "1 Cemaziyelahir 1447",
    "HicriTarihUzunIso8601": null,
    "AyinSekliURL": "https://namazvakti.diyanet.gov.tr/images/r1.gif",
    "MiladiTarihKisa": "21.11.2025",
    "MiladiTarihKisaIso8601": "21.11.2025",
    "MiladiTarihUzun": "21 Kasım 2025 Cuma",
    "MiladiTarihUzunIso8601": "2025-11-21T00:00:00.0000000+01:00",
    "GreenwichOrtalamaZamani": 3.0,
    "Aksam": "16:41",
    "Gunes": "07:51",
    "GunesBatis": "16:34",
    "GunesDogus": "07:58",
    "Ikindi": "14:18",
    "Imsak": "05:59",
    "KibleSaati": "08:28",
    "Ogle": "12:21",
    "Yatsi": "18:20"
  },
  {
    "HicriTarihKisa": "2.6.1447",
    "HicriTarihKisaIso8601": null,
    "HicriTarihUzun": "2 Cemaziyelahir 1447",
    "HicriTarihUzunIso8601": null,
    "AyinSekliURL": "https://namazvakti.diyanet.gov.tr/images/r2.gif",
    "MiladiTarihKisa": "22.11.2025",
    "MiladiTarihKisaIso8601": "22.11.2025",
    "MiladiTarihUzun": "22 Kasım 2025 Cumartesi",
    "MiladiTarihUzunIso8601": "2025-11-22T00:00:00.0000000+01:00",
    "GreenwichOrtalamaZamani": 3.0,
    "Aksam": "16:40",
    "Gunes": "07:52",
    "GunesBatis": "16:33",
    "GunesDogus": "07:59",
    "Ikindi": "14:17",
    "Imsak": "06:01",
    "KibleSaati": "08:27",
    "Ogle": "12:21",
    "Yatsi": "18:19"
  },
  {
    "HicriTarihKisa": "3.6.1447",
    "HicriTarihKisaIso8601": null,
    "HicriTarihUzun": "3 Cemaziyelahir 1447",
    "HicriTarihUzunIso8601": null,
    "AyinSekliURL": "https://namazvakti.diyanet.gov.tr/images/r3.gif",
    "MiladiTarihKisa": "23.11.2025",
    "MiladiTarihKisaIso8601": "23.11.2025",
    "MiladiTarihUzun": "23 Kasım 2025 Pazar",
    "MiladiTarihUzunIso8601": "2025-11-23T00:00:00.0000000+01:00",
    "GreenwichOrtalamaZamani": 3.0,
    "Aksam": "16:39",
    "Gunes": "07:54",
    "GunesBatis": "16:32",
    "GunesDogus": "08:01",
    "Ikindi": "14:16",
    "Imsak": "06:02",
    "KibleSaati": "08:27",
    "Ogle": "12:22",
    "Yatsi": "18:18"
  },
  {
    "HicriTarihKisa": "4.6.1447",
    "HicriTarihKisaIso8601": null,
    "HicriTarihUzun": "4 Cemaziyelahir 1447",
    "HicriTarihUzunIso8601": null,
    "AyinSekliURL": "https://namazvakti.diyanet.gov.tr/images/r4.gif",
    "MiladiTarihKisa": "24.11.2025",
    "MiladiTarihKisaIso8601": "24.11.2025",
    "MiladiTarihUzun": "24 Kasım 2025 Pazartesi",
    "MiladiTarihUzunIso8601": "2025-11-24T00:00:00.0000000+01:00",
    "GreenwichOrtalamaZamani": 3.0,
    "Aksam": "16:38",
    "Gunes": "07:56",
    "GunesBatis": "16:31",
    "GunesDogus": "08:03",
    "Ikindi": "14:15",
    "Imsak": "06:03",
    "KibleSaati": "08:27",
    "Ogle": "12:22",
    "Yatsi": "18:17"
  },
  {
    "HicriTarihKisa": "5.6.1447",
    "HicriTarihKisaIso8601": null,
    "HicriTarihUzun": "5 Cemaziyelahir 1447",
    "HicriTarihUzunIso8601": null,
    "AyinSekliURL": "https://namazvakti.diyanet.gov.tr/images/r5.gif",
    "MiladiTarihKisa": "25.11.2025",
    "MiladiTarihKisaIso8601": "25.11.2025",
    "MiladiTarihUzun": "25 Kasım 2025 Salı",
    "MiladiTarihUzunIso8601": "2025-11-25T00:00:00.0000000+01:00",
    "GreenwichOrtalamaZamani": 3.0,
    "Aksam": "16:37",
    "Gunes": "07:57",
    "GunesBatis": "16:30",
    "GunesDogus": "08:04",
    "Ikindi": "14:14",
    "Imsak": "06:05",
    "KibleSaati": "08:27",
    "Ogle": "12:22",
    "Yatsi": "18:17"
  },
  {
    "HicriTarihKisa": "6.6.1447",
    "HicriTarihKisaIso8601": null,
    "HicriTarihUzun": "6 Cemaziyelahir 1447",
    "HicriTarihUzunIso8601": null,
    "AyinSekliURL": "https://namazvakti.diyanet.gov.tr/images/r6.gif",
    "MiladiTarihKisa": "26.11.2025",
    "MiladiTarihKisaIso8601": "26.11.2025",
    "MiladiTarihUzun": "26 Kasım 2025 Çarşamba",
    "MiladiTarihUzunIso8601": "2025-11-26T00:00:00.0000000+01:00",
    "GreenwichOrtalamaZamani": 3.0,
    "Aksam": "16:36",
    "Gunes": "07:59",
    "GunesBatis": "16:29",
    "GunesDogus": "08:06",
    "Ikindi": "14:14",
    "Imsak": "06:06",
    "KibleSaati": "08:26",
    "Ogle": "12:23",
    "Yatsi": "18:16"
  },
  {
    "HicriTarihKisa": "7.6.1447",
    "HicriTarihKisaIso8601": null,
    "HicriTarihUzun": "7 Cemaziyelahir 1447",
    "HicriTarihUzunIso8601": null,
    "AyinSekliURL": "https://namazvakti.diyanet.gov.tr/images/ilkdordun.gif",
    "MiladiTarihKisa": "27.11.2025",
    "MiladiTarihKisaIso8601": "27.11.2025",
    "MiladiTarihUzun": "27 Kasım 2025 Perşembe",
    "MiladiTarihUzunIso8601": "2025-11-27T00:00:00.0000000+01:00",
    "GreenwichOrtalamaZamani": 3.0,
    "Aksam": "16:35",
    "Gunes": "08:00",
    "GunesBatis": "16:28",
    "GunesDogus": "08:07",
    "Ikindi": "14:13",
    "Imsak": "06:07",
    "KibleSaati": "08:26",
    "Ogle": "12:23",
    "Yatsi": "18:15"
  },
  {
    "HicriTarihKisa": "8.6.1447",
    "HicriTarihKisaIso8601": null,
    "HicriTarihUzun": "8 Cemaziyelahir 1447",
    "HicriTarihUzunIso8601": null,
    "AyinSekliURL": "https://namazvakti.diyanet.gov.tr/images/i1.gif",
    "MiladiTarihKisa": "28.11.2025",
    "MiladiTarihKisaIso8601": "28.11.2025",
    "MiladiTarihUzun": "28 Kasım 2025 Cuma",
    "MiladiTarihUzunIso8601": "2025-11-28T00:00:00.0000000+01:00",
    "GreenwichOrtalamaZamani": 3.0,
    "Aksam": "16:35",
    "Gunes": "08:02",
    "GunesBatis": "16:28",
    "GunesDogus": "08:09",
    "Ikindi": "14:13",
    "Imsak": "06:08",
    "KibleSaati": "08:26",
    "Ogle": "12:23",
    "Yatsi": "18:15"
  },
  {
    "HicriTarihKisa": "9.6.1447",
    "HicriTarihKisaIso8601": null,
    "HicriTarihUzun": "9 Cemaziyelahir 1447",
    "HicriTarihUzunIso8601": null,
    "AyinSekliURL": "https://namazvakti.diyanet.gov.tr/images/i2.gif",
    "MiladiTarihKisa": "29.11.2025",
    "MiladiTarihKisaIso8601": "29.11.2025",
    "MiladiTarihUzun": "29 Kasım 2025 Cumartesi",
    "MiladiTarihUzunIso8601": "2025-11-29T00:00:00.0000000+01:00",
    "GreenwichOrtalamaZamani": 3.0,
    "Aksam": "16:34",
    "Gunes": "08:03",
    "GunesBatis": "16:27",
    "GunesDogus": "08:10",
    "Ikindi": "14:12",
    "Imsak": "06:09",
    "KibleSaati": "08:26",
    "Ogle": "12:23",
    "Yatsi": "18:14"
  },
  {
    "HicriTarihKisa": "10.6.1447",
    "HicriTarihKisaIso8601": null,
    "HicriTarihUzun": "10 Cemaziyelahir 1447",
    "HicriTarihUzunIso8601": null,
    "AyinSekliURL": "https://namazvakti.diyanet.gov.tr/images/i3.gif",
    "MiladiTarihKisa": "30.11.2025",
    "MiladiTarihKisaIso8601": "30.11.2025",
    "MiladiTarihUzun": "30 Kasım 2025 Pazar",
    "MiladiTarihUzunIso8601": "2025-11-30T00:00:00.0000000+01:00",
    "GreenwichOrtalamaZamani": 3.0,
    "Aksam": "16:33",
    "Gunes": "08:05",
    "GunesBatis": "16:26",
    "GunesDogus": "08:12",
    "Ikindi": "14:12",
    "Imsak": "06:11",
    "KibleSaati": "08:26",
    "Ogle": "12:24",
    "Yatsi": "18:14"
  },
  {
    "HicriTarihKisa": "11.6.1447",
    "HicriTarihKisaIso8601": null,
    "HicriTarihUzun": "11 Cemaziyelahir 1447",
    "HicriTarihUzunIso8601": null,
    "AyinSekliURL": "https://namazvakti.diyanet.gov.tr/images/i4.gif",
    "MiladiTarihKisa": "01.12.2025",
    "MiladiTarihKisaIso8601": "01.12.2025",
    "MiladiTarihUzun": "01 Aralık 2025 Pazartesi",
    "MiladiTarihUzunIso8601": "2025-12-01T00:00:00.0000000+01:00",
    "GreenwichOrtalamaZamani": 3.0,
    "Aksam": "16:33",
    "Gunes": "08:06",
    "GunesBatis": "16:26",
    "GunesDogus": "08:13",
    "Ikindi": "14:11",
    "Imsak": "06:12",
    "KibleSaati": "08:26",
    "Ogle": "12:24",
    "Yatsi": "18:13"
  },
  {
    "HicriTarihKisa": "12.6.1447",
    "HicriTarihKisaIso8601": null,
    "HicriTarihUzun": "12 Cemaziyelahir 1447",
    "HicriTarihUzunIso8601": null,
    "AyinSekliURL": "https://namazvakti.diyanet.gov.tr/images/i5.gif",
    "MiladiTarihKisa": "02.12.2025",
    "MiladiTarihKisaIso8601": "02.12.2025",
    "MiladiTarihUzun": "02 Aralık 2025 Salı",
    "MiladiTarihUzunIso8601": "2025-12-02T00:00:00.0000000+01:00",
    "GreenwichOrtalamaZamani": 3.0,
    "Aksam": "16:32",
    "Gunes": "08:07",
    "GunesBatis": "16:25",
    "GunesDogus": "08:14",
    "Ikindi": "14:11",
    "Imsak": "06:13",
    "KibleSaati": "08:26",
    "Ogle": "12:25",
    "Yatsi": "18:13"
  },
  {
    "HicriTarihKisa": "13.6.1447",
    "HicriTarihKisaIso8601": null,
    "HicriTarihUzun": "13 Cemaziyelahir 1447",
    "HicriTarihUzunIso8601": null,
    "AyinSekliURL": "https://namazvakti.diyanet.gov.tr/images/i6.gif",
    "MiladiTarihKisa": "03.12.2025",
    "MiladiTarihKisaIso8601": "03.12.2025",
    "MiladiTarihUzun": "03 Aralık 2025 Çarşamba",
    "MiladiTarihUzunIso8601": "2025-12-03T00:00:00.0000000+01:00",
    "GreenwichOrtalamaZamani": 3.0,
    "Aksam": "16:31",
    "Gunes": "08:09",
    "GunesBatis": "16:24",
    "GunesDogus": "08:16",
    "Ikindi": "14:10",
    "Imsak": "06:14",
    "KibleSaati": "08:26",
    "Ogle": "12:25",
    "Yatsi": "18:13"
  },
  {
    "HicriTarihKisa": "14.6.1447",
    "HicriTarihKisaIso8601": null,
    "HicriTarihUzun": "14 Cemaziyelahir 1447",
    "HicriTarihUzunIso8601": null,
    "AyinSekliURL": "https://namazvakti.diyanet.gov.tr/images/dolunay.gif",
    "MiladiTarihKisa": "04.12.2025",
    "MiladiTarihKisaIso8601": "04.12.2025",
    "MiladiTarihUzun": "04 Aralık 2025 Perşembe",
    "MiladiTarihUzunIso8601": "2025-12-04T00:00:00.0000000+01:00",
    "GreenwichOrtalamaZamani": 3.0,
    "Aksam": "16:31",
    "Gunes": "08:10",
    "GunesBatis": "16:24",
    "GunesDogus": "08:17",
    "Ikindi": "14:10",
    "Imsak": "06:15",
    "KibleSaati": "08:26",
    "Ogle": "12:25",
    "Yatsi": "18:12"
  },
  {
    "HicriTarihKisa": "15.6.1447",
    "HicriTarihKisaIso8601": null,
    "HicriTarihUzun": "15 Cemaziyelahir 1447",
    "HicriTarihUzunIso8601": null,
    "AyinSekliURL": "https://namazvakti.diyanet.gov.tr/images/d1.gif",
    "MiladiTarihKisa": "05.12.2025",
    "MiladiTarihKisaIso8601": "05.12.2025",
    "MiladiTarihUzun": "05 Aralık 2025 Cuma",
    "MiladiTarihUzunIso8601": "2025-12-05T00:00:00.0000000+01:00",
    "GreenwichOrtalamaZamani": 3.0,
    "Aksam": "16:30",
    "Gunes": "08:11",
    "GunesBatis": "16:23",
    "GunesDogus": "08:18",
    "Ikindi": "14:10",
    "Imsak": "06:16",
    "KibleSaati": "08:26",
    "Ogle": "12:26",
    "Yatsi": "18:12"
  },
  {
    "HicriTarihKisa": "16.6.1447",
    "HicriTarihKisaIso8601": null,
    "HicriTarihUzun": "16 Cemaziyelahir 1447",
    "HicriTarihUzunIso8601": null,
    "AyinSekliURL": "https://namazvakti.diyanet.gov.tr/images/d2.gif",
    "MiladiTarihKisa": "06.12.2025",
    "MiladiTarihKisaIso8601": "06.12.2025",
    "MiladiTarihUzun": "06 Aralık 2025 Cumartesi",
    "MiladiTarihUzunIso8601": "2025-12-06T00:00:00.0000000+01:00",
    "GreenwichOrtalamaZamani": 3.0,
    "Aksam": "16:30",
    "Gunes": "08:12",
    "GunesBatis": "16:23",
    "GunesDogus": "08:19",
    "Ikindi": "14:10",
    "Imsak": "06:17",
    "KibleSaati": "08:26",
    "Ogle": "12:26",
    "Yatsi": "18:12"
  },
  {
    "HicriTarihKisa": "17.6.1447",
    "HicriTarihKisaIso8601": null,
    "HicriTarihUzun": "17 Cemaziyelahir 1447",
    "HicriTarihUzunIso8601": null,
    "AyinSekliURL": "https://namazvakti.diyanet.gov.tr/images/d3.gif",
    "MiladiTarihKisa": "07.12.2025",
    "MiladiTarihKisaIso8601": "07.12.2025",
    "MiladiTarihUzun": "07 Aralık 2025 Pazar",
    "MiladiTarihUzunIso8601": "2025-12-07T00:00:00.0000000+01:00",
    "GreenwichOrtalamaZamani": 3.0,
    "Aksam": "16:30",
    "Gunes": "08:14",
    "GunesBatis": "16:23",
    "GunesDogus": "08:21",
    "Ikindi": "14:09",
    "Imsak": "06:18",
    "KibleSaati": "08:26",
    "Ogle": "12:27",
    "Yatsi": "18:12"
  },
  {
    "HicriTarihKisa": "18.6.1447",
    "HicriTarihKisaIso8601": null,
    "HicriTarihUzun": "18 Cemaziyelahir 1447",
    "HicriTarihUzunIso8601": null,
    "AyinSekliURL": "https://namazvakti.diyanet.gov.tr/images/d4.gif",
    "MiladiTarihKisa": "08.12.2025",
    "MiladiTarihKisaIso8601": "08.12.2025",
    "MiladiTarihUzun": "08 Aralık 2025 Pazartesi",
    "MiladiTarihUzunIso8601": "2025-12-08T00:00:00.0000000+01:00",
    "GreenwichOrtalamaZamani": 3.0,
    "Aksam": "16:29",
    "Gunes": "08:15",
    "GunesBatis": "16:22",
    "GunesDogus": "08:22",
    "Ikindi": "14:09",
    "Imsak": "06:19",
    "KibleSaati": "08:26",
    "Ogle": "12:27",
    "Yatsi": "18:12"
  },
  {
    "HicriTarihKisa": "19.6.1447",
    "HicriTarihKisaIso8601": null,
    "HicriTarihUzun": "19 Cemaziyelahir 1447",
    "HicriTarihUzunIso8601": null,
    "AyinSekliURL": "https://namazvakti.diyanet.gov.tr/images/d5.gif",
    "MiladiTarihKisa": "09.12.2025",
    "MiladiTarihKisaIso8601": "09.12.2025",
    "MiladiTarihUzun": "09 Aralık 2025 Salı",
    "MiladiTarihUzunIso8601": "2025-12-09T00:00:00.0000000+01:00",
    "GreenwichOrtalamaZamani": 3.0,
    "Aksam": "16:29",
    "Gunes": "08:16",
    "GunesBatis": "16:22",
    "GunesDogus": "08:23",
    "Ikindi": "14:09",
    "Imsak": "06:20",
    "KibleSaati": "08:26",
    "Ogle": "12:28",
    "Yatsi": "18:12"
  },
  {
    "HicriTarihKisa": "20.6.1447",
    "HicriTarihKisaIso8601": null,
    "HicriTarihUzun": "20 Cemaziyelahir 1447",
    "HicriTarihUzunIso8601": null,
    "AyinSekliURL": "https://namazvakti.diyanet.gov.tr/images/d6.gif",
    "MiladiTarihKisa": "10.12.2025",
    "MiladiTarihKisaIso8601": "10.12.2025",
    "MiladiTarihUzun": "10 Aralık 2025 Çarşamba",
    "MiladiTarihUzunIso8601": "2025-12-10T00:00:00.0000000+01:00",
    "GreenwichOrtalamaZamani": 3.0,
    "Aksam": "16:29",
    "Gunes": "08:17",
    "GunesBatis": "16:22",
    "GunesDogus": "08:24",
    "Ikindi": "14:09",
    "Imsak": "06:21",
    "KibleSaati": "08:27",
    "Ogle": "12:28",
    "Yatsi": "18:12"
  },
  {
    "HicriTarihKisa": "21.6.1447",
    "HicriTarihKisaIso8601": null,
    "HicriTarihUzun": "21 Cemaziyelahir 1447",
    "HicriTarihUzunIso8601": null,
    "AyinSekliURL": "https://namazvakti.diyanet.gov.tr/images/d7.gif",
    "MiladiTarihKisa": "11.12.2025",
    "MiladiTarihKisaIso8601": "11.12.2025",
    "MiladiTarihUzun": "11 Aralık 2025 Perşembe",
    "MiladiTarihUzunIso8601": "2025-12-11T00:00:00.0000000+01:00",
    "GreenwichOrtalamaZamani": 3.0,
    "Aksam": "16:29",
    "Gunes": "08:18",
    "GunesBatis": "16:22",
    "GunesDogus": "08:25",
    "Ikindi": "14:09",
    "Imsak": "06:22",
    "KibleSaati": "08:27",
    "Ogle": "12:28",
    "Yatsi": "18:12"
  },
  {
    "HicriTarihKisa": "22.6.1447",
    "HicriTarihKisaIso8601": null,
    "HicriTarihUzun": "22 Cemaziyelahir 1447",
    "HicriTarihUzunIso8601": null,
    "AyinSekliURL": "https://namazvakti.diyanet.gov.tr/images/sondordun.gif",
    "MiladiTarihKisa": "12.12.2025",
    "MiladiTarihKisaIso8601": "12.12.2025",
    "MiladiTarihUzun": "12 Aralık 2025 Cuma",
    "MiladiTarihUzunIso8601": "2025-12-12T00:00:00.0000000+01:00",
    "GreenwichOrtalamaZamani": 3.0,
    "Aksam": "16:29",
    "Gunes": "08:19",
    "GunesBatis": "16:22",
    "GunesDogus": "08:26",
    "Ikindi": "14:09",
    "Imsak": "06:23",
    "KibleSaati": "08:27",
    "Ogle": "12:29",
    "Yatsi": "18:12"
  },
  {
    "HicriTarihKisa": "23.6.1447",
    "HicriTarihKisaIso8601": null,
    "HicriTarihUzun": "23 Cemaziyelahir 1447",
    "HicriTarihUzunIso8601": null,
    "AyinSekliURL": "https://namazvakti.diyanet.gov.tr/images/sd1.gif",
    "MiladiTarihKisa": "13.12.2025",
    "MiladiTarihKisaIso8601": "13.12.2025",
    "MiladiTarihUzun": "13 Aralık 2025 Cumartesi",
    "MiladiTarihUzunIso8601": "2025-12-13T00:00:00.0000000+01:00",
    "GreenwichOrtalamaZamani": 3.0,
    "Aksam": "16:29",
    "Gunes": "08:20",
    "GunesBatis": "16:22",
    "GunesDogus": "08:27",
    "Ikindi": "14:09",
    "Imsak": "06:24",
    "KibleSaati": "08:27",
    "Ogle": "12:29",
    "Yatsi": "18:12"
  },
  {
    "HicriTarihKisa": "24.6.1447",
    "HicriTarihKisaIso8601": null,
    "HicriTarihUzun": "24 Cemaziyelahir 1447",
    "HicriTarihUzunIso8601": null,
    "AyinSekliURL": "https://namazvakti.diyanet.gov.tr/images/sd2.gif",
    "MiladiTarihKisa": "14.12.2025",
    "MiladiTarihKisaIso8601": "14.12.2025",
    "MiladiTarihUzun": "14 Aralık 2025 Pazar",
    "MiladiTarihUzunIso8601": "2025-12-14T00:00:00.0000000+01:00",
    "GreenwichOrtalamaZamani": 3.0,
    "Aksam": "16:29",
    "Gunes": "08:21",
    "GunesBatis": "16:22",
    "GunesDogus": "08:28",
    "Ikindi": "14:09",
    "Imsak": "06:24",
    "KibleSaati": "08:28",
    "Ogle": "12:30",
    "Yatsi": "18:12"
  },
  {
    "HicriTarihKisa": "25.6.1447",
    "HicriTarihKisaIso8601": null,
    "HicriTarihUzun": "25 Cemaziyelahir 1447",
    "HicriTarihUzunIso8601": null,
    "AyinSekliURL": "https://namazvakti.diyanet.gov.tr/images/sd3.gif",
    "MiladiTarihKisa": "15.12.2025",
    "MiladiTarihKisaIso8601": "15.12.2025",
    "MiladiTarihUzun": "15 Aralık 2025 Pazartesi",
    "MiladiTarihUzunIso8601": "2025-12-15T00:00:00.0000000+01:00",
    "GreenwichOrtalamaZamani": 3.0,
    "Aksam": "16:29",
    "Gunes": "08:22",
    "GunesBatis": "16:22",
    "GunesDogus": "08:29",
    "Ikindi": "14:10",
    "Imsak": "06:25",
    "KibleSaati": "08:28",
    "Ogle": "12:30",
    "Yatsi": "18:12"
  },
  {
    "HicriTarihKisa": "26.6.1447",
    "HicriTarihKisaIso8601": null,
    "HicriTarihUzun": "26 Cemaziyelahir 1447",
    "HicriTarihUzunIso8601": null,
    "AyinSekliURL": "https://namazvakti.diyanet.gov.tr/images/sd4.gif",
    "MiladiTarihKisa": "16.12.2025",
    "MiladiTarihKisaIso8601": "16.12.2025",
    "MiladiTarihUzun": "16 Aralık 2025 Salı",
    "MiladiTarihUzunIso8601": "2025-12-16T00:00:00.0000000+01:00",
    "GreenwichOrtalamaZamani": 3.0,
    "Aksam": "16:29",
    "Gunes": "08:23",
    "GunesBatis": "16:22",
    "GunesDogus": "08:30",
    "Ikindi": "14:10",
    "Imsak": "06:26",
    "KibleSaati": "08:28",
    "Ogle": "12:31",
    "Yatsi": "18:12"
  }
]