[
  {
    "HicriTarihKisa": "24.5.1447",
    "HicriTarihKisaIso8601": null,
    "HicriTarihUzun": "24 Cemaziyelevvel 1447",
    "HicriTarihUzunIso8601": null,
    "AyinSekliURL": "https://namazvakti.diyanet.gov.tr/images/sd3.gif",
    "MiladiTarihKisa": "15.11.2025",
    "MiladiTarihKisaIso8601": "15.11.2025",
    "MiladiTarihUzun": "15 Kasım 2025 Cumartesi",
    "MiladiTarihUzunIso8601": "2025-11-15T00:00:00.0000000+05:00",
    "GreenwichOrtalamaZamani": 3.0,
    "Aksam": "15:17",
    "Gunes": "09:20",
    "GunesBatis": "15:10",
    "GunesDogus": "09:27",
    "Ikindi": "13:06",
    "Imsak": "06:07",
    "KibleSaati": "14:44",
    "Ogle": "12:23",
    "Yatsi": "18:09"
  },
  {
    "HicriTarihKisa": "25.5.1447",
    "HicriTarihKisaIso8601": null,
    "HicriTarihUzun": "25 Cemaziyelevvel 1447",
    "HicriTarihUzunIso8601": null,
    "AyinSekliURL": "https://namazvakti.diyanet.gov.tr/images/sd4.gif",
    "MiladiTarihKisa": "16.11.2025",
    "MiladiTarihKisaIso8601": "16.11.2025",
    "MiladiTarihUzun": "16 Kasım 2025 Pazar",
    "MiladiTarihUzunIso8601": "2025-11-16T00:00:00.0000000+05:00",
    "GreenwichOrtalamaZamani": 3.0,
    "Aksam": "15:13",
    "Gunes": "09:24",
    "GunesBatis": "15:06",
    "GunesDogus": "09:31",
    "Ikindi": "13:04",
    "Imsak": "06:10",
    "KibleSaati": "14:44",
    "Ogle": "12:23",
    "Yatsi": "18:07"
  },
  {
    "HicriTarihKisa": "26.5.1447",
    "HicriTarihKisaIso8601": null,
    "HicriTarihUzun": "26 Cemaziyelevvel 1447",
    "HicriTarihUzunIso8601": null,
    "AyinSekliURL": "https://namazvakti.diyanet.gov.tr/images/sd5.gif",
    "MiladiTarihKisa": "17.11.2025",
    "MiladiTarihKisaIso8601": "17.11.2025",
    "MiladiTarihUzun": "17 Kasım 2025 Pazartesi",
    "MiladiTarihUzunIso8601": "2025-11-17T00:00:00.0000000+05:00",
    "GreenwichOrtalamaZamani": 3.0,
    "Aksam": "15:10",
    "Gunes": "09:28",
    "GunesBatis": "15:03",
    "GunesDogus": "09:35",
    "Ikindi": "13:02",
    "Imsak": "06:12",
    "KibleSaati": "14:44",
    "Ogle": "12:24",
    "Yatsi": "18:05"
  },
  {
    "HicriTarihKisa": "27.5.1447",
    "HicriTarihKisaIso8601": null,
    "HicriTarihUzun": "27 Cemaziyelevvel 1447",
    "HicriTarihUzunIso8601": null,
    "AyinSekliURL": "https://namazvakti.diyanet.gov.tr/images/sd6.gif",
    "MiladiTarihKisa": "18.11.2025",
    "MiladiTarihKisaIso8601": "18.11.2025",
    "MiladiTarihUzun": "18 Kasım 2025 Salı",
    "MiladiTarihUzunIso8601": "2025-11-18T00:00:00.0000000+05:00",
    "GreenwichOrtalamaZamani": 3.0,
    "Aksam": "15:06",
    "Gunes": "09:32",
    "GunesBatis": "14:59",
    "GunesDogus": "09:39",
    "Ikindi": "13:00",
    "Imsak": "06:15",
    "KibleSaati": "14:45",
    "Ogle": "12:24",
    "Yatsi": "18:03"
  },
  {
    "HicriTarihKisa": "28.5.1447",
    "HicriTarihKisaIso8601": null,
    "HicriTarihUzun": "28 Cemaziyelevvel 1447",
    "HicriTarihUzunIso8601": null,
    "AyinSekliURL": "https://namazvakti.diyanet.gov.tr/images/sd7.gif",
    "MiladiTarihKisa": "19.11.2025",
    "MiladiTarihKisaIso8601": "19.11.2025",
    "MiladiTarihUzun": "19 Kasım 2025 Çarşamba",
    "MiladiTarihUzunIso8601": "2025-11-19T00:00:00.0000000+05:00",
    "GreenwichOrtalamaZamani": 3.0,
    "Aksam": "15:02",
    "Gunes": "09:36",
    "GunesBatis": "14:55",
    "GunesDogus": "09:43",
    "Ikindi": "12:59",
    "Imsak": "06:17",
    "KibleSaati": "14:45",
    "Ogle": "12:24",
    "Yatsi": "18:01"
  },
  {
    "HicriTarihKisa": "29.5.1447",
    "HicriTarihKisaIso8601": null,
    "HicriTarihUzun": "29 Cemaziyelevvel 1447",
    "HicriTarihUzunIso8601": null,
    "AyinSekliURL": "https://namazvakti.diyanet.gov.tr/images/ruyet.gif",
    "MiladiTarihKisa": "20.11.2025",
    "MiladiTarihKisaIso8601": "20.11.2025",
    "MiladiTarihUzun": "20 Kasım 2025 Perşembe",
    "MiladiTarihUzunIso8601": "2025-11-20T00:00:00.0000000+05:00",
    "GreenwichOrtalamaZamani": 3.0,
    "Aksam": "14:59",
    "Gunes": "09:40",
    "GunesBatis": "14:52",
    "GunesDogus": "09:47",
    "Ikindi": "12:57",
    "Imsak": "06:19",
    "KibleSaati": "14:46",
    "Ogle": "12:24",
    "Yatsi": "17:59"
  },
  {
    "HicriTarihKisa": "1.6.1447",
    "HicriTarihKisaIso8601": null,
    "HicriTarihUzun": "1 Cemaziyelahir 1447",
    "HicriTarihUzunIso8601": null,
    "AyinSekliURL": "https://namazvakti.diyanet.gov.tr/images/r1.gif",
    "MiladiTarihKisa": "21.11.2025",
    "MiladiTarihKisaIso8601": "21.11.2025",
    "MiladiTarihUzun": "21 Kasım 2025 Cuma",
    "MiladiTarihUzunIso8601": "2025-11-21T00:00:00.0000000+05:00",
    "GreenwichOrtalamaZamani": 3.0,
    "Aksam": "14:55",
    "Gunes": "09:44",
    "GunesBatis": "14:48",
    "GunesDogus": "09:51",
    "Ikindi": "12:55",
    "Imsak": "06:22",
    "KibleSaati": "14:46",
    "Ogle": "12:24",
    "Yatsi": "17:57"
  },
  {
    "HicriTarihKisa": "2.6.1447",
    "HicriTarihKisaIso8601": null,
    "HicriTarihUzun": "2 Cemaziyelahir 1447",
    "HicriTarihUzunIso8601": null,
    "AyinSekliURL": "https://namazvakti.diyanet.gov.tr/images/r2.gif",
    "MiladiTarihKisa": "22.11.2025",
    "MiladiTarihKisaIso8601": "22.11.2025",
    "MiladiTarihUzun": "22 Kasım 2025 Cumartesi",
    "MiladiTarihUzunIso8601": "2025-11-22T00:00:00.0000000+05:00",
    "GreenwichOrtalamaZamani": 3.0,
    "Aksam": "14:55",
    "Gunes": "09:48",
    "GunesBatis": "14:45",
    "GunesDogus": "09:55",
    "Ikindi": "12:54",
    "Imsak": "06:24",
    "KibleSaati": "14:47",
    "Ogle": "12:25",
    "Yatsi": "17:55"
  },
  {
    "HicriTarihKisa": "3.6.1447",
    "HicriTarihKisaIso8601": null,
    "HicriTarihUzun": "3 Cemaziyelahir 1447",
    "HicriTarihUzunIso8601": null,
    "AyinSekliURL": "https://namazvakti.diyanet.gov.tr/images/r3.gif",
    "MiladiTarihKisa": "23.11.2025",
    "MiladiTarihKisaIso8601": "23.11.2025",
    "MiladiTarihUzun": "23 Kasım 2025 Pazar",
    "MiladiTarihUzunIso8601": "2025-11-23T00:00:00.0000000+05:00",
    "GreenwichOrtalamaZamani": 3.0,
    "Aksam": "14:55",
    "Gunes": "09:52",
    "GunesBatis": "14:41",
    "GunesDogus": "09:59",
    "Ikindi": "12:52",
    "Imsak": "06:26",
    "KibleSaati": "14:47",
    "Ogle": "12:25",
    "Yatsi": "17:53"
  },
  {
    "HicriTarihKisa": "4.6.1447",
    "HicriTarihKisaIso8601": null,
    "HicriTarihUzun": "4 Cemaziyelahir 1447",
    "HicriTarihUzunIso8601": null,
    "AyinSekliURL": "https://namazvakti.diyanet.gov.tr/images/r4.gif",
    "MiladiTarihKisa": "24.11.2025",
    "MiladiTarihKisaIso8601": "24.11.2025",
    "MiladiTarihUzun": "24 Kasım 2025 Pazartesi",
    "MiladiTarihUzunIso8601": "2025-11-24T00:00:00.0000000+05:00",
    "GreenwichOrtalamaZamani": 3.0,
    "Aksam": "14:55",
    "Gunes": "09:55",
    "GunesBatis": "14:38",
    "GunesDogus": "10:03",
    "Ikindi": "12:50",
    "Imsak": "06:28",
    "KibleSaati": "14:48",
    "Ogle": "12:25",
    "Yatsi": "17:52"
  },
  {
    "HicriTarihKisa": "5.6.1447",
    "HicriTarihKisaIso8601": null,
    "HicriTarihUzun": "5 Cemaziyelahir 1447",
    "HicriTarihUzunIso8601": null,
    "AyinSekliURL": "https://namazvakti.diyanet.gov.tr/images/r5.gif",
    "MiladiTarihKisa": "25.11.2025",
    "MiladiTarihKisaIso8601": "25.11.2025",
    "MiladiTarihUzun": "25 Kasım 2025 Salı",
    "MiladiTarihUzunIso8601": "2025-11-25T00:00:00.0000000+05:00",
    "GreenwichOrtalamaZamani": 3.0,
    "Aksam": "14:56",
    "Gunes": "09:56",
    "GunesBatis": "14:34",
    "GunesDogus": "10:07",
    "Ikindi": "12:49",
    "Imsak": "06:30",
    "KibleSaati": "14:48",
    "Ogle": "12:26",
    "Yatsi": "17:50"
  },
  {
    "HicriTarihKisa": "6.6.1447",
    "HicriTarihKisaIso8601": null,
    "HicriTarihUzun": "6 Cemaziyelahir 1447",
    "HicriTarihUzunIso8601": null,
    "AyinSekliURL": "https://namazvakti.diyanet.gov.tr/images/r6.gif",
    "MiladiTarihKisa": "26.11.2025",
    "MiladiTarihKisaIso8601": "26.11.2025",
    "MiladiTarihUzun": "26 Kasım 2025 Çarşamba",
    "MiladiTarihUzunIso8601": "2025-11-26T00:00:00.0000000+05:00",
    "GreenwichOrtalamaZamani": 3.0,
    "Aksam": "14:56",
    "Gunes": "09:56",
    "GunesBatis": "14:31",
    "GunesDogus": "10:11",
    "Ikindi": "12:48",
    "Imsak": "06:33",
    "KibleSaati": "14:49",
    "Ogle": "12:26",
    "Yatsi": "17:49"
  },
  {
    "HicriTarihKisa": "7.6.1447",
    "HicriTarihKisaIso8601": null,
    "HicriTarihUzun": "7 Cemaziyelahir 1447",
    "HicriTarihUzunIso8601": null,
    "AyinSekliURL": "https://namazvakti.diyanet.gov.tr/images/ilkdordun.gif",
    "MiladiTarihKisa": "27.11.2025",
    "MiladiTarihKisaIso8601": "27.11.2025",
    "MiladiTarihUzun": "27 Kasım 2025 Perşembe",
    "MiladiTarihUzunIso8601": "2025-11-27T00:00:00.0000000+05:00",
    "GreenwichOrtalamaZamani": 3.0,
    "Aksam": "14:56",
    "Gunes": "09:56",
    "GunesBatis": "14:28",
    "GunesDogus": "10:15",
    "Ikindi": "12:46",
    "Imsak": "06:35",
    "KibleSaati": "14:49",
    "Ogle": "12:26",
    "Yatsi": "17:47"
  },
  {
    "HicriTarihKisa": "8.6.1447",
    "HicriTarihKisaIso8601": null,
    "HicriTarihUzun": "8 Cemaziyelahir 1447",
    "HicriTarihUzunIso8601": null,
    "AyinSekliURL": "https://namazvakti.diyanet.gov.tr/images/i1.gif",
    "MiladiTarihKisa": "28.11.2025",
    "MiladiTarihKisaIso8601": "28.11.2025",
    "MiladiTarihUzun": "28 Kasım 2025 Cuma",
    "MiladiTarihUzunIso8601": "2025-11-28T00:00:00.0000000+05:00",
    "GreenwichOrtalamaZamani": 3.0,
    "Aksam": "14:57",
    "Gunes": "09:57",
    "GunesBatis": "14:24",
    "GunesDogus": "10:19",
    "Ikindi": "12:45",
    "Imsak": "06:37",
    "KibleSaati": "14:50",
    "Ogle": "12:27",
    "Yatsi": "17:46"
  },
  {
    "HicriTarihKisa": "9.6.1447",
    "HicriTarihKisaIso8601": null,
    "HicriTarihUzun": "9 Cemaziyelahir 1447",
    "HicriTarihUzunIso8601": null,
    "AyinSekliURL": "https://namazvakti.diyanet.gov.tr/images/i2.gif",
    "MiladiTarihKisa": "29.11.2025",
    "MiladiTarihKisaIso8601": "29.11.2025",
    "MiladiTarihUzun": "29 Kasım 2025 Cumartesi",
    "MiladiTarihUzunIso8601": "2025-11-29T00:00:00.0000000+05:00",
    "GreenwichOrtalamaZamani": 3.0,
    "Aksam": "14:57",
    "Gunes": "09:57",
    "GunesBatis": "14:21",
    "GunesDogus": "10:23",
    "Ikindi": "12:44",
    "Imsak": "06:39",
    "KibleSaati": "14:50",
    "Ogle": "12:27",
    "Yatsi": "17:44"
  },
  {
    "HicriTarihKisa": "10.6.1447",
    "HicriTarihKisaIso8601": null,
    "HicriTarihUzun": "10 Cemaziyelahir 1447",
    "HicriTarihUzunIso8601": null,
    "AyinSekliURL": "https://namazvakti.diyanet.gov.tr/images/i3.gif",
    "MiladiTarihKisa": "30.11.2025",
    "MiladiTarihKisaIso8601": "30.11.2025",
    "MiladiTarihUzun": "30 Kasım 2025 Pazar",
    "MiladiTarihUzunIso8601": "2025-11-30T00:00:00.0000000+05:00",
    "GreenwichOrtalamaZamani": 3.0,
    "Aksam": "14:57",
    "Gunes": "09:57",
    "GunesBatis": "14:18",
    "GunesDogus": "10:27",
    "Ikindi": "12:43",
    "Imsak": "06:40",
    "KibleSaati": "14:51",
    "Ogle": "12:27",
    "Yatsi": "17:43"
  },
  {
    "HicriTarihKisa": "11.6.1447",
    "HicriTarihKisaIso8601": null,
    "HicriTarihUzun": "11 Cemaziyelahir 1447",
    "HicriTarihUzunIso8601": null,
    "AyinSekliURL": "https://namazvakti.diyanet.gov.tr/images/i4.gif",
    "MiladiTarihKisa": "01.12.2025",
    "MiladiTarihKisaIso8601": "01.12.2025",
    "MiladiTarihUzun": "01 Aralık 2025 Pazartesi",
    "MiladiTarihUzunIso8601": "2025-12-01T00:00:00.0000000+05:00",
    "GreenwichOrtalamaZamani": 3.0,
    "Aksam": "14:58",
    "Gunes": "09:58",
    "GunesBatis": "14:15",
    "GunesDogus": "10:31",
    "Ikindi": "12:42",
    "Imsak": "06:42",
    "KibleSaati": "14:51",
    "Ogle": "12:28",
    "Yatsi": "17:42"
  },
  {
    "HicriTarihKisa": "12.6.1447",
    "HicriTarihKisaIso8601": null,
    "HicriTarihUzun": "12 Cemaziyelahir 1447",
    "HicriTarihUzunIso8601": null,
    "AyinSekliURL": "https://namazvakti.diyanet.gov.tr/images/i5.gif",
    "MiladiTarihKisa": "02.12.2025",
    "MiladiTarihKisaIso8601": "02.12.2025",
    "MiladiTarihUzun": "02 Aralık 2025 Salı",
    "MiladiTarihUzunIso8601": "2025-12-02T00:00:00.0000000+05:00",
    "GreenwichOrtalamaZamani": 3.0,
    "Aksam": "14:58",
    "Gunes": "09:58",
    "GunesBatis": "14:11",
    "GunesDogus": "10:34",
    "Ikindi": "12:41",
    "Imsak": "06:44",
    "KibleSaati": "14:52",
    "Ogle": "12:28",
    "Yatsi": "17:41"
  },
  {
    "HicriTarihKisa": "13.6.1447",
    "HicriTarihKisaIso8601": null,
    "HicriTarihUzun": "13 Cemaziyelahir 1447",
    "HicriTarihUzunIso8601": null,
    "AyinSekliURL": "https://namazvakti.diyanet.gov.tr/images/i6.gif",
    "MiladiTarihKisa": "03.12.2025",
    "MiladiTarihKisaIso8601": "03.12.2025",
    "MiladiTarihUzun": "03 Aralık 2025 Çarşamba",
    "MiladiTarihUzunIso8601": "2025-12-03T00:00:00.0000000+05:00",
    "GreenwichOrtalamaZamani": 3.0,
    "Aksam": "14:58",
    "Gunes": "09:58",
    "GunesBatis": "14:08",
    "GunesDogus": "10:38",
    "Ikindi": "12:40",
    "Imsak": "06:46",
    "KibleSaati": "14:52",
    "Ogle": "12:28",
    "Yatsi": "17:40"
  },
  {
    "HicriTarihKisa": "14.6.1447",
    "HicriTarihKisaIso8601": null,
    "HicriTarihUzun": "14 Cemaziyelahir 1447",
    "HicriTarihUzunIso8601": null,
    "AyinSekliURL": "https://namazvakti.diyanet.gov.tr/images/dolunay.gif",
    "MiladiTarihKisa": "04.12.2025",
    "MiladiTarihKisaIso8601": "04.12.2025",
    "MiladiTarihUzun": "04 Aralık 2025 Perşembe",
    "MiladiTarihUzunIso8601": "2025-12-04T00:00:00.0000000+05:00",
    "GreenwichOrtalamaZamani": 3.0,
    "Aksam": "14:59",
    "Gunes": "09:59",
    "GunesBatis": "14:05",
    "GunesDogus": "10:42",
    "Ikindi": "12:39",
    "Imsak": "06:48",
    "KibleSaati": "14:53",
    "Ogle": "12:29",
    "Yatsi": "17:39"
  },
  {
    "HicriTarihKisa": "15.6.1447",
    "HicriTarihKisaIso8601": null,
    "HicriTarihUzun": "15 Cemaziyelahir 1447",
    "HicriTarihUzunIso8601": null,
    "AyinSekliURL": "https://namazvakti.diyanet.gov.tr/images/d1.gif",
    "MiladiTarihKisa": "05.12.2025",
    "MiladiTarihKisaIso8601": "05.12.2025",
    "MiladiTarihUzun": "05 Aralık 2025 Cuma",
    "MiladiTarihUzunIso8601": "2025-12-05T00:00:00.0000000+05:00",
    "GreenwichOrtalamaZamani": 3.0,
    "Aksam": "14:59",
    "Gunes": "09:59",
    "GunesBatis": "14:03",
    "GunesDogus": "10:46",
    "Ikindi": "12:38",
    "Imsak": "06:49",
    "KibleSaati": "14:54",
    "Ogle": "12:29",
    "Yatsi": "17:38"
  },
  {
    "HicriTarihKisa": "16.6.1447",
    "HicriTarihKisaIso8601": null,
    "HicriTarihUzun": "16 Cemaziyelahir 1447",
    "HicriTarihUzunIso8601": null,
    "AyinSekliURL": "https://namazvakti.diyanet.gov.tr/images/d2.gif",
    "MiladiTarihKisa": "06.12.2025",
    "MiladiTarihKisaIso8601": "06.12.2025",
    "MiladiTarihUzun": "06 Aralık 2025 Cumartesi",
    "MiladiTarihUzunIso8601": "2025-12-06T00:00:00.0000000+05:00",
    "GreenwichOrtalamaZamani": 3.0,
    "Aksam": "15:00",
    "Gunes": "10:00",
    "GunesBatis": "14:00",
    "GunesDogus": "10:49",
    "Ikindi": "12:37",
    "Imsak": "06:51",
    "KibleSaati": "14:54",
    "Ogle": "12:30",
    "Yatsi": "17:37"
  },
  {
    "HicriTarihKisa": "17.6.1447",
    "HicriTarihKisaIso8601": null,
    "HicriTarihUzun": "17 Cemaziyelahir 1447",
    "HicriTarihUzunIso8601": null,
    "AyinSekliURL": "https://namazvakti.diyanet.gov.tr/images/d3.gif",
    "MiladiTarihKisa": "07.12.2025",
    "MiladiTarihKisaIso8601": "07.12.2025",
    "MiladiTarihUzun": "07 Aralık 2025 Pazar",
    "MiladiTarihUzunIso8601": "2025-12-07T00:00:00.0000000+05:00",
    "GreenwichOrtalamaZamani": 3.0,
    "Aksam": "15:00",
    "Gunes": "10:00",
    "GunesBatis": "13:57",
    "GunesDogus": "10:53",
    "Ikindi": "12:37",
    "Imsak": "06:52",
    "KibleSaati": "14:55",
    "Ogle": "12:30",
    "Yatsi": "17:37"
  },
  {
    "HicriTarihKisa": "18.6.1447",
    "HicriTarihKisaIso8601": null,
    "HicriTarihUzun": "18 Cemaziyelahir 1447",
    "HicriTarihUzunIso8601": null,
    "AyinSekliURL": "https://namazvakti.diyanet.gov.tr/images/d4.gif",
    "MiladiTarihKisa": "08.12.2025",
    "MiladiTarihKisaIso8601": "08.12.2025",
    "MiladiTarihUzun": "08 Aralık 2025 Pazartesi",
    "MiladiTarihUzunIso8601": "2025-12-08T00:00:00.0000000+05:00",
    "GreenwichOrtalamaZamani": 3.0,
    "Aksam": "15:00",
    "Gunes": "10:00",
    "GunesBatis": "13:54",
    "GunesDogus": "10:56",
    "Ikindi": "12:36",
    "Imsak": "06:54",
    "KibleSaati": "14:55",
    "Ogle": "12:30",
    "Yatsi": "17:36"
  },
  {
    "HicriTarihKisa": "19.6.1447",
    "HicriTarihKisaIso8601": null,
    "HicriTarihUzun": "19 Cemaziyelahir 1447",
    "HicriTarihUzunIso8601": null,
    "AyinSekliURL": "https://namazvakti.diyanet.gov.tr/images/d5.gif",
    "MiladiTarihKisa": "09.12.2025",
    "MiladiTarihKisaIso8601": "09.12.2025",
    "MiladiTarihUzun": "09 Aralık 2025 Salı",
    "MiladiTarihUzunIso8601": "2025-12-09T00:00:00.0000000+05:00",
    "GreenwichOrtalamaZamani": 3.0,
    "Aksam": "15:01",
    "Gunes": "10:01",
    "GunesBatis": "13:52",
    "GunesDogus": "11:00",
    "Ikindi": "12:36",
    "Imsak": "06:55",
    "KibleSaati": "14:56",
    "Ogle": "12:31",
    "Yatsi": "17:35"
  },
  {
    "HicriTarihKisa": "20.6.1447",
    "HicriTarihKisaIso8601": null,
    "HicriTarihUzun": "20 Cemaziyelahir 1447",
    "HicriTarihUzunIso8601": null,
    "AyinSekliURL": "https://namazvakti.diyanet.gov.tr/images/d6.gif",
    "MiladiTarihKisa": "10.12.2025",
    "MiladiTarihKisaIso8601": "10.12.2025",
    "MiladiTarihUzun": "10 Aralık 2025 Çarşamba",
    "MiladiTarihUzunIso8601": "2025-12-10T00:00:00.0000000+05:00",
    "GreenwichOrtalamaZamani": 3.0,
    "Aksam": "15:01",
    "Gunes": "10:01",
    "GunesBatis": "13:50",
    "GunesDogus": "11:03",
    "Ikindi": "12:35",
    "Imsak": "06:57",
    "KibleSaati": "14:56",
    "Ogle": "12:31",
    "Yatsi": "17:35"
  },
  {
    "HicriTarihKisa": "21.6.1447",
    "HicriTarihKisaIso8601": null,
    "HicriTarihUzun": "21 Cemaziyelahir 1447",
    "HicriTarihUzunIso8601": null,
    "AyinSekliURL": "https://namazvakti.diyanet.gov.tr/images/d7.gif",
    "MiladiTarihKisa": "11.12.2025",
    "MiladiTarihKisaIso8601": "11.12.2025",
    "MiladiTarihUzun": "11 Aralık 2025 Perşembe",
    "MiladiTarihUzunIso8601": "2025-12-11T00:00:00.0000000+05:00",
    "GreenwichOrtalamaZamani": 3.0,
    "Aksam": "15:02",
    "Gunes": "10:02",
    "GunesBatis": "13:47",
    "GunesDogus": "11:06",
    "Ikindi": "12:35",
    "Imsak": "06:58",
    "KibleSaati": "14:57",
    "Ogle": "12:32",
    "Yatsi": "17:35"
  },
  {
    "HicriTarihKisa": "22.6.1447",
    "HicriTarihKisaIso8601": null,
    "HicriTarihUzun": "22 Cemaziyelahir 1447",
    "HicriTarihUzunIso8601": null,
    "AyinSekliURL": "https://namazvakti.diyanet.gov.tr/images/sondordun.gif",
    "MiladiTarihKisa": "12.12.2025",
    "MiladiTarihKisaIso8601": "12.12.2025",
    "MiladiTarihUzun": "12 Aralık 2025 Cuma",
    "MiladiTarihUzunIso8601": "2025-12-12T00:00:00.0000000+05:00",
    "GreenwichOrtalamaZamani": 3.0,
    "Aksam": "15:02",
    "Gunes": "10:02",
    "GunesBatis": "13:45",
    "GunesDogus": "11:09",
    "Ikindi": "12:35",
    "Imsak": "06:59",
    "KibleSaati": "14:57",
    "Ogle": "12:32",
    "Yatsi": "17:34"
  },
  {
    "HicriTarihKisa": "23.6.1447",
    "HicriTarihKisaIso8601": null,
    "HicriTarihUzun": "23 Cemaziyelahir 1447",
    "HicriTarihUzunIso8601": null,
    "AyinSekliURL": "https://namazvakti.diyanet.gov.tr/images/sd1.gif",
    "MiladiTarihKisa": "13.12.2025",
    "MiladiTarihKisaIso8601": "13.12.2025",
    "MiladiTarihUzun": "13 Aralık 2025 Cumartesi",
    "MiladiTarihUzunIso8601": "2025-12-13T00:00:00.0000000+05:00",
    "GreenwichOrtalamaZamani": 3.0,
    "Aksam": "15:03",
    "Gunes": "10:03",
    "GunesBatis": "13:43",
    "GunesDogus": "11:12",
    "Ikindi": "12:35",
    "Imsak": "07:00",
    "KibleSaati": "14:58",
    "Ogle": "12:33",
    "Yatsi": "17:34"
  },
  {
    "HicriTarihKisa": "24.6.1447",
    "HicriTarihKisaIso8601": null,
    "HicriTarihUzun": "24 Cemaziyelahir 1447",
    "HicriTarihUzunIso8601": null,
    "AyinSekliURL": "https://namazvakti.diyanet.gov.tr/images/sd2.gif",
    "MiladiTarihKisa": "14.12.2025",
    "MiladiTarihKisaIso8601": "14.12.2025",
    "MiladiTarihUzun": "14 Aralık 2025 Pazar",
    "MiladiTarihUzunIso8601": "2025-12-14T00:00:00.0000000+05:00",
    "GreenwichOrtalamaZamani": 3.0,
    "Aksam": "15:03",
    "Gunes": "10:03",
    "GunesBatis": "13:42",
    "GunesDogus": "11:15",
    "Ikindi": "12:34",
    "Imsak": "07:01",
    "KibleSaati": "14:58",
    "Ogle": "12:33",
    "Yatsi": "17:34"
  },
  {
    "HicriTarihKisa": "25.6.1447",
    "HicriTarihKisaIso8601": null,
    "HicriTarihUzun": "25 Cemaziyelahir 1447",
    "HicriTarihUzunIso8601": null,
    "AyinSekliURL": "https://namazvakti.diyanet.gov.tr/images/sd3.gif",
    "MiladiTarihKisa": "15.12.2025",
    "MiladiTarihKisaIso8601": "15.12.2025",
    "MiladiTarihUzun": "15 Aralık 2025 Pazartesi",
    "MiladiTarihUzunIso8601": "2025-12-15T00:00:00.0000000+05:00",
    "GreenwichOrtalamaZamani": 3.0,
    "Aksam": "15:04",
    "Gunes": "10:04",
    "GunesBatis": "13:40",
    "GunesDogus": "11:17",
    "Ikindi": "12:34",
    "Imsak": "07:02",
    "KibleSaati": "14:59",
    "Ogle": "12:34",
    "Yatsi": "17:34"
  },
  {
    "HicriTarihKisa": "26.6.1447",
    "HicriTarihKisaIso8601": null,
    "HicriTarihUzun": "26 Cemaziyelahir 1447",
    "HicriTarihUzunIso8601": null,
    "AyinSekliURL": "https://namazvakti.diyanet.gov.tr/images/sd4.gif",
    "MiladiTarihKisa": "16.12.2025",
    "MiladiTarihKisaIso8601": "16.12.2025",
    "MiladiTarihUzun": "16 Aralık 2025 Salı",
    "MiladiTarihUzunIso8601": "2025-12-16T00:00:00.0000000+05:00",
    "GreenwichOrtalamaZamani": 3.0,
    "Aksam": "15:04",
    "Gunes": "10:04",
    "GunesBatis": "13:39",
    "GunesDogus": "11:19",
    "Ikindi": "12:34",
    "Imsak": "07:03",
    "KibleSaati": "15:00",
    "Ogle": "12:34",
    "Yatsi": "17:34"
  }
]