[
  {
    "HicriTarihKisa": "24.4.1447",
    "HicriTarihKisaIso8601": null,
    "HicriTarihUzun": "24 Rebiulahir 1447",
    "HicriTarihUzunIso8601": null,
    "AyinSekliURL": "https://namazvakti.diyanet.gov.tr/images/sd3.gif",
    "MiladiTarihKisa": "16.10.2025",
    "MiladiTarihKisaIso8601": "16.10.2025",
    "MiladiTarihUzun": "16 Ekim 2025 Perşembe",
    "MiladiTarihUzunIso8601": "2025-10-16T00:00:00.0000000+02:00",
    "GreenwichOrtalamaZamani": 3.0,
    "Aksam": "18:28",
    "Gunes": "07:24",
    "GunesBatis": "18:21",
    "GunesDogus": "07:31",
    "Ikindi": "15:52",
    "Imsak": "05:48",
    "KibleSaati": "09:53",
    "Ogle": "13:01",
    "Yatsi": "19:52"
  },
  {
    "HicriTarihKisa": "25.4.1447",
    "HicriTarihKisaIso8601": null,
    "HicriTarihUzun": "25 Rebiulahir 1447",
    "HicriTarihUzunIso8601": null,
    "AyinSekliURL": "https://namazvakti.diyanet.gov.tr/images/sd4.gif",
    "MiladiTarihKisa": "17.10.2025",
    "MiladiTarihKisaIso8601": "17.10.2025",
    "MiladiTarihUzun": "17 Ekim 2025 Cuma",
    "MiladiTarihUzunIso8601": "2025-10-17T00:00:00.0000000+02:00",
    "GreenwichOrtalamaZamani": 3.0,
    "Aksam": "18:26",
    "Gunes": "07:26",
    "GunesBatis": "18:19",
    "GunesDogus": "07:33",
    "Ikindi": "15:51",
    "Imsak": "05:49",
    "KibleSaati": "09:52",
    "Ogle": "13:01",
    "Yatsi": "19:51"
  },
  {
    "HicriTarihKisa": "26.4.1447",
    "HicriTarihKisaIso8601": null,
    "HicriTarihUzun": "26 Rebiulahir 1447",
    "HicriTarihUzunIso8601": null,
    "AyinSekliURL": "https://namazvakti.diyanet.gov.tr/images/sd5.gif",
    "MiladiTarihKisa": "18.10.2025",
    "MiladiTarihKisaIso8601": "18.10.2025",
    "MiladiTarihUzun": "18 Ekim 2025 Cumartesi",
    "MiladiTarihUzunIso8601": "2025-10-18T00:00:00.0000000+02:00",
    "GreenwichOrtalamaZamani": 3.0,
    "Aksam": "18:24",
    "Gunes": "07:27",
    "GunesBatis": "18:17",
    "GunesDogus": "07:34",
    "Ikindi": "15:49",
    "Imsak": "05:50",
    "KibleSaati": "09:50",
    "Ogle": "13:01",
    "Yatsi": "19:49"
  },
  {
    "HicriTarihKisa": "27.4.1447",
    "HicriTarihKisaIso8601": null,
    "HicriTarihUzun": "27 Rebiulahir 1447",
    "HicriTarihUzunIso8601": null,
    "AyinSekliURL": "https://namazvakti.diyanet.gov.tr/images/sd6.gif",
    "MiladiTarihKisa": "19.10.2025",
    "MiladiTarihKisaIso8601": "19.10.2025",
    "MiladiTarihUzun": "19 Ekim 2025 Pazar",
    "MiladiTarihUzunIso8601": "2025-10-19T00:00:00.0000000+02:00",
    "GreenwichOrtalamaZamani": 3.0,
    "Aksam": "18:22",
    "Gunes": "07:29",
    "GunesBatis": "18:15",
    "GunesDogus": "07:36",
    "Ikindi": "15:48",
    "Imsak": "05:52",
    "KibleSaati": "09:49",
    "Ogle": "13:00",
    "Yatsi": "19:47"
  },
  {
    "HicriTarihKisa": "28.4.1447",
    "HicriTarihKisaIso8601": null,
    "HicriTarihUzun": "28 Rebiulahir 1447",
    "HicriTarihUzunIso8601": null,
    "AyinSekliURL": "https://namazvakti.diyanet.gov.tr/images/sd7.gif",
    "MiladiTarihKisa": "20.10.2025",
    "MiladiTarihKisaIso8601": "20.10.2025",
    "MiladiTarihUzun": "20 Ekim 2025 Pazartesi",
    "MiladiTarihUzunIso8601": "2025-10-20T00:00:00.0000000+02:00",
    "GreenwichOrtalamaZamani": 3.0,
    "Aksam": "18:20",
    "Gunes": "07:30",
    "GunesBatis": "18:13",
    "GunesDogus": "07:37",
    "Ikindi": "15:46",
    "Imsak": "05:53",
    "KibleSaati": "09:48",
    "Ogle": "13:00",
    "Yatsi": "19:45"
  },
  {
    "HicriTarihKisa": "29.4.1447",
    "HicriTarihKisaIso8601": null,
    "HicriTarihUzun": "29 Rebiulahir 1447",
    "HicriTarihUzunIso8601": null,
    "AyinSekliURL": "https://namazvakti.diyanet.gov.tr/images/ictima.gif",
    "MiladiTarihKisa": "21.10.2025",
    "MiladiTarihKisaIso8601": "21.10.2025",
    "MiladiTarihUzun": "21 Ekim 2025 Salı",
    "MiladiTarihUzunIso8601": "2025-10-21T00:00:00.0000000+02:00",
    "GreenwichOrtalamaZamani": 3.0,
    "Aksam": "18:18",
    "Gunes": "07:32",
    "GunesBatis": "18:11",
    "GunesDogus": "07:39",
    "Ikindi": "15:45",
    "Imsak": "05:55",
    "KibleSaati": "09:47",
    "Ogle": "13:00",
    "Yatsi": "19:43"
  },
  {
    "HicriTarihKisa": "30.4.1447",
    "HicriTarihKisaIso8601": null,
    "HicriTarihUzun": "30 Rebiulahir 1447",
    "HicriTarihUzunIso8601": null,
    "AyinSekliURL": "https://namazvakti.diyanet.gov.tr/images/ruyet.gif",
    "MiladiTarihKisa": "22.10.2025",
    "MiladiTarihKisaIso8601": "22.10.2025",
    "MiladiTarihUzun": "22 Ekim 2025 Çarşamba",
    "MiladiTarihUzunIso8601": "2025-10-22T00:00:00.0000000+02:00",
    "GreenwichOrtalamaZamani": 3.0,
    "Aksam": "18:17",
    "Gunes": "07:33",
    "GunesBatis": "18:10",
    "GunesDogus": "07:40",
    "Ikindi": "15:44",
    "Imsak": "05:56",
    "KibleSaati": "09:46",
    "Ogle": "13:00",
    "Yatsi": "19:42"
  },
  {
    "HicriTarihKisa": "1.5.1447",
    "HicriTarihKisaIso8601": null,
    "HicriTarihUzun": "1 Cemaziyelevvel 1447",
    "HicriTarihUzunIso8601": null,
    "AyinSekliURL": "https://namazvakti.diyanet.gov.tr/images/r1.gif",
    "MiladiTarihKisa": "23.10.2025",
    "MiladiTarihKisaIso8601": "23.10.2025",
    "MiladiTarihUzun": "23 Ekim 2025 Perşembe",
    "MiladiTarihUzunIso8601": "2025-10-23T00:00:00.0000000+02:00",
    "GreenwichOrtalamaZamani": 3.0,
    "Aksam": "18:15",
    "Gunes": "07:35",
    "GunesBatis": "18:08",
    "GunesDogus": "07:42",
    "Ikindi": "15:42",
    "Imsak": "05:58",
    "KibleSaati": "09:45",
    "Ogle": "13:00",
    "Yatsi": "19:40"
  },
  {
    "HicriTarihKisa": "2.5.1447",
    "HicriTarihKisaIso8601": null,
    "HicriTarihUzun": "2 Cemaziyelevvel 1447",
    "HicriTarihUzunIso8601": null,
    "AyinSekliURL": "https://namazvakti.diyanet.gov.tr/images/r2.gif",
    "MiladiTarihKisa": "24.10.2025",
    "MiladiTarihKisaIso8601": "24.10.2025",
    "MiladiTarihUzun": "24 Ekim 2025 Cuma",
    "MiladiTarihUzunIso8601": "2025-10-24T00:00:00.0000000+02:00",
    "GreenwichOrtalamaZamani": 3.0,
    "Aksam": "18:13",
    "Gunes": "07:36",
    "GunesBatis": "18:06",
    "GunesDogus": "07:43",
    "Ikindi": "15:41",
    "Imsak": "05:59",
    "KibleSaati": "09:44",
    "Ogle": "13:00",
    "Yatsi": "19:38"
  },
  {
    "HicriTarihKisa": "3.5.1447",
    "HicriTarihKisaIso8601": null,
    "HicriTarihUzun": "3 Cemaziyelevvel 1447",
    "HicriTarihUzunIso8601": null,
    "AyinSekliURL": "https://namazvakti.diyanet.gov.tr/images/r3.gif",
    "MiladiTarihKisa": "25.10.2025",
    "MiladiTarihKisaIso8601": "25.10.2025",
    "MiladiTarihUzun": "25 Ekim 2025 Cumartesi",
    "MiladiTarihUzunIso8601": "2025-10-25T00:00:00.0000000+02:00",
    "GreenwichOrtalamaZamani": 3.0,
    "Aksam": "18:11",
    "Gunes": "07:38",
    "GunesBatis": "18:04",
    "GunesDogus": "07:45",
    "Ikindi": "15:39",
    "Imsak": "06:00",
    "KibleSaati": "09:43",
    "Ogle": "13:00",
    "Yatsi": "19:37"
  },
  {
    "HicriTarihKisa": "4.5.1447",
    "HicriTarihKisaIso8601": null,
    "HicriTarihUzun": "4 Cemaziyelevvel 1447",
    "HicriTarihUzunIso8601": null,
    "AyinSekliURL": "https://namazvakti.diyanet.gov.tr/images/r4.gif",
    "MiladiTarihKisa": "26.10.2025",
    "MiladiTarihKisaIso8601": "26.10.2025",
    "MiladiTarihUzun": "26 Ekim 2025 Pazar",
    "MiladiTarihUzunIso8601": "2025-10-26T00:00:00.0000000+02:00",
    "GreenwichOrtalamaZamani": 3.0,
    "Aksam": "17:09",
    "Gunes": "06:39",
    "GunesBatis": "17:02",
    "GunesDogus": "06:46",
    "Ikindi": "14:38",
    "Imsak": "05:02",
    "KibleSaati": "08:42",
    "Ogle": "11:59",
    "Yatsi": "18:35"
  },
  {
    "HicriTarihKisa": "5.5.1447",
    "HicriTarihKisaIso8601": null,
    "HicriTarihUzun": "5 Cemaziyelevvel 1447",
    "HicriTarihUzunIso8601": null,
    "AyinSekliURL": "https://namazvakti.diyanet.gov.tr/images/r5.gif",
    "MiladiTarihKisa": "27.10.2025",
    "MiladiTarihKisaIso8601": "27.10.2025",
    "MiladiTarihUzun": "27 Ekim 2025 Pazartesi",
    "MiladiTarihUzunIso8601": "2025-10-27T00:00:00.0000000+02:00",
    "GreenwichOrtalamaZamani": 3.0,
    "Aksam": "17:08",
    "Gunes": "06:41",
    "GunesBatis": "17:01",
    "GunesDogus": "06:48",
    "Ikindi": "14:37",
    "Imsak": "05:03",
    "KibleSaati": "08:41",
    "Ogle": "11:59",
    "Yatsi": "18:33"
  },
  {
    "HicriTarihKisa": "6.5.1447",
    "HicriTarihKisaIso8601": null,
    "HicriTarihUzun": "6 Cemaziyelevvel 1447",
    "HicriTarihUzunIso8601": null,
    "AyinSekliURL": "https://namazvakti.diyanet.gov.tr/images/r6.gif",
    "MiladiTarihKisa": "28.10.2025",
    "MiladiTarihKisaIso8601": "28.10.2025",
    "MiladiTarihUzun": "28 Ekim 2025 Salı",
    "MiladiTarihUzunIso8601": "2025-10-28T00:00:00.0000000+02:00",
    "GreenwichOrtalamaZamani": 3.0,
    "Aksam": "17:06",
    "Gunes": "06:42",
    "GunesBatis": "16:59",
    "GunesDogus": "06:49",
    "Ikindi": "14:35",
    "Imsak": "05:05",
    "KibleSaati": "08:41",
    "Ogle": "11:59",
    "Yatsi": "18:32"
  },
  {
    "HicriTarihKisa": "7.5.1447",
    "HicriTarihKisaIso8601": null,
    "HicriTarihUzun": "7 Cemaziyelevvel 1447",
    "HicriTarihUzunIso8601": null,
    "AyinSekliURL": "https://namazvakti.diyanet.gov.tr/images/ilkdordun.gif",
    "MiladiTarihKisa": "29.10.2025",
    "MiladiTarihKisaIso8601": "29.10.2025",
    "MiladiTarihUzun": "29 Ekim 2025 Çarşamba",
    "MiladiTarihUzunIso8601": "2025-10-29T00:00:00.0000000+02:00",
    "GreenwichOrtalamaZamani": 3.0,
    "Aksam": "17:04",
    "Gunes": "06:44",
    "GunesBatis": "16:57",
    "GunesDogus": "06:51",
    "Ikindi": "14:34",
    "Imsak": "05:06",
    "KibleSaati": "08:40",
    "Ogle": "11:59",
    "Yatsi": "18:30"
  },
  {
    "HicriTarihKisa": "8.5.1447",
    "HicriTarihKisaIso8601": null,
    "HicriTarihUzun": "8 Cemaziyelevvel 1447",
    "HicriTarihUzunIso8601": null,
    "AyinSekliURL": "https://namazvakti.diyanet.gov.tr/images/i1.gif",
    "MiladiTarihKisa": "30.10.2025",
    "MiladiTarihKisaIso8601": "30.10.2025",
    "MiladiTarihUzun": "30 Ekim 2025 Perşembe",
    "MiladiTarihUzunIso8601": "2025-10-30T00:00:00.0000000+02:00",
    "GreenwichOrtalamaZamani": 3.0,
    "Aksam": "17:03",
    "Gunes": "06:46",
    "GunesBatis": "16:56",
    "GunesDogus": "06:53",
    "Ikindi": "14:33",
    "Imsak": "05:07",
    "KibleSaati": "08:39",
    "Ogle": "11:59",
    "Yatsi": "18:29"
  },
  {
    "HicriTarihKisa": "9.5.1447",
    "HicriTarihKisaIso8601": null,
    "HicriTarihUzun": "9 Cemaziyelevvel 1447",
    "HicriTarihUzunIso8601": null,
    "AyinSekliURL": "https://namazvakti.diyanet.gov.tr/images/i2.gif",
    "MiladiTarihKisa": "31.10.2025",
    "MiladiTarihKisaIso8601": "31.10.2025",
    "MiladiTarihUzun": "31 Ekim 2025 Cuma",
    "MiladiTarihUzunIso8601": "2025-10-31T00:00:00.0000000+02:00",
    "GreenwichOrtalamaZamani": 3.0,
    "Aksam": "17:01",
    "Gunes": "06:47",
    "GunesBatis": "16:54",
    "GunesDogus": "06:54",
    "Ikindi": "14:31",
    "Imsak": "05:09",
    "KibleSaati": "08:38",
    "Ogle": "11:59",
    "Yatsi": "18:27"
  },
  {
    "HicriTarihKisa": "10.5.1447",
    "HicriTarihKisaIso8601": null,
    "HicriTarihUzun": "10 Cemaziyelevvel 1447",
    "HicriTarihUzunIso8601": null,
    "AyinSekliURL": "https://namazvakti.diyanet.gov.tr/images/i3.gif",
    "MiladiTarihKisa": "01.11.2025",
    "MiladiTarihKisaIso8601": "01.11.2025",
    "MiladiTarihUzun": "01 Kasım 2025 Cumartesi",
    "MiladiTarihUzunIso8601": "2025-11-01T00:00:00.0000000+02:00",
    "GreenwichOrtalamaZamani": 3.0,
    "Aksam": "16:59",
    "Gunes": "06:49",
    "GunesBatis": "16:52",
    "GunesDogus": "06:56",
    "Ikindi": "14:30",
    "Imsak": "05:10",
    "KibleSaati": "08:37",
    "Ogle": "11:59",
    "Yatsi": "18:26"
  },
  {
    "HicriTarihKisa": "11.5.1447",
    "HicriTarihKisaIso8601": null,
    "HicriTarihUzun": "11 Cemaziyelevvel 1447",
    "HicriTarihUzunIso8601": null,
    "AyinSekliURL": "https://namazvakti.diyanet.gov.tr/images/i4.gif",
    "MiladiTarihKisa": "02.11.2025",
    "MiladiTarihKisaIso8601": "02.11.2025",
    "MiladiTarihUzun": "02 Kasım 2025 Pazar",
    "MiladiTarihUzunIso8601": "2025-11-02T00:00:00.0000000+02:00",
    "GreenwichOrtalamaZamani": 3.0,
    "Aksam": "16:58",
    "Gunes": "06:50",
    "GunesBatis": "16:51",
    "GunesDogus": "06:57",
    "Ikindi": "14:29",
    "Imsak": "05:11",
    "KibleSaati": "08:36",
    "Ogle": "11:59",
    "Yatsi": "18:25"
  },
  {
    "HicriTarihKisa": "12.5.1447",
    "HicriTarihKisaIso8601": null,
    "HicriTarihUzun": "12 Cemaziyelevvel 1447",
    "HicriTarihUzunIso8601": null,
    "AyinSekliURL": "https://namazvakti.diyanet.gov.tr/images/i5.gif",
    "MiladiTarihKisa": "03.11.2025",
    "MiladiTarihKisaIso8601": "03.11.2025",
    "MiladiTarihUzun": "03 Kasım 2025 Pazartesi",
    "MiladiTarihUzunIso8601": "2025-11-03T00:00:00.0000000+02:00",
    "GreenwichOrtalamaZamani": 3.0,
    "Aksam": "16:56",
    "Gunes": "06:52",
    "GunesBatis": "16:49",
    "GunesDogus": "06:59",
    "Ikindi": "14:27",
    "Imsak": "05:13",
    "KibleSaati": "08:35",
    "Ogle": "11:59",
    "Yatsi": "18:23"
  },
  {
    "HicriTarihKisa": "13.5.1447",
    "HicriTarihKisaIso8601": null,
    "HicriTarihUzun": "13 Cemaziyelevvel 1447",
    "HicriTarihUzunIso8601": null,
    "AyinSekliURL": "https://namazvakti.diyanet.gov.tr/images/i6.gif",
    "MiladiTarihKisa": "04.11.2025",
    "MiladiTarihKisaIso8601": "04.11.2025",
    "MiladiTarihUzun": "04 Kasım 2025 Salı",
    "MiladiTarihUzunIso8601": "2025-11-04T00:00:00.0000000+02:00",
    "GreenwichOrtalamaZamani": 3.0,
    "Aksam": "16:55",
    "Gunes": "06:53",
    "GunesBatis": "16:48",
    "GunesDogus": "07:00",
    "Ikindi": "14:26",
    "Imsak": "05:14",
    "KibleSaati": "08:35",
    "Ogle": "11:59",
    "Yatsi": "18:22"
  },
  {
    "HicriTarihKisa": "14.5.1447",
    "HicriTarihKisaIso8601": null,
    "HicriTarihUzun": "14 Cemaziyelevvel 1447",
    "HicriTarihUzunIso8601": null,
    "AyinSekliURL": "https://namazvakti.diyanet.gov.tr/images/dolunay.gif",
    "MiladiTarihKisa": "05.11.2025",
    "MiladiTarihKisaIso8601": "05.11.2025",
    "MiladiTarihUzun": "05 Kasım 2025 Çarşamba",
    "MiladiTarihUzunIso8601": "2025-11-05T00:00:00.0000000+02:00",
    "GreenwichOrtalamaZamani": 3.0,
    "Aksam": "16:53",
    "Gunes": "06:55",
    "GunesBatis": "16:46",
    "GunesDogus": "07:02",
    "Ikindi": "14:25",
    "Imsak": "05:15",
    "KibleSaati": "08:34",
    "Ogle": "11:59",
    "Yatsi": "18:21"
  },
  {
    "HicriTarihKisa": "15.5.1447",
    "HicriTarihKisaIso8601": null,
    "HicriTarihUzun": "15 Cemaziyelevvel 1447",
    "HicriTarihUzunIso8601": null,
    "AyinSekliURL": "https://namazvakti.diyanet.gov.tr/images/d1.gif",
    "MiladiTarihKisa": "06.11.2025",
    "MiladiTarihKisaIso8601": "06.11.2025",
    "MiladiTarihUzun": "06 Kasım 2025 Perşembe",
    "MiladiTarihUzunIso8601": "2025-11-06T00:00:00.0000000+02:00",
    "GreenwichOrtalamaZamani": 3.0,
    "Aksam": "16:52",
    "Gunes": "06:56",
    "GunesBatis": "16:45",
    "GunesDogus": "07:03",
    "Ikindi": "14:24",
    "Imsak": "05:17",
    "KibleSaati": "08:33",
    "Ogle": "11:59",
    "Yatsi": "18:19"
  },
  {
    "HicriTarihKisa": "16.5.1447",
    "HicriTarihKisaIso8601": null,
    "HicriTarihUzun": "16 Cemaziyelevvel 1447",
    "HicriTarihUzunIso8601": null,
    "AyinSekliURL": "https://namazvakti.diyanet.gov.tr/images/d2.gif",
    "MiladiTarihKisa": "07.11.2025",
    "MiladiTarihKisaIso8601": "07.11.2025",
    "MiladiTarihUzun": "07 Kasım 2025 Cuma",
    "MiladiTarihUzunIso8601": "2025-11-07T00:00:00.0000000+02:00",
    "GreenwichOrtalamaZamani": 3.0,
    "Aksam": "16:50",
    "Gunes": "06:58",
    "GunesBatis": "16:43",
    "GunesDogus": "07:05",
    "Ikindi": "14:23",
    "Imsak": "05:18",
    "KibleSaati": "08:32",
    "Ogle": "11:59",
    "Yatsi": "18:18"
  },
  {
    "HicriTarihKisa": "17.5.1447",
    "HicriTarihKisaIso8601": null,
    "HicriTarihUzun": "17 Cemaziyelevvel 1447",
    "HicriTarihUzunIso8601": null,
    "AyinSekliURL": "https://namazvakti.diyanet.gov.tr/images/d3.gif",
    "MiladiTarihKisa": "08.11.2025",
    "MiladiTarihKisaIso8601": "08.11.2025",
    "MiladiTarihUzun": "08 Kasım 2025 Cumartesi",
    "MiladiTarihUzunIso8601": "2025-11-08T00:00:00.0000000+02:00",
    "GreenwichOrtalamaZamani": 3.0,
    "Aksam": "16:49",
    "Gunes": "06:59",
    "GunesBatis": "16:42",
    "GunesDogus": "07:06",
    "Ikindi": "14:22",
    "Imsak": "05:19",
    "KibleSaati": "08:32",
    "Ogle": "11:59",
    "Yatsi": "18:17"
  },
  {
    "HicriTarihKisa": "18.5.1447",
    "HicriTarihKisaIso8601": null,
    "HicriTarihUzun": "18 Cemaziyelevvel 1447",
    "HicriTarihUzunIso8601": null,
    "AyinSekliURL": "https://namazvakti.diyanet.gov.tr/images/d4.gif",
    "MiladiTarihKisa": "09.11.2025",
    "MiladiTarihKisaIso8601": "09.11.2025",
    "MiladiTarihUzun": "09 Kasım 2025 Pazar",
    "MiladiTarihUzunIso8601": "2025-11-09T00:00:00.0000000+02:00",
    "GreenwichOrtalamaZamani": 3.0,
    "Aksam": "16:47",
    "Gunes": "07:01",
    "GunesBatis": "16:40",
    "GunesDogus": "07:08",
    "Ikindi": "14:20",
    "Imsak": "05:21",
    "KibleSaati": "08:31",
    "Ogle": "11:59",
    "Yatsi": "18:16"
  },
  {
    "HicriTarihKisa": "19.5.1447",
    "HicriTarihKisaIso8601": null,
    "HicriTarihUzun": "19 Cemaziyelevvel 1447",
    "HicriTarihUzunIso8601": null,
    "AyinSekliURL": "https://namazvakti.diyanet.gov.tr/images/d5.gif",
    "MiladiTarihKisa": "10.11.2025",
    "MiladiTarihKisaIso8601": "10.11.2025",
    "MiladiTarihUzun": "10 Kasım 2025 Pazartesi",
    "MiladiTarihUzunIso8601": "2025-11-10T00:00:00.0000000+02:00",
    "GreenwichOrtalamaZamani": 3.0,
    "Aksam": "16:46",
    "Gunes": "07:03",
    "GunesBatis": "16:39",
    "GunesDogus": "07:10",
    "Ikindi": "14:19",
    "Imsak": "05:22",
    "KibleSaati": "08:30",
    "Ogle": "11:59",
    "Yatsi": "18:14"
  },
  {
    "HicriTarihKisa": "20.5.1447",
    "HicriTarihKisaIso8601": null,
    "HicriTarihUzun": "20 Cemaziyelevvel 1447",
    "HicriTarihUzunIso8601": null,
    "AyinSekliURL": "https://namazvakti.diyanet.gov.tr/images/d6.gif",
    "MiladiTarihKisa": "11.11.2025",
    "MiladiTarihKisaIso8601": "11.11.2025",
    "MiladiTarihUzun": "11 Kasım 2025 Salı",
    "MiladiTarihUzunIso8601": "2025-11-11T00:00:00.0000000+02:00",
    "GreenwichOrtalamaZamani": 3.0,
    "Aksam": "16:45",
    "Gunes": "07:04",
    "GunesBatis": "16:38",
    "GunesDogus": "07:11",
    "Ikindi": "14:18",
    "Imsak": "05:23",
    "KibleSaati": "08:30",
    "Ogle": "11:59",
    "Yatsi": "18:13"
  },
  {
    "HicriTarihKisa": "21.5.1447",
    "HicriTarihKisaIso8601": null,
    "HicriTarihUzun": "21 Cemaziyelevvel 1447",
    "HicriTarihUzunIso8601": null,
    "AyinSekliURL": "https://namazvakti.diyanet.gov.tr/images/sondordun.gif",
    "MiladiTarihKisa": "12.11.2025",
    "MiladiTarihKisaIso8601": "12.11.2025",
    "MiladiTarihUzun": "12 Kasım 2025 Çarşamba",
    "MiladiTarihUzunIso8601": "2025-11-12T00:00:00.0000000+02:00",
    "GreenwichOrtalamaZamani": 3.0,
    "Aksam": "16:43",
    "Gunes": "07:06",
    "GunesBatis": "16:36",
    "GunesDogus": "07:13",
    "Ikindi": "14:17",
    "Imsak": "05:25",
    "KibleSaati": "08:29",
    "Ogle": "12:00",
    "Yatsi": "18:12"
  },
  {
    "HicriTarihKisa": "22.5.1447",
    "HicriTarihKisaIso8601": null,
    "HicriTarihUzun": "22 Cemaziyelevvel 1447",
    "HicriTarihUzunIso8601": null,
    "AyinSekliURL": "https://namazvakti.diyanet.gov.tr/images/sd1.gif",
    "MiladiTarihKisa": "13.11.2025",
    "MiladiTarihKisaIso8601": "13.11.2025",
    "MiladiTarihUzun": "13 Kasım 2025 Perşembe",
    "MiladiTarihUzunIso8601": "2025-11-13T00:00:00.0000000+02:00",
    "GreenwichOrtalamaZamani": 3.0,
    "Aksam": "16:42",
    "Gunes": "07:07",
    "GunesBatis": "16:35",
    "GunesDogus": "07:14",
    "Ikindi": "14:16",
    "Imsak": "05:26",
    "KibleSaati": "08:29",
    "Ogle": "12:00",
    "Yatsi": "18:11"
  },
  {
    "HicriTarihKisa": "23.5.1447",
    "HicriTarihKisaIso8601": null,
    "HicriTarihUzun": "23 Cemaziyelevvel 1447",
    "HicriTarihUzunIso8601": null,
    "AyinSekliURL": "https://namazvakti.diyanet.gov.tr/images/sd2.gif",
    "MiladiTarihKisa": "14.11.2025",
    "MiladiTarihKisaIso8601": "14.11.2025",
    "MiladiTarihUzun": "14 Kasım 2025 Cuma",
    "MiladiTarihUzunIso8601": "2025-11-14T00:00:00.0000000+02:00",
    "GreenwichOrtalamaZamani": 3.0,
    "Aksam": "16:41",
    "Gunes": "07:09",
    "GunesBatis": "16:34",
    "GunesDogus": "07:16",
    "Ikindi": "14:15",
    "Imsak": "05:27",
    "KibleSaati": "08:28",
    "Ogle": "12:00",
    "Yatsi": "18:10"
  },
  {
    "HicriTarihKisa": "24.5.1447",
    "HicriTarihKisaIso8601": null,
    "HicriTarihUzun": "24 Cemaziyelevvel 1447",
    "HicriTarihUzunIso8601": null,
    "AyinSekliURL": "https://namazvakti.diyanet.gov.tr/images/sd3.gif",
    "MiladiTarihKisa": "15.11.2025",
    "MiladiTarihKisaIso8601": "15.11.2025",
    "MiladiTarihUzun": "15 Kasım 2025 Cumartesi",
    "MiladiTarihUzunIso8601": "2025-11-15T00:00:00.0000000+02:00",
    "GreenwichOrtalamaZamani": 3.0,
    "Aksam": "16:40",
    "Gunes": "07:10",
    "GunesBatis": "16:33",
    "GunesDogus": "07:17",
    "Ikindi": "14:14",
    "Imsak": "05:29",
    "KibleSaati": "08:28",
    "Ogle": "12:00",
    "Yatsi": "18:09"
  },
  {
    "HicriTarihKisa": "25.5.1447",
    "HicriTarihKisaIso8601": null,
    "HicriTarihUzun": "25 Cemaziyelevvel 1447",
    "HicriTarihUzunIso8601": null,
    "AyinSekliURL": "https://namazvakti.diyanet.gov.tr/images/sd4.gif",
    "MiladiTarihKisa": "16.11.2025",
    "MiladiTarihKisaIso8601": "16.11.2025",
    "MiladiTarihUzun": "16 Kasım 2025 Pazar",
    "MiladiTarihUzunIso8601": "2025-11-16T00:00:00.0000000+02:00",
    "GreenwichOrtalamaZamani": 3.0,
    "Aksam": "16:39",
    "Gunes": "07:12",
    "GunesBatis": "16:32",
    "GunesDogus": "07:19",
    "Ikindi": "14:14",
    "Imsak": "05:30",
    "KibleSaati": "08:27",
    "Ogle": "12:00",
    "Yatsi": "18:08"
  }
]