[
  {
    "HicriTarihKisa": "28.5.1447",
    "HicriTarihKisaIso8601": null,
    "HicriTarihUzun": "28 Cemaziyelevvel 1447",
    "HicriTarihUzunIso8601": null,
    "AyinSekliURL": "https://namazvakti.diyanet.gov.tr/images/sd7.gif",
    "MiladiTarihKisa": "19.11.2025",
    "MiladiTarihKisaIso8601": "19.11.2025",
    "MiladiTarihUzun": "19 Kasım 2025 Çarşamba",
    "MiladiTarihUzunIso8601": "2025-11-19T00:00:00.0000000-06:00",
    "GreenwichOrtalamaZamani": 3.0,
    "Aksam": "17:09",
    "Gunes": "06:59",
    "GunesBatis": "17:02",
    "GunesDogus": "07:06",
    "Ikindi": "14:46",
    "Imsak": "05:33",
    "KibleSaati": "15:00",
    "Ogle": "12:09",
    "Yatsi": "18:24"
  },
  {
    "HicriTarihKisa": "29.5.1447",
    "HicriTarihKisaIso8601": null,
    "HicriTarihUzun": "29 Cemaziyelevvel 1447",
    "HicriTarihUzunIso8601": null,
    "AyinSekliURL": "https://namazvakti.diyanet.gov.tr/images/ruyet.gif",
    "MiladiTarihKisa": "20.11.2025",
    "MiladiTarihKisaIso8601": "20.11.2025",
    "MiladiTarihUzun": "20 Kasım 2025 Perşembe",
    "MiladiTarihUzunIso8601": "2025-11-20T00:00:00.0000000-06:00",
    "GreenwichOrtalamaZamani": 3.0,
    "Aksam": "17:08",
    "Gunes": "07:00",
    "GunesBatis": "17:01",
    "GunesDogus": "07:07",
    "Ikindi": "14:45",
    "Imsak": "05:34",
    "KibleSaati": "15:01",
    "Ogle": "12:09",
    "Yatsi": "18:24"
  },
  {
    "HicriTarihKisa": "1.6.1447",
    "HicriTarihKisaIso8601": null,
    "HicriTarihUzun": "1 Cemaziyelahir 1447",
    "HicriTarihUzunIso8601": null,
    "AyinSekliURL": "https://namazvakti.diyanet.gov.tr/images/r1.gif",
    "MiladiTarihKisa": "21.11.2025",
    "MiladiTarihKisaIso8601": "21.11.2025",
    "MiladiTarihUzun": "21 Kasım 2025 Cuma",
    "MiladiTarihUzunIso8601": "2025-11-21T00:00:00.0000000-06:00",
    "GreenwichOrtalamaZamani": 3.0,
    "Aksam": "17:07",
    "Gunes": "07:01",
    "GunesBatis": "17:00",
    "GunesDogus": "07:08",
    "Ikindi": "14:45",
    "Imsak": "05:34",
    "KibleSaati": "15:02",
    "Ogle": "12:09",
    "Yatsi": "18:23"
  },
  {
    "HicriTarihKisa": "2.6.1447",
    "HicriTarihKisaIso8601": null,
    "HicriTarihUzun": "2 Cemaziyelahir 1447",
    "HicriTarihUzunIso8601": null,
    "AyinSekliURL": "https://namazvakti.diyanet.gov.tr/images/r2.gif",
    "MiladiTarihKisa": "22.11.2025",
    "MiladiTarihKisaIso8601": "22.11.2025",
    "MiladiTarihUzun": "22 Kasım 2025 Cumartesi",
    "MiladiTarihUzunIso8601": "2025-11-22T00:00:00.0000000-06:00",
    "GreenwichOrtalamaZamani": 3.0,
    "Aksam": "17:07",
    "Gunes": "07:02",
    "GunesBatis": "17:00",
    "GunesDogus": "07:09",
    "Ikindi": "14:44",
    "Imsak": "05:35",
    "KibleSaati": "15:03",
    "Ogle": "12:09",
    "Yatsi": "18:23"
  },
  {
    "HicriTarihKisa": "3.6.1447",
    "HicriTarihKisaIso8601": null,
    "HicriTarihUzun": "3 Cemaziyelahir 1447",
    "HicriTarihUzunIso8601": null,
    "AyinSekliURL": "https://namazvakti.diyanet.gov.tr/images/r3.gif",
    "MiladiTarihKisa": "23.11.2025",
    "MiladiTarihKisaIso8601": "23.11.2025",
    "MiladiTarihUzun": "23 Kasım 2025 Pazar",
    "MiladiTarihUzunIso8601": "2025-11-23T00:00:00.0000000-06:00",
    "GreenwichOrtalamaZamani": 3.0,
    "Aksam": "17:06",
    "Gunes": "07:03",
    "GunesBatis": "16:59",
    "GunesDogus": "07:10",
    "Ikindi": "14:44",
    "Imsak": "05:36",
    "KibleSaati": "15:04",
    "Ogle": "12:10",
    "Yatsi": "18:22"
  },
  {
    "HicriTarihKisa": "4.6.1447",
    "HicriTarihKisaIso8601": null,
    "HicriTarihUzun": "4 Cemaziyelahir 1447",
    "HicriTarihUzunIso8601": null,
    "AyinSekliURL": "https://namazvakti.diyanet.gov.tr/images/r4.gif",
    "MiladiTarihKisa": "24.11.2025",
    "MiladiTarihKisaIso8601": "24.11.2025",
    "MiladiTarihUzun": "24 Kasım 2025 Pazartesi",
    "MiladiTarihUzunIso8601": "2025-11-24T00:00:00.0000000-06:00",
    "GreenwichOrtalamaZamani": 3.0,
    "Aksam": "17:06",
    "Gunes": "07:04",
    "GunesBatis": "16:59",
    "GunesDogus": "07:11",
    "Ikindi": "14:43",
    "Imsak": "05:37",
    "KibleSaati": "15:05",
    "Ogle": "12:10",
    "Yatsi": "18:22"
  },
  {
    "HicriTarihKisa": "5.6.1447",
    "HicriTarihKisaIso8601": null,
    "HicriTarihUzun": "5 Cemaziyelahir 1447",
    "HicriTarihUzunIso8601": null,
    "AyinSekliURL": "https://namazvakti.diyanet.gov.tr/images/r5.gif",
    "MiladiTarihKisa": "25.11.2025",
    "MiladiTarihKisaIso8601": "25.11.2025",
    "MiladiTarihUzun": "25 Kasım 2025 Salı",
    "MiladiTarihUzunIso8601": "2025-11-25T00:00:00.0000000-06:00",
    "GreenwichOrtalamaZamani": 3.0,
    "Aksam": "17:05",
    "Gunes": "07:05",
    "GunesBatis": "16:58",
    "GunesDogus": "07:12",
    "Ikindi": "14:43",
    "Imsak": "05:38",
    "KibleSaati": "15:06",
    "Ogle": "12:10",
    "Yatsi": "18:22"
  },
  {
    "HicriTarihKisa": "6.6.1447",
    "HicriTarihKisaIso8601": null,
    "HicriTarihUzun": "6 Cemaziyelahir 1447",
    "HicriTarihUzunIso8601": null,
    "AyinSekliURL": "https://namazvakti.diyanet.gov.tr/images/r6.gif",
    "MiladiTarihKisa": "26.11.2025",
    "MiladiTarihKisaIso8601": "26.11.2025",
    "MiladiTarihUzun": "26 Kasım 2025 Çarşamba",
    "MiladiTarihUzunIso8601": "2025-11-26T00:00:00.0000000-06:00",
    "GreenwichOrtalamaZamani": 3.0,
    "Aksam": "17:05",
    "Gunes": "07:06",
    "GunesBatis": "16:58",
    "GunesDogus": "07:13",
    "Ikindi": "14:43",
    "Imsak": "05:39",
    "KibleSaati": "15:06",
    "Ogle": "12:11",
    "Yatsi": "18:21"
  },
  {
    "HicriTarihKisa": "7.6.1447",
    "HicriTarihKisaIso8601": null,
    "HicriTarihUzun": "7 Cemaziyelahir 1447",
    "HicriTarihUzunIso8601": null,
    "AyinSekliURL": "https://namazvakti.diyanet.gov.tr/images/ilkdordun.gif",
    "MiladiTarihKisa": "27.11.2025",
    "MiladiTarihKisaIso8601": "27.11.2025",
    "MiladiTarihUzun": "27 Kasım 2025 Perşembe",
    "MiladiTarihUzunIso8601": "2025-11-27T00:00:00.0000000-06:00",
    "GreenwichOrtalamaZamani": 3.0,
    "Aksam": "17:04",
    "Gunes": "07:07",
    "GunesBatis": "16:57",
    "GunesDogus": "07:14",
    "Ikindi": "14:42",
    "Imsak": "05:40",
    "KibleSaati": "15:07",
    "Ogle": "12:11",
    "Yatsi": "18:21"
  },
  {
    "HicriTarihKisa": "8.6.1447",
    "HicriTarihKisaIso8601": null,
    "HicriTarihUzun": "8 Cemaziyelahir 1447",
    "HicriTarihUzunIso8601": null,
    "AyinSekliURL": "https://namazvakti.diyanet.gov.tr/images/i1.gif",
    "MiladiTarihKisa": "28.11.2025",
    "MiladiTarihKisaIso8601": "28.11.2025",
    "MiladiTarihUzun": "28 Kasım 2025 Cuma",
    "MiladiTarihUzunIso8601": "2025-11-28T00:00:00.0000000-06:00",
    "GreenwichOrtalamaZamani": 3.0,
    "Aksam": "17:04",
    "Gunes": "07:08",
    "GunesBatis": "16:57",
    "GunesDogus": "07:15",
    "Ikindi": "14:42",
    "Imsak": "05:41",
    "KibleSaati": "15:08",
    "Ogle": "12:11",
    "Yatsi": "18:21"
  },
  {
    "HicriTarihKisa": "9.6.1447",
    "HicriTarihKisaIso8601": null,
    "HicriTarihUzun": "9 Cemaziyelahir 1447",
    "HicriTarihUzunIso8601": null,
    "AyinSekliURL": "https://namazvakti.diyanet.gov.tr/images/i2.gif",
    "MiladiTarihKisa": "29.11.2025",
    "MiladiTarihKisaIso8601": "29.11.2025",
    "MiladiTarihUzun": "29 Kasım 2025 Cumartesi",
    "MiladiTarihUzunIso8601": "2025-11-29T00:00:00.0000000-06:00",
    "GreenwichOrtalamaZamani": 3.0,
    "Aksam": "17:04",
    "Gunes": "07:09",
    "GunesBatis": "16:57",
    "GunesDogus": "07:16",
    "Ikindi": "14:42",
    "Imsak": "05:42",
    "KibleSaati": "15:09",
    "Ogle": "12:12",
    "Yatsi": "18:21"
  },
  {
    "HicriTarihKisa": "10.6.1447",
    "HicriTarihKisaIso8601": null,
    "HicriTarihUzun": "10 Cemaziyelahir 1447",
    "HicriTarihUzunIso8601": null,
    "AyinSekliURL": "https://namazvakti.diyanet.gov.tr/images/i3.gif",
    "MiladiTarihKisa": "30.11.2025",
    "MiladiTarihKisaIso8601": "30.11.2025",
    "MiladiTarihUzun": "30 Kasım 2025 Pazar",
    "MiladiTarihUzunIso8601": "2025-11-30T00:00:00.0000000-06:00",
    "GreenwichOrtalamaZamani": 3.0,
    "Aksam": "17:03",
    "Gunes": "07:10",
    "GunesBatis": "16:56",
    "GunesDogus": "07:17",
    "Ikindi": "14:42",
    "Imsak": "05:43",
    "KibleSaati": "15:10",
    "Ogle": "12:12",
    "Yatsi": "18:21"
  },
  {
    "HicriTarihKisa": "11.6.1447",
    "HicriTarihKisaIso8601": null,
    "HicriTarihUzun": "11 Cemaziyelahir 1447",
    "HicriTarihUzunIso8601": null,
    "AyinSekliURL": "https://namazvakti.diyanet.gov.tr/images/i4.gif",
    "MiladiTarihKisa": "01.12.2025",
    "MiladiTarihKisaIso8601": "01.12.2025",
    "MiladiTarihUzun": "01 Aralık 2025 Pazartesi",
    "MiladiTarihUzunIso8601": "2025-12-01T00:00:00.0000000-06:00",
    "GreenwichOrtalamaZamani": 3.0,
    "Aksam": "17:03",
    "Gunes": "07:11",
    "GunesBatis": "16:56",
    "GunesDogus": "07:18",
    "Ikindi": "14:42",
    "Imsak": "05:43",
    "KibleSaati": "15:11",
    "Ogle": "12:12",
    "Yatsi": "18:20"
  },
  {
    "HicriTarihKisa": "12.6.1447",
    "HicriTarihKisaIso8601": null,
    "HicriTarihUzun": "12 Cemaziyelahir 1447",
    "HicriTarihUzunIso8601": null,
    "AyinSekliURL": "https://namazvakti.diyanet.gov.tr/images/i5.gif",
    "MiladiTarihKisa": "02.12.2025",
    "MiladiTarihKisaIso8601": "02.12.2025",
    "MiladiTarihUzun": "02 Aralık 2025 Salı",
    "MiladiTarihUzunIso8601": "2025-12-02T00:00:00.0000000-06:00",
    "GreenwichOrtalamaZamani": 3.0,
    "Aksam": "17:03",
    "Gunes": "07:12",
    "GunesBatis": "16:56",
    "GunesDogus": "07:19",
    "Ikindi": "14:42",
    "Imsak": "05:44",
    "KibleSaati": "15:12",
    "Ogle": "12:13",
    "Yatsi": "18:20"
  },
  {
    "HicriTarihKisa": "13.6.1447",
    "HicriTarihKisaIso8601": null,
    "HicriTarihUzun": "13 Cemaziyelahir 1447",
    "HicriTarihUzunIso8601": null,
    "AyinSekliURL": "https://namazvakti.diyanet.gov.tr/images/i6.gif",
    "MiladiTarihKisa": "03.12.2025",
    "MiladiTarihKisaIso8601": "03.12.2025",
    "MiladiTarihUzun": "03 Aralık 2025 Çarşamba",
    "MiladiTarihUzunIso8601": "2025-12-03T00:00:00.0000000-06:00",
    "GreenwichOrtalamaZamani": 3.0,
    "Aksam": "17:03",
    "Gunes": "07:13",
    "GunesBatis": "16:56",
    "GunesDogus": "07:20",
    "Ikindi": "14:41",
    "Imsak": "05:45",
    "KibleSaati": "15:12",
    "Ogle": "12:13",
    "Yatsi": "18:20"
  },
  {
    "HicriTarihKisa": "14.6.1447",
    "HicriTarihKisaIso8601": null,
    "HicriTarihUzun": "14 Cemaziyelahir 1447",
    "HicriTarihUzunIso8601": null,
    "AyinSekliURL": "https://namazvakti.diyanet.gov.tr/images/dolunay.gif",
    "MiladiTarihKisa": "04.12.2025",
    "MiladiTarihKisaIso8601": "04.12.2025",
    "MiladiTarihUzun": "04 Aralık 2025 Perşembe",
    "MiladiTarihUzunIso8601": "2025-12-04T00:00:00.0000000-06:00",
    "GreenwichOrtalamaZamani": 3.0,
    "Aksam": "17:03",
    "Gunes": "07:14",
    "GunesBatis": "16:56",
    "GunesDogus": "07:21",
    "Ikindi": "14:41",
    "Imsak": "05:46",
    "KibleSaati": "15:13",
    "Ogle": "12:13",
    "Yatsi": "18:20"
  },
  {
    "HicriTarihKisa": "15.6.1447",
    "HicriTarihKisaIso8601": null,
    "HicriTarihUzun": "15 Cemaziyelahir 1447",
    "HicriTarihUzunIso8601": null,
    "AyinSekliURL": "https://namazvakti.diyanet.gov.tr/images/d1.gif",
    "MiladiTarihKisa": "05.12.2025",
    "MiladiTarihKisaIso8601": "05.12.2025",
    "MiladiTarihUzun": "05 Aralık 2025 Cuma",
    "MiladiTarihUzunIso8601": "2025-12-05T00:00:00.0000000-06:00",
    "GreenwichOrtalamaZamani": 3.0,
    "Aksam": "17:03",
    "Gunes": "07:15",
    "GunesBatis": "16:56",
    "GunesDogus": "07:22",
    "Ikindi": "14:41",
    "Imsak": "05:47",
    "KibleSaati": "15:14",
    "Ogle": "12:14",
    "Yatsi": "18:20"
  },
  {
    "HicriTarihKisa": "16.6.1447",
    "HicriTarihKisaIso8601": null,
    "HicriTarihUzun": "16 Cemaziyelahir 1447",
    "HicriTarihUzunIso8601": null,
    "AyinSekliURL": "https://namazvakti.diyanet.gov.tr/images/d2.gif",
    "MiladiTarihKisa": "06.12.2025",
    "MiladiTarihKisaIso8601": "06.12.2025",
    "MiladiTarihUzun": "06 Aralık 2025 Cumartesi",
    "MiladiTarihUzunIso8601": "2025-12-06T00:00:00.0000000-06:00",
    "GreenwichOrtalamaZamani": 3.0,
    "Aksam": "17:03",
    "Gunes": "07:16",
    "GunesBatis": "16:56",
    "GunesDogus": "07:23",
    "Ikindi": "14:41",
    "Imsak": "05:48",
    "KibleSaati": "15:15",
    "Ogle": "12:14",
    "Yatsi": "18:20"
  },
  {
    "HicriTarihKisa": "17.6.1447",
    "HicriTarihKisaIso8601": null,
    "HicriTarihUzun": "17 Cemaziyelahir 1447",
    "HicriTarihUzunIso8601": null,
    "AyinSekliURL": "https://namazvakti.diyanet.gov.tr/images/d3.gif",
    "MiladiTarihKisa": "07.12.2025",
    "MiladiTarihKisaIso8601": "07.12.2025",
    "MiladiTarihUzun": "07 Aralık 2025 Pazar",
    "MiladiTarihUzunIso8601": "2025-12-07T00:00:00.0000000-06:00",
    "GreenwichOrtalamaZamani": 3.0,
    "Aksam": "17:02",
    "Gunes": "07:17",
    "GunesBatis": "16:55",
    "GunesDogus": "07:24",
    "Ikindi": "14:41",
    "Imsak": "05:48",
    "KibleSaati": "15:16",
    "Ogle": "12:15",
    "Yatsi": "18:20"
  },
  {
    "HicriTarihKisa": "18.6.1447",
    "HicriTarihKisaIso8601": null,
    "HicriTarihUzun": "18 Cemaziyelahir 1447",
    "HicriTarihUzunIso8601": null,
    "AyinSekliURL": "https://namazvakti.diyanet.gov.tr/images/d4.gif",
    "MiladiTarihKisa": "08.12.2025",
    "MiladiTarihKisaIso8601": "08.12.2025",
    "MiladiTarihUzun": "08 Aralık 2025 Pazartesi",
    "MiladiTarihUzunIso8601": "2025-12-08T00:00:00.0000000-06:00",
    "GreenwichOrtalamaZamani": 3.0,
    "Aksam": "17:02",
    "Gunes": "07:18",
    "GunesBatis": "16:55",
    "GunesDogus": "07:25",
    "Ikindi": "14:41",
    "Imsak": "05:49",
    "KibleSaati": "15:16",
    "Ogle": "12:15",
    "Yatsi": "18:20"
  },
  {
    "HicriTarihKisa": "19.6.1447",
    "HicriTarihKisaIso8601": null,
    "HicriTarihUzun": "19 Cemaziyelahir 1447",
    "HicriTarihUzunIso8601": null,
    "AyinSekliURL": "https://namazvakti.diyanet.gov.tr/images/d5.gif",
    "MiladiTarihKisa": "09.12.2025",
    "MiladiTarihKisaIso8601": "09.12.2025",
    "MiladiTarihUzun": "09 Aralık 2025 Salı",
    "MiladiTarihUzunIso8601": "2025-12-09T00:00:00.0000000-06:00",
    "GreenwichOrtalamaZamani": 3.0,
    "Aksam": "17:03",
    "Gunes": "07:19",
    "GunesBatis": "16:56",
    "GunesDogus": "07:26",
    "Ikindi": "14:42",
    "Imsak": "05:50",
    "KibleSaati": "15:17",
    "Ogle": "12:16",
    "Yatsi": "18:21"
  },
  {
    "HicriTarihKisa": "20.6.1447",
    "HicriTarihKisaIso8601": null,
    "HicriTarihUzun": "20 Cemaziyelahir 1447",
    "HicriTarihUzunIso8601": null,
    "AyinSekliURL": "https://namazvakti.diyanet.gov.tr/images/d6.gif",
    "MiladiTarihKisa": "10.12.2025",
    "MiladiTarihKisaIso8601": "10.12.2025",
    "MiladiTarihUzun": "10 Aralık 2025 Çarşamba",
    "MiladiTarihUzunIso8601": "2025-12-10T00:00:00.0000000-06:00",
    "GreenwichOrtalamaZamani": 3.0,
    "Aksam": "17:03",
    "Gunes": "07:19",
    "GunesBatis": "16:56",
    "GunesDogus": "07:26",
    "Ikindi": "14:42",
    "Imsak": "05:51",
    "KibleSaati": "15:18",
    "Ogle": "12:16",
    "Yatsi": "18:21"
  },
  {
    "HicriTarihKisa": "21.6.1447",
    "HicriTarihKisaIso8601": null,
    "HicriTarihUzun": "21 Cemaziyelahir 1447",
    "HicriTarihUzunIso8601": null,
    "AyinSekliURL": "https://namazvakti.diyanet.gov.tr/images/d7.gif",
    "MiladiTarihKisa": "11.12.2025",
    "MiladiTarihKisaIso8601": "11.12.2025",
    "MiladiTarihUzun": "11 Aralık 2025 Perşembe",
    "MiladiTarihUzunIso8601": "2025-12-11T00:00:00.0000000-06:00",
    "GreenwichOrtalamaZamani": 3.0,
    "Aksam": "17:03",
    "Gunes": "07:20",
    "GunesBatis": "16:56",
    "GunesDogus": "07:27",
    "Ikindi": "14:42",
    "Imsak": "05:51",
    "KibleSaati": "15:19",
    "Ogle": "12:16",
    "Yatsi": "18:21"
  },
  {
    "HicriTarihKisa": "22.6.1447",
    "HicriTarihKisaIso8601": null,
    "HicriTarihUzun": "22 Cemaziyelahir 1447",
    "HicriTarihUzunIso8601": null,
    "AyinSekliURL": "https://namazvakti.diyanet.gov.tr/images/sondordun.gif",
    "MiladiTarihKisa": "12.12.2025",
    "MiladiTarihKisaIso8601": "12.12.2025",
    "MiladiTarihUzun": "12 Aralık 2025 Cuma",
    "MiladiTarihUzunIso8601": "2025-12-12T00:00:00.0000000-06:00",
    "GreenwichOrtalamaZamani": 3.0,
    "Aksam": "17:03",
    "Gunes": "07:21",
    "GunesBatis": "16:56",
    "GunesDogus": "07:28",
    "Ikindi": "14:42",
    "Imsak": "05:52",
    "KibleSaati": "15:19",
    "Ogle": "12:17",
    "Yatsi": "18:21"
  },
  {
    "HicriTarihKisa": "23.6.1447",
    "HicriTarihKisaIso8601": null,
    "HicriTarihUzun": "23 Cemaziyelahir 1447",
    "HicriTarihUzunIso8601": null,
    "AyinSekliURL": "https://namazvakti.diyanet.gov.tr/images/sd1.gif",
    "MiladiTarihKisa": "13.12.2025",
    "MiladiTarihKisaIso8601": "13.12.2025",
    "MiladiTarihUzun": "13 Aralık 2025 Cumartesi",
    "MiladiTarihUzunIso8601": "2025-12-13T00:00:00.0000000-06:00",
    "GreenwichOrtalamaZamani": 3.0,
    "Aksam": "17:03",
    "Gunes": "07:22",
    "GunesBatis": "16:56",
    "GunesDogus": "07:29",
    "Ikindi": "14:42",
    "Imsak": "05:53",
    "KibleSaati": "15:20",
    "Ogle": "12:17",
    "Yatsi": "18:21"
  },
  {
    "HicriTarihKisa": "24.6.1447",
    "HicriTarihKisaIso8601": null,
    "HicriTarihUzun": "24 Cemaziyelahir 1447",
    "HicriTarihUzunIso8601": null,
    "AyinSekliURL": "https://namazvakti.diyanet.gov.tr/images/sd2.gif",
    "MiladiTarihKisa": "14.12.2025",
    "MiladiTarihKisaIso8601": "14.12.2025",
    "MiladiTarihUzun": "14 Aralık 2025 Pazar",
    "MiladiTarihUzunIso8601": "2025-12-14T00:00:00.0000000-06:00",
    "GreenwichOrtalamaZamani": 3.0,
    "Aksam": "17:03",
    "Gunes": "07:22",
    "GunesBatis": "16:56",
    "GunesDogus": "07:29",
    "Ikindi": "14:43",
    "Imsak": "05:53",
    "KibleSaati": "15:21",
    "Ogle": "12:18",
    "Yatsi": "18:22"
  },
  {
    "HicriTarihKisa": "25.6.1447",
    "HicriTarihKisaIso8601": null,
    "HicriTarihUzun": "25 Cemaziyelahir 1447",
    "HicriTarihUzunIso8601": null,
    "AyinSekliURL": "https://namazvakti.diyanet.gov.tr/images/sd3.gif",
    "MiladiTarihKisa": "15.12.2025",
    "MiladiTarihKisaIso8601": "15.12.2025",
    "MiladiTarihUzun": "15 Aralık 2025 Pazartesi",
    "MiladiTarihUzunIso8601": "2025-12-15T00:00:00.0000000-06:00",
    "GreenwichOrtalamaZamani": 3.0,
    "Aksam": "17:03",
    "Gunes": "07:23",
    "GunesBatis": "16:56",
    "GunesDogus": "07:30",
    "Ikindi": "14:43",
    "Imsak": "05:54",
    "KibleSaati": "15:21",
    "Ogle": "12:18",
    "Yatsi": "18:22"
  },
  {
    "HicriTarihKisa": "26.6.1447",
    "HicriTarihKisaIso8601": null,
    "HicriTarihUzun": "26 Cemaziyelahir 1447",
    "HicriTarihUzunIso8601": null,
    "AyinSekliURL": "https://namazvakti.diyanet.gov.tr/images/sd4.gif",
    "MiladiTarihKisa": "16.12.2025",
    "MiladiTarihKisaIso8601": "16.12.2025",
    "MiladiTarihUzun": "16 Aralık 2025 Salı",
    "MiladiTarihUzunIso8601": "2025-12-16T00:00:00.0000000-06:00",
    "GreenwichOrtalamaZamani": 3.0,
    "Aksam": "17:04",
    "Gunes": "07:24",
    "GunesBatis": "16:57",
    "GunesDogus": "07:31",
    "Ikindi": "14:43",
    "Imsak": "05:55",
    "KibleSaati": "15:22",
    "Ogle": "12:19",
    "Yatsi": "18:22"
  },
  {
    "HicriTarihKisa": "27.6.1447",
    "HicriTarihKisaIso8601": null,
    "HicriTarihUzun": "27 Cemaziyelahir 1447",
    "HicriTarihUzunIso8601": null,
    "AyinSekliURL": "https://namazvakti.diyanet.gov.tr/images/sd5.gif",
    "MiladiTarihKisa": "17.12.2025",
    "MiladiTarihKisaIso8601": "17.12.2025",
    "MiladiTarihUzun": "17 Aralık 2025 Çarşamba",
    "MiladiTarihUzunIso8601": "2025-12-17T00:00:00.0000000-06:00",
    "GreenwichOrtalamaZamani": 3.0,
    "Aksam": "17:04",
    "Gunes": "07:25",
    "GunesBatis": "16:57",
    "GunesDogus": "07:32",
    "Ikindi": "14:43",
    "Imsak": "05:55",
    "KibleSaati": "15:23",
    "Ogle": "12:19",
    "Yatsi": "18:23"
  },
  {
    "HicriTarihKisa": "28.6.1447",
    "HicriTarihKisaIso8601": null,
    "HicriTarihUzun": "28 Cemaziyelahir 1447",
    "HicriTarihUzunIso8601": null,
    "AyinSekliURL": "https://namazvakti.diyanet.gov.tr/images/sd6.gif",
    "MiladiTarihKisa": "18.12.2025",
    "MiladiTarihKisaIso8601": "18.12.2025",
    "MiladiTarihUzun": "18 Aralık 2025 Perşembe",
    "MiladiTarihUzunIso8601": "2025-12-18T00:00:00.0000000-06:00",
    "GreenwichOrtalamaZamani": 3.0,
    "Aksam": "17:04",
    "Gunes": "07:25",
    "GunesBatis": "16:57",
    "GunesDogus": "07:32",
    "Ikindi": "14:44",
    "Imsak": "05:56",
    "KibleSaati": "15:23",
    "Ogle": "12:20",
    "Yatsi": "18:23"
  },
  {
    "HicriTarihKisa": "29.6.1447",
    "HicriTarihKisaIso8601": null,
    "HicriTarihUzun": "29 Cemaziyelahir 1447",
    "HicriTarihUzunIso8601": null,
    "AyinSekliURL": "https://namazvakti.diyanet.gov.tr/images/sd7.gif",
    "MiladiTarihKisa": "19.12.2025",
    "MiladiTarihKisaIso8601": "19.12.2025",
    "MiladiTarihUzun": "19 Aralık 2025 Cuma",
    "MiladiTarihUzunIso8601": "2025-12-19T00:00:00.0000000-06:00",
    "GreenwichOrtalamaZamani": 3.0,
    "Aksam": "17:05",
    "Gunes": "07:26",
    "GunesBatis": "16:58",
    "GunesDogus": "07:33",
    "Ikindi": "14:44",
    "Imsak": "05:56",
    "KibleSaati": "15:24",
    "Ogle": "12:20",
    "Yatsi": "18:23"
  },
  {
    "HicriTarihKisa": "30.6.1447",
    "HicriTarihKisaIso8601": null,
    "HicriTarihUzun": "30 Cemaziyelahir 1447",
    "HicriTarihUzunIso8601": null,
    "AyinSekliURL": "https://namazvakti.diyanet.gov.tr/images/ruyet.gif",
    "MiladiTarihKisa": "20.12.2025",
    "MiladiTarihKisaIso8601": "20.12.2025",
    "MiladiTarihUzun": "20 Aralık 2025 Cumartesi",
    "MiladiTarihUzunIso8601": "2025-12-20T00:00:00.0000000-06:00",
    "GreenwichOrtalamaZamani": 3.0,
    "Aksam": "17:05",
    "Gunes": "07:26",
    "GunesBatis": "16:58",
    "GunesDogus": "07:33",
    "Ikindi": "14:45",
    "Imsak": "05:57",
    "KibleSaati": "15:24",
    "Ogle": "12:21",
    "Yatsi": "18:24"
  }
]