[
  {
    "HicriTarihKisa": "27.5.1447",
    "HicriTarihKisaIso8601": null,
    "HicriTarihUzun": "27 Cemaziyelevvel 1447",
    "HicriTarihUzunIso8601": null,
    "AyinSekliURL": "https://namazvakti.diyanet.gov.tr/images/sd6.gif",
    "MiladiTarihKisa": "18.11.2025",
    "MiladiTarihKisaIso8601": "18.11.2025",
    "MiladiTarihUzun": "18 Kasım 2025 Salı",
    "MiladiTarihUzunIso8601": "2025-11-18T00:00:00.0000000+02:00",
    "GreenwichOrtalamaZamani": 3.0,
    "Aksam": "15:31",
    "Gunes": "08:26",
    "GunesBatis": "15:24",
    "GunesDogus": "08:33",
    "Ikindi": "13:12",
    "Imsak": "05:49",
    "KibleSaati": "10:40",
    "Ogle": "12:04",
    "Yatsi": "17:51"
  },
  {
    "HicriTarihKisa": "28.5.1447",
    "HicriTarihKisaIso8601": null,
    "HicriTarihUzun": "28 Cemaziyelevvel 1447",
    "HicriTarihUzunIso8601": null,
    "AyinSekliURL": "https://namazvakti.diyanet.gov.tr/images/sd7.gif",
    "MiladiTarihKisa": "19.11.2025",
    "MiladiTarihKisaIso8601": "19.11.2025",
    "MiladiTarihUzun": "19 Kasım 2025 Çarşamba",
    "MiladiTarihUzunIso8601": "2025-11-19T00:00:00.0000000+02:00",
    "GreenwichOrtalamaZamani": 3.0,
    "Aksam": "15:29",
    "Gunes": "08:28",
    "GunesBatis": "15:22",
    "GunesDogus": "08:35",
    "Ikindi": "13:10",
    "Imsak": "05:51",
    "KibleSaati": "10:40",
    "Ogle": "12:04",
    "Yatsi": "17:49"
  },
  {
    "HicriTarihKisa": "29.5.1447",
    "HicriTarihKisaIso8601": null,
    "HicriTarihUzun": "29 Cemaziyelevvel 1447",
    "HicriTarihUzunIso8601": null,
    "AyinSekliURL": "https://namazvakti.diyanet.gov.tr/images/ruyet.gif",
    "MiladiTarihKisa": "20.11.2025",
    "MiladiTarihKisaIso8601": "20.11.2025",
    "MiladiTarihUzun": "20 Kasım 2025 Perşembe",
    "MiladiTarihUzunIso8601": "2025-11-20T00:00:00.0000000+02:00",
    "GreenwichOrtalamaZamani": 3.0,
    "Aksam": "15:27",
    "Gunes": "08:31",
    "GunesBatis": "15:20",
    "GunesDogus": "08:38",
    "Ikindi": "13:09",
    "Imsak": "05:53",
    "KibleSaati": "10:40",
    "Ogle": "12:04",
    "Yatsi": "17:48"
  },
  {
    "HicriTarihKisa": "1.6.1447",
    "HicriTarihKisaIso8601": null,
    "HicriTarihUzun": "1 Cemaziyelahir 1447",
    "HicriTarihUzunIso8601": null,
    "AyinSekliURL": "https://namazvakti.diyanet.gov.tr/images/r1.gif",
    "MiladiTarihKisa": "21.11.2025",
    "MiladiTarihKisaIso8601": "21.11.2025",
    "MiladiTarihUzun": "21 Kasım 2025 Cuma",
    "MiladiTarihUzunIso8601": "2025-11-21T00:00:00.0000000+02:00",
    "GreenwichOrtalamaZamani": 3.0,
    "Aksam": "15:25",
    "Gunes": "08:34",
    "GunesBatis": "15:18",
    "GunesDogus": "08:41",
    "Ikindi": "13:08",
    "Imsak": "05:55",
    "KibleSaati": "10:40",
    "Ogle": "12:04",
    "Yatsi": "17:46"
  },
  {
    "HicriTarihKisa": "2.6.1447",
    "HicriTarihKisaIso8601": null,
    "HicriTarihUzun": "2 Cemaziyelahir 1447",
    "HicriTarihUzunIso8601": null,
    "AyinSekliURL": "https://namazvakti.diyanet.gov.tr/images/r2.gif",
    "MiladiTarihKisa": "22.11.2025",
    "MiladiTarihKisaIso8601": "22.11.2025",
    "MiladiTarihUzun": "22 Kasım 2025 Cumartesi",
    "MiladiTarihUzunIso8601": "2025-11-22T00:00:00.0000000+02:00",
    "GreenwichOrtalamaZamani": 3.0,
    "Aksam": "15:23",
    "Gunes": "08:37",
    "GunesBatis": "15:16",
    "GunesDogus": "08:44",
    "Ikindi": "13:06",
    "Imsak": "05:57",
    "KibleSaati": "10:40",
    "Ogle": "12:05",
    "Yatsi": "17:45"
  },
  {
    "HicriTarihKisa": "3.6.1447",
    "HicriTarihKisaIso8601": null,
    "HicriTarihUzun": "3 Cemaziyelahir 1447",
    "HicriTarihUzunIso8601": null,
    "AyinSekliURL": "https://namazvakti.diyanet.gov.tr/images/r3.gif",
    "MiladiTarihKisa": "23.11.2025",
    "MiladiTarihKisaIso8601": "23.11.2025",
    "MiladiTarihUzun": "23 Kasım 2025 Pazar",
    "MiladiTarihUzunIso8601": "2025-11-23T00:00:00.0000000+02:00",
    "GreenwichOrtalamaZamani": 3.0,
    "Aksam": "15:20",
    "Gunes": "08:39",
    "GunesBatis": "15:13",
    "GunesDogus": "08:46",
    "Ikindi": "13:05",
    "Imsak": "05:59",
    "KibleSaati": "10:40",
    "Ogle": "12:05",
    "Yatsi": "17:43"
  },
  {
    "HicriTarihKisa": "4.6.1447",
    "HicriTarihKisaIso8601": null,
    "HicriTarihUzun": "4 Cemaziyelahir 1447",
    "HicriTarihUzunIso8601": null,
    "AyinSekliURL": "https://namazvakti.diyanet.gov.tr/images/r4.gif",
    "MiladiTarihKisa": "24.11.2025",
    "MiladiTarihKisaIso8601": "24.11.2025",
    "MiladiTarihUzun": "24 Kasım 2025 Pazartesi",
    "MiladiTarihUzunIso8601": "2025-11-24T00:00:00.0000000+02:00",
    "GreenwichOrtalamaZamani": 3.0,
    "Aksam": "15:18",
    "Gunes": "08:42",
    "GunesBatis": "15:11",
    "GunesDogus": "08:49",
    "Ikindi": "13:04",
    "Imsak": "06:01",
    "KibleSaati": "10:41",
    "Ogle": "12:05",
    "Yatsi": "17:42"
  },
  {
    "HicriTarihKisa": "5.6.1447",
    "HicriTarihKisaIso8601": null,
    "HicriTarihUzun": "5 Cemaziyelahir 1447",
    "HicriTarihUzunIso8601": null,
    "AyinSekliURL": "https://namazvakti.diyanet.gov.tr/images/r5.gif",
    "MiladiTarihKisa": "25.11.2025",
    "MiladiTarihKisaIso8601": "25.11.2025",
    "MiladiTarihUzun": "25 Kasım 2025 Salı",
    "MiladiTarihUzunIso8601": "2025-11-25T00:00:00.0000000+02:00",
    "GreenwichOrtalamaZamani": 3.0,
    "Aksam": "15:16",
    "Gunes": "08:44",
    "GunesBatis": "15:09",
    "GunesDogus": "08:51",
    "Ikindi": "13:03",
    "Imsak": "06:02",
    "KibleSaati": "10:41",
    "Ogle": "12:05",
    "Yatsi": "17:41"
  },
  {
    "HicriTarihKisa": "6.6.1447",
    "HicriTarihKisaIso8601": null,
    "HicriTarihUzun": "6 Cemaziyelahir 1447",
    "HicriTarihUzunIso8601": null,
    "AyinSekliURL": "https://namazvakti.diyanet.gov.tr/images/r6.gif",
    "MiladiTarihKisa": "26.11.2025",
    "MiladiTarihKisaIso8601": "26.11.2025",
    "MiladiTarihUzun": "26 Kasım 2025 Çarşamba",
    "MiladiTarihUzunIso8601": "2025-11-26T00:00:00.0000000+02:00",
    "GreenwichOrtalamaZamani": 3.0,
    "Aksam": "15:14",
    "Gunes": "08:47",
    "GunesBatis": "15:07",
    "GunesDogus": "08:54",
    "Ikindi": "13:02",
    "Imsak": "06:04",
    "KibleSaati": "10:41",
    "Ogle": "12:06",
    "Yatsi": "17:40"
  },
  {
    "HicriTarihKisa": "7.6.1447",
    "HicriTarihKisaIso8601": null,
    "HicriTarihUzun": "7 Cemaziyelahir 1447",
    "HicriTarihUzunIso8601": null,
    "AyinSekliURL": "https://namazvakti.diyanet.gov.tr/images/ilkdordun.gif",
    "MiladiTarihKisa": "27.11.2025",
    "MiladiTarihKisaIso8601": "27.11.2025",
    "MiladiTarihUzun": "27 Kasım 2025 Perşembe",
    "MiladiTarihUzunIso8601": "2025-11-27T00:00:00.0000000+02:00",
    "GreenwichOrtalamaZamani": 3.0,
    "Aksam": "15:12",
    "Gunes": "08:50",
    "GunesBatis": "15:05",
    "GunesDogus": "08:57",
    "Ikindi": "13:00",
    "Imsak": "06:06",
    "KibleSaati": "10:41",
    "Ogle": "12:06",
    "Yatsi": "17:39"
  },
  {
    "HicriTarihKisa": "8.6.1447",
    "HicriTarihKisaIso8601": null,
    "HicriTarihUzun": "8 Cemaziyelahir 1447",
    "HicriTarihUzunIso8601": null,
    "AyinSekliURL": "https://namazvakti.diyanet.gov.tr/images/i1.gif",
    "MiladiTarihKisa": "28.11.2025",
    "MiladiTarihKisaIso8601": "28.11.2025",
    "MiladiTarihUzun": "28 Kasım 2025 Cuma",
    "MiladiTarihUzunIso8601": "2025-11-28T00:00:00.0000000+02:00",
    "GreenwichOrtalamaZamani": 3.0,
    "Aksam": "15:11",
    "Gunes": "08:52",
    "GunesBatis": "15:04",
    "GunesDogus": "08:59",
    "Ikindi": "12:59",
    "Imsak": "06:08",
    "KibleSaati": "10:41",
    "Ogle": "12:06",
    "Yatsi": "17:38"
  },
  {
    "HicriTarihKisa": "9.6.1447",
    "HicriTarihKisaIso8601": null,
    "HicriTarihUzun": "9 Cemaziyelahir 1447",
    "HicriTarihUzunIso8601": null,
    "AyinSekliURL": "https://namazvakti.diyanet.gov.tr/images/i2.gif",
    "MiladiTarihKisa": "29.11.2025",
    "MiladiTarihKisaIso8601": "29.11.2025",
    "MiladiTarihUzun": "29 Kasım 2025 Cumartesi",
    "MiladiTarihUzunIso8601": "2025-11-29T00:00:00.0000000+02:00",
    "GreenwichOrtalamaZamani": 3.0,
    "Aksam": "15:09",
    "Gunes": "08:54",
    "GunesBatis": "15:02",
    "GunesDogus": "09:01",
    "Ikindi": "12:59",
    "Imsak": "06:09",
    "KibleSaati": "10:42",
    "Ogle": "12:07",
    "Yatsi": "17:37"
  },
  {
    "HicriTarihKisa": "10.6.1447",
    "HicriTarihKisaIso8601": null,
    "HicriTarihUzun": "10 Cemaziyelahir 1447",
    "HicriTarihUzunIso8601": null,
    "AyinSekliURL": "https://namazvakti.diyanet.gov.tr/images/i3.gif",
    "MiladiTarihKisa": "30.11.2025",
    "MiladiTarihKisaIso8601": "30.11.2025",
    "MiladiTarihUzun": "30 Kasım 2025 Pazar",
    "MiladiTarihUzunIso8601": "2025-11-30T00:00:00.0000000+02:00",
    "GreenwichOrtalamaZamani": 3.0,
    "Aksam": "15:07",
    "Gunes": "08:57",
    "GunesBatis": "15:00",
    "GunesDogus": "09:04",
    "Ikindi": "12:58",
    "Imsak": "06:11",
    "KibleSaati": "10:42",
    "Ogle": "12:07",
    "Yatsi": "17:36"
  },
  {
    "HicriTarihKisa": "11.6.1447",
    "HicriTarihKisaIso8601": null,
    "HicriTarihUzun": "11 Cemaziyelahir 1447",
    "HicriTarihUzunIso8601": null,
    "AyinSekliURL": "https://namazvakti.diyanet.gov.tr/images/i4.gif",
    "MiladiTarihKisa": "01.12.2025",
    "MiladiTarihKisaIso8601": "01.12.2025",
    "MiladiTarihUzun": "01 Aralık 2025 Pazartesi",
    "MiladiTarihUzunIso8601": "2025-12-01T00:00:00.0000000+02:00",
    "GreenwichOrtalamaZamani": 3.0,
    "Aksam": "15:06",
    "Gunes": "08:59",
    "GunesBatis": "14:59",
    "GunesDogus": "09:06",
    "Ikindi": "12:57",
    "Imsak": "06:12",
    "KibleSaati": "10:42",
    "Ogle": "12:07",
    "Yatsi": "17:35"
  },
  {
    "HicriTarihKisa": "12.6.1447",
    "HicriTarihKisaIso8601": null,
    "HicriTarihUzun": "12 Cemaziyelahir 1447",
    "HicriTarihUzunIso8601": null,
    "AyinSekliURL": "https://namazvakti.diyanet.gov.tr/images/i5.gif",
    "MiladiTarihKisa": "02.12.2025",
    "MiladiTarihKisaIso8601": "02.12.2025",
    "MiladiTarihUzun": "02 Aralık 2025 Salı",
    "MiladiTarihUzunIso8601": "2025-12-02T00:00:00.0000000+02:00",
    "GreenwichOrtalamaZamani": 3.0,
    "Aksam": "15:04",
    "Gunes": "09:01",
    "GunesBatis": "14:57",
    "GunesDogus": "09:08",
    "Ikindi": "12:56",
    "Imsak": "06:14",
    "KibleSaati": "10:42",
    "Ogle": "12:08",
    "Yatsi": "17:34"
  },
  {
    "HicriTarihKisa": "13.6.1447",
    "HicriTarihKisaIso8601": null,
    "HicriTarihUzun": "13 Cemaziyelahir 1447",
    "HicriTarihUzunIso8601": null,
    "AyinSekliURL": "https://namazvakti.diyanet.gov.tr/images/i6.gif",
    "MiladiTarihKisa": "03.12.2025",
    "MiladiTarihKisaIso8601": "03.12.2025",
    "MiladiTarihUzun": "03 Aralık 2025 Çarşamba",
    "MiladiTarihUzunIso8601": "2025-12-03T00:00:00.0000000+02:00",
    "GreenwichOrtalamaZamani": 3.0,
    "Aksam": "15:03",
    "Gunes": "09:04",
    "GunesBatis": "14:56",
    "GunesDogus": "09:11",
    "Ikindi": "12:55",
    "Imsak": "06:15",
    "KibleSaati": "10:43",
    "Ogle": "12:08",
    "Yatsi": "17:33"
  },
  {
    "HicriTarihKisa": "14.6.1447",
    "HicriTarihKisaIso8601": null,
    "HicriTarihUzun": "14 Cemaziyelahir 1447",
    "HicriTarihUzunIso8601": null,
    "AyinSekliURL": "https://namazvakti.diyanet.gov.tr/images/dolunay.gif",
    "MiladiTarihKisa": "04.12.2025",
    "MiladiTarihKisaIso8601": "04.12.2025",
    "MiladiTarihUzun": "04 Aralık 2025 Perşembe",
    "MiladiTarihUzunIso8601": "2025-12-04T00:00:00.0000000+02:00",
    "GreenwichOrtalamaZamani": 3.0,
    "Aksam": "15:01",
    "Gunes": "09:06",
    "GunesBatis": "14:54",
    "GunesDogus": "09:13",
    "Ikindi": "12:55",
    "Imsak": "06:17",
    "KibleSaati": "10:43",
    "Ogle": "12:09",
    "Yatsi": "17:33"
  },
  {
    "HicriTarihKisa": "15.6.1447",
    "HicriTarihKisaIso8601": null,
    "HicriTarihUzun": "15 Cemaziyelahir 1447",
    "HicriTarihUzunIso8601": null,
    "AyinSekliURL": "https://namazvakti.diyanet.gov.tr/images/d1.gif",
    "MiladiTarihKisa": "05.12.2025",
    "MiladiTarihKisaIso8601": "05.12.2025",
    "MiladiTarihUzun": "05 Aralık 2025 Cuma",
    "MiladiTarihUzunIso8601": "2025-12-05T00:00:00.0000000+02:00",
    "GreenwichOrtalamaZamani": 3.0,
    "Aksam": "15:00",
    "Gunes": "09:08",
    "GunesBatis": "14:53",
    "GunesDogus": "09:15",
    "Ikindi": "12:54",
    "Imsak": "06:18",
    "KibleSaati": "10:43",
    "Ogle": "12:09",
    "Yatsi": "17:32"
  },
  {
    "HicriTarihKisa": "16.6.1447",
    "HicriTarihKisaIso8601": null,
    "HicriTarihUzun": "16 Cemaziyelahir 1447",
    "HicriTarihUzunIso8601": null,
    "AyinSekliURL": "https://namazvakti.diyanet.gov.tr/images/d2.gif",
    "MiladiTarihKisa": "06.12.2025",
    "MiladiTarihKisaIso8601": "06.12.2025",
    "MiladiTarihUzun": "06 Aralık 2025 Cumartesi",
    "MiladiTarihUzunIso8601": "2025-12-06T00:00:00.0000000+02:00",
    "GreenwichOrtalamaZamani": 3.0,
    "Aksam": "14:59",
    "Gunes": "09:10",
    "GunesBatis": "14:52",
    "GunesDogus": "09:17",
    "Ikindi": "12:54",
    "Imsak": "06:20",
    "KibleSaati": "10:43",
    "Ogle": "12:09",
    "Yatsi": "17:31"
  },
  {
    "HicriTarihKisa": "17.6.1447",
    "HicriTarihKisaIso8601": null,
    "HicriTarihUzun": "17 Cemaziyelahir 1447",
    "HicriTarihUzunIso8601": null,
    "AyinSekliURL": "https://namazvakti.diyanet.gov.tr/images/d3.gif",
    "MiladiTarihKisa": "07.12.2025",
    "MiladiTarihKisaIso8601": "07.12.2025",
    "MiladiTarihUzun": "07 Aralık 2025 Pazar",
    "MiladiTarihUzunIso8601": "2025-12-07T00:00:00.0000000+02:00",
    "GreenwichOrtalamaZamani": 3.0,
    "Aksam": "14:58",
    "Gunes": "09:12",
    "GunesBatis": "14:51",
    "GunesDogus": "09:19",
    "Ikindi": "12:53",
    "Imsak": "06:21",
    "KibleSaati": "10:44",
    "Ogle": "12:10",
    "Yatsi": "17:31"
  },
  {
    "HicriTarihKisa": "18.6.1447",
    "HicriTarihKisaIso8601": null,
    "HicriTarihUzun": "18 Cemaziyelahir 1447",
    "HicriTarihUzunIso8601": null,
    "AyinSekliURL": "https://namazvakti.diyanet.gov.tr/images/d4.gif",
    "MiladiTarihKisa": "08.12.2025",
    "MiladiTarihKisaIso8601": "08.12.2025",
    "MiladiTarihUzun": "08 Aralık 2025 Pazartesi",
    "MiladiTarihUzunIso8601": "2025-12-08T00:00:00.0000000+02:00",
    "GreenwichOrtalamaZamani": 3.0,
    "Aksam": "14:57",
    "Gunes": "09:14",
    "GunesBatis": "14:50",
    "GunesDogus": "09:21",
    "Ikindi": "12:53",
    "Imsak": "06:22",
    "KibleSaati": "10:44",
    "Ogle": "12:10",
    "Yatsi": "17:31"
  },
  {
    "HicriTarihKisa": "19.6.1447",
    "HicriTarihKisaIso8601": null,
    "HicriTarihUzun": "19 Cemaziyelahir 1447",
    "HicriTarihUzunIso8601": null,
    "AyinSekliURL": "https://namazvakti.diyanet.gov.tr/images/d5.gif",
    "MiladiTarihKisa": "09.12.2025",
    "MiladiTarihKisaIso8601": "09.12.2025",
    "MiladiTarihUzun": "09 Aralık 2025 Salı",
    "MiladiTarihUzunIso8601": "2025-12-09T00:00:00.0000000+02:00",
    "GreenwichOrtalamaZamani": 3.0,
    "Aksam": "14:56",
    "Gunes": "09:16",
    "GunesBatis": "14:49",
    "GunesDogus": "09:23",
    "Ikindi": "12:52",
    "Imsak": "06:23",
    "KibleSaati": "10:45",
    "Ogle": "12:11",
    "Yatsi": "17:30"
  },
  {
    "HicriTarihKisa": "20.6.1447",
    "HicriTarihKisaIso8601": null,
    "HicriTarihUzun": "20 Cemaziyelahir 1447",
    "HicriTarihUzunIso8601": null,
    "AyinSekliURL": "https://namazvakti.diyanet.gov.tr/images/d6.gif",
    "MiladiTarihKisa": "10.12.2025",
    "MiladiTarihKisaIso8601": "10.12.2025",
    "MiladiTarihUzun": "10 Aralık 2025 Çarşamba",
    "MiladiTarihUzunIso8601": "2025-12-10T00:00:00.0000000+02:00",
    "GreenwichOrtalamaZamani": 3.0,
    "Aksam": "14:55",
    "Gunes": "09:17",
    "GunesBatis": "14:48",
    "GunesDogus": "09:24",
    "Ikindi": "12:52",
    "Imsak": "06:25",
    "KibleSaati": "10:45",
    "Ogle": "12:11",
    "Yatsi": "17:30"
  },
  {
    "HicriTarihKisa": "21.6.1447",
    "HicriTarihKisaIso8601": null,
    "HicriTarihUzun": "21 Cemaziyelahir 1447",
    "HicriTarihUzunIso8601": null,
    "AyinSekliURL": "https://namazvakti.diyanet.gov.tr/images/d7.gif",
    "MiladiTarihKisa": "11.12.2025",
    "MiladiTarihKisaIso8601": "11.12.2025",
    "MiladiTarihUzun": "11 Aralık 2025 Perşembe",
    "MiladiTarihUzunIso8601": "2025-12-11T00:00:00.0000000+02:00",
    "GreenwichOrtalamaZamani": 3.0,
    "Aksam": "14:54",
    "Gunes": "09:19",
    "GunesBatis": "14:47",
    "GunesDogus": "09:26",
    "Ikindi": "12:52",
    "Imsak": "06:26",
    "KibleSaati": "10:45",
    "Ogle": "12:12",
    "Yatsi": "17:30"
  },
  {
    "HicriTarihKisa": "22.6.1447",
    "HicriTarihKisaIso8601": null,
    "HicriTarihUzun": "22 Cemaziyelahir 1447",
    "HicriTarihUzunIso8601": null,
    "AyinSekliURL": "https://namazvakti.diyanet.gov.tr/images/sondordun.gif",
    "MiladiTarihKisa": "12.12.2025",
    "MiladiTarihKisaIso8601": "12.12.2025",
    "MiladiTarihUzun": "12 Aralık 2025 Cuma",
    "MiladiTarihUzunIso8601": "2025-12-12T00:00:00.0000000+02:00",
    "GreenwichOrtalamaZamani": 3.0,
    "Aksam": "14:54",
    "Gunes": "09:20",
    "GunesBatis": "14:47",
    "GunesDogus": "09:27",
    "Ikindi": "12:52",
    "Imsak": "06:27",
    "KibleSaati": "10:46",
    "Ogle": "12:12",
    "Yatsi": "17:30"
  },
  {
    "HicriTarihKisa": "23.6.1447",
    "HicriTarihKisaIso8601": null,
    "HicriTarihUzun": "23 Cemaziyelahir 1447",
    "HicriTarihUzunIso8601": null,
    "AyinSekliURL": "https://namazvakti.diyanet.gov.tr/images/sd1.gif",
    "MiladiTarihKisa": "13.12.2025",
    "MiladiTarihKisaIso8601": "13.12.2025",
    "MiladiTarihUzun": "13 Aralık 2025 Cumartesi",
    "MiladiTarihUzunIso8601": "2025-12-13T00:00:00.0000000+02:00",
    "GreenwichOrtalamaZamani": 3.0,
    "Aksam": "14:53",
    "Gunes": "09:22",
    "GunesBatis": "14:46",
    "GunesDogus": "09:29",
    "Ikindi": "12:52",
    "Imsak": "06:28",
    "KibleSaati": "10:46",
    "Ogle": "12:13",
    "Yatsi": "17:29"
  },
  {
    "HicriTarihKisa": "24.6.1447",
    "HicriTarihKisaIso8601": null,
    "HicriTarihUzun": "24 Cemaziyelahir 1447",
    "HicriTarihUzunIso8601": null,
    "AyinSekliURL": "https://namazvakti.diyanet.gov.tr/images/sd2.gif",
    "MiladiTarihKisa": "14.12.2025",
    "MiladiTarihKisaIso8601": "14.12.2025",
    "MiladiTarihUzun": "14 Aralık 2025 Pazar",
    "MiladiTarihUzunIso8601": "2025-12-14T00:00:00.0000000+02:00",
    "GreenwichOrtalamaZamani": 3.0,
    "Aksam": "14:53",
    "Gunes": "09:23",
    "GunesBatis": "14:46",
    "GunesDogus": "09:30",
    "Ikindi": "12:52",
    "Imsak": "06:29",
    "KibleSaati": "10:47",
    "Ogle": "12:13",
    "Yatsi": "17:29"
  },
  {
    "HicriTarihKisa": "25.6.1447",
    "HicriTarihKisaIso8601": null,
    "HicriTarihUzun": "25 Cemaziyelahir 1447",
    "HicriTarihUzunIso8601": null,
    "AyinSekliURL": "https://namazvakti.diyanet.gov.tr/images/sd3.gif",
    "MiladiTarihKisa": "15.12.2025",
    "MiladiTarihKisaIso8601": "15.12.2025",
    "MiladiTarihUzun": "15 Aralık 2025 Pazartesi",
    "MiladiTarihUzunIso8601": "2025-12-15T00:00:00.0000000+02:00",
    "GreenwichOrtalamaZamani": 3.0,
    "Aksam": "14:52",
    "Gunes": "09:24",
    "GunesBatis": "14:45",
    "GunesDogus": "09:31",
    "Ikindi": "12:52",
    "Imsak": "06:30",
    "KibleSaati": "10:47",
    "Ogle": "12:13",
    "Yatsi": "17:29"
  },
  {
    "HicriTarihKisa": "26.6.1447",
    "HicriTarihKisaIso8601": null,
    "HicriTarihUzun": "26 Cemaziyelahir 1447",
    "HicriTarihUzunIso8601": null,
    "AyinSekliURL": "https://namazvakti.diyanet.gov.tr/images/sd4.gif",
    "MiladiTarihKisa": "16.12.2025",
    "MiladiTarihKisaIso8601": "16.12.2025",
    "MiladiTarihUzun": "16 Aralık 2025 Salı",
    "MiladiTarihUzunIso8601": "2025-12-16T00:00:00.0000000+02:00",
    "GreenwichOrtalamaZamani": 3.0,
    "Aksam": "14:52",
    "Gunes": "09:26",
    "GunesBatis": "14:45",
    "GunesDogus": "09:33",
    "Ikindi": "12:52",
    "Imsak": "06:30",
    "KibleSaati": "10:47",
    "Ogle": "12:14",
    "Yatsi": "17:30"
  },
  {
    "HicriTarihKisa": "27.6.1447",
    "HicriTarihKisaIso8601": null,
    "HicriTarihUzun": "27 Cemaziyelahir 1447",
    "HicriTarihUzunIso8601": null,
    "AyinSekliURL": "https://namazvakti.diyanet.gov.tr/images/sd5.gif",
    "MiladiTarihKisa": "17.12.2025",
    "MiladiTarihKisaIso8601": "17.12.2025",
    "MiladiTarihUzun": "17 Aralık 2025 Çarşamba",
    "MiladiTarihUzunIso8601": "2025-12-17T00:00:00.0000000+02:00",
    "GreenwichOrtalamaZamani": 3.0,
    "Aksam": "14:52",
    "Gunes": "09:27",
    "GunesBatis": "14:45",
    "GunesDogus": "09:34",
    "Ikindi": "12:52",
    "Imsak": "06:31",
    "KibleSaati": "10:48",
    "Ogle": "12:14",
    "Yatsi": "17:30"
  },
  {
    "HicriTarihKisa": "28.6.1447",
    "HicriTarihKisaIso8601": null,
    "HicriTarihUzun": "28 Cemaziyelahir 1447",
    "HicriTarihUzunIso8601": null,
    "AyinSekliURL": "https://namazvakti.diyanet.gov.tr/images/sd6.gif",
    "MiladiTarihKisa": "18.12.2025",
    "MiladiTarihKisaIso8601": "18.12.2025",
    "MiladiTarihUzun": "18 Aralık 2025 Perşembe",
    "MiladiTarihUzunIso8601": "2025-12-18T00:00:00.0000000+02:00",
    "GreenwichOrtalamaZamani": 3.0,
    "Aksam": "14:52",
    "Gunes": "09:28",
    "GunesBatis": "14:45",
    "GunesDogus": "09:35",
    "Ikindi": "12:52",
    "Imsak": "06:32",
    "KibleSaati": "10:48",
    "Ogle": "12:15",
    "Yatsi": "17:30"
  },
  {
    "HicriTarihKisa": "29.6.1447",
    "HicriTarihKisaIso8601": null,
    "HicriTarihUzun": "29 Cemaziyelahir 1447",
    "HicriTarihUzunIso8601": null,
    "AyinSekliURL": "https://namazvakti.diyanet.gov.tr/images/sd7.gif",
    "MiladiTarihKisa": "19.12.2025",
    "MiladiTarihKisaIso8601": "19.12.2025",
    "MiladiTarihUzun": "19 Aralık 2025 Cuma",
    "MiladiTarihUzunIso8601": "2025-12-19T00:00:00.0000000+02:00",
    "GreenwichOrtalamaZamani": 3.0,
    "Aksam": "14:52",
    "Gunes": "09:28",
    "GunesBatis": "14:45",
    "GunesDogus": "09:35",
    "Ikindi": "12:53",
    "Imsak": "06:33",
    "KibleSaati": "10:49",
    "Ogle": "12:15",
    "Yatsi": "17:30"
  }
]