[
  {
    "HicriTarihKisa": "4.6.1447",
    "HicriTarihKisaIso8601": null,
    "HicriTarihUzun": "4 Cemaziyelahir 1447",
    "HicriTarihUzunIso8601": null,
    "AyinSekliURL": "https://namazvakti.diyanet.gov.tr/images/r4.gif",
    "MiladiTarihKisa": "24.11.2025",
    "MiladiTarihKisaIso8601": "24.11.2025",
    "MiladiTarihUzun": "24 Kasım 2025 Pazartesi",
    "MiladiTarihUzunIso8601": "2025-11-24T00:00:00.0000000+01:00",
    "GreenwichOrtalamaZamani": 3.0,
    "Aksam": "16:55",
    "Gunes": "08:09",
    "GunesBatis": "16:48",
    "GunesDogus": "08:16",
    "Ikindi": "14:31",
    "Imsak": "06:18",
    "KibleSaati": "08:17",
    "Ogle": "12:37",
    "Yatsi": "18:33"
  },
  {
    "HicriTarihKisa": "5.6.1447",
    "HicriTarihKisaIso8601": null,
    "HicriTarihUzun": "5 Cemaziyelahir 1447",
    "HicriTarihUzunIso8601": null,
    "AyinSekliURL": "https://namazvakti.diyanet.gov.tr/images/r5.gif",
    "MiladiTarihKisa": "25.11.2025",
    "MiladiTarihKisaIso8601": "25.11.2025",
    "MiladiTarihUzun": "25 Kasım 2025 Salı",
    "MiladiTarihUzunIso8601": "2025-11-25T00:00:00.0000000+01:00",
    "GreenwichOrtalamaZamani": 3.0,
    "Aksam": "16:54",
    "Gunes": "08:10",
    "GunesBatis": "16:47",
    "GunesDogus": "08:17",
    "Ikindi": "14:31",
    "Imsak": "06:19",
    "KibleSaati": "08:17",
    "Ogle": "12:37",
    "Yatsi": "18:32"
  },
  {
    "HicriTarihKisa": "6.6.1447",
    "HicriTarihKisaIso8601": null,
    "HicriTarihUzun": "6 Cemaziyelahir 1447",
    "HicriTarihUzunIso8601": null,
    "AyinSekliURL": "https://namazvakti.diyanet.gov.tr/images/r6.gif",
    "MiladiTarihKisa": "26.11.2025",
    "MiladiTarihKisaIso8601": "26.11.2025",
    "MiladiTarihUzun": "26 Kasım 2025 Çarşamba",
    "MiladiTarihUzunIso8601": "2025-11-26T00:00:00.0000000+01:00",
    "GreenwichOrtalamaZamani": 3.0,
    "Aksam": "16:53",
    "Gunes": "08:12",
    "GunesBatis": "16:46",
    "GunesDogus": "08:19",
    "Ikindi": "14:30",
    "Imsak": "06:20",
    "KibleSaati": "08:17",
    "Ogle": "12:37",
    "Yatsi": "18:31"
  },
  {
    "HicriTarihKisa": "7.6.1447",
    "HicriTarihKisaIso8601": null,
    "HicriTarihUzun": "7 Cemaziyelahir 1447",
    "HicriTarihUzunIso8601": null,
    "AyinSekliURL": "https://namazvakti.diyanet.gov.tr/images/ilkdordun.gif",
    "MiladiTarihKisa": "27.11.2025",
    "MiladiTarihKisaIso8601": "27.11.2025",
    "MiladiTarihUzun": "27 Kasım 2025 Perşembe",
    "MiladiTarihUzunIso8601": "2025-11-27T00:00:00.0000000+01:00",
    "GreenwichOrtalamaZamani": 3.0,
    "Aksam": "16:52",
    "Gunes": "08:13",
    "GunesBatis": "16:45",
    "GunesDogus": "08:20",
    "Ikindi": "14:29",
    "Imsak": "06:21",
    "KibleSaati": "08:16",
    "Ogle": "12:38",
    "Yatsi": "18:31"
  },
  {
    "HicriTarihKisa": "8.6.1447",
    "HicriTarihKisaIso8601": null,
    "HicriTarihUzun": "8 Cemaziyelahir 1447",
    "HicriTarihUzunIso8601": null,
    "AyinSekliURL": "https://namazvakti.diyanet.gov.tr/images/i1.gif",
    "MiladiTarihKisa": "28.11.2025",
    "MiladiTarihKisaIso8601": "28.11.2025",
    "MiladiTarihUzun": "28 Kasım 2025 Cuma",
    "MiladiTarihUzunIso8601": "2025-11-28T00:00:00.0000000+01:00",
    "GreenwichOrtalamaZamani": 3.0,
    "Aksam": "16:51",
    "Gunes": "08:15",
    "GunesBatis": "16:44",
    "GunesDogus": "08:22",
    "Ikindi": "14:29",
    "Imsak": "06:23",
    "KibleSaati": "08:16",
    "Ogle": "12:38",
    "Yatsi": "18:30"
  },
  {
    "HicriTarihKisa": "9.6.1447",
    "HicriTarihKisaIso8601": null,
    "HicriTarihUzun": "9 Cemaziyelahir 1447",
    "HicriTarihUzunIso8601": null,
    "AyinSekliURL": "https://namazvakti.diyanet.gov.tr/images/i2.gif",
    "MiladiTarihKisa": "29.11.2025",
    "MiladiTarihKisaIso8601": "29.11.2025",
    "MiladiTarihUzun": "29 Kasım 2025 Cumartesi",
    "MiladiTarihUzunIso8601": "2025-11-29T00:00:00.0000000+01:00",
    "GreenwichOrtalamaZamani": 3.0,
    "Aksam": "16:50",
    "Gunes": "08:16",
    "GunesBatis": "16:43",
    "GunesDogus": "08:23",
    "Ikindi": "14:28",
    "Imsak": "06:24",
    "KibleSaati": "00:00",
    "Ogle": "12:38",
    "Yatsi": "18:30"
  },
  {
    "HicriTarihKisa": "10.6.1447",
    "HicriTarihKisaIso8601": null,
    "HicriTarihUzun": "10 Cemaziyelahir 1447",
    "HicriTarihUzunIso8601": null,
    "AyinSekliURL": "https://namazvakti.diyanet.gov.tr/images/i3.gif",
    "MiladiTarihKisa": "30.11.2025",
    "MiladiTarihKisaIso8601": "30.11.2025",
    "MiladiTarihUzun": "30 Kasım 2025 Pazar",
    "MiladiTarihUzunIso8601": "2025-11-30T00:00:00.0000000+01:00",
    "GreenwichOrtalamaZamani": 3.0,
    "Aksam": "16:50",
    "Gunes": "08:18",
    "GunesBatis": "16:43",
    "GunesDogus": "08:25",
    "Ikindi": "14:28",
    "Imsak": "06:25",
    "KibleSaati": "00:00",
    "Ogle": "12:39",
    "Yatsi": "18:29"
  },
  {
    "HicriTarihKisa": "11.6.1447",
    "HicriTarihKisaIso8601": null,
    "HicriTarihUzun": "11 Cemaziyelahir 1447",
    "HicriTarihUzunIso8601": null,
    "AyinSekliURL": "https://namazvakti.diyanet.gov.tr/images/i4.gif",
    "MiladiTarihKisa": "01.12.2025",
    "MiladiTarihKisaIso8601": "01.12.2025",
    "MiladiTarihUzun": "01 Aralık 2025 Pazartesi",
    "MiladiTarihUzunIso8601": "2025-12-01T00:00:00.0000000+01:00",
    "GreenwichOrtalamaZamani": 3.0,
    "Aksam": "16:49",
    "Gunes": "08:19",
    "GunesBatis": "16:42",
    "GunesDogus": "08:26",
    "Ikindi": "14:27",
    "Imsak": "06:26",
    "KibleSaati": "00:00",
    "Ogle": "12:39",
    "Yatsi": "18:29"
  },
  {
    "HicriTarihKisa": "12.6.1447",
    "HicriTarihKisaIso8601": null,
    "HicriTarihUzun": "12 Cemaziyelahir 1447",
    "HicriTarihUzunIso8601": null,
    "AyinSekliURL": "https://namazvakti.diyanet.gov.tr/images/i5.gif",
    "MiladiTarihKisa": "02.12.2025",
    "MiladiTarihKisaIso8601": "02.12.2025",
    "MiladiTarihUzun": "02 Aralık 2025 Salı",
    "MiladiTarihUzunIso8601": "2025-12-02T00:00:00.0000000+01:00",
    "GreenwichOrtalamaZamani": 3.0,
    "Aksam": "16:48",
    "Gunes": "08:21",
    "GunesBatis": "16:41",
    "GunesDogus": "08:28",
    "Ikindi": "14:27",
    "Imsak": "06:27",
    "KibleSaati": "00:00",
    "Ogle": "12:39",
    "Yatsi": "18:28"
  },
  {
    "HicriTarihKisa": "13.6.1447",
    "HicriTarihKisaIso8601": null,
    "HicriTarihUzun": "13 Cemaziyelahir 1447",
    "HicriTarihUzunIso8601": null,
    "AyinSekliURL": "https://namazvakti.diyanet.gov.tr/images/i6.gif",
    "MiladiTarihKisa": "03.12.2025",
    "MiladiTarihKisaIso8601": "03.12.2025",
    "MiladiTarihUzun": "03 Aralık 2025 Çarşamba",
    "MiladiTarihUzunIso8601": "2025-12-03T00:00:00.0000000+01:00",
    "GreenwichOrtalamaZamani": 3.0,
    "Aksam": "16:48",
    "Gunes": "08:22",
    "GunesBatis": "16:41",
    "GunesDogus": "08:29",
    "Ikindi": "14:27",
    "Imsak": "06:28",
    "KibleSaati": "00:00",
    "Ogle": "12:40",
    "Yatsi": "18:28"
  },
  {
    "HicriTarihKisa": "14.6.1447",
    "HicriTarihKisaIso8601": null,
    "HicriTarihUzun": "14 Cemaziyelahir 1447",
    "HicriTarihUzunIso8601": null,
    "AyinSekliURL": "https://namazvakti.diyanet.gov.tr/images/dolunay.gif",
    "MiladiTarihKisa": "04.12.2025",
    "MiladiTarihKisaIso8601": "04.12.2025",
    "MiladiTarihUzun": "04 Aralık 2025 Perşembe",
    "MiladiTarihUzunIso8601": "2025-12-04T00:00:00.0000000+01:00",
    "GreenwichOrtalamaZamani": 3.0,
    "Aksam": "16:47",
    "Gunes": "08:23",
    "GunesBatis": "16:40",
    "GunesDogus": "08:30",
    "Ikindi": "14:26",
    "Imsak": "06:29",
    "KibleSaati": "00:00",
    "Ogle": "12:40",
    "Yatsi": "18:28"
  },
  {
    "HicriTarihKisa": "15.6.1447",
    "HicriTarihKisaIso8601": null,
    "HicriTarihUzun": "15 Cemaziyelahir 1447",
    "HicriTarihUzunIso8601": null,
    "AyinSekliURL": "https://namazvakti.diyanet.gov.tr/images/d1.gif",
    "MiladiTarihKisa": "05.12.2025",
    "MiladiTarihKisaIso8601": "05.12.2025",
    "MiladiTarihUzun": "05 Aralık 2025 Cuma",
    "MiladiTarihUzunIso8601": "2025-12-05T00:00:00.0000000+01:00",
    "GreenwichOrtalamaZamani": 3.0,
    "Aksam": "16:47",
    "Gunes": "08:24",
    "GunesBatis": "16:40",
    "GunesDogus": "08:31",
    "Ikindi": "14:26",
    "Imsak": "06:30",
    "KibleSaati": "00:00",
    "Ogle": "12:41",
    "Yatsi": "18:28"
  },
  {
    "HicriTarihKisa": "16.6.1447",
    "HicriTarihKisaIso8601": null,
    "HicriTarihUzun": "16 Cemaziyelahir 1447",
    "HicriTarihUzunIso8601": null,
    "AyinSekliURL": "https://namazvakti.diyanet.gov.tr/images/d2.gif",
    "MiladiTarihKisa": "06.12.2025",
    "MiladiTarihKisaIso8601": "06.12.2025",
    "MiladiTarihUzun": "06 Aralık 2025 Cumartesi",
    "MiladiTarihUzunIso8601": "2025-12-06T00:00:00.0000000+01:00",
    "GreenwichOrtalamaZamani": 3.0,
    "Aksam": "16:46",
    "Gunes": "08:26",
    "GunesBatis": "16:39",
    "GunesDogus": "08:33",
    "Ikindi": "14:26",
    "Imsak": "06:31",
    "KibleSaati": "00:00",
    "Ogle": "12:41",
    "Yatsi": "18:27"
  },
  {
    "HicriTarihKisa": "17.6.1447",
    "HicriTarihKisaIso8601": null,
    "HicriTarihUzun": "17 Cemaziyelahir 1447",
    "HicriTarihUzunIso8601": null,
    "AyinSekliURL": "https://namazvakti.diyanet.gov.tr/images/d3.gif",
    "MiladiTarihKisa": "07.12.2025",
    "MiladiTarihKisaIso8601": "07.12.2025",
    "MiladiTarihUzun": "07 Aralık 2025 Pazar",
    "MiladiTarihUzunIso8601": "2025-12-07T00:00:00.0000000+01:00",
    "GreenwichOrtalamaZamani": 3.0,
    "Aksam": "16:46",
    "Gunes": "08:27",
    "GunesBatis": "16:39",
    "GunesDogus": "08:34",
    "Ikindi": "14:26",
    "Imsak": "06:32",
    "KibleSaati": "00:00",
    "Ogle": "12:41",
    "Yatsi": "18:27"
  },
  {
    "HicriTarihKisa": "18.6.1447",
    "HicriTarihKisaIso8601": null,
    "HicriTarihUzun": "18 Cemaziyelahir 1447",
    "HicriTarihUzunIso8601": null,
    "AyinSekliURL": "https://namazvakti.diyanet.gov.tr/images/d4.gif",
    "MiladiTarihKisa": "08.12.2025",
    "MiladiTarihKisaIso8601": "08.12.2025",
    "MiladiTarihUzun": "08 Aralık 2025 Pazartesi",
    "MiladiTarihUzunIso8601": "2025-12-08T00:00:00.0000000+01:00",
    "GreenwichOrtalamaZamani": 3.0,
    "Aksam": "16:46",
    "Gunes": "08:28",
    "GunesBatis": "16:39",
    "GunesDogus": "08:35",
    "Ikindi": "14:26",
    "Imsak": "06:33",
    "KibleSaati": "00:00",
    "Ogle": "12:42",
    "Yatsi": "18:27"
  },
  {
    "HicriTarihKisa": "19.6.1447",
    "HicriTarihKisaIso8601": null,
    "HicriTarihUzun": "19 Cemaziyelahir 1447",
    "HicriTarihUzunIso8601": null,
    "AyinSekliURL": "https://namazvakti.diyanet.gov.tr/images/d5.gif",
    "MiladiTarihKisa": "09.12.2025",
    "MiladiTarihKisaIso8601": "09.12.2025",
    "MiladiTarihUzun": "09 Aralık 2025 Salı",
    "MiladiTarihUzunIso8601": "2025-12-09T00:00:00.0000000+01:00",
    "GreenwichOrtalamaZamani": 3.0,
    "Aksam": "16:46",
    "Gunes": "08:29",
    "GunesBatis": "16:39",
    "GunesDogus": "08:36",
    "Ikindi": "14:26",
    "Imsak": "06:34",
    "KibleSaati": "00:00",
    "Ogle": "12:42",
    "Yatsi": "18:27"
  },
  {
    "HicriTarihKisa": "20.6.1447",
    "HicriTarihKisaIso8601": null,
    "HicriTarihUzun": "20 Cemaziyelahir 1447",
    "HicriTarihUzunIso8601": null,
    "AyinSekliURL": "https://namazvakti.diyanet.gov.tr/images/d6.gif",
    "MiladiTarihKisa": "10.12.2025",
    "MiladiTarihKisaIso8601": "10.12.2025",
    "MiladiTarihUzun": "10 Aralık 2025 Çarşamba",
    "MiladiTarihUzunIso8601": "2025-12-10T00:00:00.0000000+01:00",
    "GreenwichOrtalamaZamani": 3.0,
    "Aksam": "16:45",
    "Gunes": "08:30",
    "GunesBatis": "16:38",
    "GunesDogus": "08:37",
    "Ikindi": "14:26",
    "Imsak": "06:35",
    "KibleSaati": "00:00",
    "Ogle": "12:43",
    "Yatsi": "18:27"
  },
  {
    "HicriTarihKisa": "21.6.1447",
    "HicriTarihKisaIso8601": null,
    "HicriTarihUzun": "21 Cemaziyelahir 1447",
    "HicriTarihUzunIso8601": null,
    "AyinSekliURL": "https://namazvakti.diyanet.gov.tr/images/d7.gif",
    "MiladiTarihKisa": "11.12.2025",
    "MiladiTarihKisaIso8601": "11.12.2025",
    "MiladiTarihUzun": "11 Aralık 2025 Perşembe",
    "MiladiTarihUzunIso8601": "2025-12-11T00:00:00.0000000+01:00",
    "GreenwichOrtalamaZamani": 3.0,
    "Aksam": "16:45",
    "Gunes": "08:31",
    "GunesBatis": "16:38",
    "GunesDogus": "08:38",
    "Ikindi": "14:26",
    "Imsak": "06:36",
    "KibleSaati": "00:00",
    "Ogle": "12:43",
    "Yatsi": "18:27"
  },
  {
    "HicriTarihKisa": "22.6.1447",
    "HicriTarihKisaIso8601": null,
    "HicriTarihUzun": "22 Cemaziyelahir 1447",
    "HicriTarihUzunIso8601": null,
    "AyinSekliURL": "https://namazvakti.diyanet.gov.tr/images/sondordun.gif",
    "MiladiTarihKisa": "12.12.2025",
    "MiladiTarihKisaIso8601": "12.12.2025",
    "MiladiTarihUzun": "12 Aralık 2025 Cuma",
    "MiladiTarihUzunIso8601": "2025-12-12T00:00:00.0000000+01:00",
    "GreenwichOrtalamaZamani": 3.0,
    "Aksam": "16:45",
    "Gunes": "08:32",
    "GunesBatis": "16:38",
    "GunesDogus": "08:39",
    "Ikindi": "14:26",
    "Imsak": "06:37",
    "KibleSaati": "00:00",
    "Ogle": "12:44",
    "Yatsi": "18:27"
  },
  {
    "HicriTarihKisa": "23.6.1447",
    "HicriTarihKisaIso8601": null,
    "HicriTarihUzun": "23 Cemaziyelahir 1447",
    "HicriTarihUzunIso8601": null,
    "AyinSekliURL": "https://namazvakti.diyanet.gov.tr/images/sd1.gif",
    "MiladiTarihKisa": "13.12.2025",
    "MiladiTarihKisaIso8601": "13.12.2025",
    "MiladiTarihUzun": "13 Aralık 2025 Cumartesi",
    "MiladiTarihUzunIso8601": "2025-12-13T00:00:00.0000000+01:00",
    "GreenwichOrtalamaZamani": 3.0,
    "Aksam": "16:45",
    "Gunes": "08:33",
    "GunesBatis": "16:38",
    "GunesDogus": "08:40",
    "Ikindi": "14:26",
    "Imsak": "06:38",
    "KibleSaati": "00:00",
    "Ogle": "12:44",
    "Yatsi": "18:27"
  },
  {
    "HicriTarihKisa": "24.6.1447",
    "HicriTarihKisaIso8601": null,
    "HicriTarihUzun": "24 Cemaziyelahir 1447",
    "HicriTarihUzunIso8601": null,
    "AyinSekliURL": "https://namazvakti.diyanet.gov.tr/images/sd2.gif",
    "MiladiTarihKisa": "14.12.2025",
    "MiladiTarihKisaIso8601": "14.12.2025",
    "MiladiTarihUzun": "14 Aralık 2025 Pazar",
    "MiladiTarihUzunIso8601": "2025-12-14T00:00:00.0000000+01:00",
    "GreenwichOrtalamaZamani": 3.0,
    "Aksam": "16:45",
    "Gunes": "08:34",
    "GunesBatis": "16:38",
    "GunesDogus": "08:41",
    "Ikindi": "14:26",
    "Imsak": "06:39",
    "KibleSaati": "00:00",
    "Ogle": "12:45",
    "Yatsi": "18:27"
  },
  {
    "HicriTarihKisa": "25.6.1447",
    "HicriTarihKisaIso8601": null,
    "HicriTarihUzun": "25 Cemaziyelahir 1447",
    "HicriTarihUzunIso8601": null,
    "AyinSekliURL": "https://namazvakti.diyanet.gov.tr/images/sd3.gif",
    "MiladiTarihKisa": "15.12.2025",
    "MiladiTarihKisaIso8601": "15.12.2025",
    "MiladiTarihUzun": "15 Aralık 2025 Pazartesi",
    "MiladiTarihUzunIso8601": "2025-12-15T00:00:00.0000000+01:00",
    "GreenwichOrtalamaZamani": 3.0,
    "Aksam": "16:45",
    "Gunes": "08:35",
    "GunesBatis": "16:38",
    "GunesDogus": "08:42",
    "Ikindi": "14:26",
    "Imsak": "06:39",
    "KibleSaati": "00:00",
    "Ogle": "12:45",
    "Yatsi": "18:28"
  },
  {
    "HicriTarihKisa": "26.6.1447",
    "HicriTarihKisaIso8601": null,
    "HicriTarihUzun": "26 Cemaziyelahir 1447",
    "HicriTarihUzunIso8601": null,
    "AyinSekliURL": "https://namazvakti.diyanet.gov.tr/images/sd4.gif",
    "MiladiTarihKisa": "16.12.2025",
    "MiladiTarihKisaIso8601": "16.12.2025",
    "MiladiTarihUzun": "16 Aralık 2025 Salı",
    "MiladiTarihUzunIso8601": "2025-12-16T00:00:00.0000000+01:00",
    "GreenwichOrtalamaZamani": 3.0,
    "Aksam": "16:45",
    "Gunes": "08:36",
    "GunesBatis": "16:38",
    "GunesDogus": "08:43",
    "Ikindi": "14:26",
    "Imsak": "06:40",
    "KibleSaati": "00:00",
    "Ogle": "12:46",
    "Yatsi": "18:28"
  },
  {
    "HicriTarihKisa": "27.6.1447",
    "HicriTarihKisaIso8601": null,
    "HicriTarihUzun": "27 Cemaziyelahir 1447",
    "HicriTarihUzunIso8601": null,
    "AyinSekliURL": "https://namazvakti.diyanet.gov.tr/images/sd5.gif",
    "MiladiTarihKisa": "17.12.2025",
    "MiladiTarihKisaIso8601": "17.12.2025",
    "MiladiTarihUzun": "17 Aralık 2025 Çarşamba",
    "MiladiTarihUzunIso8601": "2025-12-17T00:00:00.0000000+01:00",
    "GreenwichOrtalamaZamani": 3.0,
    "Aksam": "16:46",
    "Gunes": "08:36",
    "GunesBatis": "16:39",
    "GunesDogus": "08:43",
    "Ikindi": "14:27",
    "Imsak": "06:41",
    "KibleSaati": "00:00",
    "Ogle": "12:46",
    "Yatsi": "18:28"
  },
  {
    "HicriTarihKisa": "28.6.1447",
    "HicriTarihKisaIso8601": null,
    "HicriTarihUzun": "28 Cemaziyelahir 1447",
    "HicriTarihUzunIso8601": null,
    "AyinSekliURL": "https://namazvakti.diyanet.gov.tr/images/sd6.gif",
    "MiladiTarihKisa": "18.12.2025",
    "MiladiTarihKisaIso8601": "18.12.2025",
    "MiladiTarihUzun": "18 Aralık 2025 Perşembe",
    "MiladiTarihUzunIso8601": "2025-12-18T00:00:00.0000000+01:00",
    "GreenwichOrtalamaZamani": 3.0,
    "Aksam": "16:46",
    "Gunes": "08:37",
    "GunesBatis": "16:39",
    "GunesDogus": "08:44",
    "Ikindi": "14:27",
    "Imsak": "06:41",
    "KibleSaati": "00:00",
    "Ogle": "12:47",
    "Yatsi": "18:28"
  },
  {
    "HicriTarihKisa": "29.6.1447",
    "HicriTarihKisaIso8601": null,
    "HicriTarihUzun": "29 Cemaziyelahir 1447",
    "HicriTarihUzunIso8601": null,
    "AyinSekliURL": "https://namazvakti.diyanet.gov.tr/images/sd7.gif",
    "MiladiTarihKisa": "19.12.2025",
    "MiladiTarihKisaIso8601": "19.12.2025",
    "MiladiTarihUzun": "19 Aralık 2025 Cuma",
    "MiladiTarihUzunIso8601": "2025-12-19T00:00:00.0000000+01:00",
    "GreenwichOrtalamaZamani": 3.0,
    "Aksam": "16:46",
    "Gunes": "08:38",
    "GunesBatis": "16:39",
    "GunesDogus": "08:45",
    "Ikindi": "14:27",
    "Imsak": "06:42",
    "KibleSaati": "00:00",
    "Ogle": "12:47",
    "Yatsi": "18:29"
  },
  {
    "HicriTarihKisa": "30.6.1447",
    "HicriTarihKisaIso8601": null,
    "HicriTarihUzun": "30 Cemaziyelahir 1447",
    "HicriTarihUzunIso8601": null,
    "AyinSekliURL": "https://namazvakti.diyanet.gov.tr/images/ruyet.gif",
    "MiladiTarihKisa": "20.12.2025",
    "MiladiTarihKisaIso8601": "20.12.2025",
    "MiladiTarihUzun": "20 Aralık 2025 Cumartesi",
    "MiladiTarihUzunIso8601": "2025-12-20T00:00:00.0000000+01:00",
    "GreenwichOrtalamaZamani": 3.0,
    "Aksam": "16:47",
    "Gunes": "08:38",
    "GunesBatis": "16:40",
    "GunesDogus": "08:45",
    "Ikindi": "14:28",
    "Imsak": "06:43",
    "KibleSaati": "00:00",
    "Ogle": "12:48",
    "Yatsi": "18:29"
  },
  {
    "HicriTarihKisa": "1.7.1447",
    "HicriTarihKisaIso8601": null,
    "HicriTarihUzun": "1 Recep 1447",
    "HicriTarihUzunIso8601": null,
    "AyinSekliURL": "https://namazvakti.diyanet.gov.tr/images/r1.gif",
    "MiladiTarihKisa": "21.12.2025",
    "MiladiTarihKisaIso8601": "21.12.2025",
    "MiladiTarihUzun": "21 Aralık 2025 Pazar",
    "MiladiTarihUzunIso8601": "2025-12-21T00:00:00.0000000+01:00",
    "GreenwichOrtalamaZamani": 3.0,
    "Aksam": "16:47",
    "Gunes": "08:39",
    "GunesBatis": "16:40",
    "GunesDogus": "08:46",
    "Ikindi": "14:28",
    "Imsak": "06:43",
    "KibleSaati": "00:00",
    "Ogle": "12:48",
    "Yatsi": "18:30"
  },
  {
    "HicriTarihKisa": "2.7.1447",
    "HicriTarihKisaIso8601": null,
    "HicriTarihUzun": "2 Recep 1447",
    "HicriTarihUzunIso8601": null,
    "AyinSekliURL": "https://namazvakti.diyanet.gov.tr/images/r2.gif",
    "MiladiTarihKisa": "22.12.2025",
    "MiladiTarihKisaIso8601": "22.12.2025",
    "MiladiTarihUzun": "22 Aralık 2025 Pazartesi",
    "MiladiTarihUzunIso8601": "2025-12-22T00:00:00.0000000+01:00",
    "GreenwichOrtalamaZamani": 3.0,
    "Aksam": "16:48",
    "Gunes": "08:39",
    "GunesBatis": "16:41",
    "GunesDogus": "08:46",
    "Ikindi": "14:29",
    "Imsak": "06:44",
    "KibleSaati": "00:00",
    "Ogle": "12:49",
    "Yatsi": "18:30"
  },
  {
    "HicriTarihKisa": "3.7.1447",
    "HicriTarihKisaIso8601": null,
    "HicriTarihUzun": "3 Recep 1447",
    "HicriTarihUzunIso8601": null,
    "AyinSekliURL": "https://namazvakti.diyanet.gov.tr/images/r3.gif",
    "MiladiTarihKisa": "23.12.2025",
    "MiladiTarihKisaIso8601": "23.12.2025",
    "MiladiTarihUzun": "23 Aralık 2025 Salı",
    "MiladiTarihUzunIso8601": "2025-12-23T00:00:00.0000000+01:00",
    "GreenwichOrtalamaZamani": 3.0,
    "Aksam": "16:48",
    "Gunes": "08:40",
    "GunesBatis": "16:41",
    "GunesDogus": "08:47",
    "Ikindi": "14:29",
    "Imsak": "06:44",
    "KibleSaati": "00:00",
    "Ogle": "12:49",
    "Yatsi": "18:31"
  },
  {
    "HicriTarihKisa": "4.7.1447",
    "HicriTarihKisaIso8601": null,
    "HicriTarihUzun": "4 Recep 1447",
    "HicriTarihUzunIso8601": null,
    "AyinSekliURL": "https://namazvakti.diyanet.gov.tr/images/r4.gif",
    "MiladiTarihKisa": "24.12.2025",
    "MiladiTarihKisaIso8601": "24.12.2025",
    "MiladiTarihUzun": "24 Aralık 2025 Çarşamba",
    "MiladiTarihUzunIso8601": "2025-12-24T00:00:00.0000000+01:00",
    "GreenwichOrtalamaZamani": 3.0,
    "Aksam": "16:49",
    "Gunes": "08:40",
    "GunesBatis": "16:42",
    "GunesDogus": "08:47",
    "Ikindi": "14:30",
    "Imsak": "06:45",
    "KibleSaati": "00:00",
    "Ogle": "12:50",
    "Yatsi": "18:31"
  },
  {
    "HicriTarihKisa": "5.7.1447",
    "HicriTarihKisaIso8601": null,
    "HicriTarihUzun": "5 Recep 1447",
    "HicriTarihUzunIso8601": null,
    "AyinSekliURL": "https://namazvakti.diyanet.gov.tr/images/r5.gif",
    "MiladiTarihKisa": "25.12.2025",
    "MiladiTarihKisaIso8601": "25.12.2025",
    "MiladiTarihUzun": "25 Aralık 2025 Perşembe",
    "MiladiTarihUzunIso8601": "2025-12-25T00:00:00.0000000+01:00",
    "GreenwichOrtalamaZamani": 3.0,
    "Aksam": "16:49",
    "Gunes": "08:41",
    "GunesBatis": "16:42",
    "GunesDogus": "08:48",
    "Ikindi": "14:30",
    "Imsak": "06:45",
    "KibleSaati": "00:00",
    "Ogle": "12:50",
    "Yatsi": "18:32"
  }
]